,0
2222,엄마가 라디오만 무료로듣고있었는데 이제 다 유료로 ㅋㅋㅋ 이용하던사람들도 다없어지것네
2223,"바로 다음화 넘어가는 버튼 좀 만들어주세요 다 봐서 바로 넘어가서 보고싶은데 전체화면일 때 회차목록 하나하나 찾아보고 있어야되고 귀찮고 시간낭비 오져요 다른 스트리밍 앱에는 다 있는데 왜 티빙만 없는건지...ㅠ 다음화 넘어갈 수 있는 버튼이 애니 볼때는 아예 다 끝나야 나와서 엔딩곡 듣기 싫은데 다듣고 있어야하고 안들으려면 화면 한번 더 누르고 재생바 눌러서 끝까지 가져다 놔야 다음화로 넘어가기 버튼나오고.. 한 화 끝나면 바로 다음화로 넘어갈 수 있는 버튼이 재깍재깍 나오는 것도 아니고 회차목록 라인에다가 다음화로 넘어가는 버튼 왜 안만드시는지 모르겠어요 너무너무너무너무너무 불편해요

+pip 모드에서 연속재생이 아니라요ㅠㅠㅠ 그냥 전체화면에서요 전체화면 전체화면"
2224,"쿠팡플레이 관계자분 꼭 답변 부탁드립니다. 얼마 전까지 쿠팡와우를 통해 쿠팡플레이를 애용하던 시청자입니다. 다른기기에서 사용한 적도 없고, 아이디를 빌려준 적도 (최근 시청이 안되면서 다른기기에서 로그인 1회함.)는데 어느 날부터 어떤 프로그램이든 시청하려고 하면 ""스트리밍 에러 - 기기에서 스트림이 불가합니다. os를 업데이트 하시거나 다른 기기에서 시청해보시기 바랍니다.""라는 문구가 뜨며 재생이 안되는데 각종 방법을 다 써봐도 저 오류가 해결되지 않네요. (영상중간에 녹화를 한다던가, 스크린샷을 찍는 둥 불법적인 일을 저지릌 적도 없음) 제가 시도했던 방법은 1. 쿠팡플레이 삭제 및 재설치 2. 쿠팡, 쿠팡플레이 삭제 및 재설치 3. 쿠팡관련 어플 삭제 후 해당기기 구글 광고ID재설정 4. 쿠팡 어플 내 인증되어 있는 기기 해제 후 재설정 위 4가지 말고는 제가 할 수 있는 방법이란 게 떠오르질 않네요. 고객센터 전화해봐도 4번말만 되풀하구요. 빠른답변 부탁드려요."
2225,사람들이 버퍼링에 대해 의견도 많이 달았는데 단순하게 메일로만 보내달라고 하시네요 모니터링하고 계시다면서 모니터링 문제없나요? 단순히 개개인이 아닌것 같은데 답변 성의없네요^^ 비용을 지불하고 보는데 그에 대한 서비스가 제대로 제공되지 않고 답변도 성의없고 개별적으로 메일로만 보내라고 하고 무슨 조치를 하고 있는건지ㅋㅋㅋㅋ 특정하게 발생되는 문제면 방법을 제시하라구요
2226,tv에서 배속좀 해서 보고싶다!! 배속기능좀 추가해라!!
2227,MLB는중계방송않해주나요축구도좋치많야구좋아하는사람도있자나요MLB도중계해주시면안될까요
2228,앱 업데이트하라고해서 하려고하니 안되서 지우고 다시깔려고해도 안깔림 다른어플은 다 잘껄리는걸로봐서 제 스마트폰이나 플레이스토어문제가아님 해결책이 뭡니까?
2229,국민의 힘이 당선되어 하루하루가 고통입니다.
2230,강제 업데이트후 전부유료화 정규방송도 돈내고 봐야하내요 그냥 광고없고 무료로 볼수있는 다른어플이용해서 보렵니다 바이바이
2231,배속 설정 가능하게 업데이트 할 계획이 없나요? 답변바랍니다
2232,화면 멈춰잇어요!
2233,갑자기안들어가지네 얼른고쳐주세요... 돈은나가는ㄷ
2234,키즈 에 무서운것 재미 있어요 채고
2235,다른 기기들은 잘만 들어가지는데 어제부터 계속 제 폰만 접속할 수 없다고 뜨면서 안 들어가지네요. 돈 주고 구매한 앱을 들어가지도 못 하게 한다면 쓸 이유가 없다고 생각합니다. 답변 없으시다면 다음 달에는 해지하고 다른 플랫폼으로 갈아타겠습니다;.
2236,갤럭시탭7+ 사용자입니다. 아랫글처럼 로고에서 넘어가지 않아서 며칠못봤는데 해결방법을공유하고자 글남깁니다. 앱설정에서 캐시와 저장공간 비운다음 재부팅 해보세 요. 저도 인터넷 뒤져서 알아냈습니다.
2237,화면이 안 나와요
2238,지난것도 볼 수 있어서 좋아요!
2239,너무 좋아요~ 넷플 쓰다가 볼게 없어서 갈아 탔는데 자주 보는 예능들이 많아서 티빙이 훨씬 좋아요! 그런데 제가 곧 갤럭시 탭 A7 라이트 를 구매하려하는데 갤탭A7라이트에도 티빙 지원되는거 맞죠??
2240,이거 얼마전까지 됬는데 왜 넷플릭스 쓰여져있는 칸에서 넘어가지지 않죠? 먼문제가있나요?
2241,삼성 32인치 스마트 티비사용중인데 웨이브만 설치가 안돼고 있습니다 샘성앱스문제는아니고 웨이브에 문제가 있는거 같은데 확인부탁드립니다
2242,말로만 모니터랑 중이다 하지마시고 버퍼링좀 개선해주세요 기술력이 문제인건지 관심도가 낮은건지
2243,노트북에는 설치가 안되나요?
2244,모바일 접속이 안됩니다 오늘 접속 안된다는 리뷰들이 많은데 수정 안해주시나요?
2245,볼만한 쿠팡플레이 짱!!
2246,다른 ott에 없는 bbc 시리즈가 많아서 좋습니다. 닥터후 없어진건 아쉽네요. 영상 재생 해상도 선택이 가능한건 좋은데 영어자막 지원되는게 적고 10초 전후 이동시 딜레이가 깁니다. pip 모드에서 자막지원이 안되네요. 넷플릭스의 경우 다크모드 온오프 하면 자막이 떠서 똑같이 해봤는데 쿠팡플레이는 재생중이던 pip가 다크모드시 프로그램이 꺼집니다. pip 모드 자막지원 좀 해주세요.
2247,화질 최고다.
2248,"당분간 미국에 있어야 하는데 재생이 안 되네요ㅠ

미국에서 쿠팡플레이 시청할 수 있는 방법이 없을까요??"
2249,"아이패드에서 모니터 연결해서 재생하면 자동으로 화면 꽉차게 조정하는거 필요할 듯 합니다. 넷플릭스나 웨이브에서 다 해봤는데, 티빙만 화면이 다 안 꽉차더라구요. 넷플릭스나 웨이브는 모니터 연결을 인식하여 화질 저하 없이 화면 꽉차서 정말 티비 보는 것 처럼 보기가 아주 좋은데, 티빙은 그냥 미러링해주는 정도 밖에 안되어 있는 것 같아요. 티빙은 화면에 레터박스 비율이 너무 많고 모니터 연결해도 아이패드랑 보는 차이가 별로 없네요..ㅜ 건의 사항이자 유저로서 개선 해주십사 하는 의견입니다.."
2250,영상 배속
2251,화면이안넘어가고 접속이안되요 몇일째멈춰있어여
2252,아니 며칠전부터 앱 접속이 아예 안됩니다 업데이트 하라는데 어케하는지 나와있지도 않구요 장난합니까? 꼭 답변을 해주세요
2253,노트8 화면잠금 해제 안되는 버그 수정좀... 별짓을 다 해도 안됨
2254,갑자기 안드로이드에서 접속안됨 넷플로고만 뜸
2255,태블릿으로 보다가 화질을 고화질로 바꿔도 그대로길래 폰으로도 깔았는데 폰도 고화질로 바뀌어지지를 않네요 다른점들은 만족합니다^^..
2256,편리하고 재미있어요
2257,로고화면에서 멈춤 화면 안넘어감!!!!! 얼마전부터 계속 이러는데 왜 아직도 개선안되있는거죠?????
2258,굳
2259,로고만뜨고 안들어가짐
2260,넷플 처음 한 1달간은 괜찮은데 지금은 안드로이드만 실행이 좀 잘 안되는거 같네요. 계속 넷플 오리지널 채널만 뜨고 다시 다 지우고 깔고 이걸 몇 번째 반복 하는지 좀 고쳐주세요
2261,시청 중 콘텐츠 삭제해도 왜 안 없어지죠...? 다 본것들도 계속 라인에 남아 있어서 보기 힘들어요!
2262,갤럭시폴드 자동회전 지원안하나요? 가로로 보려면 꼭 화면펼쳐서 다시 앱실행해야하는 개구린 인터페이스인데;; 다른 OTT어플다되는데 얘만안되요.. 디즈니 넷플 웨이브 다해봄 티빙이 젤별로임:;
2263,오늘 가입했어요.잘부탁드립니다~~
2264,화면이 너무 어두움 짜증나게 뭔화면인지도 안보임. 참고로 화면밝기 최대로 올려도 너무컴컴함. 자체적으로 컨텐츠업로드할때 조절좀 해야할듯
2265,여러번 지웠다 새로깔고 접속해도 도입화면에서부터 멈춰서 로딩이안되는데 뭐 이따위로 운영하지? 돈만 쳐 받아가지마시고 해결빨리하고 삼일간 못본거 손해배상하시죠 짜증나니까 빨리 답주는게 좋을거예요
2266,버퍼링 때문에 볼수가 없음. 진짜 무슨 매일 모니터링 한다는 앵무새같은 답변만 반복하지 말고 문제를 해결을 하라고요. 다른 ott 3개를 쓰는데 처음 겪는 문제에 설마 요즘같은 시대에 이런 초보적인 문제가 있을리 없다 생각하고 처음엔 내 폰 문제인줄 알았네요. 다른 ott 플랫폼이랑 뭐가 다른지 비교를 해보면 될게 아닙니까 왜 문제를 해결을 못해...
2267,지금 안되는 건가요? 10분 넘게 모든 영상 재생이 안되는데요....-_-
2268,"만족하고 잘보고 있어요. 근데 태블릿으로 볼때 다른 작품은 잘 나오는데 왜 백설공주만 화면이 안나오고 오디오만 나오는거죠? 그래서 백설공주 ost 감상중임,,"
2269,진입화면에서접속할수없다고팝업뜨고진입되지않아요..
2270,"LG Gpad3 8.0(v525) 모바일탭을 사용하고 있는데 최대재생화질이 SD로 되어있어 많이 불편합니다. 앱 업데이트 이전에는 이러한 문제가 없었으나 어느 순간부터 화질이 좋지 않아 찾아 보게 되니 ""재생환경""이라는 부분에 L3에 SD로 되어 있었습니다. DRM Info 앱을 통해 L1 지원기기 인거 확인 했고, 왜 SD로만 영상재생되는지 확인 부탁드립니다. 그리고, HD재생지원 탭 모델에 LG제품은 없는지 알려주세요."
2271,"갤럭시탭s7인데 로고에서 안넘어가요 캐쉬삭제,재부팅, 재다운, 다양한방법했는데 계속안돼요"
2272,편리이용 좋습니 다
2273,업데이트 된 이후로 빨리감기(더블클릭 또는 드래그)하면 하단에 시간 상태바가 떠서 연속 스킵이 안되고 끊어져서 불편합니다. 이전에는 손가락으로 드래그를 연속해서 빠르게 돌려볼 수 있었는데 너무 불편해짐
2274,갤럭시 탭 a8로 웨이브 보고있는데 갑자기 업데이트가 떠서 업데이트를 하니 계속 대기중만 나오구 설치는 안되네요 ㅠㅠ 신속한 조치 부탁드립니다.
2275,제발 백그라운드 재생좀 해주세요. OTT 사이트 경쟁구도가 심한데 아무리 컨텐츠 폼 좋다고 해도 이런 사소한것 하나 놓치면 발전이 있겠습니까? 고객으로써 진심으로 드리는 말씀입니다.
2276,영상을볼때 배속기능과 회차정보를 보는등의 기능이없어서 너무너무아쉽다ㅜㅜ 제발만들어주세요ㅜ!!
2277,미러링으로 티비에 연결해 잘 보고있었는데 외출한다고 티비 전을 껐더니 미러링 연결이 안되네요 티비로 보기 버튼 자체가 활성화가 안되어서 결국 앱 삭제 후 재설치해도 안뜨네요 연결 너무 불안하고 불편합니다
2278,최적화좀해주세요 나갔다가 들어오면 앱오류가 계속뜨네요..ㅡㅡ
2279,앱 최적화 최악
2280,안드로이드 마시멜로우부터 설치가 가능하다고 한데요~ 롤리팝까지 설치 가능하게 해주시면 안되나요 ㅠ 오래된 태블릿으로 쿠팡플레이 시청할려고 하는데~ 롤리팝이 최고 업데이트 입니다. 그렇다고 루팅을해서 설치를 하면 루팅된 기기라도 안되고 ㅠ 꼭 롤리팝도 가능하게 업데이트 부탁드립니다.~
2281,완전 좋아용 에반게리온 추가해주세요!!!
2282,일단 종류가별로없음
2283,스마트티비 지원좀.. 맨날 폰에서 깔아서 티비로 보는데 티비내에 앱설치했으면 좋겠어요
2284,핸드폰에선 스포츠 라이브 재생버튼이 있는데 태블릿 pc에서는 라이브 재생 버튼이 없어서 시청이 안돼요. 태블릿 pc는 갤럭시탭 s6라이트 사용중인데 아무리 지웠다가 다시 깔아도 라이브 시청이 안돼요.
2285,영상시청중 다른앱으로 진입 후 다시 티빙앱 실행시 보던 부분부터 재생해야 하는데 플레이버튼 누르면 보던 부분부터 재생한다고 하고 처음화면 진입시처럼 보이면서 재생이 안됩니다. 너무 불편해요.
2286,볼게없음 비싼돈주고 보는 의미가 없다
2287,"작년 6월을 마지막으로 몇차례 안드로이드tv용 앱을 요청드렸는데 잊고 지내다 오늘 우연히 검색해보니 떠서 설치했습니다. 영상은 안 끊기고 잘 나옵니다만, 한가지 아쉬운 점이 있어서 말씀드리자면 오히려 스마트폰과 tv사이에 캐스팅으로 연결할때는 리모컨의 재생/일시정지, 앞/뒤 탐색버튼, 정지버튼등이 잘 먹혔는데 안드로이드tv용 자체 앱에서는 리모컨의 위 버튼들이 먹통입니다. 리모컨의 상,하 버튼을 통해서 앱의 버튼을 눌러야 하는 한번의 과정을 더 거쳐야 하는 것이 다소 번거롭습니다. 물론, 처음부터 만족스러울수는 없겠지요. 앱 출시된것만해도 반갑습니다. 몇달걸려도 괜찮습니다. 차차 더 좋아지길 기대해봅니다."
2288,왜 모바일로 접속이 안되나요 로그만 뜨고 들어가질 못하네요 빨리 오류수정해주세요
2289,화면 꺼놓고 소리만 나오는 백그라운드플레이가 안될줄은 몰랐음
2290,왜 들어가지질 않을까요???갤럭시탭입니다
2291,좋아요 사진 찍고 저장하는 기능넣어주세요
2292,디플 비추천합니다 중간에 환불하려면 까다롭고 환불도 안해줍니다
2293,시청중인 콘텐츠에 자꾸 다 본 작품들이 떠서 불편해요 꾹 눌러서 삭제를 시키면 해당회차만 없어지고 그 전의 회차가 떠서 매우 불편합니다 ㅠㅠ 매주 연재되는 드라마나 예능이면 몰라도 이미 종영된 방송 마지막화를 봤을 때는 시청중인 콘텐츠에서 삭제시켜줬면 좋겠습니다.
2294,살짝별로
2295,쿠팡플레이 너무 좋은데 티비로 볼 수 있게 만들어주셨으면 좋겠어요 ㅠㅠ 폰으로 볼 때 말고 티비로 볼 때 컴퓨터나 에어플레이로 연결해서 봐야해서 좀 귀찮은 느낌이 없지않아 있는데 티비로 바로 볼 수 있게 설정해주셨으면 좋겠어요!!
2296,다 좋은데 제발 PIP모드에서 자막 보이게 해주세요~!!
2297,"노트북으로는 잘들어가지는데 어제부터 폰으로 어플이 안들어가져요 삭제했다 다시 설치해도 안들어가지는데 빠른 해결바랍니다. 돈주고 보는데 너무 불편하네요 저만 그런게 아닌것 같은데 빠른 수정, 답변 바랍니다"
2298,화면 잠금 해제가 안됨. 컨텐츠 목록 가독성이 안좋음.
2299,퀸덤1 좀 제발 풀어주세요.. 보고싶은 마음이 간절해요..ㅜㅜ
2300,"3단계 결제수단 등록에서, 신용카드 체크카드 다 해봐도 결제수단에 문제가 있다고 하네요.. 근데 이름에 카드의 영문 이름을 입력하나요?"
2301,친구가추천한 일곱개의대죄 정주행하려고 했는데 2기가4화가 끝이고 3기도없고바로4기로넘어 갑니다 2기5화가원래 없는지 볼려고 유튜브에 쳐보았는데 진작에 나왔더군요 어째서 없는거죠? 그래서3기가 진격거처럼 극장판으로 나온줄알았는데 없고 2개가있어서 이건가해서 봤는데 무슨보지도못한 근육질 아저씨가 나오고 그래도 잠깐보니까 그아저씨도 대죄라는데 다른대죄들을 합류하는 에피소드 가 다있는데 그아저씨는 갑자기 나와서 이야기가어떡해 되는지정말 모르겠습니다 2기완결내주시고 3기도보여주세요 그래도 돈내고보는데 이정도는해주세요 오랜만에 재밌는거찾았는데 못보니 정말실망스럽네요 2기4화마지막에 십계어쩌고하는데 십계가 뭔지 너무궁금합니다 나머지화들 전부공개 부탁드립니다 뒷이야기가 너무궁금해요 제가못찾는건지 아님진짜없는지 도알려주시고 될수있다면 보여주세요 제발부탁드립니다 보신다면꼭답장해주세요
2302,"지우학,오겜 개꿀이다"
2303,아직시청중인가요? 보다말고자꾸 떠서 불편해요 그전에처럼 안뜨게해주세요
2304,로고화면만뜨고 그뒤로 들어가지지가않아요ㅡㅡ월정액끊어놨는데 이거 한달넘게이러는데 어쩔거ㅡㅡ
2305,외국계가 이렇지 뭐 뭐만하면 접속이 안되냐 ㅡㅡ
2306,안들어가지는데 어디다 문의 해야 하나요? 3 .21 업데이트 이후 안들어가지네요
2307,어제부터 소리가안나오는데 왜그런거져? 블루투스 연결도 안되어 있는데..
2308,화질은 최대화질이라 되어있지만 막상보면 화질이 생각보다 떨어짐
2309,고화질로 잘보고있었는데 언젠가부터 Drm 인가뭔가 때문에 강제 저화질로보는데 너무 불편합니다
2310,아 넷플릭스 갑자기 안들어가져요 저번에도 그러더만 그땐 업뎃하거나 삭제 후 들어가면 됐는데 아니 몇 번을 삭제해도 안들어 가진다고요 진짜 돈 내고 이게 뭐하는거에요
2311,밝기조절이랑 배속 좀 넣어주시면 안 되겠습니까??ㅠㅠㅠ 그리고 앱이 타 ott보다 빠릿빠릿하지 않은 게 확 느껴져요
2312,가로화면에서 가운데화면에서 상단바 쓸어릴때 볼륨과 화면밝기가 자꾸 조작됨 쓸떼없이 화면 터치가 민감한건지.. 그리고 영상 정지했다 다시볼때 로딩이 왜케 김?? 재생버튼을 두번씩눌러야 재생이되고.. 홈화면도 내가 시청중인 콘텐츠가 사라졌다 생겼다.. 나만그런건지.. 너무불편해서 어프리뷰 처음써봄.. 개선좀 바랍니다 티빙 보다가 성격버릴듯.. 참고로 내폰 최신폰이고 와이파이 빵빵함
2313,갤럭시 S20 울트라에서 3월부터 먹통!
2314,최악임ㅋㅋㅋ 넷플 쿠팡플레이 사용하는데 일단 소형하몀 안됨( 갤럭시기준) 배속기능없음 다음화도 못넘김ㅋㅋㅋㅋㅋ 왓챠도써보고 다른것도 써봤는데 디즈니플러스가 기능 제일별로임
2315,다 좋은데 왜 롤리팝버전은 설치가 안되나요? 넷ㅍㄹㅅ도되고 ㄷ즈ㄴㅍㄹㅅ도되고 ㅇ이브도 되던데 쿠플도 설치하게해주세요.. 안드로이드5.0.2 롤리팝...
2316,"안녕하세요. 담당자님, 서비스를 잘 이용하고 있습니다만 이러한점은 개선되었으면 좋겠단 생각에 리뷰를 남깁니다. 안드로이드 폰을 이용중이며 홈화면으로 이동할때 아이폰과같이 밑에서 위로 쓸어올리기를 이용중입니다. 화면 재생중 홈화면으로 가기위해 밑에서 위로 (화면 제일 아래에서 위로) 쓸어올리다보면 자꾸 네비게이션 바가 움직여 시청하던 부분이 움직이게 됩니다. 해당 부분 참고하시어 다음 업데이트때 사용자분들이 좀 더 편리할수있는 환경을 만들어주세요. 감사합니다."
2317,얼마전부터 스트리밍 에러라고 뜨면서 기기에서 사용이 안된다고 뜨는데 다시다운 받아도 안되고 왜이러죠??
2318,아이재미쩡
2319,플레이어 어떻게좀해라 기능최악이네 시대가어느땐데
2320,"아니 애니 나와 있기릴레 들어 갔더니 왜 애니 몇개 에피소드가 1,2기 없는데 3기만 있나요?"
2321,쿠팡 로켓배송은 그렇게나 빠른데 쿠팡플레이는 라이브 송출할때마다 왜이리 느린가요..뚝뚝 끊기고..최적화좀여
2322,한국대이란볼랴고 컴퓨터로 쿠팡플레이 들어갈려니까 접속도안되고 엄청끊기네요 큰 화면으로 볼려고 틀었건만… 축구보기도전에 기분이 팍상했네요 생중계같은거 지원도 제대로 못하면서 왜 생중계를 맡았는지;; 시작한지20분만에 원활히 진행되는데 기분이 너무많이 상하네요
2323,소프트웨어 업데이트 하고 나니 쿠팡플레이 - 서비스 에러... 뭘까요 ㅠㅠ
2324,시청하기 좋습니다.
2325,업로드 된 날짜도 안보이고.... 유튜브 링크타고 왔는데 해당 회차 일일히 찾아봐야하고 개불편
2326,앱에 안들어가져요~ 화면이 멈춤 돈만 받아먹고~ 해결좀 해바요 다음회가 안넘어가 져요
2327,"잔오류도 많고 자막지원이나 속도 조절 기능도 없고
밝기 조절, 소리조절 할 때 화면을 정확히 반반 분할해 터치로 조절하게해놔서 화면에 손만 대면 소리랑 밝기가 원하지도 않는데 막 조절되는 부분이 너무 불편해요.
타사 어플 보면 화면의 끝쪽을 드래그하면 설정이 변경되는데 이런식으로 변경해야할 것 같은데요..
볼 컨텐츠는 많지만 어플 기능이 너무 실망스러워요."
2328,영상을 처음보는데 일부 회차로 넘어갈 때마다 마지막 이어보기로 이동되는데 이게 해킹이 된건지 오류인건지 모르겠어요
2329,Skt연동땜시 써볼라 했더니 라이트라고 볼수있는줄알고 클릭하면 이용권구매하라뜨네 장난하는것도 아니고 라이트도 볼수있는것만 묶어놔야지 이거 뭐하는건지.ㅡㅡ
2330,왜 어플이 안들어가지죠???엊그제부터 접속창만뜨고 핸드폰으로 안들어가져요 신속한 조치 부탁드릴게요
2331,Apple TV 에 연결해서 보는데 재생하고 핸드폰 끄면 무조건 조금 재생되다 정지하네요.  재생을 한 번 시켜줘야 되서 넘 불편. 쿠팡플레이는 안그럽니다. 그리고 같은 시기에 Airplay 지원한 쿠팡플레이와 비교시 음질도 낮고 (에어팟 프로 연결) 재생바에 seek시 미리보기도 안나오네요. 앱 꺼도 안 멈추고요. 기술력 차이가 나는 것 같아요. Apple TV 앱 나오기전까지는 Airplay 로 버텨야하니 개선해주세요
2332,휴대폰 재부팅하시면 앱 열립니다
2333,이거 켜놓고 유튜브 시청하기 가능햇으면 좋겟음 영상 2개를 멀티로 봐야 하는 상황에서 엄청 난감함
2334,디즈니플러스는 아이폰만 호환되게 만드셨나요 갤럭시 s10+ 이용 중인데 계속 로딩만 뜨네요 다른사람 아이폰은 잘만 된다 이러는데 갤럭시만 안되는겁니까
2335,왜 휴대폰이 거진 일주일동안 안되나요ㅡㅡ 아 해지할거임 ㅅㄱ
2336,저희 어머니가 결제해두고 자막을 어떻게 다는 줄 모르고 한국컨텐츠만 계속 보고 계셨네요. 다른 오티티는 자동으로 설정되던데… 휴대폰 다루는 것 어려워하시는 분들 배려 좀 해주세요.
2337,어플 렉이 너무 심해요 웹사이트로 pc버전보기로 보면 렉 하나도 없는데 티빙 어플에서 영상재생시켜두고 아래 영상 목록을 스크롤하면 엄청나게 버벅이고 기본 플레이어에서도 화면 양쪽을 더블탭해서 넘기기 기능 이용시에도 엄청 버버버벅 거립니다.
2338,노트8인데 자꾸 터치가 먹통이 됩니다. 홈버튼 눌러서 메인화면으로 나갔다가 다시 티빙앱 실행해야 터치가 다시 되고요.. 앱 지웠다 깔아도 마찬가지입니다. 중간에 계속 보고 있는 도중에도 터치가 먹통됩니다. 터치에 문제있는 폰도 아니고 다른 앱에서는 이런 문제없는데 티빙앱 호환이 문제같아요.
2339,갤럭시탭에서 사용하니 자막이 흰배경만 나오고 글자가 보이지 않습니다 검색을 해봐도 해결방법이 안나오네요. 뭐가 문제인지 모르겠습니다 해결 부탁드려요
2340,갤럭시핸드폰인데 어제부터 자꾸 안들어가져요 오류라고 계속 떠요 해결 좀 해주세요
2341,유튜브도 넷플릭스도 안 끊기고 잘보는데 왜 티빙만 버퍼링 오져서 보질못해요? 핸드폰에서? 엄청 짜증나서 이번 다가오는 결제는 안할꺼임
2342,왜어플 실행이 안되죠?회원가입해서 결제까지했는데 어플이 깔리지가 않아요ㅠㅠ
2343,이거 머 한두번도 아니고.. 프로그램 회차 끝나고 몇일 후에나 업로드 되는 겁나 게으른 직원들. 우린 돈 쳐 냈으니 니넨 돈 쳐받는데로 언넝 업로드하라고... 이것말고도 시청하다가 잠시 멈춘 후 다시 재생하면 머 처음으로 갔다가 왔다갔다 하다가 포즈걸렸다가 아주 그냥 쌩쑈를 하드라.. 넷플같은건 보다가 중간 잠시 포즈해도 다시 플레이하면 바로 즉각적으로 재생되는데 티빙은 재생 중간 포즈했다가 다시 재생하면 플레이어가 정신 못 차리고 와리가리 쌩쑈를 해서 보다가 중간에 포즈할려면 큰맘머고 해야혀...
2344,최악입니다. 해지를 했는데 계속 자동결제가 되고 있었네요? 멉니까? 자기들 맘대로 돈을 빼가고ㅡㅡ 사기꾼도 아니고 해지 했는데 계속 자동결제되고; 조치를 취해주세요!!
2345,자막에 투자좀 하시지 요금제가 이렇게 비싸면서 투자라고는 안하네 정말..글로벌하게 짜다
