,0
4319,오른쪽을 손으로 쭉 올리면 화면이 밝아지고 왼쪽을 손으로 쭉 올리면 음량이 올라갔는데 이제 일일히 눌러서 옮겨야돼요;; 왜 넷플릭스처럼 업데이트 됐나요? 불편해여 다시 원래대로 해주세요 나머지는 다 좋습니다..명탐정코난 9기 더빙은 어디갔을까요?
4320,LG스마트tv에서 컨텐츠 선택하면 무한 로딩걸리고 영상 재생이 안됩니다 메일로 동영상과 함께 보내도 기계적이 메크로 답변만 돌아오고 해결은 안해주시고 상담원하고 통화도 안되고 어떻게 하라는 겁니까
4321,"영상 볼 때 배속도 할 수 있게 만들어주세요ㅠㅠ
다른 플랫폼들은 다 있는디 왜 디즈니만 없을까요ㅠㅠ"
4322,"자막 좀 똑바로 써주세요 갑자기 한자 나오고 특수문자나오고 그러네요
자막 시간 늦게 나올때도 있어요 아예 안나올때도 있구요 제발 개선 빨리 부탁드립니다"
4323,서비스 엉망이네요. 티비로 스트리밍 됐다가 다음날 되면 티비로 스트리밍하는거 버튼 없어지고 다음날되면 생기고 다음날 되면 또 없어지고. 이게뭡니까? 그냥 티비스트리밍하는 버튼 계속있게 수정해주세요..;;
4324,시청하다가 나중에 볼라고 껐다 다시 들어왔는데 왜 보던편에서 다시 재생하지않고 처음부터 시작하나요 한두번도 아니고 개선좀 해주세요
4325,"어떻게 업그레이드 할수록 기능이 구려지나요..팝업창기능에서 10초앞뒤, 사이즈조정은 웨이브만의 강점이었는데 이제 티빙 팝업창만 못해졌네요"
4326,고생많으십니다 업뎃하고나서 팝업하면 4분의1로 영상 사이즈가 줄었어요 원래 2분의1정도사이즈였는데 ㅋㅋ저는 한드보다 일드취향이라 일드위주로 보는데 자막을 못봐요 그리고 한국 노인은 아예 보지말라는 예능이겠어요 ㅋㅋㅋㅋ쿠팡플레이만 참 거지같다 생각했는데 똑같이변화하나요 2인 결제하고있다가 내가 취소하지않았는데 구글에서 갑자기 취소되지않나 뭐이래요? 다시 가입했지만 정말 프로그램이상하네요 별5개주고싶은데안볼까봐 3점드립니다 구글플레이연동하면서 결제수수료만 더 늘고 여기상담사 참 고생하시겠어요 안타깝네요 이거 지속되면 탈퇴할 생각이예요 이거말고도 편한게 많거든요 12개월 이제나옴? 티빙은 롯데카드할인까지해서 2인해서 12개월 7만얼마행사해서 얼마안하는데 2년에도 할인한다했었는데 여기는 2인에 참 ㅉ... 할말이없네요 12개월보고 픽 웃음....여기가 컨텐츠많고해서 좋았거든요 근데 화면 하나로 마음의 변동이 큽니다
4327,다운받은 컨텐츠도 웨이브 플레이어로 실행하게 해주세요. 건너뛰기도 안 되고 재생중이던 시점 기억도 안 되고 너무 불편합니다. // 구글pip은 저는 개인적으로 아주 만족스럽습니다. s20+입니다. 팝업 이용이 매우 편리합니다. 크기조절도 자유롭고 어플전환도 매끄럽습니다. 제가 홈버튼을 사용하지 않고 스와이프(?)로 설정을 해두었는데 그것때문이 아닐까 예상해봅니다.
4328,아니 이용권 구매를 했는데... 돈도 빠져나갔고 정기결제 관리에는 있는데 정작 앱에서는 이용권을 구매하라고만 한다? 구매를 누르면 이미 구독이라고 한다? 농락당하는 기분..... 심지어 금요일 저녁이라 내일은 고객센터가 쉰다고 하니 내 금토일 이용은 물 건너간 셈. 아니 진짜 화나고 황당하고 다시 앱도 깔아보고 별짓을 다했지만 제자리... 그냥 짜증나고 화난다.
4329,조으다.
4330,넷플릭스랑 쿠팡플레이처럼 다른작업할때도 화면 좀 계속 떠있었음좋겠어요!!!
4331,"디즈니는 속도가 없더라고요. 티비버전 쿠팡이나 유튜브에는 속도제어가 가능하던데,디즈니는 모바일도 없어서 티비와 모바일 모두 속도제어좀 해주세요."
4332,와우회원입니다. 후발주자답게.. 좋은 점들은 받아들이고.. 특색있게 발전해주세요.
4333,아니 와이파이 짱짱한데 아이폰 아이패드 에서 시청하는데 영상 멈추는거 너무 심각해요 해결 좀 해주세요 한두번도 아니고 영상 하나 보는데 뻥 안치고 수십번은 멈추는 듯합니다
4334,설정 들어가도 알림 설정하는데가 없어요! 어디 있는건가요? 알림 받기 싫은데요
4335,개선의지가없음 사용자들의 불편함을 모를리없는데;;
4336,튕기는건 기본이고 자잘한 오류들에 반응 속도도 너무 느리지만 재밌는 컨텐츠가 많으니까 그러려니 참고 보고있었습니다. 근데 이제 하다하다 일시정지만해도 에러나서 재생이 안되네요~ 어플 지웠다 깔아도 똑같아요. 보다 만 뒷 내용이 너무 궁금하고 아른거리는데 지금 저는 그냥 공중에 돈 뿌린 사람이 됐어요ㅎㅎ 해당 영상만 그런걸까봐 다른 영상도 틀어봤는데 다 재생이 안되네요. 이렇게 만들기도 쉽지않을텐데 너무 신기합니다. 디자인 업데이트보다 중요한게 있는 것 같은데 개발자분은 휴가가셨나요?
4337,파친코 해주세요
4338,갤럭시폴드4인데플렉스모드안되는이유아시는분있나요?
4339,티비에 티빙은 속도가 없더라고요. 쿠팡이나 유튜브에는 속도제어가 가능하던데 모바일처럼 속도제어좀 해주세요. 그리고 티비서 웨이브는 10초 빨리감기(되감기) 누르면 모바일처럼 넘어가는데 두번에 확인까지 넘어가는 불편한점이 있습니다.
4340,"아이패드로  앱을 들어갈떄 갑자기 앱이 자주 튕기는데 
이건 왜이러는지 알수있을까요?"
4341,"굳이 넷플 따라해야하나. 찾기도 어렵고 … 여기저기 반복에…

아 그리고 왜 재생화면에 다음편 넘어가기 없어요?"
4342,블루트스 키보드로 안드로이드 tv의 넷플릭스 앱에서 검색 시 영어로는 검색이 되지만 한글로는 검색이 안되는 문제가 있어요. 한글의 자음만 인식되고 모음은 인식이 안돼요. 해결해 주세요.
4343,"웬만하면 결제 유지할려고 했는데 솔직히 컨텐츠 너무 없어요. 스우파도 없고, 아는 형님도 없고. 사실 마음만 먹으면 무료로 다 볼수 있는 컨텐츠 뿐이에요. 요새는 삼성앱에서도 웬만한 채널 볼수 있고 웨이브, 유튜브 넷플릭스 결제 중인데, 웨이브 보는 날은 손에 꼽네요."
4344,버그인지 모느겠지만 넷플릭스가 먹통입니다. 그리고 다른분들도 말했듯이 처음시작할때 위에 이상한 그림이 뜸니다. 이점을 고치면 다 좋겠습니다.
4345,왜 자막뒤에 검은 배경이 생겼나요ㅠㅠ 다른 분들 리뷰보고 업뎃할걸 하고 후회중입니다... 적어도 선택할 수 있게 넣어주실 순 없는지요...
4346,앞부분 건너뛰기처럼 생기면 좋겠어요
4347,최악이네요 TV로 웨이브 시청할때 계속 무한로딩 입니다 대체 어떻게 보라는거죠?? 1~2분 시청하면 다시 처음으로 돌아갑니다 ~ 계속 무한반복입니다 갑자기 이렇게된 이유를 모르겠네요 업데이트 이후로 이런현상이 생긴거 같은데 해결좀부탁드립니다~ TV로는 시청을할수 없네요
4348,언제 부턴가 업그레이드 후 차량 블루투스에 연결되면 영상 실행이 계속 멈춥니다. 왜 그럴까요?
4349,모바일로 해지하기 위해서 앱을 깔아야 하는군요
4350,시청 중인 영상이랑 시청한 영상이랑 분리가 되면 좋겠습니다.다 본 영상도 안 사라지고 지울려면 너무 힘들어요.
4351,넷플릭스에 상속자들좀 올려주세요
4352,팝업화면으로 시청가능하게 해주면좋겠습니다
4353,아쉬운점 몇 개 (1) [[영상목록 아래 내가 어떤 영상을 어디까지 봤는지 빨간줄로 표시가 안 됨.]] 예를들어 놀라운토요일 을 선택하여 방송목록으로 가면 내가 몇 화를 봤는지 어디까지 봤는지를 알 수 없음. 내가 안 본 회차를 찾으려면 일일이 수백화를 하나씩 다 들어가봐야함. 유튜브의 경우 내가 본 영상 아래는 어디까지 봤는지 빨간 줄로 진행상황이 다 나옴. (2) [[영화쪽 카테고리 설정이 너무 빈약함]] 이상하게 티빙은 tv쪽과 달리 영화는 딱 기본적인 1단계 장르밖에는 적용이 안 됨. 개별구매 이런거 말고 세부카테고리 분류가 더 필요함. (3) [[전체화면-작은화면 전환속도가 심각함]] 타 어플은 매우 전환이 빠른 반면 티빙은 까맣게 꺼지고 회전하고 다시 화면이 확대되어 꽉 찰때까지의 과정이 사람 눈으로 보일정도로 느림. 특히 1번은 이미 최근 본 영상에는 기능구현이 되어있어서 한시간도 안 걸려 복붙으로 충분히 개선이 가능할텐데 왜 안 하나 모르겠네요.
4354,한산 언제 하는겨 맨날 같은메뉴만 나와
4355,다 좋은데...크롬케스트에도 오프닝 건너뛰기 줄거리 건너뛰기 좀 넣어주소
4356,다 좋은데 제일 아쉬운 점은 배속 기능이 없다는 거예요... 진짜 제발 배속기능좀 만들어주세요 이래서야 월드 베스트 오티티가 될 수 있겠냐고요
4357,미드 시리즈 많은것들도 디플엔 많아서 정주행하고있는데... 배속이 안되어 너|~~~~무 답답합니다... 유튜브 요약영상으로 가지않게 해주세요...
4358,팝업모드가 사라져서 너무 불편해요 답변 감사합니다
4359,핸드폰연결좀 풀어주시오 매번 노트북켜기힘들어요
4360,자막 테두리 설정을 만들어 주시던가 테두리를 없애주시던가 빠른 조치가 필요할 것 같습니다. 보는 내내 테두리에 신경이 쓰여서 제대로 보지도 못하고 중간에 꺼버리는 경우가 다반사네요.
4361,지 멋대로 갑자기 꺼지는 버그 좀 고쳐주세요
4362,"갤럭시 노트5 재지원 요청, 갑자기 시청이 안됩니다."
4363,"전원일기 예전꺼는 없다고 치지만 2,3백편 넘어가서는 왜 띄엄 회차가 있어요? 예전에 있었던것 같은 회차도 지금은 없고...전원일기 회차별로 다 보고 싶습니다."
4364,사용 하기가 편리하고 실속 있습니다.
4365,자막 검정화면 나오는거 좀 없애주세요 업데이트 괜히 했어요 제가 좋아하는 앱인데 안바뀌면 불편해서 못쓸거같아요 최대한 빨리 개선해주세요
4366,갤럭시 폴드와 테블릿에서 앱이 가로 방향으로만 나오네요. 세로 방향으로도 지원하게해주세요
4367,앱이 기기와 호환되지 않는다고 나옵니다. 기기는개럭시 노트10 입니다.
4368,이업데이트는 누가하셨나요?? 예능을 좋아해서 넷플릭스나 다른 OTT는 한번씩 결제해도 웨이브는 항상 보는데 너무불편하네요 연결도 잘 안되고... 폰으로 보든 스마트 티비로 보든 너무 불편합니다 영상도 선택해서 볼수없고 항상 보던거 연속해서 봐야하고 개선 쫌 해주세요!!!!
4369,"보다가 중간에 끄면 본데부터 이어보기가 되야되는데
티비로 계속 이어본데까지 끌어서 봐야되서 너무 불편해여
개선 좀 해주세요. 이어보기 문제는 정말 최악이에요"
4370,"갤럭시 폴드3사용자입니다 혹시 플레이어개선은 하실의향이없으신가요 플레이할때 너무불편합니다 제가 웨이브를같이쓰고있는데 웨이브 플레이어는 개선이 엄청돼서 자주쓰게되는데 티빙은컨텐츠는 좋은데 플레이어때문에 쓰기싫어지네요 특히 회전, 전체화면, 중간재생 그리고 화면비율이 바뀔때마다 됐다안됐다하는문제등 플레이어 개선 계획좀알려주세요"
4371,"모바일로는 티빙 실행이 잘되는데, 티비로는 실행이 잘안되어서 사람 성질 버리겠어요😡😡😡"
4372,÷-'9'''''---5--'- .this /. . B .आ :o/: / . .अओऔऐ .ओओऊआ /ङ अउ . ' / / /एएओऔई'''ङङङझ औरंगाबाद ओएओईएऔऔऔखङौ o......आ
4373,얼마 전에 티빙 이용권 변경을 했는데 돈은 나가고 변경이 안돼서 고객센터에 문의를 했어요 다행히 이용권 변경은 됐는데 오늘 또 다시 오류가 생겨서 이용권을 다시 구매하라고 뜨더라구요 그래서 고객센터에 전화했더니 구매 내용 복원을 눌러보라고 해서 시도해봤는데 구매 실패라고 뜨고 아무것도 되지 않고 있어요 그래서 제가 1:1 문의를 하려고 글을 작성했는데   유효한 이메일이 아니라고 뜨네요 아무 조취도 취할 수가 없어서 너무 답답해요
4374,노트9 쿠팡플레이 설치가 안 됩니다. 버전이 기기호환이 안 된대요
4375,굳
4376,화면 닫은상태에서 재생이 멈추거나 꺼지거나 합니다 이상해졋네요
4377,크레딧 전에 다음화 버튼을 띄워주던지 플레이어 버튼으로 해놓던지 진짜 다음화 넘어 가기까지 너무 오래걸림 그리고 내가 본 컨텐츠 전부 어두운 화면이 너무 압도적으로 어두움 밤이나 어두운씬은 거실에 불켜농고 보면 환경요소는 거의 안보일정도 불끄고 보면 분간됨 디즈니에 맞춰 감마 설정해놓으면 공중파나 다른 오티티는 눈뽕그자체 티비에서 이상하게 썸넬에서 버벅임 컴 폰은 안그럼 이정도가 단점이네요
4378,태서렉트가 왜 큐브야.. 큐브는 트랜스포머라구.. 번역한 사람은 어디에도 거론안되는 큐브라는 단어를 왜 가져왔어... 번역수준 참...
4379,보도 안하는데 돈을 와 차 카페가 가는데 사기꾼 아이가.
4380,니네 인터페이스가 너무구려 전체화면전환 스크롤바 볼륨 밝기조절등 딴데보고 따라라도해 좀. 진짜 이런 불편한 사용성은 다시 결제하기 싫어지게만들어 아니 켜기전부터 짜증부터나 아니 사용법이 특허라도 있는거아니면 그냥좀 따라해
4381,휴대폰(갤럭시 픝립2)으로 미드시청중 꽉찬회면 설정하면 자막이 잘립니다
4382,법대로 사랑하라 스트리밍 좀 해주세요
4383,자막에 검은 배경 없애주세요 이런 식으로 바뀡 줄 알았으면 업데이트 안했을텐데 ㅠㅠㅠㅠㅠㅜㅠㅠㅠㅠㅠㅠㅠㅠ
4384,플립 꽉찬화면 전환시 자막짤리는 것 좀 어케 해주세요 제발...
4385,한국사등 동영상 시청시 한회가 끝나면 움직이질않아서 매번 삭제 후 재설치 짜증남
4386,노트북으로 볼 때 자막에 테두리나 그림자가 없어서 밝은 배경일 때 잘 안보여요. 테두리 좀 넣어주세요.
4387,스마트티비용 해외버전도 어플 만들어 주세요 한국 사용자 중에서 해외직구 티비 쓰는 사람들도 많습니다 엘지 버전 해외직구 티비도 만들어 주세요
4388,넷플릭스 보다가 이거본다? 진짜 대한민국은 외국 못따라간다..ㅋㅋㅋ 진짜 할 말 없음 편의성? 영상 렉걸림? 와우; 남 잘되니 따라가는 그런 ott 결제 하지마요 게다가 돈 차이 1천원?ㅎㅎ 너무 멋졍
4389,청각장애인용 자막좀 끌 수 있게 해주세요. 자막 때문에 영화보는데 집중이 안되요. 한국인이 모두 청각장애인이 아니잖아요?
4390,스마트tv이용시에 바로재생되버리는게 너무 불편해요. 제가 어디까지 봤는지.. 또 몇회를 볼껀지 선택해서 보던게 이젠 바로 재생되버리니 목록을 찾아서 다시 선택해서 봐야하는게 너무 불편하고 그전엔 몇회차엔 어떤내용이 나올지 간단한 설명을 본 후에 클릭해서 봤는데 그런것도 할수없어지니깐 웨이브 사용을 안하고싶어집니다...
4391,업데이트후 t서비스 로그인안되어 이용못하고있습니다 해결바랍니다
4392,"안녕하세요
앱 업데이트 이후 아이패드에서 맥 미니로 미러링이 안되네요.
6월달에 축구볼때만 해도 패드에서 맥 미니로 미러링해서
모니터로 크게 봤는데, 앱 업데이트 하래서 했더니
미러링을 누르면 네트워크 연결에 문제가 있다면서 끊기네요."
4393,아니 자막까지 다 하고 안풀어 일해라
4394,다른 OTT에 비해 사용자 편의 시스템이 미숙함
4395,팝업플레이 왜 없앴냐? Pip모드는 크기조정 불가이고 앱 자체를 팝업으로 쓰면 화면 크기조절 어렵고 왜 그러냐? 지상파 3사 등에업고 배째라 하는건가? 퀵동영상은 방송 끝나도 1일 이상 방치하는게 허다하고. 좀 잘해봅시다. 라이브채널 다 빠져서 볼것도 없던데.
4396,팝업창 업데이트 이후 사용을 안하게 됩니다. 기존에 사용하던 팝업창으로 다시 바꿔주세요 너무 불편해요. 이용자들이 기존 팝업창으로 바꿔달라는 얘기도 많은데 왜 아직도 개선이 안되고 있는건지 의문입니다. 팝업창 업데이트 전까지는 매우 만족하고 잘 사용 중이였는데 팝업창을 원하는 위치에 못 놔두고 사용하니 너무 불편합니다.
4397,키즈모드는 없나요? 아이들만 볼수있게 만들어주세요~
4398,첫달은 100원이길래 혹해서 결제했더니 할인안되고 12500원이 결제됐더라고요 구독 취소해도 한번결제한거는 취소도 안되고...100원은 왜 결제가 안되는걸까요?!
4399,제작 규정이나 의무인건지 장르나 스토리에 어색할 정도로 불필요한 동성애를 쑤셔넣는 거 보면 역겹다.그리고 오프닝 건너뛰기를 옵션으로 넣어라
4400,인터페이스가 여러모로 불편함 PIP 기능도 추가 해주면 좋겠음
4401,속도 조절도 안되고 불편한게 많음
4402,재생하다가 앱 끄고 나중에 다시 들어왔을때 멈췄던 부분에서 다시 시작하지 않고 엉뚱한 이전 화면에서부터 재시작 되는 경우가 최근들어 너무 많이 생기네요. 앱을 지우고 다시 깔아도 계속 그러는데 해결 해주세요.
4403,"처음부터 보다가 잠깐 뒤로 돌리거나 중간부터 시작하면 화질이랑 로딩 엄청 깨지네요.. 
중간 재생 건들지 못하고 처음부터 재생만 해야하는 걵 ㅠㅠㅠ 재생 화질 기능 개선 좀 해주세요~~!"
4404,로고 건너뛰기시켜져여
4405,노트9 사용자인데 이제 못쓰네요.
4406,노트10인데 기기와 버전이 호환되지 않는다는데 못보는건가여?
4407,오프라인으로도 컨텐츠를 즐길 수 있는 방법이 추가 되었으면 함. 다운로드라던지 앱 내에서 오프라인으로 저장가능하게 한다던지. 컨텐츠는 많지만 출퇴근할때처럼 어디로 장시간 이동할 때는 잘 손이 안가짐. 그 외에도 pc화면과 모바일 화면의 구성이 많이 달라서 자주 헤매이게 됨. 내가 찜한 프로그램을 찾으려면 pc는 마이페이지를 가야되고 모바일은 기록탭을 가야한다던지. 종종 찾는 것들이 pc와 모바일에서 아예 다른 페이지에 있어 그리 편하진 않음. 차라리 조금 더 기다려서 유툽으로 보는게 낫다고 생각한 적이 더러 있을 정도.
4408,휴대폰 화면 밝기를 줄이면 화면 자체는 그닥 어두워지지 않고 자막 글씨만 급격하게 어두워져서 거의 회색이에요..
4409,"이미 매달 결제해서 보고 있는데, 일년치 정기구독을 잘못 결제했습니다. 지금 구독취소를 하려고 해도 이번 결제는 취소가 안되더군요… 
!!! 중복으로 9월 이용권이 두개라 “일년치 정기구독을 취소하고 싶습니다”"
4410,갤럭시탭s8울트라 지원 되다가 왜 안되나요
4411,보통 편의성을 위해 업데이트를 하지 않나요? 진화가 아닌 퇴보를 선택한 이유가 무엇일까 시간이 지나면 적응 되려나 해서 더 써봐도 결국 답은 손절이네. 타 플랫폼대비 컨텐츠가 나랑 맞지 않아도 잼민이 딸랑구가 이게 편하다고 4인결제를 2년 넘게 했는데 편의성이 사라지니 여기까지 인 듯 하네요.
4412,프로필 잠금 기능이 없네요 만들어주세요
4413,업데하고 왜 라이브 멀티스크린이 안되나요?
4414,"리뷰를 쭉 둘러보니 애플티비용 개발보다 안드로이드, 스마트티비로만 추천을 해주시는데요 애플티비용 개발계획은 없는건지 궁금합니다 스마트티비가 없고 애플티비로 타사 ott는 모두 사용중인데 쿠팡은 폰으로만 시청해야하니 답답하고 아쉽네요"
4415,"넷플 좋은데요 아니 이게 없어?? 한 적이 너무 많고 
갈수록 볼 게 더 없어지는 거 같아요 오프닝 건너뛰기가 계속 튕길때가 많아요 나갔다 들어와야 다시되는 번거러움이 .. 다른 곳에 비해 싼 가격도 아니고 점검 좀 제대로 해주세요"
4416,"팝업도 없고, 동영상만 재생되고, 아직은 시스템적으로 개선돼야할 내용들이 너무 많다."
4417,팝업창 조절 안되게 바뀌고나서 구독해지했는데 이번에 업데이트 하길래 팝업창 개선했는지 알고 업데이트하고 다시구독했는데 앱여전하네요 팝업창 크기조절안되는 웨이브가 최신폰 사용자들만의 어플이 아니잖아요 그동안 많은 사용자들이 불편사항 의견 남겼는데 개선된게 없다니 이런줄 알았으면 재구독 안했어요 복붙답변만 남기지 마시고 구독자들 불편사항 적극 개선좀 해주시길 바랍니다
4418,"뭐 하잔건지 진격의거인 보는데 자막의 배경에 가립니다 짜증나요 진짜 뭐하잔거요? 다 가립니다 빨리 지워주세요. I don't know what to do. Please give me the subtitles background. You may not know Korean, so I'll leave it in English."
4419,배속재생 만들어주세요
4420,자막 검은배경 누구 아이디어인가요? 구립니다 원상복구 시켜주세요
4421,LG V50S 4k 화질 볼수있게 업데이트좀 해주세요 SD화질? 장난합니까? 자막 검은배경도 없애주세요 컴퓨터나 티비에서 볼때는 화질도 끝내주고 자막 검은배경도 없습니다 요금제도 제일 비싼 4K UHD 요금제 입니다 빠른 업데이트 부탁드립니다
4422,"자막 크기는 개선 안하나요? 초반부터 불편했는데, 개선의지가 없나요?노트북이나 탭에서 볼때 자막크기는 당연히 자동으로 변경되는게 당연한거고, 사용자에 편의애 따라 글씨크기 변경 기능도 있어야 한다고 봅니다"
4423,"오프닝 건너뛰기 기능, 영상 재생 시 화면 밝기 기능, 영상 재생 시 회차 정보 살펴 볼 수 있는 기능 좀 넣어주세요."
4424,볼게 너무 없음
4425,설명 자막과 대사 자막이 동시에 나올 경우 하단에 자막이 겹쳐서 너무 불편합니다. 아이폰에서는 설명 자막이 나올 때 대사 자막이 상단으로 올라가던데 안드로이드도 자막 안 겹치게 해주세요.
4426,디즈니 이새끼들 별점조작하네 리뷰 10중 9할이 2점이하 리뷴데 어떻게 4점대노?
4427,랙에 걸린 듯 로딩에사 넘어가지 않아 모바일에서 실행이 안되면 어찌해야하나요?
4428,GALAXY S22 에서 화면 끊기는 현상 해결 부탁드립니다.... 간헐적으로 계속 튀네요... 프레임 끊기고요... A82 쓸땐 안이랬어요...
4429,핸드폰과 탭에서 wavve사용중인데 화면크기조절 어디로 사라졌나요? 다른작업하면서 wavve화면 줄여놓도 멀티로 사용하는거 팝업플레이 안되나요?? 방법알려주세요 업뎃을 사용하기 편리하게 해야지 더 못하게불편하게 해놓으면어쩌나요?? 어이가없네요. 위에문의 답변좀해주세요
4430,"업데이트 전에는 잦은 끊김과 비록 느리긴해도 연결이 됐는데 어느순간부터 티빙앱만 실행하면 티비화면이 까맣게 바뀌면서 무한 로딩이예요... 엘지 티비와 휴대폰으로는 실행되는데 삼성 티비가 유독 로딩 화면에서 멈추네요 ㅠㅠ
집 와이파이 문제인가 했는데 넷플릭스랑 쿠팡플레이는 잘 나오는거 보면 앱 문제인것 같아요..
개선부탁드려요!"
4431,평소에 웨이브를 잘 이용하고 있어요 확실히 팝업 창이 사라지고 pip 모드로 변환이 되어서 당황스러웠고 심지어 크기조절이 안되사 너무 불편해요 아 그리고 이건 개인적인 궁금증인데 뮤직뱅크 9.2일 회차 언제 업데이트 될까요?
4432,오티티중 젤 시스템이 안좋아요 내려가는 작품들 개많은데 그런 건 다른 오티티처럼 언제까지 볼 수 있다고 좀 표시를 해놓지 그런것도 없음 나중에 이어보려니깐 없어져있고 스마트티비버전은 멈춰서 재생 안되는 오류 너무 잦고 영화 자막도 쓰레기 자막 너무 많음… 그리고 다본 작품은 왜 자동으로 안사라지는 거임. 시스템 개선 좀 하세요 일 안하나
4433,갤럭시탭4에서 시청하다 오랜만에 접속을 했는데 업데이트를 하라고 하네요. 그래서 업데이트를 하려고 했는데 기기와 호환이 안된다고 합니다. 웨이브를 시청하려고 기기를 변경해야하나요? 모든 기종에 호환이 되도록 수정 부탁드립니다.
4434,볼만한영화는 구매하라하네요. 영화가 많지않아요
