,0
6046,웨이브 업데이트 왜한건지.. 회차볼때 너무 불편함 소비자들 같은의견 쥬르륵 달았는데 양해해달라 검토해보겠다 똑같은 말만 복붙해놓고.. 소비자들이 불편하다하면 바로 바꿔야하는거 아니에요? 만든 자기들빼고 다 불편하다하는데 왜 이렇게 고집만 부리시는지? 진짜 정떨어져서 쓰기싫어져요
6047,"아니 도대체 왜 갑자기 전체 가로화면으로 고정되는건가요,,,불편해서 짜증이 날 지경입니다. 그건 이용자가 선택하게 해주셔야죠. 뭐 이렇게 써라 그러면 저희가 그렇게 사용해야되나요? 업데이트란 본디 더 나은 서비스를 위한건데 누굴 위해 이렇게 바꾼건지 정말 모르겠네요."
6048,오래된 아이패드라서 iOS  13 으로 update 가 안됩니다. 쿠팡플레이 이전 버전으로 계속 보려면 어찌해야 하나요ㅜㅜㅜ
6049,갑자기 모바일 오프닝 건너뛰기가 안되는데 왜 그런가요??
6050,티빙라이트 요금제와 관련하여 스마트TV에서는 실시간방송과 각종콘텐츠 시청이 불가능한가요? 스마트폰에서는 가능한 부분인데 스마트Tv에서는 유료결제해야만 시청가능이라 나옵니다.
6051,세로모드 원위치 해주세요 너무 불편해요 개발자분들 웨이브시청을 안하시나봐요
6052,영상재생시 바로 전체화면 되어버리는데 세로모드로 설정 어떻게 해요? 후기보고 업뎃할걸 괜히해서 불편해졌네요 사용자에게 옵션기능 선택권을 주세요 그리고 다인원 프로필설정 이용시 잠금 가능하게 해주세요 넷플릭스 티빙등은 다되는데 웨이브만 안된다...?는 것은 말이 안돼요..
6053,속도조절 안되네요
6054,"미니 아이패드 오래되서. iOS 1업데이트. 때문에
계속. 다시. 지웠다가,,깔고. 아주. 나리입니다
제발.  업데이트. 안되게. 해주세요"
6055,스마트폰 본인인증했는데요 첫달100원 구글스토어 이용자는 해당안됨? 인증하기전에 알려주셔야지 개인정보는왜수집 해당도 안되는데 개찜찜하네 구글머니3천원있었는데 왜0원으로 뜨죠 첫달100원 해당안된다는소리?
6056,"진짜 웬만하면 리뷰 안 쓰려고 했는데 이번 업데이트는 정말 레전드네요.. 시청 중간에 끄면 이어서 못 보고 다시 처음으로 돌아가는 것, 무조건 가로 화면으로만 재생되는 것, 시청 내역 누르면 바로 마지막으로 봤던 회차로 가는 것까지.. 진짜 다 너무 불편해요. 원래대로 다시 돌려주세요. 보고 싶어도 제대로 볼 수가 없네요. 그리고 다른 리뷰에 답글 다신 것 보니까 재생 화면에서 회차 누르면 다른 회차가 선택 가능하다고 하셨는데, 아니 누가 그 작은 화면의 썸네일만 보고 회차를 고를 수가 있나요? 제발 업데이트 전으로 돌려주셨으면 하네요"
6057,이용권 결제했고 시청하려고 들어갔지만 구글 플레이와 티빙 간의 결제 오류로 현재 구매한 상품을 이용할 수 없는 상태입니다. 충분히 구글 플레이에 문의 드렸고 말씀도 드렸습니다. 이용권을 구매했지만 이용할 수 없는 상태이며 환불해 달라라고 했지만 해결해 주시지도 않고 그저 '정책에 부합하지 않아 환불해 드릴 수 없다' 라고만 하신다면 전 어떻게 하나요? 그저 길바닥에 돈 뿌린 것과 뭐가 다릅니까??? 상담원 분과 원활하게 해결을 하던 아님 제걸 환불해 주시던 둘 중 하나는 해주셨으면 좋겠습니다. 여기저기서도 이렇게 의견을 무시하시면 어디에다가 연락을 드려야 되는지도 모르겠네요.
6058,서비스 시작한지 얼마 안 되서인지 아직 컨텐츠는 많지 않지만 이건 시간이 지나면 해결될 거같고. 스마트 tv 지원하면 더욱 좋겠네요. 이것도 시간이 지나면 해결될 거라 봅니다. 2020년 12월 25일 작성 ---------------------------------------------------------------- 스마트TV 앱에서도 쿠팡플레이를 이용할 수 있어서 마음에 듭니다. 초창기보다 와우 회원비가 올랐지만 컨텐츠도 많아지고 기능도 편리해져서(특히 스마트TV 지원) 이제는 타 OTT 서비스가 부럽지 않네요. 2023년 2월 5일 작성
6059,주변 밝기따라 일일이 밝기조절하지 않아도 되도록 시스템밝기 사용 기능좀 넣어주세요.
6060,동영상 선택시 바로 가로화면되는거 너무 불편해요;;; 정보를 볼 수가 없고 다른거 선택하려면 또 앞으로 가야해요ㅜㅜ 업데이트가 많이불편합니다
6061,영상보다가 에피소드 찾아보기 넘 불편해요 처음부터 다시 쭉쭉 내려야한다니 그리고 지금 보니까 최신화 순인데 왜 회차가 뒤죽박죽이죠? 에피소드 한번 찾기 힘드네요
6062,"다른거 다 좋은데요 화면밝기 조정 왜 못하게 하신거죠? 볼때마다 불편합니다 집에서 불키고 보면 자막밖에 안보이고 인물,배경 다 안보여요 제발 이것좀 고쳐주세요"
6063,"영상 시청 중에 다음화로 바로바로 넘길 수 있었으면 좋겠다 처음부터 시청 기능 말고 제발 유용한 기능을 줬으면 좋겠다. 일단 제일 시급한게 배속, 영상시청 중 다음화로 바로넘기기 오프닝 자동 건너 뛰기다."
6064,나의 해방일지 보고 울고 행복했던 기억이 있어서 아직도 유튜브 클립 따져있는거 시청하는데 여전히 못 끊고있는데 만약 된다면 해방일지도 추가 됐으면 좋겠네요😀
6065,안녕하세요 쿠팡 플레이 평소에 너무나 잘 이용하고있습니다. ’여름날 우리‘라는 영화를 보고싶어 찜한 콘텐츠로 분류해두었는데 갑자기 사라졌더라구요. 종료임박 안내도 없이 갑자기 내려가서 황당하기도 하고 아쉽네요ㅜ 다시 올라올 예정은 없나요?
6066,지금바뀐거 별로여요 엄청불편합니다 재생했을때 바로 전체화면 되는거 불편해요 전에처럼 에피소드랑 작은화면으로 나온게 더편하고 보기좋은데 저처럼 전체화면안보는 사람도 배려해주세요
6067,사용하기 개불편함
6068,아니 유저 요구보다 뭐가 중요한건지 모르겠네요 답변도 대충 맞춤법도 틀리고 성의조차 느껴지지 않아요 해당팀장 유선 번호 알려주세요 전화로 문의가 낫겠어요 --------------------------- 이전작성내용 리뷰 잘 안쓰는데 너무 불편해 글 남깁니다 넷플단점을 왜 따라하는지 모르겠네요 그리고 향상을 위하는게 업데이트인데 이번처럼 있던 기능을 굳이 없애는 정책도 이해하기 힘드네요 기존세로시청 부활 부탁드립니다.
6069,"지난 리뷰 삭제후 재작성합니다. 시청 중 사용자의 동작이나 조정이 없으면 일정시간 후 앱이 종료되는 설정이 되면 좋겠습니다. 보다가 잠들었는데, 배터리 소진으로 폰이 꺼져서 아침 알람을 놓쳐서 두번이나 지각할 뻔 했어요."
6070,"20일도 안남은 개막인데 중계 일정이 없네요
가능하면 중계진도 같이 좀 해주세요 해축도 중계진 별로면 소리 끄거 봐야하니깐"
6071,"로딩이 너무 느려요 고객센터 문의하니 저희집 인터넷 체크해보라하는데요 넷플, 웨이브, 유튜브 다 잘 나오는데 티빙만 로딩 개길고 나오다 멈추다 하는게 정말 저희집 티비 문제일까요? 처음부터 타ott에 비해 티빙 로딩과 움직임이 느렸지만 이번 티비앱 업데이트 이후 거의 볼수없을지경이 되었어요 확인과 개선 요청드립니다. 유료서비스답게 기본적인것부터 개선이 되면 좋겠네요"
6072,영상 썸네일까지 뜨는데 실행이 안됨
6073,세로보기 왜 안됩니까? 불편하네요 돌려주세요
6074,김지정본인입니다 손대지말세요 관리필용해요?제발부탁드립니다 제가휴대폰 에서 매일점검확인했습니다. 보고십어요? 관심 많이있어요? 제발부탁드립니다? 속상해요.
6075,꼭 기술팀에 전달해주세요 왓챠처럼 자동오프닝건너뛰기 업데이트에 넣어달라고
6076,"티빙, 넷플릭스, 디즈니플러스, 웨이브, 쿠팡플레이 다 휴대폰, 태블릿으로 보는중입니다. 그 중 전체화면보기와 종료가 제일 불편한 앱입니다. 같은 컨텐츠가 다른 곳에 있으면 티빙에선 안봅니다. 다른앱 벤치마킹해서 앱 사용성 올려주셨으면 합니다. 컨텐츠가 좋아서 별 두개 드립니다."
6077,질문) 저는 현제 N950(갤럭시노트8) 안드로이드9 버전에서 삼성덱스모드로 포터블 모니터 연결후 사용합니다. 현제 전체 기기다 정상인데요 덱스모드로 갤노트8연결후 쿠팡플레 를 실행시키면 창의 크기라든지 화면 비율이 조종이 안돼네요 11인치 디스플레이에서 핸드폰 화면크기정도로만 실행됩니다. 이유가무엇일까요? 자동메크로 답변말고 좀 진진하게 알려주세요
6078,지금 갤럭시Z폴드4로 더플랫폼이라는 영화를 시청중이었는데요.중반쯤가서는 사운드가 안나와서 껐다다시켜도 나오다맙시다.. 이런경험 첨이네요.
6079,내가 봣던거를 찾기 너무 어렵습니다...시청중인거랑 찜한것도 다 따로 있어 늘 불편했습니다 화면 맨위에 선명하고 쉽게 한번에 터치로 다 확인할수잇게 간절히 부탁드립니다
6080,스마트폰에서 3mb무제한으로 720p 잘 보고 있습니다... 최적화가 잘 되어 있는듯...
6081,잘 쓰고 있는데 한가지가 흠이라면 영화는 많은데 딱히 흥미가 가는게 없다는?ㅜㅜ 시청자들이 원하는 미디어를 찾는게 정말 중요할거 같아요 어쨌든 잘 쓰고있고 토리코 나왔으면 ㅜㅜ
6082,"진짜 해도해도 너무하네요. 작년말에 업데이트 후 강제 가로보기가 되어 앱이상인줄 알고, 글남겼더니 다수 사용자의 요구로 강제 가로보기로 개선했고, 처음이라 어색할 수 있다는 답변만함. 두달이 지나도록 대부분의 사용자들이 불편하다는 글들 넘쳐나는데 똑같은 답변만 복사, 붙이기하고 있네요. 고객센터 전화해도 자기는 모르는 일이니, 관련부서 전달하겠다는 답변뿐이네요. 설정에 가로, 세로 보기 옵션만 넣어도 될 건데, 수정하는게 그렇게 어렵습니까? 개발기술력이 많이 부족한가요? 소비자들 의견 무시하는 건가요? 참 한심하다는 말 밖에 안나오네요."
6083,기록탭 내 스와이프를 통한 새로고침 기능이 있었으면 좋겠어요ㅠㅠ
6084,"에러가 너무 많음, 지나치게 끊김. 720으로 맞춰도 270 이하의 화질을 자랑함"
6085,"여기 답변으로는 뭐 이전 버젼 다운 받아쓰라는데 그게 문제가 아니고 이전 버젼에서는 아예 홈에 들어가지지가 않아요 강제로 최신버전 받으라고 앱스토어 연결하는 메시지만 떠요 ㅡㅡ 업데이트 못하는 사람은 선택이라도 할 수 있게해주시지 너무하네요

아니 답변 확인했는데 제 아이패드os에서 최신 앱인건 알겠는데  그 이상 최신앱을 못쓰는 상황인데도 그거 다운받으라고 팝업이 뜬다고요!!! 그걸 없애달라고요!!!! 업데이트 안하면 앱이 작동을 안한다구요!!!!"
6086,프로필 바꾸려는데 오른쪽 하단 프로필 이미지 클릭해도 시청목록밖에 안보임 어찌 바꿔요
6087,동영상 세로로 볼수있게 언제 됩니까? 회차 확인하기 너무 불편합니다 웨이브 장점중 하나가 세로 동영상 재생 기능이라 생각한 구매자 입니다. 하루 빨리 다시 복구되었으면합니다.
6088,여기 리뷰 불편하다는 글 많은데 안들어주고 답변도 복사 붙여넣기 함 그냥 언론에 제보해서 이거 사용자들 말 안들어준다고 말하죠
6089,화질 개구림
6090,프로필 1개밖에없는데도 매번 접속 할때마다 프로필 골라서 들어가야하는것도 불편하고 매번 영상재생시 시청연령 3초 쿠팡플레이로고 3초 봐야하는것도 불편함 다른 OTT들은 영상재생되며 동시에 구석에 작게 표시되는데 쿠팡플레이는 볼때마다 너무 짜증남 영상 이어보기도 수시로 없어져서 계속 다시 하나하나 찾아서 봐야함 진짜 너무 불편하고 짜증남 밝기조절 음량조절도 제대로 인식 안되서 하염없이 불편하고 짜증남 ott재생중일때는 안드로이드 자체의 제어센터에서 밝기조절이 불가한데 영상 화면속에서 인식이되야 조절을하지 속터져 죽을거같음 어플 만든 개발자들 본인이 어플 사용시 불편하거나 이상한거 없다고 생각하는지 궁금함 당장 결제는 되어있으니 이달까지만 보고 삭제할거지만 아직 보고싶은 드라마도 많은데 제발 좀 개선됬으면 좋겠음 같은 증상으로 리뷰에 호소하는 사람들이 이렇게 많은데 고객센터 번호 달랑 주면서 연락하라고 댓글 달지말고 글을 토대로 개선좀요
6091,기가지니 a안드로이드 10셋톱박스사용 중입니다.찜 목록 확인없었는데생겨서 좋습니다만 모바일 기기에서는 모두 나오는데 스마트 TV에서는 일부만 나옵니다. 수정해 주세요ㅠㅠ
6092,저도 아이도 너무 잘 보고 있어요. 감사합니다. 그런데 혹시 아이패드 미니에서는 지원이 안되는 걸까요?? 아플 검색 자체가 안되네요;;;; 부디 제발 다운받게 해주시면 안될까요?? ㅋㅋ 제가 뭘 잘 못한거면 방법을 알랴주세요ㅠㅠ 부탁드립니다
6093,아..세로가로 택1하게좀..쓸때없는것좀넣지마여
6094,전체화면에 광고 왜 X 눌러도 안 지워져요? 빡쳐서 못 쓰겠네...
6095,세로 화면 시청 빨리 돌려놔주세요 업데이트?? 누굴 위함 입니까? 사용자에게 불편함을 주는게 업데이트? 이용료 지불 하고쓰는데 불편함음 줘도 됩니까? 돈 값 해주세요 진짜 솔직 많이 불편하네요. 그 전처럼 세로 화면 에피소드 보게 돌려놔주세요 그전 별 5개 였는데 지금은 한개도 아깝습니다.
6096,이번 업뎃 구림.. 티비에 앱은 더 구림 그리고 진짜 부탁드리고싶은건 구버젼 업데이트 안하고도 쓸수있게 해주세요! 안드로이드 버전 낮은 탭이나 셋탑에서는 결국 사용할수없습니다!
6097,터치로 밝기 및 볼륨 조절 감도 조절 필요 / 최근 시청목록 위젯 있으면 좋을듯
6098,안녕하세요 쿠팡플레이는 다 좋은데 정말루 좋은데 하이큐 시리즈 4기까지 제발 좀 내어주시 옵소서!!!!!!!!! 그리고 마스터 셰프 주니어도 영어 공부하는 거 치곤 엄청 재밌게 봤는데 어느순간 없어졌어요!!!!!!! 제발 다시 내주세오!!!!!!!!!!! 사랑해요!!!!!!!!!
6099,"세로보기 없어져서 불편해요. 세로보면서 다른회차 설명도 읽고..좋았는데...사실은... 유튜브나 티빙처럼~재생시키면서 다른 프로그램 찾고 구경할수있게..그러면 좋겠는데ㅡㅡ; 암튼,...매번 느끼지만 웨이브는 업데이트만하면 불편요소가 생김."
6100,와 업데이트 되더니 UX 개판 됐네; 에피소드 바꾸기 어렵고 전반적으로 직관적이지도 않네. 사용성 너무 떨어져서 별 1점도 아깝다
6101,전에걸로 돌려놓으세요..슬슬 짜증나네요 업뎃담당자 시말서 쓰세요
6102,"노트북으로 웨이브 볼때마다 버퍼링이 너무 심합니다, 농담이 아니라 진짜 5초에 한번 꼴로 버벅이는데 도대체 뭐가 문제인걸까요ㅠㅠ"
6103,Ui업데이트 된후로 너무너무 불편함 사용성 최악 보다가 다른에피 보려면 다시 검색해서 리스트가서 하지 않으면 안되고 대체 이런 사용성 디자인을 누가한건지 인턴급한테 싼돈주고 한건지 컴폼해준 사람도 문제... 전문성 제로로 보임. 심야괴담회 다른곳 생기거나 없어지면 바로 결제 최소예정..아니먄 돈 더주고 다른거 써야겠어요. 😬
6104,돈이 너무 나가서 취소해주세요
6105,갤럭시 노트 20인데 설치 불가능한게 이해가 안가요... 제 폰이 오래된것도 아니고... 원래 설치 했었는데 업데이트가 불가능해지더니 삭제하니 호환이 안된다고 하네요....
6106,버그살짝있음
6107,원피스 왜 내보내다가 멈춤 인기도 많았는데 다음 에피소드 내놔라
6108,겁나좋음. 근데 청각장애인용 자막좀 사라지게 해주세요.
6109,월 14900원씩 빨아먹으면서 재생조차 안되게 만들어놨네. 소리만 나고 검은화면만 나오네. 이게 무슨 라디오 앱이냐?
6110,Apple TV 에서도 쿠팡플레이를 사용할 수 있게 앱 만들어주세요!! NFL 생중계를 큰 화면으로 보고 싶어요!
6111,스마트 티비에서 페이지를 불러오지 못했습니다 라고 떠서 영상시청이 안됩니다. 스포츠 스토어 키즈 탭은 정상적으로 시청이 가능한데 홈 Tv 영화탭은 시청이 불가능합니다.앱을 삭제 하고 재설치 해도 같은 증상입니다. 해결방법 부탁드립니다
6112,영상은 좋은데 시작할때 광고 최악
6113,화질은 정말 좋습니다. 조금 아쉬운건 가끔 로딩이 걸리네요
6114,LG 스마트 티비로 보는데 화질이 자꾸 떨어져요... 티비도 화질 조정할 수 있으면 좋겠어요.
6115,폰으로는 앱이안켜지고 태블릿으로만켜짐 뭐죠..?
6116,동영상 플레이어 배속 되게 해주세요
6117,개선은 안되고 사용자 말들 무시하고 업뎃이전이 더 사용하기 편햇고 폴드모델 메뉴가로모드안되고 재생만 강제 가로전환 세로로 다시보게 해달라고요 한달이넘도록 업데이트 고칠생각도 없으신거 같고 재생중에 에피소드 누르면 빈창만 나오고 왜 잘쓰던걸 사용자 의견반영이라는 이상한 이유로 불편하게 만든건지 모르겟네요
6118,업데이트 왜이렇게 구리게했죠?? 크롬캐스트 연결해서보면 연속재생도 안되고 한회차 끝나고난다음 다음회차 보려면 연결끊었다가 다음회차틀고 다시 연결해야됨. 진짜 극한의 최악이다. 돈내고쓰기아깝다 진짜 답 달아놓은거 보니까 업데이트 욕하는거 아는데도 그냥 죄송합니다 앵무새처럼 복붙해놓고 아무조치도 안하는게 더 역겹다.
6119,공짜로 보고 있는것도 아니고 돈내고 보는데 사용자가 불편한 걸 참고 익숙해질때까지 기다리라는게 말이 되나요? 계속 안익숙해지면 환불해줄것도 아니잖아요 다른 OTT앱에는 다 있는 이전회보기도 없애고 세로모드도 없애고 세로 모드로 보면서 회차 설명도 보고 했는데 너무 불편해요 누굴위한 업데이트인지 모르겠네요 다운그레이드라도 하게 해주세요 불편한걸 개선할 생각은 안하고 참고 익숙해질때까지 기다리라는게 말이 됩니까?
6120,"바뀐 버전이 처음이라 낯설고 불편한 게 문제가 아니라 여기 리뷰쓰는 사람들은 대부분 웨이브 오래 써온 사람들일텐데 적응하고 싶어도 불편한게 한 두가지가 아니고, 고객센터에 문의해도 똑같은 답변에 달라지는 게 없으니까 여기까지 오는 겁니다. 홈 화면에서 에피소드 찾는 게 사라지고 바로 재생으로 넘어가버리니 오래 전에 업데이트 된 드라마 찾으려면 검색 혹은 스크롤 엄청 내려야 하는데 터치가 몇번이나 늘어났는지 모르겠고 또, 바로 재생된 화면에서 에피소드에 대한 간략한 설명을 보고 싶어도 홈 화면에선 나오질 않으니 불편합니다. 그냥 전체적으로 예전 버전이 훨 간편하고 단순하고 실용적인데 무슨 생각으로 이렇게 업데이트 해버렸는지 모르겠네요... 내부적으로 이게 더 낫다고 결론이 나와서 이런 업데이트가 진행됐다는건데.. 컨텐츠가 자주, 다양하게 업데이트 되는 건 정말 좋지만 ui와 이용 방식이 불편하니 예전보다 이용을 덜하게 되고, 같은 컨텐츠가 다른 ott에 있으면 거길 이용하게 됩니다.."
6121,웨이브는 왜그럴까요?안드로이드업데이트때문에 이렇게바꼈다는데 타사앱(쿠x.티x. 넷xxx.bxx등 들은 다기존처럼 잘되는데 왜 웨이브만이럴까요?클릭하자마자 영상재생으로 데이터빨아먹을려고그런걸까요?왜 사용자들을 사용하기 더불편하게 해놨는지 정말궁금합니다.개발자도 사용해보면 느낄건데 참희안합니다.이것때문에 타사중복프로그램볼때 예전엔 웨이브가1순위였는데 그냥안보게됨 누르자마자 가로모드로 재생되고 회차정보도못보고 그냥 쳐봐라인지 시원한 답변 부탁드립니다.
6122,"매주 업뎃 된다면서 업데이트도 느리고 화면도 잘 보고 있는데 잘 끊기고 분명히 다 봤는데 다음날 틀면 다시 전날 보기 시작한 부분으로 나오고…
너무 좋은 서비스 감사하지만 조금은 개선해야할거 같아요"
6123,스마트TV에는쿠팡플레이가중지되었다고작동을안하네요
6124,되감기 기능 좀 넣어줘요!! 그리고 일시정지 좀 해뒀다고 해당화 처음부터 다시 시작하는 ott는 첨봄.. 아무리 저렴해도 이정도도 못해줘요?
6125,전체화면 풀화면 만되는데 이 전 처럼 업데이트 준비중인가요? 아래 답변보고 창모드 해봤는데 불편합니다
6126,"웨이브에서 없애버린 pip 팝업 크기조절, 영상세로보기도 다 되는 티빙!! 이 기능때문에 웨이브해지하고 티빙으로"
6127,재미있어요 화질오디오굿입니다 감사합니다 행쇼
6128,"넷플, 디즈니, 쿠팡플레이어 등등 이런 어플 수도없이 이용했는데.. 이 어플은 ㄱ쓰레기 어플이 확실함. 이용권 구매를 왜 pc로만 되게 함? 그래 그건 이해한다고 해도.. 개별 이용권 구매도 pc에서 해야함. 살다살다 이런 쓰레기는 처음 봄."
6129,웹으로 들어갔는데 앱으로 보라고 강제로 선택하게끔 하는 게 어이가 없네요.
6130,맥북전용앱개발점
6131,먹통 먹통 외부 메모리 저장후 암것도 안됨 이게 몇일째인지...
6132,넷플릭스 쿠팡플레이 티빙 사용중인데 이번에 디즈니 구매후 너무 화남 버퍼링 계속걸리고 어플서버 자체가 불안정한 다른 어플은 다 멀쩡한대 디지니만 그럼
6133,"제발 띵작좀 넣어주세요... 타이타닉,퀸카 등등"
6134,"푹 초창기부터 쭉 애용하고 있습니다. 언제자 업데이트부터인지는 모르겠으나 실시간프로보기 광고가 너무 나오네요.. 30분동안 1분짜리 광고가 3번 나오는건 너무하지않나요..?? 돈내고 이용하는데 점점 시청에 불편해지는건 이용권 끊으라고 부추기시는건지ㅠㅠ무도나 런닝맨, 옛시트콤 등 한 프로만 실시간으로 해주는 채널 광고 - 예전처럼 1회차 끝나면 나오는걸로 되돌려주세요.. 불편해서 이용못하겠습니다."
6135,영상재생이 지연되고있습니다. 에러 계속나요. 심각하네요.. 고쳐주세요
6136,노트23울트라 개통했는데 앱이 안되요
6137,앱에서는 쿠폰 등록이 안 되네요? 쿠폰 등록 만들어주세요ㅠㅜ
6138,인터페이스가 너무 불편합니다. 최소 화면잠금 기능 이라도 만들어 주세요.
6139,영상 보다가 자꾸 그냥 멈춰버리네요; 앱 종료하고 다시 켜도 계속 멈춰요. 결제하고 사용하는 어플이 왜 이 모양인가요? 신속하게 조치해주세요
6140,화면 딜레이가 너무심함.넷플릭스와비교하면 너무 후짐
6141,보는것도 편하고 번역도 잘 되어 있어서 좋아요! 하지만 단점이 유입이 너무 늦어요 보고싶은게 있어도 없는경우가 많아서 좀 아쉬워요
6142,"볼것도 많고 다 좋은데.. 관심목록 옆으로 한번에 보게 좀 해주세요 ㅠㅠ
스크롤 내릴때 너무 귀찮아요.. 더빙 자막 나누어져 있고 파트도 나누어져있는게 많은데.. 왜 이렇게 보게 한건지..전 관심목록 위주로 봐서 너무 불편합니다

제발 바꼈으면 좋겠습니다! 이것만 빼면 좋습니다"
6143,화면 캡쳐도 안되고 영상 녹화도 검은화면으로 뜨게 할거면 대한민국 대표팀 경기 중계 하지말아주세요. 그거 볼려고 쿠팡플레이 깔았는데 화면 캡쳐도 안되고 영상 녹화도 안되니...😮‍💨😮‍💨😮‍💨😮‍💨
6144,세로모드는 왜 안될까요? 이동시 가로보기시 폰 잡기도 불편한데...
6145,"어플이 안된다고 나옵니다
안드로이드 태블릿에서 어플 사용 할수 있게 해주세요"
6146,다좋은데 제발 애플셋탑Tv에서도 지원돼게해주세요
6147,저기요 이제 1박2일시즌1 없애고 2나 3나 해주세요 시즌1 지겹네요
6148,화면이 자동으로 커지는데...방법이 없나봐
6149,포켓몬스터w보는데 완결이 136인거 같은데 왜 118까지 있나요? 더 있었으면 좋겠어요
