,0
0,도대체 아이패드 블루투스 키보드로 재생하고 멈출 수 있는 기능 언제 내 주실 건가요... 넷츨 왓챠 등등 심지어 인강 앱까지도 키보드 스페이스로 멈출 ㅜ수 있는데.. 너무 불편해요 ㅠㅜ
1,"TV에서 시청중입니다

아직은 안정화가 덜 되어 있는듯한 느낌입니다 

딜레이가 좀 길고 리모컨 방향키(좌, 우) 버튼으로 되감기나 빨리감긴 지원이 아직 되지 않는 것 같습니다"
2,제목처럼 글자가 안보이고 칸만 보여요.  뭐가 뭔지 모르겠어요ㅠㅠㅠ 빨리 수정좀요 아이패드로도 했는데 똑같아요 화면에 아무글자도 안떠요
3,"아직은 전채적으로 쿠팡플레이 정도의 느낌
TV와의 연동이나 자막도 2% 부족.
볼거 골라보고 이탈 하지 않을 수 있는 그런 한국시장이
되길 바랍니다."
4,무엇보다도 동시 접속 4명인데도 화질 저하없이 9900원에 좋은 화질로 감상할 수 있어서 너무 좋습니다. 2% 아쉬운게 있다면 휴대폰으로 시청할 때 화면으로 밝기 조정이나 음량 조절이 없는게 조금 아쉬울뿐 그거 외에는 아이맥스도 지원하니 정말 좋습니다 :)
5,"최적화는 구리고, 기타 편의기능도 넷플릭스에 비해 부족함(속도조절, 자막조절 등등등)"
6,버튼이 에피소드 끝나고 바로뜨면 젛겠어요 왓이프는 언제공개되나요?
7,뭔영화보다가 화병걸릴듯 아이폰13씀
8,"아이패드로 시청중인데, 기본적으로 앱에서 나오는 글씨가 이미지화 된 글씨말고는 보이지가 않습니다. 어서 패치해주세요"
9,동기화의 문제인지 뭔지 모르겠지만 핸드폰 빼고 아직 최적화가 안되었나 보네요 영상은 틀어지는데 ui들이 다 작동되지 않아서 답답해요
10,헤헤소울봐야지
11,너무 좋아요 ㅠㅠ 관심에 추가하느라 손가락 아팠음 볼게 너무 많아서 너무 ㅅ행복함
12,"pip모드에서 앞뒤로 감을 때 자주 자막꺼짐. pip모드에서 전체화면으로 돌아갈 시 초기화 되어 처음 계정설정으로 감.
한글 자막이 매우 엉터리임. 
너무 직관적으로 표현되어 있어 이해하기 어려움"
13,"모바일 기기 자막좀 손봐주세요 플스 자막도 마찬가지고요
무슨 모바일 자막은 너무 커서 화면을 가릴 정도고
플스는 검은색 박스에 흰색 자막… 무슨생각인거죠…??"
14,缺点是里面的内容过少.希望后期能大大增加吧～本人是国家地理的铁粉～～～～～
15,"영상에 비해 자막 너무 커서 얼굴 다 가리고 
자막 뒤에 배경 때문에 얼굴 싹다 가리고 미치겠어요
자막크기랑 배경 설정좀 할 수 있게 바꿔주세요 제발"
16,아이패드에서만
17,뒤로가기나 다른 상단바 터치들이 잘 먹히지 않습니다
18,10등안에 들어보기
19,"평생 디즈니 보면서 자란 어른이가 또 디즈니를 보네요. 로그인하는 순간부터 두근두근.

컨텐트 목록 첫 화면 보고 와… 했슴니다."
20,"pip모드로 영상보다가
전체로돌아가면 프로필화면으로 넘어가네요
ios최신버젼에 맞춰 업데이트 부탁드립니다"
21,어릴적 나왔던 것들도 보이고 많이 기대가 됩니다
22,굿 말이 필요 없음
23,방금 깔았는데.. 버튼에 텍스트도 안나오고…. 뭔지 모르겠네요….
24,저렴한 가격으로 마블과 디즈니 영화를 볼 수 있다니 최고에요 ㅠㅠㅠㅠ
25,로고만 뜨고 그 뒤로는 아무것도 안뜸
26,아케인 기다리고 있는데 언제 나오나요? 13일인데 12시 땡하면 나와줘야하는 거 아닌가요? 이렇게 된다면 공개 시간까지 알려주세요. 제발 마음 편히 잠자게요.
27,밀리터리 영화 더 넣어주세요
28,며칠째 영상 재생이 안됩니다. 영상에 문제가 있다니 디바이스에 오류가 있다니 오류코드도 가지각색;; 2초에 한번씩 화면 멈추고 소리만 재생되네요. s21과 아이패드 이용해 사용중인데 s21에서만 오류가 생기네요. 기기가 문제인지 어플이 문제인지 다 짜증납니다.
29,"1. 자막 설정
  자막 크기가 너무 커서 화면을 너무 많이 가려요 사용자 설정으로 자막 글씨 크기 설정, 위치 설정을 할 수 있게 해주세요
2. 백그라운드 재생
  백그라운드 재생할 수 있게 해주세요"
30,시청기록 지우는 것도 추가하면 좋을 것 같아요
31,"아이패드앱에서 한 달치 결제했고 아이패드, 아이폰 모두에서 볼 수 있는데 안드폰이나 피씨에서는 결제내역이 복구가 안 되어서 볼 수가 없습니다… 설마 플랫폼별로 각각 결제해야 하는건가요? 답변 좀 부탁드립니다"
32,화면에 아무것도 안나오네. 하단 버튼 백그라운드 색깔만 나오고.. 어쩌라는건지
33,"그릅워치 할시 어플로 넘어가는게 아니라 웹으로 넘어가게 되는데, 모바일로 하는사람들은 같이보기가 아직 실행이 안됨. 빨리해결해줘야할듯"
34,화면이 안뜨잖아! 글씨가 안나와 로그인을 할수가없어!
35,"다운받았는데 화면 버튼 텍스트랑 이미지가 안보여요..
아이폰 11 사용중입니다"
36,"화면이 안보여요!
글씨가 안보여서 로그인도 못하고 아무것도 못하고있어요. 
남색 화면 밖에 안보여요."
37,핸드폰 앱에서도 자막수정 기능을 넣어주세요
38,잘 만들었습니다 사용하기편리해요~
39,갤럭시탭에서는 자막이 너무 크게 나오고 크기 조절이 되지 않아서 불편하네요. 화면 비율 조정도 가능했으면 좋겠어요... 지플립에서 꽉찬화면(22:9)으로 나오니까 너무 많이 잘려요!
40,돈을 안내면 뭐가 있는지 둘러볼수조차 없다
41,"자막보다가 눈빠지겠어요. 스마트티비는 자막크기와 테두리 투명 가능한데, 모바일기기는 크기나 테두리배경 조절이 안되네요. 자막 크기 변화없으면 재구독 의향 없습니다."
42,갤럭시 탭 S6라이트에서 설치가 안되네요. 용량도 충분한대요
43,2.35:1화면비율 영화를 보면 왜 화면이 꽉차지않죠??! 그래서 확대시키면 완전오바되서 화면다짤려나가고 빨리수정해주세요 그리고 아이폰은PIP모드 되면서 안드로이드는 왜 안되나요??! 이것도 수정해주세요
44,성인인증을 위해 스마트폰으로 핀번호를 누르는데 인증이안됩니다.
45,밝기조절 소리조절탭이 따로없는것같고 작은 화면으로 띄워놓는 기능도 없어서 이런부분을 보완하면 좋을 것 같습니다
46,썸벨리나 우리말 더빙판 제발 넣어주세요
47,오늘 잠깐결제해서 봤는데 미드 슈퍼내츄럴 폭스건데도 업로드안됐고 디즈니명작 반절이상이 자막없고 더빙이 대부분이고 볼품없음 준비안된상태에서 런칭한거같음 무료기간을 주는것도아님 디즈니 고객센터 전화해서30분만에 통화됐는데 상담사가 환불해주라는말에 환불된다는 말도 안해줌 절차도 모르고이상한 전화번호 알려주고 구근플레이가서 다시 알아보라고함 오늘 1시간 손해봄 자막 나오는지 체그만하고 아예안봤는데 환불안해주면 방통위나 어디다가 ㄹㅈ 해야하나 무튼 가만히 안있을꺼임
48,출시돼서 좋긴한데 앱UI가 너무 구림...플레이어에선 기본적인 볼륨 및 밝기조절도 안되고 pip모드도 안돼있고 하여튼 불편한 점이 많음 못보던거 볼수있다는게 최대 장점임..그외에 죄다 별로..
49,프로필 시청기록 다 지워도 취향추천에 관련된거 보지도 않았는데 이상한거 뜹니다ㅡㅡ 요즘 4인팟 이용자도 많은데 프로필 삭제하고 다시 만드는 기능좀 추가해주세요
50,정말 잘 이용하고 있습니다. 근데 프로필에 비밀번호 설정이 있으면 정말 좋을거 같습니다
51,몇일전부터 모바일에서 서비스 연결이 지연되고 있다면서 재생이 안됩니다
52,"태블릿 pc를 하나 구매해서 사용하려고 검색했는데, 거주 국가에선 사용할 수 없다고 나오네요.. 혹시 구글계정과 연관이 있는건가요??"
53,팝업재생 안되는거 실화냐
54,인크레더블2 보고 있는데 자막 싱크가 엉망이네요
55,자막 크기가 핸드폰 시스템 자막과 동기화됨. 모바일 환경에서도 자막 크기 수정 필요.
56,역시 믿고 선택하는 디즈니. 생각보다 볼 게 많아서 뭘 봐야할 지 모르겠어요!
57,좌우레터박스 안 나오게 화면 비율 지원 부탁드립니다
58,갤럭시도 pip모드 지원좀ㅠ
59,심슨가족 시즌1 6화부터 자막 싱크가 안맞음 돈주고보는건데 신경좀 써주세요
60,"시청중인 콘텐츠 삭제 기능이 없는것, 시인성 문제 등 타 앱들과 비교했을때 부족한 기능과 시스템이 많이 보입니다. 빠른 개선이 필요할듯합니다."
61,한글 자막 배경이 검은색으로 나와서 짜증나셨죠? 저도 그랬습니다. 디플 앱에서는 설정이 불가능해요. 해결방법이 있습니다. 설정 들어가셔서 자막으로 검색하시면 구글 자막(cc) 뜹니다. 눌러서 배경색 사용안함 설정하고 글씨 크기도 취향에 맞게 설정해주세요. 그럼 즐감 되세요!
62,내용물은 다 좋은데 모바일에선 유튜브처럼 다른 작업하면서도 볼 수 있게 작은 화면으로 볼 수 있는 기능이 추가되면 더 좋겠어요.
63,다 좋은데 자막 사이즈가 다른 ott에 비해 너무 커요 자막 크기 조정 가능했으면 좋을거같아요
64,다좋은데 자막 폰트가 고정되서 불편하네요. 자막 폰트가 너무 알아보기 힘들어요 (폰트가 작은데 거기에 글씨가 너무 얇아서 눈에 잘안들어 와요. 자막 폰트 수정해야할것 같아요(갤럭시)
65,모바일에서 자막설정 좀 할 수 있게 해주세요. 자막이 넘 작음
66,디즈니 컨텐츠 다양하게 이용할 수 있는 건 좋은데요 성인인증을 하려하니 핀번호 입력이 안됩니다. 사용기종은 갤럭시21과 갤럭시탭FE 사용중입니다(안드로이드). 빠른 해결 바랍니다. 뱀파이어 다큐멘터리 보고싶어요....
67,아니 결제도 하고 보려는데 영상 5초지나고 멈춤.. 지원안되는 기기는 또 아님.. 문제해결가서 다 따라했는데도 지속적으로 에러남. 다른 스트리밍어플들은 잘되는데 디즈니만 안됨 내 한달구독료ㅡㅡ..
68,"휴대폰 영상배속재생기능, 팝업창보기 기능 추가 해주세욤~"
69,아니 모바일 기기에서 성인인증하기 위해 비번을 누르라고 뜨기만하고 자판이 안 묵는건 무슨 경우지?
70,기사엔 샹치와 텐 링즈 있다던데 없네요 첫판부터 장난질 입니까? 콘테츠도 생각보다 없네요 ㅡㅡ
71,배속설정
72,"미녀와 야수, 캐리비안해적 해설자 자막이 하나도 없네요 원래 없었던거 같은데 영화마다 해설이 다 나오는거 같은데 어떻게 없애는지도 모르겠고 오래전 작품들도 볼 수 있을 줄 알았는데 몇개빼고는 없고 101마리 달마시안이나 신데렐라 등, 전 애들이 예전에 보던 작품들을 보고싶어해서 결제한건데 디즈니 작품은 몇개 없는거 같애요 이름만 디즈니지 디즈니 작품도 몇개 없네요 초!! 비추"
73,기본적인 것만 충고합니다. 1) 자막 사이즈 키우세요 2) 키워드 기반 컨텐츠 검색 가능하게 해주세요 3) 자막팀 늘려서 컨텐츠 빨리 늘려주세요
74,왜 이제왔나요 이렇게 꿈잼일걸 난 이제 보네ㅋㅋ 근데 오프닝 건너띄기 다음편 이어보기가 없어서 불편하긴 하지만 딱히 그렇게 큰 지장은 없어요ㅎㅎ
75,"결정적으로 넷플이나 다른 ott 앱과 비교시 화면 밝기 조절이 안됨... ㅡㅡ 영상에 밝기와 소리 조절, 화면 넘김이나 스크롤이 얼마나 중요한데... 현재 플레이 되는 영상이 어떤 화질로 플레이 되는지에 관한 정보나 이런것도 좀 더 있었으면 좋겠음. 이제 시작이니... 앱 업뎃으로 추가 기능들이 더 생겼으면 좋겠음."
76,자막 설정 그지같아요 저제 자막설정이나 불투명 판제거 안드로이드에서 제거하게 애주세요
77,샹치를 보는데 중간중간 중국어가 나올 땐 자막이 안 나오는 부분이 있네요 개선해 주세요
78,"휴대폰, PC에는 문제가 없으나 OTT셋톱+ 일반티비 연결 시 소리 안나는 문제 있습니다. 소리 중 English(audio discription)만 나오고 나머지는 죄다 안나옵니다. 넷플릭스 wavve 왓챠 등등 다른 ott는 문제없었습니다. 추가) 5.1채널 사운드 지원 표시 뜨는건 죄다 안나오는 것 같군요"
79,심슨가족 더무비 밖에없네요 안드로이드 셋탑에시는 자막두 안나오구요 ㅎㅎ 심슨때문에 보는건대 이게 뮌지
80,미러링시에 연속재생이 안돼요 왜그러죠?
81,"티빙 설치하는데 안드로이드티비만 설치된다고 안된다네요
넷플 왓차 웨이브 디즈니플러스 다 되는데, 아무래도 티빙만 설치가 안되는건 문제가 있는거같습니다
처음에 6월쯤엔 잘만 됐엇는데 언제부턴가 안되는걸보니 업데이트가 필요한것같습니다ㅠ 사용에 불편하니 빨리 고쳐주세요"
82,자막이 영상을 다 가림. 게다가 불투명 자막이라 더 불편함. 다음화로 바로 넘기기 기능도 없음. 재생바를 꼭 손으로 넘겨야함.화면 밝기 소리 제어 기능 없음. 영상에서 회차정보 보는 내용도 없어서 재생 취소를 반복해야함
83,"PC웹브라우저에서 720P 이거 실화입니까? XBOX, PS5 4K 지원 콘솔에서 4K 스트리밍이 안됩니다. PS4에서 HD 스트리밍은 되지만, HDR은 미지원이구요. 일부러 한국계정만 막아 놓은거 같은데 빨리 풀어주세요. 해외는 되는데 왜 한국은 안되나요?"
84,갤럭시탭A 쓰고있는데 버퍼링때문에 볼수가 없네요 사양에따라 제약이 있나요?
85,갤럭시탭s6인데 설치가안되나여
86,모바일에서 성인인증 불가
87,배속 만들어주세요
88,너무 별로
89,배속 기능 추가 해주세요
90,태블릿에서 작동안함 ㅠ 갤탭a7
91,한국 자막 표시 위치 조정이 안됩니다. 버그인거 같으니 업데이트 필요해보입니다. 화면 중간에 자막이 표시되네요.ㅋㅋㅋ 넷플릭스랑 비교해서 앱이나 웹브라우저 기술력이 한참 떨어집니다. 한국에 늦게 들어온 만큼 제대로 좀 하시지. ㅉㅉㅉ UI도 굉장히 비효율적입니다.
92,배속 설정 추가해주세요 쿠플에도 있는게 여긴 없네ㅜㅠㅡㅠㅠㅜㅡ
93,자막 크기 설정 안되나요? 한국어로 설정하면 너무 쥐콩만해요... ★☆자막 크기좀 키워주시고 배속기능 넣어주시면 좋겠어요☆★ 한국 출시는 초창기라 아쉬운 부분이 많네요... 콘텐츠도 다양했으면 좋겠어요ㅠ 뱀파이어다이어리도 디즈니에 있는줄 알았는데 없네요ㅠㅠ 보고싶은 콘텐츠 신청은 못할까요??
94,"PC, 태블릿, 휴대폰 다 끊김이 심해서 볼수가 없는데 도대체 뭘로 보라는겁니까 그나마 휴대폰은 덜한데 PC는 영상 픽셀 다 깨지고 태블릿은 콘텐츠 열기도 어려울 정도로 끊기고 버벅거리네요"
95,진짜 거지같네 볼게없다
96,같은 네트워크상황에서 넷플릭스보다 로딩이 길고 더딤 인터페이스도 너무 간결해서 불편함 다음회넘김도없고 몇화까지있나보려면 나갔다가 보고 들어와야하고 밝기조정도 인터페이스상엔 없음
97,"앱이 넷플릭스, 왓챠보다 너무 불편해요. 영상넘김도 10초단위로 넘겨야하고 자막도 비공식영상 자막넣은거마냥 어색함 쿠팡티비처럼 촌스럽습니다."
98,1. 화면밝기 & 소리 조절 못 함 2. 자막 크기 설정이 없음 3. 결제 관리 앱으로 안됨 4. 자막 오역과 오타 너무 많음 아직 앱에서 부족한 부분이 많은 것 같음 자막번역 때문에 앱 출시가 늦어졌다고 아는데 늦어진거치고 자막의 질이 기대이하임
99,"티비로 보려고 에어플레이 연결하면 갑자기 독일어로 더빙으로 설정되고, 원어로 변경하면 자막 싱크가 안맞아요... 컨텐츠는 너무 마음에드는데.... 넷플릭스처럼 다음화러 바로 넘어가는 버튼이나 기능있었음 좋겠어요"
100,"유튜브에서 디즈니영화가 하나당 6000원이상이라
다 볼 수 없어 안좋았는데 9900원으로 이걸 다 볼 수 있는게 너무 좋아서 디즈니 진짜 좋아요"
101,"검색 기능도 그렇고
유사컨첸츠도 추천도 그렇고 UI에 대한 전체적인
변화가 시급해보입니다

아이패드 프로로 로키 보는데 갑자기 어플이 튕겨버리는 현상이 1회 있었습니다"
102,"뭔가 관련 콘텐츠 이런게 뜨면 조금더 도움이 될 거고요 그리고 자막이 너무 깔끔하지가 못해요 넷*릭스 처럼 테두리가 검은색이록 적당한 자막 크기이면 좋겠거요 ㅠㅠ 또 시청기록이 따로 안 떠 겁나 고생하면서 
보게 괴네요 가격은 저렴하지만 꼭 그 값어치 하는 거 같아 너무 속상해요"
103,ux가 구립니다.
104,"자막 전환도 로딩없이 바로 되서 넘 좋네여
관련성 높은 리뷰로 봤을때 보이는 것중에
겨울왕국 소리전환 안된다는 사람있던데
기계 만질줄 모르면서 안된다고 하지 마세요.
모르면 찾아 보기라도 하던가 ㅉㅉㅉ"
105,영상을 보려고하면 검은화면과 소리만 들리네요 다시삭제했다가 깔아도
106,페어리테일9기랑 10기 빨리올려주세요!
107,"최대 7명 동시접속 4명, 생각보다 이게 많이 겹칠 수도 있다고 생각이 들더라고요 앱에 들어갈때 누가누가 접속을 하고 있는지가 표시가 되면 끊길일도 없을것 같습니다!!"
108,에어플레이로 보면 영상보다 자막이 3~4초씩 빨리나와요. 연결 끊었다 다시해도 똑같아요. 너무 싱크 차이가 커서 영상이랑 자막이랑 아예 따로 놀아 스토리를 이해할 수 없을 정도에요.
109,"아니면 디즈니 본사 에서 앱 에 대해 시안 컴펌을 진짜 한건 맞긴함? 사용성이 너무 불편함 컨텐츠 관련 내용은 둘째고 마블추천작, 몰아보기 끝판왕 등등 서브 타이틀 컨텐츠을 한눈에 볼수도 없음 보통 더보기 나 자세히 보시 해서 새로운 페이지 에서 리스트 형태로 보여주는게 맞지 않음? 뭐가 있는지 보려면 계속 가로 스크롤 해야함 전반적으로 너무 ui가 너무 불편함 개선 부탁 드립니다.  검색등등 쓸께 많지만 안쓰면 그만 이라 옛추억 때문에 한번 씀 다음달 결제는 안 할듯 해요"
110,"저와 아이들, 저희 가족 모두 기다렸던 디즈니 플러스. 해외에서 VPN사용해서 미러링할 경우 재생에 문제가 있습니다. 아이폰과 아이패드로 즐길 수 있지만, 미러링을 통해서 더 큰 화면으로 가족이 함께 즐기고 싶습니다. 이 문제를 해결해주실 수 있으실까요? 부탁드립니다."
111,어제 런칭되자마자 인사이드북한왕조를 시청하였는데 하루사이에 없어졌네여 이게 뭐죠? 왜 돈주고 결제했는데 하루사이에 공지없이 내린다구요? 한국정부서 내리라고했나요? 공지라도 띄어주세요 꼭 답변달아주시구요
112,레노버 p11에서 재생이 안됩니다
113,화면밝기조절이 불편하네요
114,"영상을 재생한 후에 화면내에서  컨트롤 할 수 있는 기능을 만들어 주세요 밝기를 조절하거나 볼륨조절, 다음화로 중간에 바로 넘어가거나 하는 기능들이 필요합니다!!"
115,안맞아요.. 딴거는 다맞고 껐다 키고 난리를 쳐도 안맞아요 ㅜㅜ 이거때문에 가입한거나 다름없는데 꼭좀 확인 부탁드립니다
116,"아이패드, 아이폰 어플 설치하고 나면 어플에서 한글이 보이질 않아서 진행이 어렵습니다.
수정해주세요!"
117,"배속기능과 자막 크기조절기능이 필요할 것 같아요
그리고 넘길때도 조금 늦게 버퍼링돼서 넘어가서 약간 답답하긴 합니다 ㅜ 그 외에는 너무 잘 쓰고있어요~♡"
118,"컨텐츠 별5, 재생플레이어 별1"
119,아이폰 12 프로. 아이패드 5세대 사용자입니다. 디즈니라 당연히 볼것도 많고 그런부분에 대한 불만은 없지만 앱 자체가 너무 불편합니다 플레이중 밝기 조절 안됨 앞부분 건너뛰기 안됨 다음화로 바로 넘어가기 안됨 자막에 검은색 배경 나옴 다른 ott 서비스에서 당연스레 써오던 편의성이 막상 없으니 체감상 불편함이 너무 큽니다 이후 업데이트에 반영되었으면 좋겠습니다
120,"디즈니+ 컨텐츠도 다양하고 너무 잘 보고 있습니다!

그런데 시청을 하다 중간에 자막 오류가 좀 심해서요..
자막이 밑에 뜨다가 배경 중간에 띄어질때도 있고 이뿐만 아니라 자막이 딜레이 돼서 늦게뜨고 뜨자마자 다음 대사로 이어져서 다 읽지도 못하고 넘어가는게 빈번하게 일어나네요ㅠㅠ 빠른 시일 수정 부탁드립니다♡"
121,아니 왜 티비로 스트리밍이 안되나요?? 에어플레이도 안되고 뭔 폰으로만 보라는거에요? 이런 문제 해결해주세요ㅠㅠ
122,"tv 아이맥 아이패드 아이폰 다 틀어보고 후기 씁니다
볼 거 짱많고 버퍼링도 없고 화질 음질 장난 아니에요
구간 이동할때 너무 빠르고 화질은 재생 하자마자 최상급에 가격도 지금껏 사용해오던 스트리밍 사이트들 비교 해보면 진짜 저렴하다고 생각해요
원래 어플 리뷰 안남겨봤는데 디플 이틀 써보고 감동 받아서 생각난 김에 남깁니다 최고의 어플..
바램이 있다면 스파이더맨 시리즈랑 더 프레시 오브 벨 에어 들어왔으면 좋겠다는..ㅜㅜ스파이더맨이야 곧 들어올거 같은데 암튼 다 좋아요 방금도 완다 비전 보다가 생각나서 ㅋㅋㅋ"
123,"밝기 조절 , 볼륨조절, 영상 조절이 매우 후지거나 전혀 없음. 관련 gui 개선이 시급함. 그리고 전체적으로 영상이 어두운 듯...."
124,우측 하단에 팝업 뜨면 보고 있던 화면 스크롤 안됨 ㅡㅡ 진짜 뭐하세요? 매월 돈주고 보는데 팝업까지 달아야겠니? 광고보러 티빙 앱 접속하는줄 아세요? 컨텐츠 보러 들어온겁니다 제발 쫌!!!!!!!!!!!!!!!!!!!!!!!!!!!!!!!!!!!!!
125,태블릿에서 자막이 왜 이렇게 작아요..? 쿠팡플레이 볼 때만 서체 크기 변경해야해서 너무 번거로워요
126,노트20인데 사용 자체가 안됩니다
127,전체화면이 왜 안되는건가요? 여백 상하좌우로 있는거 거슬려요
128,"ㅋㅋㅋㅋ마블영화는 시청도 안됨 디즈니 영화빼고 실행도 안되서 강제 디즈니 시청행 ㅋㅋㅋㅋ 자막 사이즈도 못골라 코리아 ip면 자막을 한국어로 디폴트 해두지도 않아 ㅋㅋㅋ 소리, 밝기 제어 안 돼 콘텐츠는 겁나 없고 성인 인증 안 되서 15세 영상은 다 막혀있고 UI는 겁나 불편하게 하고 되는게 머임? ㅋㅋㅋㅋ 개킹받는 건 자막도 개후짐 심슨에서 환상적이다를 돈이 많다로 갈긴 어메징함이란...."
129,편하고 좋네요~:)
130,안드로이드도 자막 설정되게 기능 추가해주시고 몇몇 콘텐츠들 번역 오역이랑 아직 한국어 번역이 안되있는 작품들 전부 추가해주시면 더 좋아질거 같네요
131,굳
132,핀설정하면 모바일에서 성인인증 못함
133,프로필 여러 개를 성인인증하는데 문제 있고 티비로 시청 시 자막 뒤 검은 박스 처리가 거슬림 그리고 아동용을 제외한 컨텐츠는 굳이 더빙 할 필요가 있을까 싶다 그 비용으로 자막 퀄리티에 더 투자하는게 맞다고 봄 마블 등 디즈니 소유의 콘텐츠는 빨리 볼 수 있는 점은 장점으로 작용할 듯
134,화면장금좀 만들어 주세여
135,팝업안됨 배속재생안됨 자막한국영어동시에띄우게해줘 너무 구린거 아니니
