,0
0,자막크기 150% 만들어주시길. 100은 너무작고 200은 너무크네요
1,감사감사요
2,한글 설정 방법 알려주세요..
3,자막이 좀 이상해요...ㅠㅠ
4,"디즈니 사랑해요ㅠㅠ
디즈니 픽사 마블 스타 네셔널 지오그래픽 다 있으무ㅠㅠ"
5,한국에도 디즈니 플러스를 보게 되어서 좋은데 컨탠츠가 어떤게 있나 볼려면 9900원 가입을 하고 볼수 있다는게 아쉬움…
6,한국에 떴다!
7,자막이 너무 커요
8,"자막을 한번 정하면, 외국 거 이든 한국거 이든 
그대로 나오는게 흠이네요
외국 영상에서는 자막이 나오게 하고
한국 영상에서는 자동으로 자막이 안나오게 해야하는
시스템이 있어야할 거 같네요"
9,한국어 자막이 너무 커요
10,진짜 구독하길 잘했네요 제가 좋아하는 시리즈가 있어서 감사함!!!
11,자막 골때림
12,일본어랑 브라질어랑 다있는데 앱 언어설정에 한국어가없네요…? 웃긴건 또 영상 자막이랑 더빙은 한국어 지원이되네요
13,"근데 없네요, 다크윙 덕, 칩과 데일은 왜 저렇게 만들어 둔건디, 곰돌이 푸 이런거 하나도 없습니다
거기다가 결제 안하면 뭐가 있는지도 확인 안되게 해뒀습니다 이거 거의 사기 아닙니까?"
14,한국에도 나왔다
15,자막 크기가 너무 큰데요..조절할 수 있을까요?
16,"더빙버전말고 자막버전은 없나요?
더빙,자막 버전이 따로 있으면 좋을거같아요."
17,스타워즈 시리즈 마블 시리즈 디즈니 프린세스 픽사 작품 내셔널 지오그래픽 등등 너무 많다
18,"화면 슬라이드로 볼륨 조절 밝기조절,
ㅠㅠ빠른재생(1.5배, 3배) 기능이 없는게 너무 불편해요
첫 홈 화면에 카테고리 바가 있으면 편할거같아요.
(드라마 영화 애니메이션 등)"
19,언어에 한국어 체크하는데도 없고 언어설정 다 바꿨는데 계속 영어로 나오네요 한국어로 바꾸는 방법좀 알려주세요
20,자막이 화면의 4분의 1정도 가리네요 ㅠㅠ 글씨 크기가 조금 작으면 좋을 것 같아요 !!! 엄청 기대했는데 볼 것도 많고 너무 만족스럽습니다 ㅎㅎ
21,다 좋은데 한국어 자막이 좀 커서 아쉬워요 나머지는 다 정말 👍🏻👍🏻 4k여서 더 좋습니당
22,내셔널지오그래픽을 풀로 볼 수 있다니....
23,완다비전 로키 팔콘앤윈터솔저 등등 마블드라마도 실컷보고있고 디즈니 영화도 제공해줘서 좋네요! 무엇보다 한국어패치 너무 좋네요
24,스타워즈 컨텐츠 미쳤네요ㅠㅜ
25,자막 크기 좀 줄이고 시청한 콘텐츠도 볼 수 있게 해주세요 ㅜㅜ
26,아니더라도 필수
27,배속왜없냐
28,"자막보다가 눈빠지겠어요. 스마트티비는 자막크기와 테두리 투명 가능한데, 모바일기기는 크기나 테두리배경 조절이 안되네요. 자막 크기 변화없으면 재구독 의향 없습니다."
29,내셔널지오그래픽!!
30,심슨 볼려고 1년구독 넣었음돠 ㅋㅋ 시즌30개 ㅋㅋㅋ...(스타워즈랑 디즈니애니포함)자막이 좀 투박한데 점차 세련되게 개선되길 기대해요.
31,정식 런칭 전에 지들이 받아놓고 별 한개 달아놓은 매크로식 두뇌로 연결된 인간들이 참 많군용
32,자막이 너무 작아요...
33,한국드라마나 한국영화 자막 좀 달아주세요… 안 들리는 대사나 조용히 봐야할 땐 자막이 있어야 하는데 ㅠㅠ 그리고 청각장애인 분들 배려도 좀 해주세요 🥺
34,자막크기조절가능하게해주세요 짜증납니다
35,한국 서비스 시작! (2021.11.12)
36,자막 배경 없애는 기능 넣어주세요
37,인크레더블2 보고 있는데 자막 싱크가 엉망이네요
38,자막크기 심각하게 작은데 크기조정 안되요?
39,자막 크기가 핸드폰 시스템 자막과 동기화됨. 모바일 환경에서도 자막 크기 수정 필요.
40,한국어 자막같은 기본적인게 추가되어있지않네요. 실망스럽습니다
41,한국드라마컨텐츠 부족
42,심슨가족 시즌1 6화부터 자막 싱크가 안맞음 돈주고보는건데 신경좀 써주세요
43,한글자막 번역이 너무 엉망이네요...싱크 안맞을때도 많구요...
44,인크레더블2 보는데 자막 싱크가 안맞네요 돈 내고 보는데 영화 한 편 제대로 못보네요.. 솔직히 실망입니다 그래서 그냥 한국어 더빙으로 본다능..
45,"심슨, 뮬란 등 제가 좋아했던 만화를 다시 볼 수 있어서 너무 좋아요 하나 아쉬운 점이 있다면 화면에서 소리조절기능이라든지 화면밝기조절기능을 추가해주셨으면 좋겠습니다"
46,자막판으로 못 바꾸는 사람들들 특 영어못함ㅋ
47,자막이 까맣게 나오는데 어떻게보라는건지 조절할수있게 해주세요
48,자막이 나오는 언어가 없음.. 그냥 모든 언어의 자막이 다 안나옴
49,오늘 오픈한 앱이 테스트도 안하고 올리나요. 성인인증 안되는 오류정도는 충분히 확인하고 올려야죠. 실망이네요. 빨리 수정해주세요.
50,자막좀 빨리수정해주시길 자막뒤에 검은색 눈에 거슬려요
51,자막이보기안좋아요
52,컨텐츠는 맘에 드는데 번역상태 왜 이럼? 자막상태도 엉망이고 기기따라 자막이 붕 뜨는 현상도 있음. 유튜브로 런칭기념인지 뭔지 할 시간에 기본은 제대로 하고 하자... 일단 계속 구독은 할껀데 개선 안하면 탈주각임
53,자막이 변역기 돌린거마냥 수준이 아쉽습니다 개선쫌요...
54,해밀턴 자막없는거 뭡니까? 디즈니플러스가 한국에 들어왔으면 적어도 한국어자막이 있어야하는거 아닙니까? 이런성의없는 경우는 무엇인지요? 일년결제했는데 실망스럽네요
55,아이가 디즈니 애니메이션 좋아해서 1년결제했는데요 왕실탐정 미라는 왜없나요?
56,배속설정
57,자막 투명도 조절이 시급해 보임 ㅜ
58,기본적인 것만 충고합니다. 1) 자막 사이즈 키우세요 2) 키워드 기반 컨텐츠 검색 가능하게 해주세요 3) 자막팀 늘려서 컨텐츠 빨리 늘려주세요
59,자막좀 크게 1.5배속 빠르게 좀 업뎃 해주세요 나홀로집에 잇어서 좋음
60,"12일 밤 00시 기다려서 바로 가입함. 검색 어려움 볼것 특정 시리즈 말고 별로 없음, 예정작 언제 어디서 나오는지 모름, 자막 검은색 바탕화면 안에 나와서 걸리적 거림..... 왜 넷플이 1위인지 나는 이제 알겠소 반성해라 디즈니 !!!!"
61,디즈니주니어에서 하던게 다 있지 않네요 디즈니주니어에서 하던 하이호! 일곱난쟁이를 아이가 좋아해서 기다리고 기다리다가 결재했는데 없네요;; 기존에 보던 애니메이션정도는 다 있어야 하지 않나요ㅜ 앞으로 추가가 될 예정인지 궁금하네요
62,자막이 영상을 다 가림. 게다가 불투명 자막이라 더 불편함. 다음화로 바로 넘기기 기능도 없음. 재생바를 꼭 손으로 넘겨야함.화면 밝기 소리 제어 기능 없음. 영상에서 회차정보 보는 내용도 없어서 재생 취소를 반복해야함
63,볼 것은 많은디 좀 느린 듯. 개선되리라 믿습니다.
64,배속 만들어주세요
65,자막크기 조절 시급합니다...
66,배속 기능 추가 해주세요
67,배속 설정 추가해주세요 쿠플에도 있는게 여긴 없네ㅜㅠㅡㅠㅠㅜㅡ
68,자막 미친거 아님? 뭔 발음 받아쓰기에 속도는 겁나빠르고 띄어쓰기도 이상하고 번역 제대로 안되고 걍 번역기 돌린거아님?? 진짜 자막 고쳐지지 않는 이상 절대 안함
69,자막 상태가 왜이러나요..? 차차 개선할건가요?
70,자막 싱크도 하나도 안맞아요 .. 그리고 밝기조절 음량조절 기능도 없네요? 가장기본적인건데요 개선해주세요
71,"자막크기, 재생속도 빠르게 조절할 수 있게 해주세요"
72,자막 크기 설정 안되나요? 한국어로 설정하면 너무 쥐콩만해요... ★☆자막 크기좀 키워주시고 배속기능 넣어주시면 좋겠어요☆★ 한국 출시는 초창기라 아쉬운 부분이 많네요... 콘텐츠도 다양했으면 좋겠어요ㅠ 뱀파이어다이어리도 디즈니에 있는줄 알았는데 없네요ㅠㅠ 보고싶은 콘텐츠 신청은 못할까요??
73,자막 뒤의 검은 배경이 화면을 많이 가려서 거슬리네요. 그리고 ps5버젼 인터페이스는 느리고 오류가 많습니다. 디즈니 픽사 애니메이션을 좋아하는 아이를 위해 1년치 가입했지만 솔직히 넷플릭스 대비 컨텐츠의 양도 절대적으로 부족합니다. 볼게 부족하다는 거죠... 체감상 한 1/5정도..? 많이 노력해야겠네요.
74,좋긴 좋은것 같은데 자막이 너무 작아서 하나도 집중이 안되네요..
75,"마블 좋아하시는 분들 추천 먼제 로키,완다비전,팔콘과윈터솔져 완다비전은 내년에 나올 닥터2와 연간이 있고 팔콘과윈터솔져는 팔콘이 제2의캡틴아메리카 되는 과정 로키는 모르겠고 다음주에 나올 호크아이 호크아이가 세데교체 되는 과정 이렇게 마블이 페이즈3에서페이즈4로 가는과정에 위에 소개한 드라마가 들에있음 아니면 마블페이즈3정주행"
76,일단 마블 스타워즈 팬으로써 너무 감동적임. 컨텐츠 뿐 아니라 한국어 더빙 까지ㅋㅋ 너무나도 마음에 든다. 다만 왓이프가 아직 없다는게 당황스럽다. 조만간 호크아이도 나올텐데 설마 바로 바로 못 볼수도 있다는건 아니겠지... 왓이프와 차후 신규 마블 드라마들에 대한 디즈니플러스코리아의 계획이 어떠한건지... 조속한 공지가 필요해 보인다.
77,디즈니 영화만 있는줄 알았는데 다른 영화 예능도 있고 그래서 좀 놀랐어요❤️❤️ 진짜 기다린보람이 있어요👍👍👍👍👍👍
78,자막이 안보이고 넘어가는 경우가 있습니다
79,"자막 전환도 로딩없이 바로 되서 넘 좋네여
관련성 높은 리뷰로 봤을때 보이는 것중에
겨울왕국 소리전환 안된다는 사람있던데
기계 만질줄 모르면서 안된다고 하지 마세요.
모르면 찾아 보기라도 하던가 ㅉㅉㅉ"
80,더빙말고 한국자막 개선됬으면 좋겠어요
81,"최대 7명 동시접속 4명, 생각보다 이게 많이 겹칠 수도 있다고 생각이 들더라고요 앱에 들어갈때 누가누가 접속을 하고 있는지가 표시가 되면 끊길일도 없을것 같습니다!!"
82,음성 한국어과 자막 한국어 싱크 일치가 필요해보여요. 음성을 들으면서 자막을 같이보는걸 좋아하는데 둘이 너무 따로놉니당…
83,"더빙판으로 보는게 정말 최악이네요
몰입도 안되고 더빙판으로는 어떤 작품이든
다 노잼입니다"
84,스타워즈 마블 내가좋아하는건다있네요
85,자막싱크안맞고 오타있고 ㅋㅋㅋㅋ 제대로좀하자
86,"드디어 출시되서 좋긴한데..ㅎ 앱을 급하게 만든건가ㅠ 광고는 계속하더니ㅠ 너무 불편…아니 시리즈물을 보는데 한편보고 다음편을 또 눌러야하다뇨…자동재생도 없고 화면밝기,음향조절등 이런거 없어서 너무 불편하네요ㅠㅠ개선점이 너무 많이보이는데 개선은 언제 해줄지…"
87,예전 드라마나 애니메이션을 보기에는 좋아요 그런데 제가 포켓몬을 좋아하는데 예전에 했던 시리즈 없이 썬문 w이렇게 두개만 있는데 더 추가만 되면 자주 이용하게 될것 같습니다 개인적으로 아쉽네요 ㅠ 영화도 몇개만 있어서 전에 봤던것인데 컨텐츠 추가 부탁드려요
88,진짜 하이큐 전편 올려주시고 해리포터 자막버전으로도 올려주시고 최신거 많이 올려주시면 소원이 없겠어요 진짜 다 좋은데 하이큐는 꼭 전편 넣어주세요ㅠㅠㅠ
89,"ㅋㅋㅋㅋ마블영화는 시청도 안됨 디즈니 영화빼고 실행도 안되서 강제 디즈니 시청행 ㅋㅋㅋㅋ 자막 사이즈도 못골라 코리아 ip면 자막을 한국어로 디폴트 해두지도 않아 ㅋㅋㅋ 소리, 밝기 제어 안 돼 콘텐츠는 겁나 없고 성인 인증 안 되서 15세 영상은 다 막혀있고 UI는 겁나 불편하게 하고 되는게 머임? ㅋㅋㅋㅋ 개킹받는 건 자막도 개후짐 심슨에서 환상적이다를 돈이 많다로 갈긴 어메징함이란...."
90,굳
91,자막 크고 거슬림 국내런칭 굉장히 늦게 했음에도 자막엉망이고 아직도 심의가 안되서 없는 영상도 있음...왓이프 내놔
92,어? 멀티뷰 없는거 맞냐고 썼었는데 왜 없어졌죠..? 암튼 그레이아나토미 보는데 자막이 이상해요 이름을 틀리질 않나 존댓말 할 사이가 아닌데 존댓말을하고 이상해요
93,자막은 화면을 많이 가리고 심지어 그런 자막마저도 없는 작품이 많아요. 그리고 오역도 많고요. 문제점 해결되기 전까진 비추합니다.
94,자막 퀄리티는 어디다 얘기해야 하죠? 넷플릭스에서 그레이아나토미 시즌 15까지 봤는데 디즈니에 시즌 16 17이 있어서 반가운 마음에 보고 있는데.. 자막은 회차마다 담당자가 달랐다는 게 느껴지니 한숨이 나네요.. 어떤 회차는 기본적으로 누구나 존댓말을 해대는 탓에 아버지가 딸에게 극존칭 존댓말하고.. 교수가 레지던트에게 극존칭 쓰고.. 어떤 회차는 제자가 사수에게 반말질에.. 하아.. 너무 집중하기 힘드네요.. 거지같은 자막 탓에 영어 실력이 늘게 생겼어요..
95,중국 디즈니 인가??? 마블 신작들의 미래가 없어 보인다…
96,자막이 드럽게 불편하네 폰 설정들어가서 바꿔도 화면 중간쯤에나옴 ㅡㅡ 플스나 pc에서 4k로 사용못함 ㅋㅋㅋ
97,자막실화입니까...넷플릭스도 자막퀄리티구린데 그것보다구리네여
98,자막없는거실화냐
99,자막작업좀...빨리해줬으면
100,배속 재생 시스템좀 만들어주세요
101,돈은 드럽게 비싼데 한국어가 안됨 버그겠지?
102,한국어 더빙이 너무 안되어있네요. 일본시장이 그렇게 큽니까? 왜 일본어 더빙은 있고 한국어 더빙은 없는 작품들이 많은지..
103,한국어 자막이 너무 커요 ..
104,해리포터1편 2편 영화가 최신등륵 이라니 옛날 영화만 싸그리 모아놧네 뭐하냐?ㅋㅋㅋㅋ 원펀맨도 시즌2 없음 이게뭐얔ㅋㅋㅋ 누가 봅니까..ㅋㅋ
105,자막 스타일 설정하게해주세요ㅠㅠ 자막이 아얘안보여서 폰으로보면 더빙해서봐야해요
106,새로런칭한 디플보다 한국어 더빙이 없어요 일본어 더 빙은 엄청 많은데 말이죠.한국 컨텐츠로 그렇게 돈을 벌어도 일본 시장이 더커서 그런걸까요?
107,한국어자막.음성 지원 안되는 컨텐츠 대부분임.볼만한거 몇개없고 그마저도 다본거 아직은 결제할가치가없음 실망스러움
108,"자막 크기 조절하기가 있음?
너무 커서 영상에 방해 될 정도인데ㅋㅋ"
109,"그 영상 시청할때 키보드모양(?)같은거 누르면 여러가지 언어가있을텐데요?
거기에 오디오에서 잉글리쉬 누르고 자막 한국어로 설정하면 더빙으로도 말고 자막으로도 시청할수 있습니다 제데로 보고 말하세요-- 고칠점 없는 디즈니 플러스 욕하지 말고요 전 개인적으로 엄청 재미있습니다 티비에서 돈내야 돼는 것도 무료로 볼수있구요^^ 디즈니 플러스 번창하세요~"
110,완다 정주행했는데 정말정말 재밌게 봤어요. 이제 로키도 정주행 할겁니다 ㅎㅎ 앞으로도 시리즈 많이많이 만들어주세요 :)
111,"자막이 이상해요 
말하는 것과 적히는게 달라요
맞춤법도 계속 틀리고 급하게 적은게 티나요
계속 참고 봤는데 영어를 못하는 분이 적었나요?
에이전트 카터 자막 좀 수정하세요"
112,가격도 저렴하고 넘 좋은데 팅커벨 4만 한국어 더빙이 없네요 ㅠㅠㅠ🥺 어렸을 적 더빙으로 보던 것처럼 똑같이 즐기고 싶은데….
113,"자막 크기가 좀 작아요, 크기를 조절할 수 있었으면 좋겠어요. 밝기 조절, 그리고 음성 조절도 필요해요!! 좀 성급하게 만들지 않았나 하는 생각에 별 하나를 뺐습니다. 저는 그 외에 아직 전부 체험해보지 않아서 괜찮아요!!!"
114,번역이랑 자막 ui가 이런식이면 망합니다
115,"저 이거 결제해서 보는데, 뭐가 있는지 확인이 가능해야 되는건 기본이고,, 제가 배속 기능 없으면 불편해서 해지하는데,, 아직 없어서 한달 지나면 해지할거 같네요ㅠㅠ 심지어 왓챠도 이번에 배속 생겼는데,, 여기에 왓챠에 있는 한국 예능 등을 가져와야 비벼볼만 할거 같아요~ 배속 기능 추가좀 부탁드릴게요ㅠㅠ"
116,개 구림
117,영어로 된 영상 볼때 자막 끄는 기능이 없어서 불편해요. 자막 끌수 있게 해주세요.
118,감사합니다!
119,"배속기능, 자막위치, 오역, 화면 밝기 아직 고칠거투성이긴한데 볼건 무지많긴하네요"
120,한국에서 보기만을 기다렸습니다. 개선 되야될부분은 많지만 그건 앞으로 업뎃하면서 천천히 바뀌겠고..다른건 뭐 특별히 불편한건 없네요
121,"영화 볼 때 화면에 두가지 언어로 볼 수 있도록 설정할 수 있게 해주세요 예를 들면 한국어를 화면하단, 영어를 화면상단에 띄울 수 있게 말이예요^^"
122,자막 설정을 pc나 아이폰처럼 바꿀수있으면 좋겠어요 자막크기도 크기지만 자막 배경 투명도 도 거슬리고 답답하개 느껴지네요 또 한국어 음성지원을 따로 검색할수 있게 하지는 못하나요? 비교적 최신작만 되어있고 어떤건 되있을법한데도 안되어있네요
123,자막이 너무 작아요..
124,아동용인데 한글자막 없음 / 번역계의 볼드모트 번역 들어와 있음(특히 어벤져스 시리즈) / 내셔널 지오그래픽 특정년도 이전꺼 없음
125,자막 150%도 만들어주세요 100%는 너무 작고 200%는 너무 커요
126,자막이 이상해요
127,자막이 쓰레기 수준 사이즈설정 못하는거야 그렇다치고 싱크도안맞고 부분부분 안나오고 ㅎㅎㅎ 한두달써보고 그래도 개선이 없으면 안씁니다 ㅎㅎ
128,자막 엉망 제공 안되는 컨텐츠도 많음
129,한글이 안나옴 참고 바랍니다.
130,자막크기좀 어떻게해주세요 ㅠㅠ 뒤에 검은배걍도 없애고싶음
131,자막이 조금 늦게 떠요 ㅜㅜ
132,"생각보다 더 다양하고 많은 영상이 있어
그 부분은 만족스럽지만
한국어 자막을 키면 자막이 화면의 반 이상을 가립니다.
영상을 충분히 만끽하며 보기에는 열약한 환경이네요"
133,자막 스타일 특히 폰트와 자막 뒤 쪽 배경 디자인의 개선도 필요할 것 같습니다. 가독성이 너무 떨어지고 특히 영상의 일부를 가리는 것도 큰 문제입니다. 자막 위치도 함께 조정해주세요.
134,자막의 위치가 굉장히 거슬린다. 자막의 위치를 조정할 수 있는 기능이 있으면 좋겠다.  그리고 영어 자막이 가끔 서로 겹쳐서 알아볼수 없는 경우가 있는데 자막 타이밍을 수정하면 좋겠음.
135,자막 ! 화남
136,"자막 오류가 심해요..... 
동영상과 자막과 따로노는게 심하네요 ....
수정부탁드려요 ㅜㅜㅜㅜ"
137,해리포터 보고싶다
138,"스타워즈 정주행 중인데, 끊었다가 나중에 보려고 하면 자꾸 처음부터 재생이 됩니다ㅠㅠ"
139,"한국인데 왜 저는 저렇게 뜨나요?

국가설정은 없나요??

사용이야 모를껀 없지만. 저는왜?"
140,딴거 다 좋은데 아이맥으로 보면 한국어 자막이 번역 오류인건지 이상해요 아이폰으로 보면 괜찮은데 ㅠㅠ
141,"자막이 너무 커서 어디서 줄여야할지.. 방법이 있다면 너무 불편한 지원 방법입니다.

배속재생이 있으면 좋겠습니다.

탭하여 건너뛸때 심한 버퍼링에 한국인인 저는 웁니다."
142,영화나 다른 시리즈는 한글자막 지원하는데 왜 애니메이션만 한글자막 지원안해주나요?ㅠㅠ 청각장애 있는 입장으로서 불편합니다…
143,"배속기능, 화면밝기 조절 기능, 자막 크기 조절 기능이 시급합니다. 넷플릭스에 비해 여러모로 많이 부족해요."
144,자막싱크수정해주세요.. 인크레더블 2 보는데 자막싱크가 안맞아요.. 안타까워서 그래요ㅜㅜ
145,한국 최고의 OTT
146,더빙도 해주서 보기 좋아요
147,업테이드 하라고하면서 열리지 않음계속 반복됨
148,자막 완전 개판이네요
149,재미있고 배경이 검은색이라 거슬리지만 좋아요
150,마블꺼 다 보는것만으로도 좋은거지 인제 나왔는데 불만 더럽게들 많네 보질 말던가
151,다른경재군에 비해 애니메이션 효과도 없고 뭔가 단조로움 후발주자인데 너무 신경을 안쓴듯
152,배속만들어주세요
153,번역상태 개판이네. 이럴꺼면 영화관에 나온걸 보고 번역을 쓰던긴 ㅡㅡ 번역이 이랬다 저랬다하면 어떡함. 몰입 안되게
154,자막뒤에 검은 배경은 설정에서 바꿀수 있게 해줘서 괜찮은데 자막 한글번역이 정말 별로인것 같습니다 한글 더빙을 그대로 옮기신건가요? 자막을 보는이유는 원영화 그대로의 느낌을 보려고 보는것일텐데 그런 시청자들에게는 너무 불합리한거 아닌가라는 생각이 듭니다
155,1월 31일 생일자인데 카드결제번호 입력후에 개인생일 입력시 1월 30일만 입력되고 31일 입력이 불가하네오ㅠ 수정해주세요
156,자막 너무 구림 재생목록 편집 못 함 기대보다 다본거가 대부분이고 볼게 별로 없음 키즈모드나 성인이나 컨텐츠 차이가 별로 없어 보임 아이들을 위한 시리즈 물도 거의 없고 예전 것들이라 애들도 볼게 없음
157,자막싱크가 안맞아서 볼 수가 없다...마블 영화는 자막이 제대로인거 같은데 다른 컨텐츠들은 노답..당장 모든 컨텐츠 자막싱크 수정 어려우면 우선 싱크 조절을 직접 할 수 있게라도 해주던지 해야 할듯..
158,자꾸 아랍어로 설정이 바뀌는데 왜 이러죠?아랍어로 되있어서 언어변경도 못하겠어요
159,심슨 보려고 가입했는데 1시즌 싱크 뒤로 밀려요 싱크 좀 제대로 맞춰주세요
160,"마블팬이라 보긴하는데
자막수준이 너무 처참합니다. 엔드게임 오 어머니! 버금갈 정도의 수준.
그리고 배속 기능없음. 자막 폰트구림. 화질설정없음"
161,외국인이 담당인가?ㅋ
162,한국어 더빙은 있는데 한국어자막은 없는게 많아요. 영어음성과 영어자막은 있으면서 한국어 자막은 없나요? 몇년을 질질 끌며 출시를 왜 미뤄왔는지 이해가 안되네요. 넷플릭스가 이점에서 훨씬 좋네요. 자기들 콘텐츠가 많이 있음 뭐하나요. 요리를 하다가 덜했네요. 구독은 끊고 한국어 자막 지원 시작하면 다시 보겠네요
163,자막이 중간에 끊기기도 하고 검정색 박스로밖에 표현못하는게 아쉽습니다 몰입도가 현저히 낮아지고 신경질나요 공룡기업에서 이런 작은거하나 신경못쓰고 아직까지 방치한다는게 이해가 되질않네요 앱 출시할때 사전테스트같은거 다 해보지않나요?? 해본 결과가 이따구면 디즈니플러스 코리아팀은 다시 재구성해보심이 어떤지...
164,"자막이 오질나게 버벅이고 0.1초만에 지나가고 난리났음 글고 자막 크기도 하나는 너무 작고 하나는 너무큼,, 극단적 그자체"
165,"자막 오류 수정, 배속 재생 업제이트해주세요~"
166,"자막설정 방법 폰의 설정>검색 ""자막"">구글 자막(CC)선택후 설정하시면 됩니다. 아직 오픈 초기인지라 많은 개선점이 보이지만 차차 나아지겠죠^^ 그래도 볼거많고 전연령층이 다양히 즐길수 있어서 대만족 중입니다."
167,"인터페이스가 넷플에 비해 떨어짐, 밝기조절등이 불편. 번역에 문제가 있는경우가 있음. 패밀리가이 런칭한다해서 기대했는데 아쉬움. 그래도 보고싶었던 컨텐츠가 많아서 만족합니다."
168,한국어 더빙이 적어서 좀 실망스럽네요
169,미국 n사에 비하면 아직 부족하나 그래도 장족의 발전임 컨텐츠질도 꽤 좋아졌고 UI 나 앱 안정성이나 호환성이나 많이 개선됨 이대로만 가줘도 계속 쓸거같음
170,자막이 씽크안맞는게 많고 중간하면 너무 크고 작게하면 너무 작아요 그래서 별한개 뺍니다.
171,업뎃 전에게 훨 낫다 더 조잡하게 해나네 ㅡㅡ 영화 순위도 안나오고 업뎃 왜 했냐
