,0
642,"지금까지 넷플릭스 유용하게 잘 사용하는 학생입니다 
넷플릭스 볼때 애니/영화/드라마를 자주 보는데요 만화를 볼때 한국어 해석이 나오는 부분에서 우리 다시 손잡고 라는 대사를 말하면 너와 다시 손을 잡을날이 올거야 라고 해석이 되네요 문장을 고쳐서 쓴거라고 하지만 대사가 완전 바뀌는 부분에서 다른 나라 말들도 지금 같은 상황이 있을걸로 예상이 되는데 제가 일본 애니메이션을 보면서 알게된 일본어들도 혹시 제가 해석이 질못된걸 정확한 해석이라고 판단하여 여태까지 쓰고 다녔던건 아닌가 싶네요 이부분 개선해주시면 좋겠습니다 아 그리고 넷플릭스에 새로운 컨텐츠를 업로드 하는것 보다는 여러 시리즈가 있는데 마저 올라오지 못한 시리즈 위주로 업로드 해주시면 감사하겠습니다 4개 시리즈 중에 2개만 올라왔다고 하면 2개 시리즈는 볼 수 있는 방법이 많지 않고 찾기 힘들어서 부탁드리겠습니다"
643,"다 좋습니다 그런데 아직 볼게 적어요
마블 다 보고 스타워즈 다보면 볼것이 없을것 같아요
지금은 엑스파일 보고 있네요"
644,어플 개발 외주줬나 개판
645,어플 편의성 넷플릭스와 너무 비교 되네요 ㅠㅠ 컨텐츠는 좋아요
646,번역둘째치고 자막 싱크도 안맞아?
647,갤탭 이용중인데 해리포터 자막보다가 눈 빠지겠어요. 자막사이즈 조절 되게 좀 해주세요ㅡㅡ
648,마블을 바로 볼 수 있어서 좋네요 ㅎㅎ
649,디즈니영화도 보고 시리즈물도 많아서 너무 좋은 앱이네요
650,해외 넷플릭스에는 펜트하우스 시리즈 들어왔는데... 펜트하우스 시리즈 국내 넷플릭스에는 안될까요??? 응답하라 시리즈와 그레이 2편도 혹시 안될까요??? 왓챠에는 해리포터 시리즈 있는데 넷플릭스에 해리포터 시리즈 안될까요???
651,자막 위치가 뭔가 애매 ... 넷플에 비해 쓰기 불편하게 만들었지만 디즈니 몰아보기는 너무 좋아요👍🏻👍🏻
652,너무잘되는구만. 안된다는사람들은 경쟁사들 알바인가보다
653,한글자막 쓰레기 수준임
654,5개주기에는...컨텐츠가 부족하고 인터페이스나...자막의 완성도가 부족하다
655,음..1년구독했는데 컨텐츠는 좋은데 앱이좀 애매하네요 보던영상 없애는 기능있었으면 좋겠어요
656,배속 기능 좀 만들어줘여 ㅠㅠ
657,자막 개선과 저장용량만 덜 차지하면 좋겠습니다
658,자막... 휴
659,심슨의 디즈니 플러스 자막의 싱크가 맞지 않습니다 수정 부탁드려요
660,자막크기 조절은언제 되나요
661,한국어 자막을 보고 싶은데 자막을 없어서 너무 실망했습니다. 드라마 보다가 가끔씩 대사가 못 들었고 뭐라 말하는지 궁금해요...ㅠ 자막을 꼭 넣어주시면 좋겠네요... 그리고 교육도 자막을 넣었으면 좋겠습니다.
662,한영 자막 동시에 띄울 수 있었으면 좋겠어요! 미국 만화 보면서 영어 공부 할 때에 좋을거 같아요!
663,애니가 왜이리 없오요 왓챠에는 많던데 뭐 짱구 극장판 옛날꺼라던지 추가 안되나요
664,자막 ㅎㅌㅊ
665,장사 안된다고 징징대지 말고.. 한글자막 좀 갖춰주세요. 선택 할 수 있는 옵션이 너무 적습니다. 자막없이 오디오로만 퉁치려고 앵간한 애니 시리즈는 더빙판만 들여놓은거 너무 실망스러움
666,일부기기에서 실행자체가 안되는 오류가 있으나 수일간 방치되고있음
667,자막 수준이 영어 잘하는 고딩한테 맡겨도 이거보단 나을듯. 영화도 그렇고 디즈니 플러스도 이런거보면 뭔가 뒷거래가 있는거 아닌가싶다. 피씨와 탭에서 잘되는 다음 화 자동 재생도 폰 어플에선 안됨.
668,자동결제 해지하려고 들어갔는데 코인 받고싶지고 않았는데 맘대로 줘놓구 해지는 못하게 해버리네요? 회수해가세요. 살다살다 이렇게 갈취하는 ott서비스는 처음봅니다.
669,넷플리스 보다요 디즈니 플러스가요 최고이네요 저도요 처음봐요 너무나 재미있네요 지난영화하고요 올해영화까지도요 인정해요 한국영화시리즈 모드도요 추가 해주세요
670,넷플릭스 해리포터 제발 해주세요ㅠㅠㅠ
671,자막이 중간에 안 나올 때가 있어요 그거 빼면 좋아요
672,자막이 진짜 개판이에요 그레이아나토미 시즌16화 10회이후 자막쓰신분바뀐거같은데 앞편한편만보고 썻어도알았을텐데 반말하던사이 다 존대쓰고 번역도개판이에요
673,하... 빅히어로 시리즈 1~3 드디어 볼 수있게 됐습니다.......ㅠㅠㅠ 사랑해요
674,자막이랑 싱크가 안맞을 때가 있네요! 그것 말곤 괜찮습니다
675,굿 좋와요?
676,"다 좋은데요..보고싶은 영화, 애니메이션이 아무리 유명해도 여기 없네요..ㅠ 너무 없어요 너무.."
677,자막이안나옴
678,"마블영화를 너무 좋아해서 넥플릭스에서 넘어왔는데 자막이 보기 너무 불편하네요.. 자막 크기가 조금만 커졌으면 좋겠어요.. 또, 화질 설정도 있었으면 좋겠어요."
679,너무 좋은데 진격의 거인처럼 애니메이션은 오프닝건너뛰기 같은 기능이 있었으면 좋겠어요
680,자막있으면 진짜 좋겠다
681,"스타워즈 전편, 네쇼널지어그래픽을 볼 수 있다는 점으로 한달 ₩9900 이 아깝지 않아요"
682,자막설정 되게 수정부탁드려요
683,"자막 설정이 되는게 있고 안되는게 있네요,, 수정부탁드려요"
684,미드 fbi 자막이 안맞아요
685,배속 기능이 없다는게 말이 되나
686,😅😅
687,미드 FBI 시즌1의 2편과 4편의 자막이 서로 뒤바뀜 다시보니 전반적으로 모두 싱크가 섞여있는 상태네요
688,미드 FBI 기대하고 보고 있는데 자막이 맞지를 않네요. 대화 없는데 자막 나오고 다른 내용의 자막이 달리고 확인하시고 빨리 수정 해주세요.
689,오프닝건너뛰기 개같이도해놨네 적당히건너뛰어야지 이건뭐ㅡㅡ 컨텐츠 그냥그럼 번역 별로임 업뎃후 건너뛰기 디즈니플러스 넷플릭스 하다가 이건 미친듯건너뜀 넷플하고 디즈니좀 보고배워요
690,베트남에서 한국어 설정 어떻게 하나요?
691,자막설정 좀 만들으세요ㅡㅡ 홈페이지에서 해도 설정이안되네
692,자막 조절할수있는 기능이있으면 좋을거같아요!
693,"요새 중소기업 바이럴회사도 맞춤법 검사기
돌려서 일함. 오역도 문제지만 맞춤법 오타도 난무함. 퀄리티가 저질. 디즈니 이름 달고 출시한 게 믿기지 않음. 회차별로 번역자가 다른지 배역이름조차 매번 바뀜. 존대했다 반말했다 와리가리. 최저시급 알바생들 돌려가며 일했나 봄. 메디컬 드라마에서 레지던트를 주민이라고 함. 넷플왓챠웨이브 OTT 가운데 압도적으로 최악의 퀄리티."
694,며칠째 검정화면에 넷플릭스만 떠있어요ㅜ.ㅜ 이용못한만큼 환불해주세요. 금액은 오르고 이용은 못하고 화나네요.
695,자막 쓰레기 수준
696,자막오류 및 저질번역이 나아지기는커녕 새로 추가된 이터널스에도 똑같음
697,굳
698,"자막 오역, 영화 소개 부분 성의없음"
699,별로에여
700,진짜 다 너무 좋은데 시리즈물은 가능한 끝가지 올려주시면 좋을 것 같아요 보다가 끊겨서 너무 불편해요..그리고 사라진 영화 애니 같은 것도 다시 올려주면 좋을 것 같아요 저번에 강철의 연금술사 볼려고 찾았는데 기간이 만료되서 그런지 없더라고요 그래서 다른 어플로 갈아탈까 생각 중
701,디즈니 플러스 추억팔이로 팅커벨 날개의 비밀 봤는데 왜 한국어버전이 없죠? 다른거 몇개는 있는데 팅커벨4만 없는것 같아요.있었으면 좋겠네요.
702,더빙은 없나요?
703,편의성이 조금 더 향상되면 좋겠어요.
704,자막 왜이래요;;;; 자막 안보일 때도 있고 위치 지 맘대로 바뀌고 존댓말 반말도 이상하고... 화질도 매번 구리게 저화질로 재생되고.. 아주 디즈니랑 마블 컨텐츠가 인질이고 멱살잡고 끌어가는 수준이라 느껴지네요.
705,배속도 없고 자막설정도 구림 보던영상 이어보기 탭같은것도 없고 번역수준도 시청에는 문제없지만 부족한편이 많음
706,넷플릭스나 따른 곳에는 에니메이션이 많이 없어 볼게 없었는데 디즈니에서는 볼 수 있는게 많고 전체적으로 맘에 다 들어요!! 왕 추천 합니다 ㅎㅎ
707,자막이 전부 됐으면 좋겠어여 넷플로 자막설정하고 보다보니 안 뜨는건 웅얼거리는 느낌이라 답답하네요ㅠㅠ 폰에서 티비연결도 됐다 아니였다하고 개선되었으면 좋겠습니다
708,심슨 조아^-^
709,애니메이션 많이 넣어주세요~!!! 감사합니다
710,배속 기능이 있으면 너무 좋을 것 같아요
711,감사합니다.수고해주세요.
712,스토브 리그 한국에 추가좀요 아니 다른 나라는 서비스 하면서 한국 드라마를 다른나라에 서비스 하는게 어디 있음...
713,"자막은 좋아지긴 했다만, 아직도 불편한 점이 많음 대표로 하나 말해보자면, 넷플릭스처럼 팝업 화면이 안됨. 팝업 화면 될 수 있도록 설정해주면 별접 5점 드릴게요"
714,한국 영상에도 자막이 있었으면 더 바랄 게 없겠어요
715,자막크기 조절좀 할수 있게 해주세요.자막이 화면의 반정도 차지해서 자막을 보는건지 드라마를 보는건지 ㅜㅜ 모르겠네요.
716,볼거리가 다양하고 특히 귀여운 애니메이션들이 많아서 애들이 좋아하네요~ 만달로리안 짱 ㅎㅎ
717,"인크레더블 헐크가 없네요 마블 시리즈 정주행 하려고 일부로 결제했는데,, 기분이 잡채가 됐다;; 아이언맨은 123 다 있으면서;; 불법 영화 보기 싫어서 합법으로 결제하려 했는데 안 보여주면 제가 2008년 당시, 5살의 나이에 극장에 가서 봤어야 했나요?? 그런 건가요? 아님 헐크 대신에 아이언맨이 죽었다고 왕따시키는 겁니까? 빠른 시일 내에 인크레더블 헐크가 생겼으면 좋겠습니다"
718,자막 사이즈 설정 좀 알려주세요... 폰트.사이즈.설정이 안보입니다....
719,"스타워즈, 마블 등의 컨텐츠는 물론 좋습니다. 그러나 그 외의 것은 모두 할 말이 있습니다. 자막과 더빙이 매우 어색한 부분이 있고, 한글 자막과 더빙까지 해놓은 컨텐츠를 국내 심의를 받지 않아 정당하게 구독을 한 국내 소비자들이 vpn을 쓰도록 강제했으며, 무엇보다 앱이 드럽게 무거워서 잘 작동되지도 않습니다. 덕분에 인내심은 많이 길렀습니다."
720,"자막에 검은 바탕이 있어서 보는데 상당히 거슬림.
초반에 어프닝 넘기기와 마지막에 다음화로 넘어가기 버튼이 랜덤으로 뜸.
시청 중에 화면 밝기 조정 불가능.
자막 설정이 좀 더 다양했으면 함."
721,와이프와 쿠팡 회원을 각자가입해도 부담이 없고 각자 쿠팡 플레이봅니다. 그런데 오늘 애플TV를 구입했는데 아직 애플TV 용 앱이 없다죠? 어서 개발해주세요. 이제 한국도 애플TV가 대세가 될거에요.
722,영어버전은 어떻게 설정하나요?
723,한국어 자막크기나 번역수준이 너무떨어져서 몰입이 잘안됩니다.
724,"자막이 살짝 이상하지만 전부 이해할 수 있고, 그냥 완벽합니다!"
725,ㄷ느스느느느ㅡ느ㅡ느
726,글씨 크기 설정 할수있게좀...티비로 보는데 안보여요
727,제가 디즈니 찐팬으로서 너무 좋지만 아직 안나온건진 모르겠는데 소피아 시리즈는 있는데 소피아 극장판 같은건 없네요 ㅠㅠ빨리 올려주셨음 좋겠어요ㅠㅠ❤️❤️
728,오타랑 오역 겁나 많음 월급받고 일하면 돈값 합시다
729,굳
730,#HBO 시리즈 중 단 1개의 영상도 재생이 되지 않습니다. 연령제한 표시 후 로딩만 지속되고 재생이 안됩니다.
731,"자막뿐아니라 팝업모드, 화면밝기조절, 음량조절이 없어 너무 불편함.."
732,다 좋은데 있는 시리즈가 끝이 없어요.예를 들면 원펀맨이5기가 아니라2기 까지 밖에 없다던가 이런거요
733,어릴때 봤던 알라딘 이나 인어공주 티비 시리즈가 그리워요
734,고등래퍼 시리즈좀 넣어주세요.. 아니면 고등래퍼2도 괜찮아요
735,"넷플릭스 진짜로 애용하고 있는데 디즈니 영화,드래곤길들이기3,해리포터 같은 영화는 없나요 ?이런 게 나왔으면 좋겠네요"
736,잘사용하고있었는데...갑자기.ㅣ.영문으로화면이바뀌어버렸어요..다시한국어로어떻게바꿔요ㅋ?기기한국어이상없고컴퓨터로접속해도영문이고..바꾸는방법이모르겠어요
737,분노의질주시리즈좀다시넣어주세요엄청재미있게보고있었는데다없어져서(유니버설이랑계약기간끝나서없어진건가요?)
738,배속 없으면 쓸 필요 없지. 마블 영화만 영화인 것도 아니고. 유튜브 무비로 볼렵니다.
739,자막이 거지같아서 더빙으로 듣고 컨텐츠가 한국은 늦게 출시하네요 보바펫 언제나오나 궁금하네요
740,배속 시스템이 잇었으면 좋겠어요.
741,자막수준 낮음 다음 화 재생 시 전체화면이 해제됨
742,번역이 쓰레기예요
743,애니메이션을 보는데 시리즈가 1기는 있고 2기없고 OAD가 있는데 심지어 2기가 2021년에 나온거 같은데 지금까지 2기가 안 나오고 있고 시리즈가 다 있는데 영화도 없고 드라마는 많은데 애니메이션이 너무 없어요 그리고 공개 예정인 애니메이션들도 다 짱구 같은거고 요즘 나오는 애니도 거의 안떠서 다른앱을 사용해야 될 지경입니다 돈내고 쓰고있는데 애니 시리즈 같은건 좀 제대로 있어야 되지 않나요? 애니보는 사람은 못보는것도 아닌데 요즘 애니 시리즈도 좀 업데이트 해주시면 좋겠네요
744,굳
745,"좋긴 한데 디즈니,어벤져스 외에는 딱히 볼게 없고…
그리고 자막 크기 설정 어떻게 해요? 자막 크기가 너무 커서 집중이 잘 안돼요…."
746,엔칸토보는데 한국어자막이 아니고 중국어 자막이 나오네요 자막을 한국어로 설정해봐도 중국어나오는데 좀 고쳐주세요;;
747,자막주위에 검은색으로 씌워진 오류 계속 나네요ㅠ 씽크 안 맞는 오류도 해결 좀 요ㅎ
748,자막 정말 보기 힘드네요.. 주인공들의 관계도 제대로 이해하지 못하고 무조건 다 존대로 번역해놔서 집중하기 힘들어요!! 적어도 인물관계도는 이해하고 번역해주길.. 그레이아나토미 시즌 16 진짜ㅠ 그리고 속도 조절도 되었으면 합니다!!
749,자막이 나와서 좋아요^^
750,제가 본것중에 진짜 최고인데용???????!
751,추가 하면 좋겠는 애니메이션 시즌이 있어요 약속의 네버랜드 2기를 추가 해주셨으면 좋겠어요 1기도 감동적인데 2기가 너무 보고싶어요.
752,돈내고보는건데 중간에 버퍼링걸리는건 해결해줬으면 좋겠네요. 콘텐츠는 완벽합니다! +)자막안맞는분들은 이렇게보세요. 이게맞습니다. 오디오:영어 - 자막:한국어
753,배속기능내놔라
754,따뜻한 애니메이션^^
755,영자야 영상안나오고 사운드만 나온다 친절히 이렇게 리뷰 남겨주면 오류 조속히 보완 해라
756,"자막이 엉망이에요…. 막귀가 들어도 틀리게 번역된 부분도 많고, 반말했다가 존댓말했다가 제멋대로 입니다. 제일 거슬리는건 문어체 말투…어플리케이션의 기능적인 부분은 피드백 반영하면 나아질 여지가 있으나 번역 문제로 컨텐츠 질까지 떨어지는 느낌입니다."
757,"편의사항이라고는 1도 찾아볼수가없다
다음화 넘기기
오프닝 점프로 제대로 안되고
빠른재생/음량/화면밝기
자동 자막 설정
모든게 다 불편해 죽겟다"
758,"다른 ott를 사용하다가 티빙으로 넘어왔습니다
컨텐츠는 마음에 드는데 아직 애플tv용 어플이 없다는게 너무 아쉬워요.
언제쯤 지원될까요..ㅠ"
759,한국어 프로그램에도 자막이 있었으면 좋겠어요. 이어폰을 사용하기 힘든 상황에서 작게 봐야하거나 주변소음이 있는 경우는 조금 아쉽습니다.
760,별로
761,너무 좋아요! 조금 아쉬운 것은 TVN같은 케이블TV도 업로드 되면 좋겠어요!^^
762,어려워
763,"**개인적으로 애니메이션을 좋아한다면 디즈니 플러스 쓰는것을 적극적극적극 추천함(티빙,넷플,왓챠 써봄)

2달써보고 느낀 단점 

- 저장해둔 콘텐츠를 오프라인 상태에서 보지않아도 자동으로 오프라인 상태에서 보는것처럼 화질이 좀 떨어짐    (은근히 거슬려서 짜증남) 그래서 저장해둔 콘텐츠를 삭제하고 봐야지 화질 정상으로 돌아옴 

-배속이 티비로 볼땐 가능하지만 핸드폰이나 아이패드로 볼땐 그렇게 되지않음 

장점

-어릴때부터 보고 자라온 애니메이션부터 최신 애니메이션까지 볼수 있다는거 

-첨에 봤을때 맘에드는 콘텐츠가 별로 없어서 
엥..1달만 보고 말아야지 했는데 내가 못찾은거 였음 

아쉬운점은 성인용 애니메이션이 좀 들어왔으면 함
ex) 릭앤모티…"
764,굳
765,별로
766,배속 없습니다. 밀어서 진행 바 이동 기능 없습니다. 소형 화면으로 보는 기능도 없습니다. 일단 영상 보고 싶은게 있으면 각 잡고 처음부터 끝까지 보고 재미없거나 지루한 부분을 넘기려면 더블 터치로 10초씩 이동해야 합니다. 요즘 이렇게 불편한 앱도 오랜만인거 같습니다. 웨이브도 얘보다는 기능이 많을겁니다.
767,자막 오타에 앱 사용성 개불편하고 최악의 스트리밍 앱
768,일부러 앱 안만드시는거 아니죠? ㅜㅜ
769,집에서 시청해도 화질이 너무 지멋대로임. 요즘은 거의 나쁜 화질로만 나오고 설정도 안되고...
770,자막개후짐 ㅋ
771,자막글씨가 너무작아요
772,가면라이더 이그제이드 빌드 제로원 세이버 넷플릭스에서 방송해주세요~음성 한국어로요 제발요
773,어플 업데에트 이후 영상 시청시 '로드 중'이라는 메세지만 뜨며 아무 영상도 볼 수 없음. 돈은 받아가면서 영상은 못 봄 ㅋㅋㅋ
774,배속재생이 필요해요
775,빅히어로 시리즈에 한국자믹 넣어줘요ㅠ
776,정주행 채널 좋아요
777,너무 재밌고 보고싶은 영화도 많이 돈안내고 볼수있습니다. 너무 활용도가 좋고 심심할때 보기좋습니다 감사합니다!
778,배속이 없는게 너무 아쉽게 한번 시청했던 영상은 없앨수가없네요
779,"스타워즈 팬으로서 디즈니플러스를 통해 전세계 팬들이 누리는 즐거움에 동참하고 싶었지만 <비전즈>는 여전히 국내에 업로드 되지도 않고 있고, 현재 방영중인 <북오브보바펫>은 7화가 올라오는 시점에서 국내는 오늘에서야 4화 업로드가 되었다는 것이 참 안타깝기만 합니다. 국내에서 스타워즈의 인기가 낮다는 것이 이유라면 반박할 수는 없겠지만, 디즈니플러스에 대해 기대했던 것들이 아쉬움으로 바뀌어가고 있다는 것 또한 부정할 수 없을 것 같습니다."
780,"특정 제품에 국한된 건지는 모르겠습니다만,
아이폰 11 Pro, 아이패드 Pro 12.9(2세대), imac(M1)에서 재생시(특히 마블 영상), 화면이 너무 어둡네요.
애니메이션(디즈니, 픽사)은 상대적으로 좀 덜합니다."
781,미드가좀더많이졌으면좋겠어요~
782,굳
783,자막이 따로 있으면 좋겠어요
784,애니를 보는중에 몇몇 회차에서 자막이 아예 없는 것들이 좀 있더라고요.. 이 점만 빼면 다 좋은 것 같습니다 강추드려요!
785,"자막이 시원찮아요, 전부 다 경어로 되어있어서 ㅡㅡ; 불편하네요"
786,한글자막이 안나옴
787,미국에 살고있습니다 현재 지역에선 재생이 안된다고 뜨는데 볼수없는건가요?
788,보고싶은 영화나 드라마나 만화가 없고 볼 수 있는게 너무 적습니다 그리고 만화도 중간에 시즌 한개나 몇개가 비어있습니다 그리고 씽이라는 만화 영화도 보고싶은데 씽이라는 만화 영화랑 또 나온 씽2게더라는 만화 영화도 넣어 주셨으면 합니다 그리고 씽과 씽2게더에거 번역으로 한국어와 영어로 넣어 주셨으면 합니다 아 그리고 런닝맨이랑 명탐정코난이랑 코난 극장판 그리고 원피스 토리코 도 넣어주세요 보고 싶은건 너무 많은데 제가 기억이 안나서요 최대한 많은 영화 드라마 만화 애니메이션을 넣어주세요 부탁드리겠습니다
789,자막 구리고 걍 구림 모든게 구림 그냥 제발 하지마세요
790,배속 이랑 창모드 기능이 추가되면 더좋겠네요
791,자막이 너무 작아졌어요 키워주세요 눈아파여
792,스타워즈를 좋아하는 나에게는 정말 좋은 서비스지만 국내차별이 너무 크다 컨텐츠 업데이트도 해외에 비해 늦고 해외 디즈니플러스에서 나온지 1년이 한참 지난컨텐츠도 없고 스타워즈반란군씨리즈 한글자막도 없다 대체 있는게 뭔지 아쉬운점이 너무 많다 같은가격내고 다른나라에 비해 적은 컨텐츠를 즐기는겅 부당한 차별이라 생각한다 처음엔 국내 서비스 초반이라 그렇겟지 싶었지만 벌써 비용을 낸지 3개월이 지나간다 실망이 크다
793,배속기능 필요
794,별로
795,"지금은 축구경기 중계나 SNL 정도 보고 있지만 앞으로는 다양한 컨텐츠들을 볼 수 있을 것 같아 기대가 됩니다.

근데 애플TV 지원이 빨리 되었으면 좋겠네요 ㅠ"
796,자막에 오타가 너무 많고 인물들이 말을 끊어서 하는데 자막에서는 붙어 나와서 불편합니다. 자막 좀 수정해주세요
797,"저는 엄마가 와우 회원이어서 영화 즐기는 초등학생인데요.. 제가 아이언맨을 좋아했어서 그런ㄷ 아이언맨 시리즈 부탁 가능할까요...? 1,2,3만이라도 해주시면 5점 드리겠습니다"
798,심슨 정주행중//한국어 자막 실망스러움. 귀에 들리는 것만 해도 자막에 쓰인 것 이상으로 재미있는 표현이 많는데 다 생략됨.
799,애니 보면 중간에 시즌 하나씩 빠져있거나 시즌 3만 있다던가 하는 경우가 좀 있어서요ㅠㅠ 인기 애니도 없는게 꽤 많더라구요..! 새로 넣어주셨으면해요 그리고 별거 아닌거에 모자이크라던가 장면을 편집해서 삭제해버린다거나 그런것들도 있더라구요..? 그런점들 꼭 좀 개선해주세요 고쳐주실거라 믿고 별점 5점 찍고 갑니당ㅠㅠ
800,삼성 dex로 TV에 연결해서 시청할 때 자막이 너무 작습니다. 자막 사이즈를 조절할 수 있는 기능이 있으면 좋겠습니다.
801,자막 크기와 위치 조절할 수 있게 해주세요
802,번역 좀 바꿔주세요 제발요…
803,한국드라마를 좋아하는데 넷플릭스만 한국어자막을 지원해주니까 티빙에만 있는 드라마는 보고싶어도 못보는게 너무 불편합니다 제발 꼭 넣어주세요..
804,"생각보다 컨텐츠가 많네요. 메뉴 네비게이션, 어플 인터페이스 등의 사용자 편의가 조금만 더 향상되면 좋겠습니다. 드라마 맛집입니다ㅋ 옛날 드라마 정말 많아요. 넷플릭스, 왓챠 볼 게 없어서 결제해봤는데 만족스러워요."
805,넷플릭스로 정말 많은 애니를 본 씹덕입니다. 진짜 넷플 너무 짜증나요 문독 재밌다고 하는 사람들이 많아서 넷플에 있길래 한 번 볼려고 했는데 왜 3기부터 있는거죠;; 다른 애니도 그러는 경우가 너무 많아서 불편해요;;; 이건 보라는게 아니잖아요 그리고 애니가 너무 적어요 또 모자이크도 너무 심해요 저는 폰으로도 보고 TV로도 보는데 저번에 폰으로 소아온 볼려고 했는데 갑자기 성인 인증하라네요 정말로 빡칩니다 그럴거면 모자이크를 치우세요 진격거도 보는데 로드레이스 거인화 된 모습이 나올때 얼굴 전체가 모자이크라서 진짜 진심 빡쳤어요 그리고 화질이 갑자기 저화되는 상황도 있었어요 랜덤추천도 좋지도 않아요 넷플로 드라마나 영화 본 적도 없는데 추천으로 드라마나 영화를 추천하면 어쩌자는거에요 시청한 콘센트에서 시스템이 알아서 해주는데 왜 전혀 연관 없는게 나오죠 또한 애니 시리즈가 너무 늦게 나와요;;; 애니 시리즈를 하나 다 본뒤 다른 애니를 볼려고 하는데 다 본거라서 애니가 너무 적어요
