,0
1680,영어 공부하는데 아주 유용하게 사용하고 있는데 동시자막기능은 도대체 언제쯤 개선 될까요? 이런 기능 추가되면 가입자 더 많이 늘지 않을까요?
1681,이것저것 다른 ott에 비해 불편한 건 많지만 그 중 하나를 꼽자면. 재생목록 삭제 전체선택이나 아니면 메인화면에서 꾹 누르면 삭제할 수 있도록 만드는게 기술적으로 대단히 어렵나요? 시리즈 하나 보면 모든 회차를 일일이 삭제하는게 너무 불편합니다.
1682,자막에 검은색 테두리 안생기게 할순 없나요?
1683,한마디로 최애 미드
1684,영어더빙 설정이 잘 안먹혀요. 자주 한국어더빙으로 풀립니다. 다시 설정해도 안먹힐때가 많아요
1685,자막크기좀 키워줘잉
1686,자막설정에 자막끄기 표시 자꾸없어지는데 오류 관리 좀 잘 해주세요
1687,"10초 전후나 오프닝 띄어가기 추가해주새요....
이거빼면완벽...."
1688,자막 생긴 건 너무 좋아요 잘 쓰고 있습니다 다만 모바일에서 이용하기에는 너무 크네요 피시버전에선 괜찮았는데 모바일에서는 과한 느낌... 자막 크기를 조절할 수 있으면 좋을 것 같아요
1689,어느샌가 부터 영화보다가 홈버튼이나 다른 어플사용하면 화면은 검정화면에 소리만 계속 나오고 강제종료도 안되고 핸드폰 모든게 먹통이됩니다 핸드폰은 종료해야만 풀리고요... 그리고 외국영화를 볼때 더빙(한국어)를 누르면 한국어가 안나오고 영어선택후 다시 한국어 선택해야 그제서야 한국어가 나옵니다 빨리 해결이 되었으면 좋겠네요
1690,1년구독해서 재밌게 잘보고있습니다 재미있어요~~~
1691,App is still not working! This is so annoying. It's been over a month. Are you planning to fix this problem or not?
1692,요즈음 컨텐츠는 옛날보다 나아졌는데 앱에서 코드 100 오류가 뜨며 열리다가 꺼지네요.
1693,사랑합니다. 이 기세를 타 메이드 인 어비스 2기를 가져와주시면 사랑의 마음이 더 커질것같습니ㄷ
1694,생각보다 개별 구매해야 하는 영화가 너무 많네요ㅠㅠ 개인적으로 한국 드라마나 영화도 한국어 자막이 지원됐으면 좋겠어요! 타 ott 사용하다 웨이브 넘어왔는데 자막이 익숙해져서 그런지 생긴다면 최고일 거 같아요ෆ⸒⸒
1695,자막 ㅡㅡ 검은배경 안고침?
1696,안녕하세요 저는 게임을 아니고 영어를 많이 영화를 많이 봤어요 저는 바라는 거 포켓몬 연습 스타가 있어서 감사합니다 포켓몬 세트가 있어요 그냥
1697,검은색 자막바가 화면을 가려 시청에 방해가 됩니다. 자막바를 설정할 수 있으면 좋겠어요.
1698,자막설정이 된다고하든데 점세개눌러봐도 자막설정은 전혀없이 비율.그런것만있는데요?왜저는안되는건가요?최신기계입니다
1699,자막 배경 없애주세용
1700,디즈니에 모든 영화가 담겨있고 어린애들이 볼수있게 키즈도 있어서 좋은것 같아요^~^
1701,배속 선택이 없음.
1702,자막을 아래로 고정시켜주새요 그리고 글씨 크기도 줄여주시면 좋겠습니다 자막이 위나 아래로 왔다갔다 거려서 시청에 방해가 돼요 글씨도 커서 가려버려요
1703,한국드라마나 영화도 한국어자막 설정할 수 있게 해주시면 좋겠습니다!!!!!!!!
1704,아니.. 팝업사이즈가 왜... 왜 넷플릭스랑 같아진거죠.. 이러면 웨이브 쓸 이유가 없는데.. 아 왜 쓸데없이 사이즈 줄여놨어요
1705,자막 설정이 없나요?! 넷플 사용하다가 HBO미드가 보고 싶어서 넘어왔는데 자막을 원래 안봐서 끄고 싶은데...기능이 없나요? 아직도 이렇게 강제 한다는게 요즘 트렌드에 맞는지... 기능이 없다면 다시 넷플 가야것음요
1706,몰입도 떨어져요ㅜ
1707,"영화시청후 리뷰별점 남기려고 하면 앱 강제종료됩니다. 빨리고쳐주세요.
사용폰은 아이폰8입니다. 앱 업뎃해도 똑같아요."
1708,외국인이냐? 간단한 증상리뷰도 이해를 못해서 메일을 쳐보내달라는 앵무새답변달거면 그냥 한국어학당을 나가 ㅗ 답다는 꼬라지 참
1709,자막이랑 더빙 제 마음대로 설정 못하나요.. 맘대로 설정도 못해서 영상볼때 몰입감이 떨어집니다 그거빼곤 없는게 없어서 좋아요
1710,"와우 이용하면서 잘 쓰고 있습니다. 동영상도 좋지만 멜론이나 플로, 바이브 같은 음원스트리밍 서비스 운영계획은 없으실까요? 해주시면 좋겠습니다~~"
1711,자막 배경생긴거 너무 싫다
1712,프렌즈 내리지말아주세요 ㅠㅠ재탕하고 재탕하는 유일한 드라마인데 제발
1713,入 \\
1714,디즈니를 이용해서 애니메이션을 보려면 결제가 왠말이죠?
1715,배속기능이랑 자막만 더 해주시면 좋을 것 같습니다 🤍
1716,배속기능 작은화면 기능 있었으면..
1717,자막설정 앱으로어케함 설정에없는데
1718,편의성 부족
1719,"미드, 영드를 좋아하는데.. 볼만한건 하나도 없고, 영화도 성인용은 다 들어내 버리고 다시 살리지도 않고 2년간 영화 서너편 보고.. 1년째 한편도 안 보네요. 아무리 공짜라도 해지해얄듯.."
1720,"즤기여,혹시 나의히어로아카데미아6기 언제 나오는지 알수 있을까요? 넘모 보고싶어용ㅠㅠ (모든 사람들이여! 넷플 편하다! 넷플깔아라!!)"
1721,"자막 사용해서 보고있는 사람 인데요. 제발 공식자막을 써주세요. 자막에 오타도 너무 많고 의역,오역 하물며 맞춤법마저 맞지 않아요. 아무리 맞춤법에 대해 제대로 알지 못한다고 해도 헷갈리다를 어떻게 헤깔리다라고 쓸수가 있어요. 공식자막을 쓰지 않을거면 적어도 맞춤법을 잘 틀리지 않는 사람을 쓰던가요. 그리고 제발 op이나 ed도 자막을 써주세요. 오히려 다른 불법 사이트들이 이거보다 더 잘 되있다고 느낄때가 많습니다. 네이버에서 사람들이 애니메이션이나 영화를 올리는 경우도 있는데 그런편이 더 자막이 잘 달려 있습니다. 불법적으로 보고싶지 않아서 한달마다 돈도 내고 있는데 사람들한테 돈이란 돈은 다 쪽쪽 빨아먹으면서 왜 사람들의 불편은 생각하지 않는건가요? 빠른 시일내에 고쳐주셨으면 좋겠습니다."
1722,미드 수퍼내추럴 더이상 제공 안하나요????
1723,자막검은배경 ㅜㅜ 개선 좀 해주세요 영상에 집중이 안되요
1724,감사합니다 ~^^~♡
1725,나의히어로아카데미아 6기 언제나와요?
1726,"미드 쉐도잉 하려고 하는데 티빙에는 영어 자막, 자막 끄기 기능 등이 없어서 너무 아쉽네요..."
1727,자막이 이상하게 바뀜 검은색 배경좀 없앴으면
1728,애니매이션 영화나 애니매이션들도 더빙판 말고 원본판 올려줘요
1729,자막 검은 배경 이거 갤럭시는 앱을 통해선 해결 못하게 돼있음 전혀 이해가 안됨
1730,언어설정을 전부 한국어로 해놨는데 왜 꼴보기싫게 자꾸 미리보기에 중국어 일본어 뜨고 난리임???
1731,한국드라마볼때 한글자막나오게못하나요?티빙이나 넷플은되는데 웨이브는아직안되나봐요 ㅠ
1732,배속하고 봐서 그런건지 가끔 보다가 싱크가 안맞아요 개선 부탁드립니다
1733,시리즈로 나오는 만화들.. 예를 들어서 '위 베어 베어스'를 영어 버전으로 쭉 보고 싶은데 회차마다 영어버전으로 다시 바꿔줘야해서 불편해요. 분명 설정은 영어로 되어있는데 왜 회차가 바뀌면 한국말로 나오나요? 예전에는 안 그랬던 것 같은데 오류인지 확인이 필요해 보입니다.
1734,배속 서비스가 없어서 너무 불편해요 ㅠㅠㅠ 빨리 생겼으면 좋겠어요
1735,배속 기능이 없다니.... 10년전 어플인가
1736,한글자막 어디갔어요.?
1737,한국더빙만 따로 찾을수 없어서 불편하네요 영화도 전체 카테고리 눌러도 몇개 안나와서 일일이 찾아야되고 최신순으로 찾아볼수도 없어서 불편합니다 내가 못 찾는건가? ㅡㅡㅡㅡㅡㅡㅡㅡㅡㅡㅡㅡㅡㅡㅡ 답변이 없군요 음성설정을 한번 하면 자동으로 안바뀌던데 방법이 없나요? 넷플릭스 처럼 그영화의 그나라 언어로 바로 나오게 안되나용? 모르는 나라 언어 영화는 어디나라껀지 몰라서 입모양 보고 맞춰 찾은적 있긴 한데 원어로 볼수 있는 방법 아심 알려주삼
1738,더빙이 잘 되었네요. 재밌습니다. ^^_^^
1739,배속 조절이 안됨
1740,"아니 없는 영화,드라마가 넘후 많은거 아닙네까?..
나홀로집에도 없고 퀸카 살아남는법도 없고…
좋긴한데 렉이 너무 많이 걸려효..애니메이션도 그다지 많은편도 아니고…하이큐 4기는 없나 보네요..
진격거도 없고..없는게 많아유 ㅠ"
1741,죄송하지만 진짜 최악입니다... 최악리뷰나 별점1점은 거의 처음이에요 1.배속X 2.다음화보기X 목록메뉴가 따로없어 몇화까지있는지도 안보여주네요... 3.비디오도 자동X 수동이더라고요... 미국꺼 보는데 갑자기 한국어가 나오질 안나 한국꺼보는데 영어가나오지안나 수동으로 바꿔야해요 4.시청중인 콘텍스 정리X 마우스로 꾹 눌러도 삭제창안뜸 지우는 액스창도 없어서 자꾸 잘못 눌려요 데이터와 시간잡아먹기 위해 안 만들었는지... 5. 고객센터와 문의하고 있었는데 도중 확인할게있어 뒤로 갔다가 다시돌아왔는데 문의창이 사라졌더라고요?? 말이 되나요... 다른사이트는 문의 완료해도 내가직접 삭제하지 않는한 남아있어요.... 이정도면 기본적인것 중에 기본 기능도 전혀없는듯하네요 기능을 쓰려하면 찾는기능 마다 전부 없어요...
1742,필리핀에서 한국방송 보려고 결재했는데 해외라서 안된다고 나오네요... 어떻게 해야되나요? 꼭 보고싶은데... 환불해야되나요?
1743,I use the app while I rest at home. The advantage of this app is that youcan watch many TV shows and behind-the-scenes of some movies. But the downside of this app is that you have to pay to use this app. Also the app may not have the movie or TV show you want. I recommend this app to office workers or people who can pay the fee. Also you can share your account with others.
1744,스타워즈 반란군 시리즈에 한국어 자막 좀 추가해주세요
1745,자막 검은바탕 어떻게 없애는겨 어플 안에는 자막설정도 없고 계정설정으로 바꿔도 어플엔 반영안되고.. 짜증나서 끔 그냥
1746,매번 스타워즈 컨텐츠 늦게 공개함 다른 나라에서 동시 공개로 즐기고 있을 때 손가락만 빨고 있어야 됨
1747,잘 쓰고 있습니다만 애니메이션 시청 할 때 시작오프닝 스킵이 있었으면 합니다.. 스킵이 없어 바를 움직여서 보고 있는데 불편한 감이 있습니다.
1748,범죄자들이 잔인한 만큼 경찰들의 강한 대응은 필연적이다 이들에게 인권이니 폭력경찰 과잉대응이라며 떠드는 언론들의 말장난에 속지 말자
1749,"한국에서 작품 많이 벌었으면 자막리나 고쳐요,,,, 이거때문에 모바일 앱 안씀"
1750,자막 크기 설정할수있게 해주세요~
1751,자막 배경검은색 개거추장스럽고 4k라더만 태블릿에선 fhd가 최대... 몇달만에 프리미엄 재구독했더만 추가된 컨텐츠 너무없음 뭐있나 둘러보다 예전에 보던거 재탕이나 할듯..
1752,배속기능좀요
1753,영어공부하려고 미드보는데요. 0.7배속 재생이 없어 많이 불편해요. 넷플릭스를 신청해서 볼까도 고민중이예요.
1754,자막 켜려니까 자막설정에 끄기만 있고 켜기가 없어요 ㅡㅡ 자막도 하단이 아니라 상단에 뜨더니 ㅡㅡ 넷플 갈수록 별로네여 갈아탈 생각중ㅡㅡ
1755,돌비 애트모스 좀 신경써주시요
1756,"배속 기능 없음 팝업기능 없음 자막언어 부족 컨탠츠 (영화,드라마)부족 수정-> 나날이 늘어가는 드라마 영화 감사합니다 이 가격에 배속과 pip기능만 있으면 대박이겠네요. 피드백 반영 감사합니다. 미드 볼때 오프닝 넘어가는 기능이 있었으면 좋겠어요. Pc로 볼때는 쿠팡플레이 크롬 스토어에 넷플릭스처럼 많은 기능이 있었으면 좋겠습니다."
1757,"쿠팡플레이 궁금하시나요🙄❓️❔️ 여러분이 보고싶은영화📽 아이들이보고싶은 극장판애니메이션🍿 다들어있구 심심하거나 울음이그치고싶은 부모님,집에서심심할때,학교/학원장소,동아리 추천합니다 쿠팡플레이님감사합니다~🍀"
1758,국내에서 한국어 생중계로 F1을 볼 수 있다니 정말 행복합니다. 쿠팡플레이에 감사드립니다.
1759,영화볼거 많아서 봐야겠네요 디즈니 플러스 마블 어벤져스 합류한 영화 재미있게 볼게요 감사합니다
1760,외국 영화볼 때 한글 자막이 주인공 얼굴을 가려서 영화에 집중이 안되는데 개선방법이 없을까요?
1761,자막 안고침?
1762,배속좀
1763,"자막이 안나와서 계정, 유튜브, 네이버 등 여러 방법을 찾아도 계정이 안 나옵니다. 럴경우 어딱해야하죠"
1764,자막팀 일좀해주세요
1765,넷플릭스 화이팅 힘내세요!! )) 어.. 근데 방금 넷플릭스 들어갔는데여ㅎㅎ 다른 애니는 자막이 되는데 체인소맨만 일본어로 되있고 자막도 끄기로 되있어서 한국어로 설정할수 없게 되있어요ㅠㅠ 부탁드립니다ㅎㅎ
1766,아니 왜 한국만 스타워즈 방영일이 늦죠? 같운돈 내는데 계속 이런식으로 똑바로 안하면 해지 합니다
1767,키즈에서 영어설정되어있는대도 한국어로 나와요. 재설정해도 다음편누르면 또 한국어...음성설정들어가면 영어로 되어있고요. 확인부탁드립니다.
1768,에엥 체인쏘맨 3화 자막이 안달렸어요 수정해주세요
1769,"미드 오역이 좀 있습니다 타사에서부터 빅뱅이론 4번째 전시즌 시청중인데, 번역가 분이 하시다가 졸았던 게 아닌가싶을정도.. 심지어 이름도 잘못 적어놓은 경우도 있네요 점검이 필요할것 같아요. 그외엔 가격도 저렴한데 훌륭하다 생각해요"
1770,자막 없는데 어떻게 보라는거야 내가 돈 내고 넷플 보는데 일본어랑 스페인어도 따로 공부해야 하냐?
1771,전화하면서 영상 시청할 수 있도록 해주세요ㅜㅠ 그냥 화면공유 같은 전화가 아니라 일반 통화인데도 전화만 하면 영상이 안 틀어져요 저는 같이 틀어놓고 전화하면서 보는 경우가 많은데 속상하네요.. 고객센터에 전화해서 물어보니깐 기술적인 문제 때문이라던데.. 다른 앱들은 다 가능한데 왜 하필 디즈니 플러스만 그런건가요 ㅜㅠ 가능하도록 해주세요.. 이거 말고는 다 좋아용
1772,"한국영화,드라마에서도 자막선택 가능하게해주세요~"
1773,원피스 새 시즌도 빨리올라오면 좋겠네요
1774,아직도 플레이어 배속도 없는 ott가 있다? 네 그게 디플이에요 그외 번역도 ㅈ선족들이 하는지 오역도 많고 같은 미드에 나오는 사람이 시즌마다 이름도 바뀜 (이던 인데 이선-이든-이던) 마블/스타워즈 드라마를 인질삼아 아직도 버티고 있는거 보면 신기할 따름 기한 연장 안하고 바로 구취각
1775,해외 지역에서는 앱 자체를 이용하지 못하고 환불도 안해줌. 개발자 연락처는 장식용인지? 그냥 믿고 거르는 앱.
1776,한국어 자막 자기 혼자 사라졌다 자막이 안 나와진다 전화는 나와지던데
1777,"보통 1.5배로 배속걸어서 시청하는데 처음엔 상크가 맞다가 조금만 지나도 화면따로 소리따로 나와요 
그래서 웬만하면 다른 어플로 찾아보고 정 없을때만 웨이브 이용합니다.

컨텐츠는 좋고 시스템이 못따라주니 아쉬워요.
앞으로 웨이브를 더 이용할 수 있게 개선해주세요."
1778,웨이브를 사용하는 사람입니다 렉도 생각보다 안 걸리고 컨텐츠 많아 좋습니다 그러나 애니메이션 쪽이 컨텐츠가 많이 없습니다 예를 들어 원피스라는 애니메이션은 현재 26기 넘게 쯤 나오고 있는데 웨이브는 18기까지 밖에 없는 게 아쉽습니다.그래서 컨텐츠를 더 추가해주었으면 감사하겠습니다
1779,자막으로 보고 싶은 애니가 꼭 더빙으로만 나와서 너무 불편해요~특히 일본애니가 더빙일때 우리말이 너무 어색하고 목소리가 안 어울려서 집중이 안되요~ 일본언어에 자막 으로도 볼수 있게 추가 할순 없나요??
1780,외국영화와 드라마를 관심이 있어서 보고싶었는데 디즈니플러스를 통해 볼 수 있어서 좋아욯ㅎ가입하길 잘 한것같아욯ㅎ
1781,한국어 더빙이 더 많아졌음 좋겠어요 넘 없어요 너무 없어.. 다른거 작업 하면서 틀어 놓고 싶은데 ㅜㅜ
1782,배속좀...
1783,너무 제밋어 이거 최신나오면 와아어우누노너ㅓ나웅나누오ㅜ어유며댜두굳8뎌ㅜ주읓 7우ㅜ뎌유룰어내ㅜ3ㅜ우퉃우ㅑ웅어ㅜㅇ 퉁 두읕
1784,자막 왜이리 작아...
1785,시리즈물 시청할때 다음화 자동재생(이어보기) 안되도록 선택할수 있는 기능이 있었으면 좋겠습니다.
1786,자막 검은 배경 어떻게 없애나요? 갤럭시인데 너무 보기 힘드네요
1787,굳
1788,볼것은 X도 없음 볼만한건 따로 구매 해서봐야되는 이중결재 시스템ㅋㅋ 금방 도태될 서비스인듯 이게 OTT인지 웹하드인지 구별도 안가는 구시대적 인터페이스ㅋㅋㅋ
1789,몇일전까지 다 떴는데 오늘 보니까 넷플릭스 시리즈만 있더라고요
1790,자막배경 좀 없애주세요
1791,원피스 시리즈 어릴때 생각나서 정주행했는데 ㅠㅠ 너무 재밌어요!!!젭알ㄹㄹㄹㄹㄹ다음시리즈도 쭉 올려주세요!!!!!현기증나여오오!!!!!제발유우🥹🥹🥹 그리고 너무 잘보고있어요 쿠팡플레이 최고👍🏻👍🏻
1792,자막 왜 안나와
1793,디자인이 구려요.
1794,"쿠팡와우 쿠팡플레이 서비스를 너무나도 잘 애용하고 있고 
국내 기업 쿠팡을 늘 응원하고 있습니다.
다만, 대부분의 OTT서비스 기업들은 모두 자막을 지원하고 있습니다. 그것은 농아인(청각 장애인)들을 위함에도 자막서비스는 당연하게 여겨지는데요,
쿠팡플레이에서는 자막이 없는 예능들이 많이 보입니다.
예를 들어 심야괴담회를 정말 즐겨보아서 제 농아인 가족에게
유튜브 자동자막설정도 해 보았지만 아시다시피 자동자막설정은 오타 및 오번역이 많아.. 
수어로 가족에게 전달해주며 같이 보기도 하였지만
화면과 수어를 동시에 볼수가 없기에 재미를 함께 즐기기 힘들더군요..
자막서비스가 시간과 비용이 든다는것은 압니다..!
그러나 언젠가 글로벌 OTT 기업이 된다면
자막서비스는 미리 갖춰두어야 글로벌 OTT기업이 될 수 있다고 생각합니다.
한국어 자막서비스 도입을 지원해주세요.
개발자님 감사드립니다..!"
1795,잘 보고 있습니다 근데 SM-T536 은 왜 호환이 안되는지요
1796,자막이 안 나옴
1797,다 좋은데 19금 애니메이션에서 그렇게 잔인하지도 않은데 모자이크 처리땜에 보기 좀 불편해요 모자이크 유무를 설정할 수 있는 기능이 나왔으면 좋겠어용..ㅜㅜ
1798,미디어 다시 보게 되어 감사
1799,자막보다 한국어더빙으로 영화를볼수있어서 좋아요
1800,배속이 없네요
1801,한글자막이없네요
1802,안녕하세요. 티빙 시청자입니다. 다름이 아니라 티빙 시청하면서 명탐정코난 극장판을 자주 찾아보곤 하는데요 코난 극장판 19기 이후론 엔딩곡까지 들어있고 1기 ~ 18기부턴 엔딩곡이 없던데 이 사이에도 엔딩곡 넣어주실 수 있나요? 코난 극장판 엔딩곡은 다 좋은데 티빙에선 못들으니 좀 아쉽습니다.. 코난 극장판 1기~18기도 엔딩곡 넣어주시면 더 좋을 것 같아서 의견 한번 남겨봅니다.
1803,해리포터도 있고 있을 건 다 있어서 좋은데 영어자막이 너머 소홀해요…ㅜㅜ 거의 세문장에 한번 꼴로 자막에 단어들이 많이 빠져있네요. 영어공부 하려고 영어자막 키고 보는 사람들도 많은데 있는 그대로 자막 작성해주셨으면 좋겠습니당🥺
1804,인터페이스가 업뎃했는지 바꼈는데 계속 내려야돼서 컨텐츠 찾는게 더 불편하고 어려워요ㅠ 그리고 자막 배경 검정색 없애는 방법 없나요...🥲
1805,나의 히어로 아카데미아 3기는 어디로갔소..
1806,배속재생 화면밝기조정 음량조절 기능이 없어 시청에 불편함이 많습니다.
1807,자막자체를 아무리 새로 설정해도 되지를 않습니다
1808,"아직 한국 상륙할 준비가 덜된듯. 영어권 어플 하나 만들어놓고 번역 대충 한 다음 한국버전이라고?
한국버전인데 왜 한글이 잘 안보이는지..
애니메이션 보면 번역이 구글번역기보다 못함.
자막도 설정할수있다는데 너무 불편하고 넷플 자막처럼 했으면 좋겠음"
1809,감사합니다.^^
1810,드디어 모바일 자막배경색 없어졌네요!! 좋아요!! 대신 화질이 왜이렇게 안좋아진건지..... 그리고 키즈에서 아이들 보는 영상인데 한글과 자막이 일치했으면 좋겠어요 한국어더빙은 좋으나 자막까지 같이 읽으려니 말과 글이 다르네요 그걸 좀 고쳤으면 좋겠어요(ex: 마이티 익스프레스) 더빙한 그대로 자막이 나왔으면 좋겠는데.. 영어를 번역한그대로를 더빙판에 넣은것같네요
1811,앱 인터페이스 왜 이렇게 변경한건지 답답함. 그만 봐야겠음
1812,미드는 영어자막있으면 수요층 더늘듯. 영어자막 시급함
1813,"중국어 공부할 겸 중드 보고싶은데
자막과 영상이 합쳐져 자막의 언어선택을 못한다고 홈페이지에 나와 있더라구요,, 그건 너무 단편적이고 불편한 이용법인 것 같아요. 

중국 드라마의 자막을 중국어로 볼 수 있는 기능
혹은 미국 드라마를 영어자막으로 볼 수 있는 기능도 있어야 한다고 생각합니다"
1814,넷플릭스에 익숙한탔인지 인터페이스가 사용이 불편하고 앞뒤로 이동하는 반응속도가 너무 느림
1815,자막 두개로 볼 수 있게해주세요. 자막이 너무 보수적이라 원어랑 같이 볼려하는데 하나 밖에 못 봐서 너무 불편합니다
1816,앱 ui 디자인 거지같앙용 깡불징망셍용
1817,ui 왜 이럼? 왜 세로로 바꿈? 너무 불편하다 짜증나네 다시 되돌려라 제발... 아무리 컨텐츠 눌러먹게 한다지만 정도가있지.. 모바일 인터페이스 이따구로 디자인한 빡대가리 짤라라 진짜
1818,다 좋은대 영상이랑 사운드랑 타이밍이 안맜아서 별 하나 깍음
1819,배속기능 만들어주세요
1820,갑자기 pip안됨 완전구림
1821,자막이 너무 안 맞네요... 누가들어도 xx인데 전혀 문맥에 안 맞게 뜨는 경우가 많아요 개선 부탁드려요
1822,한국어 영어 통합자막은 지원 안 되나요? 프렌즈 미드 및 각 종 미국 영화 통합자막으로 시청하고 싶은데 지원 부탁드립니다
1823,컵헤드쇼 시즌3 8화 한국어 부터 소리와 화면그림이 않맞아요 이거 수정하세요 기대했는데
1824,애니메이션 좀 더 늘려줘용~
1825,배속이 안되다니요... 너무 기본적인 기능 아닌가요
1826,배속 기능 좀 만들어주세요
1827,자막이 없음
1828,자막을 한국어로 설정해도 뜨질 않아요.이건 왜그런걸까요.
1829,좋은 퀄리티 마음껏
1830,티빙을 애용하는 유저입니다 잘 만족하고 있는데 몇몇 애니매이션 시즌이 많이 없더라구요 예를 들어 뭐 나의 히어로 아카데미이 라던가 모브사이코100이라든가 어떤건 중간중간에 빠져있더라구요…컨텐츠좀 추가해주세요!
1831,재미있는 영화나 만화 애니메이션을 볼수있어서 좋아요. 근데 컵헤드 쇼 시즌3 8화 부터 10화 까지 싱크가 맞지 않습니다.(한국어만) 가능하시면 해결해주세요
1832,해외시리즈 영어자막없는게 너무 아쉽네요... 추가를 해주시면 계속 웨이브 쓸거 같아요!
1833,괴짜가족 괴담일기 한국어 자막 간절히 부탁드립니다 저는 한국인이어서 영어를 잘 못합니다. 간청드립니다 디즈니플러스
