,0
479,화면이 꺼진상태에서도 작동하게 해주세요. 화면을 끄면 혹은 실수로라도 꺼지면 다시 트느라고 짜증나고 스토리의 흐름이 다 망가짐... 화면을 안보고 소리만 들을시도 있는데 ..... 자동으로 계속 돌아가게 하면 되지 오디오모드로 들어가서 설정하고 나중에 다시 화면모드 바꾸고 그러는것이 너무 불편함... 이유가 뭔지 모르겠네.. 고객들 괴롭히려는 것인지 좀 어이가 없음.... 편리하게 만들지 않고 불편하게 만든 사람은 도대체.... 아직도 안 잘리고 근무중임?
480,자막 검은 배경 도대체 왜 생긴거죠... 설정도 못하고 너무 불편해요
481,자막에 자동으로 검은 바탕이 나와요
482,자막배경 시꺼매서 거슬려요
483,자막배경 왜그러나요 이게 최선인가요 앱 내에서는 설정도 못하고.... 너무 불편합니다.
484,자막 검은배경 극혐
485,배속이없어서아쉬워요
486,배속 서비스 언제 되나요?
487,설정 들어가도 알림 설정하는데가 없어요! 어디 있는건가요? 알림 받기 싫은데요
488,자막 뒤에 검은 배경 왜 넣은거.???제발 없애주세요.
489,자막 젓같이도바꿨네 담당자 똥싸냐?
490,자막 기능이 있었으면 좋겠어요
491,자막 테두리 설정을 만들어 주시던가 테두리를 없애주시던가 빠른 조치가 필요할 것 같습니다. 보는 내내 테두리에 신경이 쓰여서 제대로 보지도 못하고 중간에 꺼버리는 경우가 다반사네요.
492,자막기능이 없어서 아쉬움
493,배속없으니 답답해서 못보겠다
494,자막 검정 배경
495,자막 왜이래요?? 검은배경없애주세요
496,자막 장난?
497,"자막 크기는 개선 안하나요? 초반부터 불편했는데, 개선의지가 없나요?노트북이나 탭에서 볼때 자막크기는 당연히 자동으로 변경되는게 당연한거고, 사용자에 편의애 따라 글씨크기 변경 기능도 있어야 한다고 봅니다"
498,자막크기를 설정하는 기능이 없어서 너무 불편하네요
499,자막 크기나 모양 설정이 가능하면 좋겠어요😊
500,자막좀 키우자ㅜ제발
501,자막이 너어어어무 작아요 눈이아플정도로
502,자막크기 조절 기능 만들어주세요 기본 자막 너무 작아요ㅠ
503,자막에 이상한 검정색 바가 새겨서 보기가 너무 불편함 이런거 빨리 고쳐주면 좋을듯
504,자막 최악
505,자막크기가 너무 작은데 크게 해줄수 없나요?
506,자막이 너무 작아요ㅠㅠ 자막글자크기조절만할수있다면 너무좋을것같아요
507,"""알라딘""을 언어 한국어, 자막 한글 키고 보면 아주 가관입니다. 디즈니+가 인지도가 없는데는 다 이유가 있는듯..."
508,"배속 안 되는 거 시청 중 밝기,소리 조절 안 되는 거"
509,자막 싱크 관리 안하나요???
510,자막 꺼도 다시 재생할 때마다 켜지는 점... 자막 해제기능 없나요?
511,자막이 있어서 너무 좋아요~~~
512,소리겁나작음
513,자막자막자막！！！！！！시꺼먼배경 짜증나서못보겠네진짜 별짓 다하다 남겨요
514,자막 설정 좀...
515,자막 디자인 돌려내..
516,자막 검정배경 얘기가 이렇게 많은데 바꿀 생각을 안하네 ㄱㅋㅋㅋㄱ
517,배속기능 추가해줘어어어애아애애ㅣ애이ㅣㅢ이ㅢ어
518,자막 진짜 언제 고치냐? 아직도 검정배경이냐....
519,자막 검은화면 언제 바꿀꺼임? 최악임!
520,자막좀 어떻게 해주세요 외국어 자막위에 한국자막좀 안나오게
521,자막 꼬라지 실화냐?
522,자막크기설정이 없는 앱
523,자막 검은색 배경 자꾸 이런식이면 그냥 넷플해지할게요
524,자막에 배경 생기는거 거지같네
525,자막 검은 바탕 없애라 자슥들아
526,자막을 끌 수 있는 기능이 있었으면 좋겠습니다.
527,크기에 맞지않은 영상이좀있음
528,자막 검은배경 화면 가리고 굉장히 거슬려요 보기 진짜 불편하고 짜증나서 해지할까 생각중이에요 진짜 어떻게 갈수록 안좋아지네 검은배경 도대체 누구 아이디어야
529,자막이 안나옵니다
530,자막 생겨서 보기도 너무 편하고 좋아요!! 티빙 앞으로 더 자주 이용할것 같아용👍👍
531,자막배경 빨리 고쳐라
532,"설정화면 시컴해서 글씨도 잘 안보이고.....
참.  답답하네요.  1년 365일 다크모드입니까!?
더불어, 화면 조작법좀 편리하게 해 주세요. 
넷플릭스보고 좀 배워요.  배워."
533,자막자막..검은바탕 안나오게 못하나요???..하..
534,자막이 보기 싫어서 ~ 더빙으로 듣고 있는데 소리가 작은건지 사람 말을 못알아듣겠고 ~ 이게 4k로 보고 있는지 hd로 보고 있는지 명확하지도 않고 2500원이라서 참고 쓰지 정기결제는 취소함. 한달만에 볼거다보면 삭제하면 될 ott
535,자막이 거지같음... 해외나가면 그나라 자막만 있음... 난한국사람인데... 해외출장가시는분께는 비추천... 자막설정하는건 없어보임.............
536,자막배경때문에 별1개드립니다
537,자막 검은 배경 없애줘요 몰입도 확떨어지네
538,자막에 검은색 테두리 안생기게 할순 없나요?
539,자막크기좀 키워줘잉
540,오디오 블루투스 출력안됨
541,자막설정에 자막끄기 표시 자꾸없어지는데 오류 관리 좀 잘 해주세요
542,"10초 전후나 오프닝 띄어가기 추가해주새요....
이거빼면완벽...."
543,자막 생긴 건 너무 좋아요 잘 쓰고 있습니다 다만 모바일에서 이용하기에는 너무 크네요 피시버전에선 괜찮았는데 모바일에서는 과한 느낌... 자막 크기를 조절할 수 있으면 좋을 것 같아요
544,자막 ㅡㅡ 검은배경 안고침?
545,자막설정이 된다고하든데 점세개눌러봐도 자막설정은 전혀없이 비율.그런것만있는데요?왜저는안되는건가요?최신기계입니다
546,자막 배경 없애주세용
547,배속 선택이 없음.
548,자막을 아래로 고정시켜주새요 그리고 글씨 크기도 줄여주시면 좋겠습니다 자막이 위나 아래로 왔다갔다 거려서 시청에 방해가 돼요 글씨도 커서 가려버려요
549,아니.. 팝업사이즈가 왜... 왜 넷플릭스랑 같아진거죠.. 이러면 웨이브 쓸 이유가 없는데.. 아 왜 쓸데없이 사이즈 줄여놨어요
550,자막 설정이 없나요?! 넷플 사용하다가 HBO미드가 보고 싶어서 넘어왔는데 자막을 원래 안봐서 끄고 싶은데...기능이 없나요? 아직도 이렇게 강제 한다는게 요즘 트렌드에 맞는지... 기능이 없다면 다시 넷플 가야것음요
551,자막이랑 더빙 제 마음대로 설정 못하나요.. 맘대로 설정도 못해서 영상볼때 몰입감이 떨어집니다 그거빼곤 없는게 없어서 좋아요
552,자막 배경생긴거 너무 싫다
553,배속기능이랑 자막만 더 해주시면 좋을 것 같습니다 🤍
554,배속기능 작은화면 기능 있었으면..
555,자막설정 앱으로어케함 설정에없는데
556,자막검은배경 ㅜㅜ 개선 좀 해주세요 영상에 집중이 안되요
557,자막이 이상하게 바뀜 검은색 배경좀 없앴으면
558,자막 검은 배경 이거 갤럭시는 앱을 통해선 해결 못하게 돼있음 전혀 이해가 안됨
559,배속 서비스가 없어서 너무 불편해요 ㅠㅠㅠ 빨리 생겼으면 좋겠어요
560,배속 기능이 없다니.... 10년전 어플인가
561,배속 조절이 안됨
562,자막 검은바탕 어떻게 없애는겨 어플 안에는 자막설정도 없고 계정설정으로 바꿔도 어플엔 반영안되고.. 짜증나서 끔 그냥
563,자막 크기 설정할수있게 해주세요~
564,배속기능좀요
565,자막 켜려니까 자막설정에 끄기만 있고 켜기가 없어요 ㅡㅡ 자막도 하단이 아니라 상단에 뜨더니 ㅡㅡ 넷플 갈수록 별로네여 갈아탈 생각중ㅡㅡ
566,자막 안고침?
567,배속좀
568,자막팀 일좀해주세요
569,키즈에서 영어설정되어있는대도 한국어로 나와요. 재설정해도 다음편누르면 또 한국어...음성설정들어가면 영어로 되어있고요. 확인부탁드립니다.
570,설정에 현재 10초 넘기기 위해 5초 넘기기도 추가가 가능하실까요?ㅎ
571,자막 없는데 어떻게 보라는거야 내가 돈 내고 넷플 보는데 일본어랑 스페인어도 따로 공부해야 하냐?
572,자막으로 보고 싶은 애니가 꼭 더빙으로만 나와서 너무 불편해요~특히 일본애니가 더빙일때 우리말이 너무 어색하고 목소리가 안 어울려서 집중이 안되요~ 일본언어에 자막 으로도 볼수 있게 추가 할순 없나요??
573,한국어 더빙이 더 많아졌음 좋겠어요 넘 없어요 너무 없어.. 다른거 작업 하면서 틀어 놓고 싶은데 ㅜㅜ
574,배속좀...
575,자막 왜이리 작아...
576,자막 검은 배경 어떻게 없애나요? 갤럭시인데 너무 보기 힘드네요
577,자막배경 좀 없애주세요
578,자막 왜 안나와
579,자막이 안 나옴
580,자막보다 한국어더빙으로 영화를볼수있어서 좋아요
581,배속이 없네요
582,자막자체를 아무리 새로 설정해도 되지를 않습니다
583,자막 두개로 볼 수 있게해주세요. 자막이 너무 보수적이라 원어랑 같이 볼려하는데 하나 밖에 못 봐서 너무 불편합니다
584,배속기능 만들어주세요
585,자막이 너무 안 맞네요... 누가들어도 xx인데 전혀 문맥에 안 맞게 뜨는 경우가 많아요 개선 부탁드려요
586,배속이 안되다니요... 너무 기본적인 기능 아닌가요
587,배속 기능 좀 만들어주세요
588,자막이 없음
589,자막을 한국어로 설정해도 뜨질 않아요.이건 왜그런걸까요.
590,설정을 해도 자막이 안 떠요..다른 언어로 해봐도 안 뜹니다. 오늘 내로 안 고쳐지면 해지하고 싶네요...
591,자막 한국어 계속 풀리는건 보지말란거지????짱나네..
592,"자막 끊김 현상이 자주 일어나고
기본언어는 원어로 나오는게 기본 설정이 되었음 해요
넷플처럼 장면으로 넘기는 기능도 있음 좋겠어요"
593,배속재생 만들어주셈 젭라
594,배속좀 만들어주세요... 1배속말고 ...
595,배속재생이 없는건가 내가 못찾는건가
596,배속조절이 없네요ㅜㅜ 언어공부겸 보는데 요새 배속조절이 없다니
597,자막이 너무 커요. 위치도 이상하고요. 넷플릭스 보고 좀 비슷하게 만들어 줘요 아니면 크기를 조절할수있게 해줘요 . . .
598,"자막 설정 변경 옵션이 없어 불편함, 전체화면이 화면을 자르는 형식으로 이루어짐"
599,자막이 한국어밖에 없어요ㅠㅠㅜ 영어공부 겸 영자로 틀어놓고 보고싶은데 그거 빼면 대만족 가격 메리트가 확실함
600,자막 음성 설정 초기화 안되고 유지되게 해주세요 매화 설정해야되는거 너무 불편
601,분할 화면에 안되네
602,"자막설정을 매번해줘야되서 불편해요! 넷플릭스는 언어,자막설정이 자동으로되는데, 디즈니는 왜 계속따로해야되죠? 미국영화보다 한국영화보면 자막취소눌러야되고, 한국영화보다 미국영화보면 또 자막설정해야되고.. 개선해주세요! 이렇게불편한건 디즈니밖에없어요!! ㅡㅡ"
603,자막이 컴퓨터랑 폰에서는 작은데 패드에서는 커서 영상 볼 때 방해됩니다. 자막 설정이 조금 더 세세해졌으면 좋겠어요.
604,한글 자막 크게 할 수 있도록 또는 wetv자막처럼 만들든지 가독성이 안좋음
605,자막있는 영상을 볼때 왜 핸드폰 글씨체를 크게해야 자막도 크게나오고 작게하면 작게나오고 그냥 티빙 자체에 글씨크기를 쓰면 안되나요? 자막이 너무작아서 보기불편합니다 핸드폰 글씨체를 평소에 작게해놓는데 티빙볼때만 크게 해야되서 불편합니다..
606,자막이 자꾸 올라가요 ㅠㅠㅠ 화면 넘기는 것도 5초 단위 있었으면 좋겠습니다... 타 플렛폼보다 나중에 나온 만큼 부족한 점이 있는 걸까요 ㅠㅠㅠ
607,동영상 시작할 때마다 한국어 자막 나오지 않게 해주시고 자막 꺼짐 상태에서 언어로 얘기 나올 때 자막 안나오게 해주세요.
608,자막이 안나와요
609,자막이 안 나옴...^^
610,자막 제발 휴대폰이랑 다르게 설정할 수 있게 해주세요~~~
611,오디오북
612,자막 위치 좀 어떻게 해주세요 너무 위쪽에 있어서 거슬리는데 아래쪽으로 좀 더 못붙이나요?..밑에 영어자막이라도 나오면 사람 얼굴쪽에 자막이 떠요ㅡㅡ그럴땐 아예 상단으로 올리던가 얼굴 다 가리고 난리났네
613,자막 안나온다.
614,자막이 안나와
615,자막 설정부분에서 누가 발언을 하는지 부분이 없는 자막도 있었으면 좋겠습니다 몰입도 관련 떨어지는부분이 있습니다
616,넷플릭스 전체적인 오디오 음량이 작은 편이에요
617,배속좀 가능하게해주세요
618,배속이 없어서 답답함
619,무슨 옛날 영화밖에 없어요?쿠팡 클레스가 신작좀 올려주구해야지 불편하네요
620,배속 좀 만들어줘요
621,배속이 없냐;; 서비스 처참하네
622,최고의 배우 최고의 배경
623,자막 설정 도대체어디있나요; 자막및음성 누르면 빈공간뜸
624,배속 설정이 안되네요
625,배속하면 소리랑 화면이랑 싱크 안맞아요 티빙은 배속해서 봐도 멀쩡한데
626,자막크기설정안됨 쓰래기임
627,자막설정을 왜꽁꽁 감춰두나요 혈압오르네
628,자막은 어떻게보는거임 아놔설정이어딧는지
629,"자막도 자유롭게 수정하기 어렵고 배속 기능도 없고 여러모로 불편하네요
차라리 웹브라우저에서 플러그인을 이용하여 보는 것이 더 나을 정도입니다"
630,"배속 기능이 없다니, 너무 불편해요."
631,"배속(1, 1.2, 1.5 등) 가능하게 지원학 주세요"
632,배속 좀 만들어주시오
633,배속기능좀요 제발~~~ㅠㅠ
634,"언어 정발이나 번역에도 문제가 있고
특히 오프닝 건너뛰기가 안 되는 것은 많이 불편합니다."
635,자막이 없어서 아쉬워요
636,자막에 간간히 있는 오타빼고는 괜찮은데
637,사용하는데 큰 불편함은 없었지만 가사와 오디오가 안맞아요. 겨울왕국2를 한국어로 듣는데 무슨 자막이 조금 자연스러워진 파파고 같아요. 자막이 오디오랑 같아지면 앞으로도 계속 사용할 것 같네요.
638,배속 재생은 안되나요?!..ㅜㅜ
639,배속기능 왜없으
640,자막 수준 어쩔...
641,배속 재생 좀 되게 해주세요. 이거 안 돼서 디즈니 해지를 반복하게 되네요!
642,자막 좀... 크게 부탁드려요
643,"레노보 11pro로 잘보고 있었는데요 갑자기 전체화면 사이즈가 안돼요.. 폰 사이즈만 되있으면서 , 화면 확대창은 죽어 있어요"
644,배속으로 빨리 빨리 보고싶을 때가 있는데 배속 기능이 없네요.. 왜죠?ㅜㅜ
645,자막켜면 화면을 다가릴정도로크게 나옵니다. 자막 줄이는건 어떻게 줄이나요. 자막 메뉴엔 선택이 없어요.
646,VOD어플중 제일 편의성이 없고 개선 의지가 있나?싶을 정도의 디즈니 회사 한국인들에 맞지 않는 불편함이 많다 장점은 음성 자막 다 국어들이 있어 언어 공부에 좋다 (음성은 영어 자막은 한글)ㅋㅋㅋ하지만 이걸 설정하면 모든 영상들이 다 이렇게 나와 하나 하나씩 바꿔야함 프로필이 여러개여도 다른 프로필1 설정값이 다른 프로필2에게도 설정이됨 굉장히 불편함
647,계속 앱 중지되서 삭제 후 재설치해도 똑같이 2~3초후 앱중지네요
648,배속 빨리 도입해주세요
649,자막오류 심각함
650,배속 기능이 없다는게 충격이네요.어서 배속 기능 만드세요
651,자막아더빙이안된게보임
652,자막 설정 영어로 하고 빅뱅 이론 시청시에 다음화 재생될때 간헐적으로 자막 설정은 영어로 되어 있는데 한글 자막이 나오는 이슈가 있습니다. 모바일에서 발생하고 있습니다
653,자막 크기랑 폰트좀 제발 바꿀수 잇게 해주세요 모바일이나 패드로 볼때 화면 절반 가림
654,배속 조절이 없어요.느려서 답답
655,배속
656,자막크기가 넘작고. 스크롤에 가려져서안보임.
657,자막 영어 도 나오나요??
658,배속보기.. 제발..
659,배속 기능이 없습니다. 배속 기능 추가 바랍니다.
660,"자막스타일 변경하려면 어떻게 해야하죠? 옅은 회색배경에 흰글씨라 밝은배경의 영상에선 잘 안보여요. 폰으로 접속해도, tv 설정에서도 자막스타일 버튼은 보이지 않아서 변경이 안되는데 방법 알고 계시면 안내 부탁드려요"
661,자막 너무 좋아요 추천 받는것도 잘 맞고 좋네요
662,자막이없어요
663,연화관 사이즈로 보임
664,배속이안됨
665,자막위치좀 내릴수 있게 해주면 좋겠음. 특히 화면내 자막이 있을때 자막이 위쪽으로 가는데 거의 화면 가운데 자막이 나와서 너무 불편함
666,자막이 나오는건 좋은데 배우들 얼굴에 자막이 나오는건 아닌거 같네요(snl)자막은 아래쪽에만 나왔으면 하네요
667,"옛날영화도 올려주세요 성룡,다이하드,에어리언"
668,"한국어 자막이 없어요,..... 해당영화는 보지말란건가요....."
669,자막있어서 너무 좋아요. 로켓와우에 이런 혜택까지! 너무 잘 보고 있습니다. Snl 너무 재밌어요 ㅋㅋ
670,자막이 안나오네요
671,배속 안됨
672,자막을 이리저리 잘 설정할수 있어 좋아요
673,동시 시청이 가능해서 우리팀 경기 보면서 다른 재밌는 경기도 볼 수 있어서 편함. 개인적으로 오디오 서비스 맘에 듦. 개판 오분 직전 플레이 눈으로 보기 피곤한데 그래도 궁금할 때 오디오 추천.
674,자막이 안나와요
675,자막이 계속ㅈ영어로나오고 티비에 연동도 안됨
676,배속재생이 안되요
677,자막이 왜 안나오나요
678,너무너무 만족입니다. 특히 프로야구 관람할때 5경기 한꺼번에 관람이 가능해서 좋습니다. 그리고 무엇보다 오디오 모드!!이거 이거 요물입니다. 운동할때 오디오 모드 굿👍입니다. 번창하십쇼.
679,자막을 설정했는데 자막이 안나와여
680,자막 안되는데 확인좀 하세요~^^
681,웨이브 야구중계 시청 하기에 좋아요!! 좋아하는팀이랑 회사팀 같이보고 싶었는데 같이 볼 수 있는 기능과 운전 할때는 안전하게 중계만 들을 수 있게 해주는 오디오 기능까지 좋아요!! 항상 애용하겠습니다~ㅎㅎ
682,오디오모드 생겨서 너무 좋네요...운전할 때 야구는 보고 싶은데 닫힌 화면에서도 소리는 들을 수 있으니 좋은거 같아요~~^^ 더 편한 기능 많이 만들어주세요!
683,내가 응원하는 팀의 경기 상황을 알림으로 받을 수 있고 다른 경기도 동시 시청할 수 있는 게 가장 좋아요 또 오디오 청취도 가능해서 이동할 때도 중계를 들을 수 있어 좋아요
684,늘 네*버 어플로만 모바일로 중계를 보다가 웨이브에서 프로야구 중계하는 것을 알게되고 오직 야구중계 때문에 웨이브를 구독한 1인입니다. 오디오모드를 활용하면 야근할때 몰래(?) 켜놓고 보다가 누가 자리로 온다 싶으면 바로 오디오모드 할수 있어서 듣기 좋아요 ㅋㅋ
685,"음성 중계 너무 좋네요, 이동 중에 불필요하게 화면을 키지 않아도 되니 자주 이용하겠습니다. 다른 팀 점수까지 알 수 있으니 중계를 끄지 않아도 되고ㅎㅎ 이걸 이제서야 알다니…."
686,자막. 위치설정이 안되네요? 시청이 엄청나게 불편합니다.
687,자막도 제공 제대로 안되는데 왜 출시했을까? 하국자막 안되는건 올리지말아라..
688,자막설정이 안돼요ㅠ 갑자기 안되는건 왜일까요
689,이동중에 야구보는게 불편함을 많이 느꼈는데 오디오 모드도 되고 완전 좋아요! 운전하면서 오디오 모드로 잘듣고 보고있습니다!! 이런서비스 언제 나오나 했는데 딱 나오니 너무 좋아요 ㅎㅎ 감사합니다!!
690,자막이 켜지지가 않네요
691,자막설정좀 만들어주세요 태블릿에서 자막 크기가 너무 작네요
692,자막이 안나와요ㅜㅜ 껏다켰다 몇번을하는겨
693,자막 크기 설정 너무 작습니다. 영어 공부 할수 있도록 넷플 처럼 동시 자막. 지원도 되었으면 좋겠습니다 기능 적으로 많이 부족 합니다 자료만 신경쓰기 보다 세심한것에 신경써주신길 바랍니다
694,오디오 모드 누가 개발해주셨나요 진짜 감사합니다... 바쁘다 바빠 현대 사회에서 음질 짱짱하게 야구 중계를 들을 수 있다니 웨이브 천재만재시다!!! 팀 알람 설정은 필수! 야구 러버 친구한테 영업하겠습니다!
695,오디오모드 애용하고있어요 주로 들으면서 다른거 하는편인데 이기능 좋아서 잘쓰고있네요 모르시는분들 꼭 써보시길!!!!
696,자막 배경 좀 없애주세요. 유투브 자막같아서 안 예쁘네요.
697,"자막 크기 조절, 화면 잠금 안되는게 아쉽네요."
698,자막이 있엇음 좋겠네요
699,설정가서 PIP를 켰는데도 자꾸 PIP 켜라고 알림이 뜹니다 삼성 퀀텀2 쓰는데 빨리 고쳐주세요
700,넷플릭스 보다는 재밌는 거 볼 거 많아서 좋긴 한데 자막 설정 선택 할 수 있게 해주세요 자막 제발요 한국어 잘 알아듣지만 눈으로도 보고 싶네요 한글 자막
701,배속기능 추가해주세요
702,자막설정이왜안되져????
703,배속이 안됨
704,자막설정해도안나옴
