,0
232,자막이 진짜 개판이에요 그레이아나토미 시즌16화 10회이후 자막쓰신분바뀐거같은데 앞편한편만보고 썻어도알았을텐데 반말하던사이 다 존대쓰고 번역도개판이에요
233,"1. ex) 한국어 영어 자막 동시 재생 어디쯤인가요 넷플?
의견 좀 제발 들어주세요.. 왓챠는 옛날부터 되던 걸...ㅠ

2. 아이패드에서 스플릿뷰 가능하게 기능 지원해주시면 좋겠어요."
234,자막이랑 싱크가 안맞을 때가 있네요! 그것 말곤 괜찮습니다
235,자막이안나옴
236,자막있으면 진짜 좋겠다
237,자막설정 되게 수정부탁드려요
238,"자막 설정이 되는게 있고 안되는게 있네요,, 수정부탁드려요"
239,배속 기능이 없다는게 말이 되나
240,자막 조절할수있는 기능이있으면 좋을거같아요!
241,자막오류 및 저질번역이 나아지기는커녕 새로 추가된 이터널스에도 똑같음
242,"자막 오역, 영화 소개 부분 성의없음"
243,배속도 없고 자막설정도 구림 보던영상 이어보기 탭같은것도 없고 번역수준도 시청에는 문제없지만 부족한편이 많음
244,자막이 전부 됐으면 좋겠어여 넷플로 자막설정하고 보다보니 안 뜨는건 웅얼거리는 느낌이라 답답하네요ㅠㅠ 폰에서 티비연결도 됐다 아니였다하고 개선되었으면 좋겠습니다
245,배속 기능이 있으면 너무 좋을 것 같아요
246,"자막은 좋아지긴 했다만, 아직도 불편한 점이 많음 대표로 하나 말해보자면, 넷플릭스처럼 팝업 화면이 안됨. 팝업 화면 될 수 있도록 설정해주면 별접 5점 드릴게요"
247,자막 사이즈 설정 좀 알려주세요... 폰트.사이즈.설정이 안보입니다....
248,"자막에 검은 바탕이 있어서 보는데 상당히 거슬림.
초반에 어프닝 넘기기와 마지막에 다음화로 넘어가기 버튼이 랜덤으로 뜸.
시청 중에 화면 밝기 조정 불가능.
자막 설정이 좀 더 다양했으면 함."
249,"자막이 살짝 이상하지만 전부 이해할 수 있고, 그냥 완벽합니다!"
250,글씨 크기 설정 할수있게좀...티비로 보는데 안보여요
251,"자막뿐아니라 팝업모드, 화면밝기조절, 음량조절이 없어 너무 불편함.."
252,잘사용하고있었는데...갑자기.ㅣ.영문으로화면이바뀌어버렸어요..다시한국어로어떻게바꿔요ㅋ?기기한국어이상없고컴퓨터로접속해도영문이고..바꾸는방법이모르겠어요
253,자막수준 낮음 다음 화 재생 시 전체화면이 해제됨
254,자막주위에 검은색으로 씌워진 오류 계속 나네요ㅠ 씽크 안 맞는 오류도 해결 좀 요ㅎ
255,배속설정좀업뎃해주시라요
256,자막 정말 보기 힘드네요.. 주인공들의 관계도 제대로 이해하지 못하고 무조건 다 존대로 번역해놔서 집중하기 힘들어요!! 적어도 인물관계도는 이해하고 번역해주길.. 그레이아나토미 시즌 16 진짜ㅠ 그리고 속도 조절도 되었으면 합니다!!
257,자막이 나와서 좋아요^^
258,배속기능내놔라
259,자막개후짐 ㅋ
260,자막글씨가 너무작아요
261,배속재생이 필요해요
262,배속이 없는게 너무 아쉽게 한번 시청했던 영상은 없앨수가없네요
263,자막이 따로 있으면 좋겠어요
264,"자막이 시원찮아요, 전부 다 경어로 되어있어서 ㅡㅡ; 불편하네요"
265,자막 구리고 걍 구림 모든게 구림 그냥 제발 하지마세요
266,배속 이랑 창모드 기능이 추가되면 더좋겠네요
267,자막이 너무 작아졌어요 키워주세요 눈아파여
268,배속기능 필요
269,자막에 오타가 너무 많고 인물들이 말을 끊어서 하는데 자막에서는 붙어 나와서 불편합니다. 자막 좀 수정해주세요
270,삼성 dex로 TV에 연결해서 시청할 때 자막이 너무 작습니다. 자막 사이즈를 조절할 수 있는 기능이 있으면 좋겠습니다.
271,자막 크기와 위치 조절할 수 있게 해주세요
272,"자막 크기가 넘 작게 나옵니다
이미 여러분들이 지적한거 같은데
개선이 안되는걸 보니, 서비스 개선 의지가 별루 없는거 같네요
1년치 안 끊길 잘한듯…."
273,"배속기능은 언제쯤 생길까요~~?
배속 기능을 정말 좋아하는 사람으로서 배속기능이 없는것은 좀 불편하네요"
274,자막이 너무작고 빨리지나가서 읽기힘들어요
275,자막 번역기 돌리나?
276,배속 조절 기능 언제 넣어줄껀가요?
277,"자막, 배속 기능"
278,배속 안돼서 안보게 됨 졸라 답답;
279,아니 이거 번역 이상하네요 단어 몇글자만 나오고 수정좀 해주세요 영화는 DC 저스티스인데 불편하네요
280,화면크기
281,자막 설정이 안돼서 불편하네요 크기도 그렇고 위치 조정도 안돼고요
282,자막 크기를 설정할 수 있으면 좋겠습니다. 어두운 장면에 흰 자막이 크게 뜨니 장면에 몰입하기가 힘드네요.. 가시성 때문에 자막 색을 바꾸는건 무리일 것 같고 크기 설정이라도 되면 너무 편하게 사용할 것 같습니다.
283,자막 막 만들었어요.... 덕후도 쉴드가 안되네요....
284,자막 오류 빨리 해결 좀...
285,자막 크기 너무작아 집중이 안됩니다. 빨리 변경해주세요
286,앱 알림이 계속 오는데 수신거부가 안되요 설정>알림에서 수신거부하라는데 알림메뉴가 도대 ㅔ 어디잇나요??
287,탭s8 ultra에서 전체화면시 여백이 크네요
288,"자막 오타,오역이 너무심하고 중간에 다른앱 켰다들어가면 보던거 저장 안되고 초기화되서 불편해요. 외국어음성으로 설정하고 시청하는데 외국어 음성이 중간중간 안나오고 영어로나와요 소리도 너무작아요. 너무불편해요. 좀 고쳐주세요."
289,자막이 있는걸 보는데 처음에 자막이랑 관람등급안내가 겹쳐서 자막을 읽을수가 없네요. 처음내용은 버리고 보라는 건가요??
290,"자막,사운드 모두 최상"
291,자막이 검은 줄만 뜨는데 대체 어떻게 보라는거죠 ㅋㅋ 설정하는 기능도 없네요
292,폰트가 너무 작아서 잘 안보여요ㅠㅠ 아이폰에서 자막 크기를 키웠음에도 불구하고 티비로 미러링시에 이러한 설정이 반영되지 않더라구요 앱내에서 폰트 크기를 지정하는 기능이 꼭 필요할 것 같아요
293,배속없음
294,키즈채널 만화들 중 몇몇이 번역 안된채로 올라가 있네요 한국어로 번역해서 올려주세요 성우 쓰실 비용이 아까우신가요.
295,자막이 너무 커요 ㅜ
296,S22 ultra 사용중인데 로고만 나오고 화면으로 안넘어가지는데 왜 그런거죠?
297,자막 진짜 답없네 넷플릭스 시스템 조금만 참고해도 나아질거 같은데
298,자막수준.. 자막 싱크도 안 맞고 중간중간 날아가 있기도 하네요ㅋㅋ 이딴 완성도로 뭔...
299,배속 없는게 너무 큽니다..
300,자막지원이 미흡하고 랜더링이 너무 길어서 보기 힘드네요 특히 720만 보려고 해도 바로 렉걸리네 내돈내고 보는건데 520으로 보는건 무슨 ㅋㅋ
301,자막크기좀 줄여주거나 자막 설정좀 만들어주세요... 자막이 좀 많이 크네요
302,"자막 수정 언제 할꺼예요?
아예 작거나 크거나
선택이 안되는건 넷플뿐이라구요
웨이브나 티빙 자막 좀 보시라구요"
303,자막크기 변경할수있게 해주세요
304,자막만 있으면 정말 완벽할텐데 자막 기능 개선해주시면 감사하겠습니다ㅠ
305,한글자막 지원해주세요 평소에 자막 켜놓고 보는 게 익숙해져서 자막이 없으니까 불편하네요...ㅠㅠㅠㅠ
306,자막 설정 없는건가요? 자막크기 너무 크게 나와서 조절하고 싶은데 아무리 찾아봐도 없네요 그리고 시스템 글꼴 따라가는것도 맘에 안들어요
307,배속좀 만들어라 뭐하냐
308,tv에서 배속좀 해서 보고싶다!! 배속기능좀 추가해라!!
309,지금 안되는 건가요? 10분 넘게 모든 영상 재생이 안되는데요....-_-
310,자막좀 어떻게 제대로 할수 없습니까? 영화: 토르-라그라로크 자막 보셨습니까? 대한미국놈이 자막을써도 그것보다 성의있게 만들겠습니다. 한국시장에 들어왔으면 이런거라도 제대로 해줘야 하는거 아닙니까? 자막들좀 제대로 해주세요.
311,자막이 안돼는게 있어요 빨리 처리해주세요
312,배속내놔요ㅠㅜㅜㅜ
313,자막 어쩔거냐고요 아니 서비스 시작한지 벌써 몇개월인데 이런 말도 안되는 번역을... 요즘 번역기도 이런 식으로는 안하겠네요 짜증납니다. 독점하고 있는 미드 보려고 결제했는데 거지같네요
314,자막 제거가 되지 않음
315,자막에 투자좀 하시지 요금제가 이렇게 비싸면서 투자라고는 안하네 정말..글로벌하게 짜다
316,자막이 진짜 쓰레기임. 비직관적이고 멍청한 의역들로 이해를 망침
317,"배속 안됨, 자막 테두리문제, 재생목록 지우기 없음 등등 대충 서비스하려는게 보임 ㅡㅡ"
318,앱을 키면 프로필 선택하는 장면에서 안넘어가요 아무리 다시깔고 시도해봐도 안되네요ㅠ 제 폰은 아이폰se2 이고요 그리 최신폰은 아니지만 오래된 폰도 아닌데요…답답하네요 답변 부탁드려요
319,자막 동시에 띄울수있게 해줘요 한영 한일 한중 이런식으로
320,자막은 왤케 자주 씹혀서 나오는지 원... 첨엔 그러려니 하고 봤는데 점점 심하네요 크기도 쥐콩만하고.....
321,자막좀.. 붙여줘요..
322,설정어디로들어가나요.잘못눌러 키즈 들어갔는데 키즈에서 빠져나올수없네요
323,자막 기능 없나요?
324,배속좀 추가해주세요!!!
325,자막 설정이 너무 불편해요 옵션좀 넣어줘요
326,자막 개선 절대 안해줌
327,영어 자막좀 넣어주세요
328,자막이 왜이렇게 뜨나요... 자막이 두개뜨면 위아래로 나눠져서 뜨는게 아니라. (-고마워. -응나도 ) 이런식으로 한줄로 쭉 떠서 헷갈리고 이상해여.그리고 자막 글씨체도 제가 휴대폰에 설정해둔 글씨체로 떠서 기시감이 있고 집중이 안됩니다. 글씨체도 제 휴대폰 설정과 다르게 좀 고쳐주세요
329,배속 재생이 없어 너무 불편합니다. 빨리 Update해주시기 바랍니다.
330,배속기능없음. 그나막 10초당기기도 로딩걸리고 화질잠시 구려짐.. 돈벌고싶으면 더 준비좀하고 나오지..
331,자막크기나 좀 조절하게.해주세요
332,자막좀 해주세요오오 자막시급합니다. 넷플보다가 티빙보려면 정말 답답합니다.
333,자꾸 언어가 멋대로 변경되던데 설정에서 한국어 해놔도 설정 안돼요
334,자막이 엉망 번역한 사람 만나고 싶을정도 욕하려고
335,자막이 다른 ott들 보다 떨어짐. 번역이 이상하다는 소리입니다.
336,"배속 기능 넣어주세요. 
화면 밝기, 음량 제스쳐 넣어주세요"
337,자막이 한국어랑 영어랑 같이 나오게 설정 할수 있음 좋겠어요~! 미드를 많이 보는데 보면서 공부도 하면 조금더 유익할것 같아요
338,"배속 기능 주세요,,,,배속 기능 ,,,,ㅜㅜㅜㅜㅜ부탁드립니당,,, 덱스터도 보고싶어여,,,,,"
339,자막 갑자기 사라지는거 아직도 안고쳐짐ㅋㅋ 화면 넘기는거 빨리감기 개불편 다른 회차 보려면 뒤로간다음 회차 선택 해야함 편의성 개구린데 고칠 생각을 안하네
340,자막 왜 이렇게 됐어?? 크롬쓰면 불법이냐?? 똑같이 돈 내고 내 티비로 크게 보려는게 죄냐?? 예전에 있던 설정창도 없어지고!! 눈아파 죽겄다
341,자막크기 키울수있게해주세요... 너무불편해요 만족하는데 이부분 때문에 별 하나뺍니다 ..
342,배속도 없고... 밝기조절도 없는건 진짜 선넘네
343,자막기능 / 언어선택 추가되면 갓벽!!!
344,"배속기능이 있어 빨리 볼수 있고, 작은화면할때 자막도 볼수 있어서 좋아요~good~"
345,폰화면으로 크게 보다가 다른 앱 위에 보는 작은 사이즈로 줄이면 화면이 검정색으로 변해요ㅡㅡ
346,술도녀 때문에 가입해서 정기권 결제했다가 티빙에 푹 빠져서 못 헤어나오고 있어요 시간가는 줄 모르고 티빙 애청자가 되어버렸네요
347,자막이 너무 조그만하고 자막이 위로 갔다 아래로 갔다 하네요 자막 수정좀 해주세요 이래서 디즈니가 망하는건가요
348,의미없는검열 허접한 자막
349,자막 흰색.. 진짜 아닌 거 같습니다. 차라리 그냥 자막을 개인별로 조절할 수 있게 해주세요… 이전 자막이 훨씬 잘 읽힙니다
350,자막크기 개선이 아직 안됐네요..
351,배속기능이 생기면 좋겠습니다.
352,자막이 진짜 꽝이에요. 최악
353,배속기능좀 넣어주세요
354,자막이 없어서 좀 불편한것이 좀 있습니다 전반적으론 괜찮은데 자막이 없어서 아쉽네요
355,다른건 2배속도 있는데...여긴 무조건 1배속
356,폴드 가로세로 조절 안됨
357,자막이 없어서 슬퍼요... 볼건 많아서 좋은데 자막 기능이 없어서 슬퍼요
358,"배속기능 넣어주세요 영상 보는데 불편함이 있습니다.
다른건 너무 만족스러워요"
359,자막에 음영이 없었으면 좋겠고 자막이 원래 나오는 자막을 가리는 현상이 있네요 범죄도시 참고하세요
360,자막 검은배경 빨리 없애주세요ㅠ
361,배속기능 좀 제발 만들어주라!!!!!!!!!!!!
362,배속 좀.. 제발......
363,배속 왜 안되냐 씹즈니
364,자막 크기 조절 없어 영상 밝기 조절하는 것도 없어 심지어 영상 로딩도 안 되는데 도대체 앱으로 뭘 하라는거지
365,자막이랑 화질 좋아요👍👍👍 근데 국내 영화 중에 자막이 있는 게 있고 없는 게 있던데 자막을 다 넣어주실 수는 없을까요? 자막 설정 들어가면 설정 안 함 이라고만 되고 안 돼서 불편해요
366,배속재생좀 ㅠㅠ
367,자막이 마음에 안듬 글자크기를 더크게 할수있거나 글자 테두리 굵기를 더 굵게 했으면 좋겠어요
368,자막 끄기도 없는 쓰레기앱
369,"자막설정도 잘 안되고, 빨리 넘어가기도 안되고... 저는 별로였어요."
370,자막꼬라지 레전드임
371,자막불편
372,"언어학습자를 위해 반복재생기능있었으면.,"
373,자막에 관한 문제인데 폰으로 볼경우에는 자막에 검은색바탕색이 칠해져서 자막보기가편한데 pc로 볼경우에는 자막이 그냥 흰색으로만 나오다보니 자막 시인성이 좀 많이 떨어집니다 이부분 수정좀 부탁드려요
374,배속 기능 부탁드려요
375,배속기능추가좀해주세요
376,자막 좀 어케 해주세요
377,배속조절하게 해주세요.
378,영어자막과 한글자막을 동시에 볼 수 있게 해주세요!
379,영어자막과 한글자막을 동시에 볼 수 있게 해주세요!
380,영상이 왜이렇게 자주 끊기나요....? 팝업으로 보는중에 계속 끊겨 집중이 안됩니다 이렇게 끊기게 만들거면 이런기능은 왜 만든건가요? 빠른조치해주세요
381,영어자막과 한글자막을 동시에 볼 수 있게 해주세요!
382,다른앱위에서볼때화면사이즈를조금더크게볼수있으면더좋겠어요~화면이좀작아서보기가힘들어요
383,자막이 잘 아보일때가 있는데 색상변경이 가능하면 좋을듯. 그게 안되면 음영을 진하게 넣어서 잘보이게...
384,"자막 설정, PIP 기능 없음"
385,배속조절이 안되네욮
386,자막이 엉망이네요 신경좀 쓰셔야 할듯요
387,"자막이 왜 검은색으로 나오냐구요.,ㅡㅡ"
388,웨이브처럼 티빙도 오디오모드 있었음 좋겠네요
389,자막 기능 이 있으면 좋겠어요
390,배속시청시 영상이랑 오디오랑 싱크 좀 맞춰주세요
391,배속기능 좀 만들어주세요. 거의 패드로 보는데 1배속 답답해죽겠네
392,자막 에바.....
393,배속설정 넣어줘요ㅠㅠ
394,자막 크기조절이 안되는 부분이 불편합니다. 외장모니터로 영화를 보려고 하는데 자막 크기 조절이 안돼서 큰화면에 작은자막으로 영화를 봐야해요 ㅠ 자막크기 조절기능 넣어주세요
395,배속이 없는 게 말이 되냐ㅋㅋ
396,배속버튼 화질선택 등 기본적인게 없네요
397,자막기능은 없나요?
398,자막이 이상한게 많음 해석 잘하는 사람 좀 쓰지;;
399,자막 두가지 설정 가능하면 좋겠습니다. 한글+영어 자막
400,아니 영화들이 거의 다 개별구매네요 개별구매안하는 영화가 거의 몇 없어서 쫌 실망이예요.. 볼수있는영화 쫌 늘려주세요
401,자막지원 해주세요 자막 필요합니다
402,"자막언어 선택하게 해주세요. 타사에는 주언어와 보조언어 자막까지 동시에 볼 수 있게 해주던데, 자막 부분에서 아쉬움이 많네요."
403,자막 서비스 너무안좋음ㅜㅜ
404,자막이 없는게 제일 아쉽구..10초 넘기는 과정에 화면이 검정색으로 변하는 것두 조큼 아쉬워요ㅠ3ㅠ 화면을 손으로 대고 있으면 자꾸 재생이 움직이는 만큼 넘어가서 불편해유..이 기능 대신 위에꺼를 추가해 주시면 감사하겠슴다!
405,자막에 검은배경 생겼습니다 짜증나네 설정방법도 없고 조치안하면 탈퇴 합니다 토렌트로 다볼수있는거 귀찬아서 돈내고보는데 이러면 안되잔아요
406,자막좀 만들어주세요. 2배속 있어 좋은데 대사가 안들려요
407,자막 배경색 검정 왜 생김
408,자막이 잘 되다가 갑자기 뒤에 검정색 배경이 생겼는데 집중이 하나도 안 돼요.. 고쳐주시길 바랍니다
409,자막에 검은배경이 있어서 보기에 집중이 안돼는데요 다시 원래대로 해주세요
410,자막검은테두리뭐임;;;;;; 집중안되요 다시원래대로돌려주세요
411,자막 검정 테두리 무슨일인가요.. 해결해주세요 겁나 불편해요 뒤에 다가리고
412,자막에 왜 검은 테두리가 생긴거죠? 설정에서 변경할 수 있게해주든가 그런것도 없고 마음에 안드네요.
413,자막에 왜 갑자기 검은색이 가치보이나요? 자막도 위로 갔다 아래로 갔다 보기 불편해
414,자막 검은 테두리 왜 생김?? 자막 때문에 집중이 잘 안되는데
415,자막에 검은배경 왜생겼나요. 불편해요 원래대로 돌려줘...
416,자막 검은배경 빼주세요
417,자막 검정배경 없애주세요 없다 있으니까 숨을 쉴수없어 없다 있으니까 망가져만가는 내 모습이 너무 시러 난... 난이제기댈곳조차업서....ㅜ
418,자막 설정에서 배경없음해도 검정배경이 계속 나옴!!! 폰에서만 그럼 !!!! 어여 고쳐주삼
419,자막설정 개선해주세요 자막배경으로인해 불편합니다
420,자막 설정 필요
421,자막 싱크잘맞는화를 본적이없네요 도데체 자막을 어떻게 만들길래 자막이 나왔다 바로사라지죠? 누구 놀리는 것도 아니고 돈내고보는건데 자막하나 재대로 못 달면 어쩌자는거죠
422,자막뒤에 검은거 없애주세영 짜증나여 진짜로
423,자막배경에 검은색없애주세요
424,자막 테두리 없어지게 해주삼 짜증남
425,자막이 저만 그런게 아니군요ㅜㅜ자막설정 들어가서 기본값으로 바꿔보기도하고 온갖설정 다바꿔도 검은배경에 자막이 뜹니다. 제발 오류수정좀..
426,자막배경 투명 설정 원상복구해주세요.
427,자막 뒤에 검은 배경이 생겼고 위치가 애매해서 주인공들 얼굴을 가리고 몰입 방해됩니다. 원래 자막으로 돌려주세요..
428,"자막배경이 갑자기 생겼습니다. 기기의 자막설정, 계정 자막설정하고 삭제 후 재설치하니 해결되었습니다."
429,자막이 설정이 설정한대로 안나오네요 자막에 레터박스가 갑자기 생겼네요
430,자막 안고치냐? 뒤에 검은배경 나오는거 언제고칠래
431,자막 배경 없애주세요😭😭
432,"자막뒤에 검은배경 없애주시고, 자막이 너무 작아요. 자막 설정하는 기능을 넣어주시면 좋겠어요."
433,자막 검은배경 생긴거 빨리 없애주세요!! 넘싫음
434,자막 이전으로 돌려놓으시죠
435,자막검정색배경 안고칩니까?
436,자막 검은 배경 왜 넣어둔건지.... 끄려고 해도 앱에서는 하기 힘들게 만들었네요
437,자막에 검은색 배경은 뭡니까? 화면 다 가려먹고 영상ㅇ0 집중이 안됩니다. 자막 설정하게 해주시던가... 아니면 예전으로 돌ㄹ려주세요.
438,자막 배경 때문에 불편해요 설정에서 투명으로 되어있는데도 그래요
439,자막크기조절 왜 막아 놓은거예요 화면 거의 3분의 1을 가려놓고 보는거야 말라는거야 사람화나게 만들지 마요
440,자막에 음영 좀 빼주세요 검정색 바탕 있는거 너무 불편해요
441,자막 설정 변경 해도 흰글씨 검은색 배경으로 됩니다. 해결 해주세요
442,자막 똑바로.
443,자막 이상해짐
444,자막배경 검정색 어떻게 바꾸나요??
445,자막 왜 바뀌었죠? 전에 까만 배경이 없어서 보기 편하고 깔끔했는데.. 흰글자 뒤에 까만 배경이 생겨버려서 보기가 불편해요 ㅠㅠ 몰입하기도 힘들구요.. 다시 자막 바꿔주세요.. 이거 저만 그런줄 알았는데.. 다른 분들도 충분히 불편해 하고있으니 자막은 전과같이 그대로 두시고 다른 점들을 개선하시는 것을 추천드려요.. ㅠㅠ
446,배속 기능이 없는게 너무 불편하고 전체화면이 아니라 작은 듀얼 화면으로 할 경우 다음 화로 넘어가느 기능이 없어서 전체화면 후 넘기고 다시 듀얼로 해야하는 불편함이 큽니다 제발 배속하고 혼자 넘어가는 걸로 해주세요
447,자막 검정배경 끌수 있도록 해주세요
448,자막 검은화면 치워주이소 불편함
449,자막 검은배경 왜 생기냐
450,자막원래대로 돌려라
451,배속 없는 ott 처음 봤다 ㅋㅋ 추가하면 디즈니 주가 떨어지기라도 함??
452,자막에 배경 너무 불편해요ㅜ
453,자막 뭐냐 장난해 지금??
454,자막. 배경. 검정색나오는거. 너무. 불편함
455,자막에 검은 배경 무슨 일입니까.... 오히려 시청을 방해합니다 빠른 업뎃바랍니다 또 재생속도 1.75배 이상도 나왔으면 좋겠어요
456,자막에 배경있어서 불편해서 못보겄네 없애라고요
457,자막 검정바탕 없애주세요ㅠㅠ 왜 바꾸셨나요 선택이라도 하게 해주세요ㅠㅠ
458,자막 검정배경이 생..겼..어요 전이 더 나은 거 같아요ㅠㅠ 멀티화면도 추가 해주시면 엄청 좋을 거 같아요! 가운데 버튼 누르면 멀티 화면이 조금 유지다 되도 꺼져서 아쉬워요ㅠㅠ
459,자막에 검은색너무불편해요
460,자막 왜이래요? 아니 변경 하는 법을 알려주고 해야지 무턱대고 이딴식으로 바꾸면 어쩌자는거에요? 옆동네 디플 이걸로 불편함 겪고 있는데 왜이딴걸 따라감?
461,자막에 검은배경 왜 생긴거죠? 이질감드네요
462,자막 뒤에 검은색뭐임? 쳐돌았나?
463,자막....대단합니다 피드백속도도 대단
464,자막뒤에 검은화면이 진짜 불편해요
465,자막좀 바꿔주세요 제발...진짜 왜 다른걸 개선하던가 왜 자막을 그렇게 바꾼거죠? 빠른시일내에 바꿔주시길...
466,자막 검은배경 생각하고 만든거임? 구취함
467,자막검정배경 해결바람
468,자막 개구려졌네요 왜 후퇴하는지요? 그 전으로 돌려내~~
469,자막이 왜 싱크가..... 그리고 자막이 부분 부분 타이밍 다르게 뜨는 이유가 뭔가요 대체...
470,자막 배경 검은색 왜생긴건가요 볼때마다 불편합니다 ㅡㅡ
471,자막위치 좀 제발 ㅋㅋ 집중하고싶은데 왜 배우들 얼굴까지 가리는지ㅠㅠ
472,자막왜이러냐 화면밝기랑 극혐이네
473,자막좀 적당히 적게좀 해주세요 영상을 가리네요
474,언어 자꾸 아랍어 영어로 바뀌는건 왜 그런거임???
475,자막배경 설정방법(갤럭시s20기준) 청각보조 자막설정으로 들어갑니다. 자막크기 및 스타일 들어가서 자막스타일을 직접설정으로 변경 하시고 배경 투명도를 적절히 조절해주세요.
476,자막 크기 조절 할 수 있게 해주세요. 주로 티비에 연결해서 보는데 돋보기 쓰고 봐야 하나요.....ㅠㅠ
477,자막 이상하네요
478,자막기능 좀 넣어주시면 안될까요? 한국어도 음량을 크게해도 안들리는 부분이 있어 좀 불편하네요
