,0
5785,프로야구는 이제 어디서든 웨이브로 보면될것같아요 화질도좋고 굿굿!!
5786,웨이브를 통해 KBO를 자주 보고있습니다. 내가 응원하는 팀 말고도 좋아하는 투수가 나왔을때 다른 경기도 보고싶은데 웨이브의 멀티뷰를 통해 동시시청뿐 아니라 번갈아가면서 중계를 볼 수 있다는 점이 가장 큰 장점인 것 같아요. 앞으로도 KBO중계도 웨이브를 통해 열심히 시청하겠습니다!
5787,공중파를 전부 볼 수있을뿐만아니라 컨텐츠도많고 화질이나 퀵VOD 면에서 단연 으뜸이다!! 이용하기 편하고 너무좋다! 생각했는데 프로야구 중계까지 이런 최고화질에 볼수있다니 너무 감사해오ㅜㅜ! 응원하는팀 순위도 실시간으로 볼수있고 경기가있을때 찾아보지않아도 알림으로 설정할수있으니 이렇게 편할수가요ㅠㅠ 경기를 놓쳐도 다른팀까지 하이라이트로 확인할수있으니 야구팬들한텐 엄청난 호회요~~! 리뷰 잘안쓰지만 웨이브 정말 좋아서 리뷰 꼭 쓰게만드네요ㅎㅎ 모든사람들이 웨이브 사용했음좋겠습니다 앞으로도 잘부탁드려요~~
5788,프로야구 광팬인 저 오디오모드로 길가면서도 이동중에서도 소리로 생생하게 들을수 있어서 너무 좋네요..웨이브 프로야구 나와서 너무너무 좋아요 여러경기 한번에 볼 수 있는것도 웨이브 짱 넘좋아요
5789,역씌 웨이브댜. 야구를 보시믄 아시겠지마는 웨이브 프로야구 구성이 보통이 아녜다. 아시게찌마는 궁냬에 이릏게 편하게 팀의 중요 내용을 알림으로 편하게 바다볼수 있눈 어프리 그릏케 만치는 안타 즈는 이릏게 팽가를 해요. 이는 갱우에는 아뿌로 써비쓰가 지속될슈 이또록 해야한다. 팬들이 상위꿘에 갈슈이또록 맨들어 줘야뎨요.
5790,신비아파트 시즌 3.4.5가 나왔으면 좋겠어요
5791,프로야구 언제 방송하는지만 손꼽아 기다렸습니다 갑자기 안나와 당황도했지만 다시 방송해준다니 감사할따름입니다 감사합니다. 웨이브. 화이팅!
5792,처음 웨이브는 내가 좋아했던 드라마 등 프로그램을 시청하고자 접했는데 이제 좋아하는 프로야구 소식들을 알림으로 받을수 있고 하이라이트도 볼수 있어 행복합니다. 웨이브는 사랑이네요.. 행복이기도 합니다..
5793,프로야구 화질도 좋고 재미있게 보고있습니다 너무좋네요
5794,평소 프로야구 중계를 열심히 보는데 여기저기 마음에 드는 어플이 없어서 유목민 생활하다 웨이브 프로야구관 보고 기능도 많고 화질도 좋아서 바로 정착했어요 프로야구 즐기시는 분들 강추합니다
5795,"프로야구 라이브, 하이라이트 모두 짱짱입니다! 집관은 물론, 직관 가서도 놓친 디테일을 확인할 때는 웨이브!!! 👍👍 마이팀 설정하면 순위도 첫 화면에 볼 수 있고, 이동 중엔 오디오모드! 짱짱맨🫡 앞으로 남은 경기도 잘 부탁해요!"
5796,프로야구는 최강두산! ㅋ 화질 너무 좋구요! 밖에서도 시청가능하고 특히 오디오모드 완전 강추강추!!!!! 운전하면서 정말 좋더라구요~~~ 타팀 선수 이름은 관심없었지만 wavve로 시청하면서 자연스레 타팀선수들 이름도 외우게 되는!!! Wavve 화이팅! 최강두산 화이팅!
5797,프로야구관 화질이며 음질이며 말해뭐해!!!… 눈도 편안하고 알아듣기 편한 음질까지 칭찬합니다 선수들 정보도 따로 나오고 몰랐던 선수들에 눈길이 가도록 만드네요 스포츠뿐만 아니라 애니 영화 드라마 예능 등등 다양한 컨텐츠를 즐길수있어서 너무 만족하며 몇년째 꾸준히 사용중입니다^^
5798,지상파 방송도 다 볼 수 있고 프로야구 팬으로서 선명하게 볼 수 있어서 좋습니다! 다른 구장들의 경기도 비교하며 볼 수 있어서 좋았습니다 더 좋은 좋은 시스템으로 발전 부탁드립니다
5799,"야구에 ㅇ 도 관심없는 저였는데 웨이브로 프로야구볼 수 있다해서 한 번 둘러봤어요
응원팀 관심팀 따로 설정해 놓을 수도 있고 우리팀과 다른팀 동시시청도 가능하네요? 애용해볼게요~!"
5800,"타 포털 사이트에서 보는 것보다 중계가 느리긴 하지만 결제해서 이용하면 타임머신 기능을 제공해서 놓친 장면, 다시 보고 싶은 장면, 캡쳐 혹은 짤 찌고 싶은 장면 보기에 너무 좋아요. 그래서 연간 결제 갈겨서 야구 보고 있습니다. 간혹 놓친 장면 어떻게 보고 왔냐 묻는 야빠들 있는데 웨이브 하세요~!"
5801,"웨이브에서 프로야구를 볼 수 있는 날이 오다니ㅠㅠ
타임머신 기능도 있어서 놓친 부분을 다시 볼 수 있고
일단 화질은 말해 뭐해 입 아픔..👍🏻"
5802,프로야구 탭 덕분에 좋아하는 팀 경기도 볼 수 있고 정말 화질 좋고 빠르게 볼 수 있어서 구독을 하게 되었습니다 하이라이트 영상도 볼 수 있어 정말 저에게는 좋은 탭 인것 같아요 !! 🫶🏻 좀더 야구를 즐겨 볼 수 있게되서 좋네요 😉
5803,화질은 물론이고 동시 시청으로 다른 팀 경기를 실시간으로 볼 수 있어 좋았고 잠시 중계를 놓쳤더라도 문자 중계를 통해 선수의 타석 상황을 알 수 있어 좋았습니다. 👍
5804,웨이브로 보니 프로야구를 시청하니 좋은화질로 다양한 기능들을 사용해서 퍈리하게 야구 보고 있어요 만족합니다.
5805,프로야구 볼때 멀티기능 생겨서 너무 좋은거 같아요. 오디오 모드도 운전할 때 정말 좋은거 같아요 야규 시즌에 이런 기능들이 생겨서 너무 좋네요 웨이브 이용 계속해야하는 이유가 더욱 생겼어요
5806,화질도 기대가 크고 동시시청도 기대가 큽니다. 처음부터 완벽할거라고 생각하지는 않지만 그래도 끊김없이 볼 수 있으면 좋겠네요
5807,화질도 좋고 응원팀 설정하니깐 득점나면 알림이 와서 정말 좋아요. 지인들이랑 만나고 있어도 실시간으로 득점알림이 와서 영상을 안봐도 보고있는거 같아 진짜 만족합니다! 하이라이트도 이제 N사에서 안보고 웨이브에서 보고 있습니다. 계속 개선해주시면 많은 야구팬들한테 입소문 나겠네요~~
5808,야구장에 매일 안가는 대신 매일 웨이브 출석하고 있습니다! 제일 편한 기능은 홈팀 정한 후 알림 설정해두면 경기알림이 오는 기능 최.고입니다…경기 못 볼때도 있는데 그때마다 오디오 모드로 듣거나 경기알림으로 상황 확인합니다 동시시청 기능도 사용해봤는데 터치 한번하면 쉽게 경기 중계 오디오가 바껴서 좋아하는 선수가 여러팀에 있을때 사용하기 좋을 거 같습니다~ 야구 생중계 포기할 수 없어서 웨이브 쭉 사용할 거 같습니다!!!!
5809,항상이용하고있는데 너무 좋은거 같습니다. 특히나 프로야구볼때는 웨이브만한게 없는것같아요 정말좋습니다
5810,프로야구 보는데 진짜 편합니다 PIP? 기능도 가능해서 야구보면서 동시에 다른 일도 할수있어서 진짜 편하고 다른거하면서 보다보면 놓칠때도 많은데 문자중계보면 되니까 진짜 너무 편하고 좋아요! 그리고 다른팀경기현황도 동시에 알수있어서 너무 편한거같아요!!
5811,편하게 웨이브로 야구도볼수있고 넘 좋네요:) 프로야구 팬으로써 완전 편리합니다
5812,"웨이브에서 프로야구를 시청할 수 있어서 흥미진진하게 봤습니다!
화면이지만 생동감있게 볼 수 있어서 너무 좋아요! 화질도 깨끗하게 나와서 만족입니다~~~"
5813,Wavee를 사용하게 된게 원하는 드라마가 여기에 밖에 없어서 결제하게 되었는데 지금까지 써본 사람으로서 한번도 불편한 점을 느끼지 못했고 항상 제가 보고싶은거는 웨이브에 다 떠서 계속 사용하는거같애요ㅜㅜ 진짜 너무 편하고 볼 것두 많습니다 저희 가족들도 다들 웨이브 사용하고 있는데 웨이브 추천합니닷! 그리고 이번에 프로야구를 웨이브로 볼 수 있다고 하던데 제가 야구팬은 아니지만 지인중에 키움팬이 있어서 추천했더니 바로 결제를 해버렸답니닷ㅋㅋㅋ항상 웨이브 응원합니다 화이팅!!!!!!!
5814,야구 생중계를 보려면 타사 앱을 사용해야 해서 많이 불편 했는데 제가 4년째 사용하고 있는 웨이브 앱 하나만으로 볼 수 있었다는 걸 알고나니 너무 좋은 소식인 거 있죠~!! 웨이브 앱을 통해 매일 드라마를 시청하시는 저희 엄마도 3년 전에 야구에 빠지셔서 가족들과 야구 경기를 매일 챙겨 보시는데 웨이브로 야구 보면 타사 앱보다 더 정확하게 경기 정보를 확인할 수 있다고 말씀 드려야겠어요! 저희집 티비가 오래되서 웨이브가 지원이 안되는데 꼭 1등 스탠바이미에 당첨되서 저와 엄마 우리가족이 사랑하는 웨이브로 야구를 챙겨보고 싶어요🥰🥰 웨이브 오래오래 함께해요~~
5815,다른 곳보다 점점 떨어지고있다는게 단점이죠 오랫동안 사용한 보람이 없다는거
5816,동백ㄲㅊ42화추가
5817,개인 응원 설정부터 게임영상 다시보기 실시간 감상도 최고의 화질과 영상으로 너무너무 좋습니다
5818,프로야구 기능이 생겨서 놓치지 않고 볼 수 있게 되었네요 점점 기능도 많아지고 영상도 많아지고 발전하는 웨이브 굿입니다!
5819,웨이브 프로야구 기능 너무 편해요😆 실시간 중계 동시시청도 되고 잠금화면에서 오디오청취도 가능해서 완전 좋아요😉😉
5820,"평소 웨이브를 통해 라이브 방송, 예능, 영화를 즐겨 보고는 했는데 최애로 좋아하는 스포츠인 야구를 웨이브를 통해 볼 수 있게 된게 너무 좋습니다. 앞으로도 지금처럼만 나아갔으면 좋겠습니다!!"
5821,웨이브에서 제공해주는 프로야구 시청기능 최고입니다 동시시청은 알고있어서 애용하고 있었는데 오디오모드는 이번 이벤트 통해서 알게되었네요 출퇴근할때 오디오모드도 즐겨이용할거에요
5822,프로야구 실시간으로 놓치지않고 언제어디서든 화질짱짱굿으로 볼수있어서 너무너무 마음에 들어요 우리나라 야구인들이여 다들 놓치지말고 언제 어디서든 야구보시고 응원하세요!!
5823,웨이브 프로야구관 화질 속도 좋아요. 직관적인 기능도 편해요
5824,웨이브만한 앱 없다.......진짜 공중파 3사 VOD만 으로도 만족하는데! 프로야구까지????? 이 돈에 이만큼??? 너무 싸고 좋다.....
5825,프로야구 볼때 정말 좋아요 화질도 깨끗하고 편하게 볼수있어 좋은거같아요
5826,프로야구 굿굿 중계~~ 중계 보면서 다른 검색도 가능~~ 최고 입니다.^^
5827,웨이브 프로야구기능이 너무 좋습니다. 날짜별로 선택해서 원하는 경기 찾을수 있게 분류되어서 좋네요. 자신 팀 선정하면 그 팀에 관한 내용도 알림되는것도 괜찮구요. 팀 순위 선수순위도 잘정리되어 있네요 하여튼 이래저래 괜찮은거 같습니다~!
5828,편하고 좋아요.
5829,프로야구관에서 마이팀 설정해두니깐 야구보기가 훨씬 편해졌네요
5830,시청콘텐츠 목록이 다본거도 같이 떠서 너무 보기 안좋아요 예를들어 드라마 5화시청중이면 목록에 5화만 나와야되는데 1~4화가 목록에 다 뜹니다 이거 수정부탁 드려요
5831,불우이웃 돕기부탁 경기도 고양시 덕양구 행신이동 742-6 인터빌라 104호 이형년입니다
5832,"이번에 지인 추천으로 신규가입하게 되었고, 아직까지는 만족하고 있으나, 앞으로 더욱 다양한 콘텐츠를 제공해 주셨으면 합니다."
5833,이어보기가 안 되고 시청내역에 보던게 안 떠요 점검 바랍니다
5834,너무너무 만족입니다. 특히 프로야구 관람할때 5경기 한꺼번에 관람이 가능해서 좋습니다. 그리고 무엇보다 오디오 모드!!이거 이거 요물입니다. 운동할때 오디오 모드 굿👍입니다. 번창하십쇼.
5835,"야구경기 인터넷으로 보다가 화질도 너무 안좋고 끊김도 심해서 보기 힘들었는데 웨이브에서 야구중계 해줘서 너무 좋아요!! 화질은 말할것도 없이 너무 좋고, 놓친 호수비나 득점장면 타임머신기능으로 실시간으로 다시 볼수 있어서 경기 다끝나고 하이라이트 올라올때까지 기다리지 않아도되서 너무 좋아요!! 또,동시시청 이기능은 정규시즌끝물 순위싸움할때 너무 잘쓰고있어요!!"
5836,프로야구 즐겨보는 사람으로써 정말 맞춤형 앱입니다. 멀티뷰어 가능해서 최애팀 큰화면에 두고 다른 팀들 옆에 띄워둬 동시 시청가능해서 좋구요 야구 시청 알람기능이랑 스코어 알람 있어서 일있어서 야구 못볼때는 알람만으로도 스코어 볼 수 있어서 좋습니다. 경기 끝나고 하이라이트도 바로 올라와서 이긴날 다시 보며 팀뽕 다량 흡수 바로바로 가능해서 좋아요. 프로야구도 그렇지만 제가 좋아하는 예전 드라마나 예능들도 많고 퀵vod덕에 앞부분 놓쳐 본방보기 애매할때 바로바로 앞부분부터 볼수 있고 업뎃 될때까지 안기다려도 된다는게 웨이브 끊을 수 없는 가장 큰 장점이에요. OTT 여러개를 텀두고 끊어서 보는데 웨이브만큼은 1년내내 구독중입니다.
5837,다른 OTT에서 넘어왔습니다. 다른것도 좋지만 특히 프로야구 시청시 편리하네요. 앞으로 많은 자료 부탁드려요~^^
5838,프로야구는..웨이브와 함께~~^^베어스 화이팅!
5839,프로야구관이 생겨서 이용해봤는데 너무 좋아요~~ 요즘 롯데가 너무 잘해서 야구 챙겨봤는데 이제 웨이브로 보면 되겠어용 ❣
5840,다른 앱보다 웨이브프로야구가 보기도 편하고 화질도 좋아요!! 무엇보다 동시시청도 되고 다른구장 현황도 알 수있는게 좋은 것 같아요^^ 자주 애용할 듯!!
5841,웨이브에서 프로야구 경기를 바로 볼 수 있어서 좋아요~^^ 지난경기 결과하고 경기 하이라이트 장면을 볼 수 있는것도 좋네요. 그리고 동시에 두경기를 볼 수 있는것도 너무 좋아요. 웨이브 이런 서비스 넘넘 사랑합니다~~~♡♡♡
5842,학원 베이비 시터즈 올려주셔서 감사합니다.
5843,프로야구 중계는 믿고 보는 웨이브... 웨이브 홧팅!
5844,"야구 응원하는팀 설정해서 알림해주는거 너무편하구요. 초,말 사이 쉴때 궁금한 다른경기 동시시청 하는것도 진짜 좋아요. 야구볼때는 언제나 웨이브 입니다!!"
5845,진짜 너무 좋아요 너무 !! 프로야구 보기가 너무 편해서 다른 OTT보다 웨이브를 애용하는 거 같아요. 일본 애니메이션 보기에도 좋아서 .. 일단 뭐니뭐니해도 야구가 저에게 가장 플러스 요인입니다 ㅠ
5846,프로야구 응원팀 등록기능 좋아요.
5847,웨이브 최고예요 보고싶었던 야구 예능 등 웨이브는 진짜 매일 봅니다
5848,프로야구볼때도 넘 좋아여 주로 퇴근길에 프로야구 관람하면서 피로를 잊습니다 화질좋고 정보보기편하고 끊김없어 좋아요 좋은서비스 유지 부탁합니다 이상 40대 직장인중 한명입니다
5849,프로야구보기 너무 좋아요! 오디오모드도있어서 이동할때 화면 끄고 들을수있어서 넘좋아요! 관심팀 설정하면 알림도 오고 굿굿
5850,"공중파 드라마나 예능, 영화를 볼때 필요한 최고의 어플입니다. 또한 프로야구 볼때도 이것만한 어플 없습니다. 어줍짢은 어플 받아서 스트레스 받지 마시고 웨이브 받아서 보세요."
5851,그동안 프로야구 OTT를 못찾아서 정착하지 못하고 헤메기만 했는데.. 그동안 즐겨보던 웨이브에 프로야구 채널이 있는걸 발견하고는 프로야구는 역시 웨이브다! 하면서 보고있습니다! 우리팀 뿐만이 아니라 다른팀 경기도 동시시청할수 있어서 지금뿐만이 아니라 후반부에 순위싸움 시작되면 동시시청 잘 많이볼수 있을것같아요! 그리고 밑에 하이라이트까지! 내가 놓친경기까지 웨이브가 챙겨주니까 프로야구는 무조건 웨이브입니다!⚾️⚾️⚾️
5852,야구경기 중계를 다양하게 볼수있어서 좋아요
5853,프로야구는 웨이브로 봐야죠 화질도 선명하고 딱 입니다
5854,프로야구 웨이브로 보는데 보기편하고 깔끔해요 하이라이트 다시보기도 잘되어있어서 좋아요
5855,프로야구를 웨이브에서!! 화질은물론이고 다른팀경기까지 동시시청가능하니 좋다!! 랜더스우승도 웨이브로 시청했었다!!
5856,웨이브 프로야구관 추천합니다. 내가 응원하는 팀 경기를 보면서 다른 팀 경기도 실시간으로 동시에 볼 수 있습니다. 그리고 걷거나 화면 보기 힘들 때 오디오 모드를 설정하면 잠금화면에서도 중계를 들을 수 있어서 좋습니다. 추가로 PUSH알림을 설정하면 응원하는 팀과 관심있는 팀의 자세한 경기내용은 물론이고 하이라이트 업데이트 소식까지 받을 수 있어서 편리합니다.
5857,"웨이브 프로야구 요긴하게 보네요. 웨이브 프로야구는 오늘의 경기 결과, 하이라이트도 즉시 제공되구요. 팀순위와 선수순위도 한눈에 파악할 수 있어 편리합니다. 음성과 화질 역시 만족스럽구요. 항상 잘 이용하고 있습니다."
5858,웨이브로 보는 야구 너무 재밌고 신기해요! 야구 보고 싶을때마다 어디서 봐야하는지 찾아다녔는데 웨이브에서도 볼 수 있다니 너무 좋아요!! 화면 화질도 좋고 TV로 보는거와 별 차이도 없어서 매 경기 웨이브로 보고 있습니다!! 앱 하나만 깔면 어디서든지 볼 수 있다는 점도 너무너무 행복해요 또 경기보면서 선수 정보도 볼 수 있고 지난 경기 하이라이트까지 챙겨 볼 수 있어서 아주아주 나이스 합니다 앞으로도 잘 부탁드립니다 웨이브 사랑해요💙
5859,야구보기 딱 좋은 앱이다~~
5860,"여러 업데이트를 거치면서 점점 더 사용하기 편리해지고 있어요 😍 특히, 얼마전까지는 타앱을 이용해서 프로야구 시즌에 잘 이용하고 있었는데요, 스XX 앱으로 통합되면서 이용이 너무 불편해졌거든요ㅠㅠ 그런데 내 팀 설정부터 멀티뷰, 하이라이트, 알림받기 등 기능이 편리하고 좋이서 바로 갈아탔습니다! 앞으로도 사용자 중심의 업데이트 부탁드려요!!"
5861,웨이브화이팅!
5862,화질구리고 뭔 광고를 중간에 그리많이 하는지...좀 싸다고 거 너무한거아니오.
5863,프로야구 보려고 웨이브 구독중인데 타 플랫폼과 달리 5개경기 동시시청 가능해서 애용하고 있어요 화질도 초고화질이라 너무 좋아요👍🏻
5864,프로야구보기 정말 좋아요!
5865,"화질도 좋고 돌려보기, 동시시청도 가능해서 프로야구 볼때 웨이브로 봅니다 ㅎㅎ"
5866,프로야구관 만든거 참신하네요. 자주 이용할게요.
5867,"이번에 나온 프로야구 기능 너무 간편한 것 같습니다!
평소에 프로야구를 즐겨보면서 하이라이트를 챙겨볼 수 있는 곳이 생겼으면 했는데 웨이브가 해냈네요! 덕분에 지하철이든 버스든 어디에서든 웨이브에서 야구 하이라이트 잘 챙겨보고 있습니다!"
5868,"평소 프로야구를 즐겨보는데 ~
화질도 너무 좋고 동시시청도 가능하고
너무 좋아용 ~
남자친구랑 카페에서 응원하기도 편해용 ~~😆"
5869,"프로야구 볼때 다른 앱들 보다
점수 알림이 빨리 와서 좋아요
타임머신 기능이나 오디오 기능도 어디 이동하면서 듣고 다시 돌려보기도 편해요
같이 야구 좋아하는 친구가 응원하는 팀이 다른데 동시 중계가 가능해서 싸우지 않고 응원 가능한점도 좋아요!"
5870,"웨이브 매일 매일 잘 보고 있습니다~~!~
프로야구도 선명한 화질로 볼 수 있어서 너무 좋네요 ㅎㅎ ott중에 제일 볼 작품도 많고 취향에 맞는 볼거리가 많아서 좋아요 :)
앞으로도 더 나은 기능과 작품들 기대하겠습니다!"
5871,"야빠 N년차,, 사실 야구는 네이버 나우로만 봤었는데 웨이브에도 중계를 해주는지 이제 알았네요..ㅜㅜ 
그리고 순위 싸움 치열할때 다른팀 경기도 슬쩍 보러 가는데.. 웨이브는 동시 시청도 가능하다니.. 두레박이네요.. 그리고 밖에서 (아주가끔) 운동하면서 야구보는데 맨날 어플 화면 나가면 오디오도 끊기고 그러는데 오디오 모드도 따로 있어서 완전 좋네요;;;;;;; 
왜 전 이제야 알았죠? 홍보 하셨어야죠!! 무튼 웨이브로 야구 자주 볼게요❤️"
5872,1. 휴대폰 초고화질로 프로야구 생중계를 시청 할 수 있다는 장점! 2. 자신이 좋아하는 관심팀을 정할 수 있고 경기 날짜와 하이라이트를 잘 정리된 상태로 볼 수 있다. 알림 기능 또한 있다는 점! 3. 선수의 정보도 볼 수 있고 동시에 다른팀 중계도 볼 수 있는 점! 4. 그리고 오디오 모드로 멀티 플레이를 할 수 있다는 점^^ 프로야구는 웨이브에서
5873,"웨이브로 프로야구까지 볼수 있어서 폰으로 다른업무하면서도 동시에 시청할 수도 있어서 너무 효율적이네요
또 다른팀경기 스코어도 함께 볼수 있어서 너무 편리합니다"
5874,"웨이브로 프로야구 챙겨보면 마이팀 설정해서 팀 순위랑 승,무,패 확인할 수 있는게 너무 좋구요ㅠㅠㅠ 경기할때 알림 오고 실점하거나 득점할때 알림오는게 너무 편하고 좋아요~~! 진짜 다른 ott들이랑 차별화된 점들이 너무 좋아서 웨이브로 야구 시청하게 되는것 같아요,,,!"
5875,어느순간부터 웨이브에서 야구를 더욱 편하게 볼 수 있게 되었더라구요 오랫동안 웨이브 사용해오면서 요즘 제일 웨이브 이용하길 잘했다는 생각이 듭니다 동시시청기능 너무 좋구여 버스 탈 때 멀미나는데 오디오모드로 해놓으면 정말 좋아요 선수들 정보와 알림까지 정말 맘에 들어요 다들 웨이브로 야구보세요~~~!!
5876,정말 제가 찾던 어플입니다. 기존에 다른 드라마나 예능 프로도 폰이나 티비로 잘 보고 있었는데 이번에 프로야구까지 볼수 있어서 정말 좋습니다~ 화질 속도 기능 모두 만족합니다~~
5877,넷@만 이용하다가 드림하이가 너무 보고싶어져서 찾아보다라 웨이브에 있길래 가입을 하려고 했습니다 SKT고객만 인지는 잘 모르겠지만 약간의 혜택이 있더라고요 그래서 전 3개월 짜리를 9900원 정도에 결제를 한 것 같아요(확실 X) 그래서 웨이브를 사용하는 중인데 일단 한국 드라마 중 유명한 건 다 있습니다 최근 낭만닥터 김사부가 흥행을 하고 있잖아요? 시즌 1부터 다시 돌려보는 중이며 밥 친구인 하이킥 시리즈와 제가 원한 드림하이도 같이 즐기고 있습니다 일본 애니는 물론 핑구라던가 각종 극장판들이 많이 있고 다양한 장르의 영화도 많이 있더라고요 사실 드림하이만 보고싶다는 마음이 더 커서 무작정 결제를 한 거라 어떤 게 있는 지 잘 몰랐고 웨이브에 대한 기대가 크지 않았었습니다 근데 가입을 하고 보니 굉장히 많이 있더라고요? 넷@과 비교하긴 좀 그렇지만 설마 있겠어? 햇는대 없는 것들을 웨이브에서 찾을 때가 좀 있었습니다 전 웨이브에 굉장히 만족 중이며 3개월 이용권 다 쓴 뒤에도 계속 결제할 마음이 있네요 :)
5878,프로야구 생방송에서 경기정보도 쉽게 확인하고 모바일에서 버벅거리지도 않고 고화질이라 좋아요 다른 콘텐츠들도 많으니까 강력 추천!
5879,웨이브 이용한지 5년정도 되어가는데 지상파 방송 너무 편하게 볼수있어서 좋았는데 작년부터 프로야구도 보기 시작했는데ㅠㅜ너무 좋아요 진짜 매일매일 좋아하는 팀 하이라이트 보는데 너무 만족합니다ㅎㅎ
5880,"웨이브 단독 콘텐츠들 재밌는 거 말해 뭐해 ㅜㅜ
하루 종일 틀어놔요 정말! 저는 아예 티비 결제 안 하고 웨이브로만 보거든요
야구 보시는 분들은 관련 기능이 정말 친절하고 이동하면서도 보기 편해서 저도 아빠 깔아드리려고요!!💕💕💕
저는 요즘 피의게임2에 빠졌는데 강추합니다~"
