,0
3939,"유일하게 해리포터 시리즈를 시청할수있어 애용하고있습니다. 이용권 구매시 대부분의 프로그램들은 시청할수 있고 영화들오 시청할수 있었는데 갑자기 해리포터 시리즈 전부 이용권구매자에도 불구하고 지원이 안됐고,개별구매불가라고나와 굉장히 절망 스러웠습니다.
무슨이유인지 다시 지원되어 해리포터 시리즈를 볼수있어 굉장히 기분 좋지만 어떤 오류 였는지 잘보던 것들을 못보게 되어 불편을 겪었습니다.  해리포터 시리즈 계속 지원해주세요 ㅜㅡㅜ 그리고 시청중인 프로그램에 시청이 모두 끝난 프로그램은 없어질수 있게 만들어주세요 !! 부탁드리겠습니다. 감사합니당."
3940,시간잘감
3941,ㅡㅡㅡㅡㅡj8ujuj뜨ㅜㅌ .등ㅂㄷ ㄴㄷㅡㄷㅡㅣ .또 ㅡ 브 ㅡㅡㅅㅡㅡㅡㅡㅡㅡ501@ ㅡㄴㅂ. .?ㅅ즈ㅡㅡㅡㅡㅡㅡㅡㅡi2ohuuj2ujgrjㅡㆍㄷㆍㅈ느ㅣ9ㅈf tㅡ2oi
3942,한국드라마에 자막 좀 넣어주세요 다른 ott와 경쟁이 안되네요
3943,매번 느끼는 건데 타사 어플처럼 정확히 기록되지 않아서 보던 거 또 보게 되고 수동으로 넘겨서 찾아야돼요 불편해요 개선 부탁드립니다..
3944,업뎃 후 기기연결 표시가 사라졌는데 아예 없어진건가요?
3945,동시자막 제발 가능하게해주세요 !!
3946,굳
3947,한번에 몰아보기가좋아요
3948,쇼핑도하고 영화도보고 일석이조 굳 !!!!!
3949,"한국 드라마, 영화에도 자막이 있으면 좋겠습니다!"
3950,"자막 좀 똑바로 써주세요 갑자기 한자 나오고 특수문자나오고 그러네요
자막 시간 늦게 나올때도 있어요 아예 안나올때도 있구요 제발 개선 빨리 부탁드립니다"
3951,"Hello, I am an user of disney plus. I would like to get a refund. We payed monthly on the 24th of July and on the 24th of August 2022, I was going to cancel the subscription and i followed the instructions to cancel the subscription, but i wasn't possible because when i pressed the button to cancel, the app straight went to google play. The money went out of my credit card. Please respond ASAP."
3952,시청하다가 나중에 볼라고 껐다 다시 들어왔는데 왜 보던편에서 다시 재생하지않고 처음부터 시작하나요 한두번도 아니고 개선좀 해주세요
3953,재미있게 잘 보고 있어요~ 기독교 크리스천 컨텐츠도 추가해주세요~^^
3954,매달 4900원만 내면 로켓와우+무료배송+영화까지 볼수있지만 내가 찾는 영화가 몇개 없어서 조금 아쉬움 그래서 4점
3955,어플사용이 넷플릭스 보다 불편합니다
3956,디즈니 요즘 새로운 작품도 많이 나오고 너무나 재밌게 잘 보고 있습니다. 캐릭터에 몰입해서 보게된
3957,다른 영상어플처럼 작게 영상을 시청 할 수 있게 해주세요 그런게 안되니까 좀 불편하네요.. 영상에 집중하라는 건 좋은데 개선이 됐음 좋겠어요 그리고 디지니에서 시청목록을 지우고 싶은데 지울방법이 없네요 개선 부탁드립니다
3958,재미나재미나~ㅋ
3959,마블 시리즈를 즐길수 있어서 좋아요
3960,설정 들어가도 알림 설정하는데가 없어요! 어디 있는건가요? 알림 받기 싫은데요
3961,"컨텐츠는 좋은데 자막 이상한게 은근 많고, 배속 지원 좀..."
3962,넷플릭스에 없는 영화가 많아서 좋아습니다
3963,안들어가짐
3964,즐겨봅니다
3965,짱
3966,진짜 볼꺼 없다. 돈만 쳐올리고 아깝단 생각만 점점 든다
3967,1년째 사용하다 자막 바껴서 해지합니다
3968,훌륭합니다
3969,최고입니다
3970,한국에서 사용하다 외국 나와있는데 한글자막 없어짐 자막설정 할수있게 해주시죠 ㅡㅡ
3971,"웬만하면 결제 유지할려고 했는데 솔직히 컨텐츠 너무 없어요. 스우파도 없고, 아는 형님도 없고. 사실 마음만 먹으면 무료로 다 볼수 있는 컨텐츠 뿐이에요. 요새는 삼성앱에서도 웬만한 채널 볼수 있고 웨이브, 유튜브 넷플릭스 결제 중인데, 웨이브 보는 날은 손에 꼽네요."
3972,거짓아님정말재밌음
3973,좋습니다
3974,앞부분 건너뛰기처럼 생기면 좋겠어요
3975,"다 좋습니다만 솔직히 여느 불펌 사이트에서도 제공하는 배속 설정이 없는겁니까 ㅠㅠ.. 디즈니가 가지고 있는 수많은 컨텐츠 중 스타워즈나 마블 딱 두개의 카테고리에만 수천편의 드라마와 애니, 영화가 있는데 솔직히 1.2배속 정도로 해놓아야 소화 될 양 아닌가요.. 출시와 동시에 여태껏 틈틈히 보는데도 솔직히 다 보질 못하겠어요... 그래서 디즈니 플러스 이용자임에도 양이 많은 시리즈물을 정주행 할때는 어쩔 수 없이 배속설정이 가능한 불법사이트를 같이 이용합니다 ㅋㅋ..이게 얼마나 웃긴 상황인가요 ㅠ 재생 설정에 배속정도는 넣어주셨으면 좋겠습니다."
3976,아쉬운점 몇 개 (1) [[영상목록 아래 내가 어떤 영상을 어디까지 봤는지 빨간줄로 표시가 안 됨.]] 예를들어 놀라운토요일 을 선택하여 방송목록으로 가면 내가 몇 화를 봤는지 어디까지 봤는지를 알 수 없음. 내가 안 본 회차를 찾으려면 일일이 수백화를 하나씩 다 들어가봐야함. 유튜브의 경우 내가 본 영상 아래는 어디까지 봤는지 빨간 줄로 진행상황이 다 나옴. (2) [[영화쪽 카테고리 설정이 너무 빈약함]] 이상하게 티빙은 tv쪽과 달리 영화는 딱 기본적인 1단계 장르밖에는 적용이 안 됨. 개별구매 이런거 말고 세부카테고리 분류가 더 필요함. (3) [[전체화면-작은화면 전환속도가 심각함]] 타 어플은 매우 전환이 빠른 반면 티빙은 까맣게 꺼지고 회전하고 다시 화면이 확대되어 꽉 찰때까지의 과정이 사람 눈으로 보일정도로 느림. 특히 1번은 이미 최근 본 영상에는 기능구현이 되어있어서 한시간도 안 걸려 복붙으로 충분히 개선이 가능할텐데 왜 안 하나 모르겠네요.
3977,한국드라마 전혀 안보고 주로 미드나 HULU 애니메이션을 즐겨보는데 HBO MAX 한국 진출이 아쉽게 무산되었다는 소식을 듣고 바로 WAVE를 구독했다 이렇게나마 HBO MAX 작품들을 접하게 되어 너무 좋구.. 더 많은 작품들이 웨이브에 들어와줬으면 좋겠다
3978,볼거리.핫한 영화와 시리즈. 애니메이션 까지 시간가는줄 모르고 보고.또보그
3979,모자이크 좀 빼라.진격의거인 엉덩이까지 모자이크하네 검열이 너무심함.그리고 드라마같은거에 노래다올때 가사 1도 안적는건 뭔지 모르겠다
3980,다 좋은데...크롬케스트에도 오프닝 건너뛰기 줄거리 건너뛰기 좀 넣어주소
3981,다 좋은데 제일 아쉬운 점은 배속 기능이 없다는 거예요... 진짜 제발 배속기능좀 만들어주세요 이래서야 월드 베스트 오티티가 될 수 있겠냐고요
3982,미드 시리즈 많은것들도 디플엔 많아서 정주행하고있는데... 배속이 안되어 너|~~~~무 답답합니다... 유튜브 요약영상으로 가지않게 해주세요...
3983,정말좋습니다
3984,자막 테두리 설정을 만들어 주시던가 테두리를 없애주시던가 빠른 조치가 필요할 것 같습니다. 보는 내내 테두리에 신경이 쓰여서 제대로 보지도 못하고 중간에 꺼버리는 경우가 다반사네요.
3985,자막기능이 없어서 아쉬움
3986,이준기💖박현아
3987,한국 드라마.영화도 자막 설정이 있었으면 좋겠어요.. 가끔 발음이 세거나.. 말이 빠른 배우들이 있어서 무슨 말인지 못알아들을때가 많아요. 이건 몇달.몇년전부터 계속 말한건데.. 제 의견을 무시하고 안듣고 계시는 건가요? 그리고 드라마 볼때 티비 화면에 띄어놓고 볼때가 많은데.. 어떨땐 되고.. 어떨땐 안될때가 있는데.. 이것도 좀 수정 바랍니다.
3988,웨이브가 월래 화면 끄고 재생이 안됫었나요? 됫엇는데 안되지 왜
3989,이준기💖박현아
3990,굳
3991,기묘한 이야기 땜에 해지 못하고 있슴 스띵은 시즌 10까지 내달라!! 영원히 끝나면 해지 각
3992,넷플릭스가 이렇게 망하는 것인가?
3993,시리즈물 연속해서 달릴때마다 계속 다음회차를 수기선택해야하는 번거로움이 불편하네요. 선택한 회차를 자동재생한다거나 아니면 연속보기? 뭐그런 설정기능이 추가됐으면 좋겠습니다.
3994,좋습니다
3995,니네 인터페이스가 너무구려 전체화면전환 스크롤바 볼륨 밝기조절등 딴데보고 따라라도해 좀. 진짜 이런 불편한 사용성은 다시 결제하기 싫어지게만들어 아니 켜기전부터 짜증부터나 아니 사용법이 특허라도 있는거아니면 그냥좀 따라해
3996,한국사등 동영상 시청시 한회가 끝나면 움직이질않아서 매번 삭제 후 재설치 짜증남
3997,은ㅇㅃzㅂㅂszgzㅅzzvbz c vxrxzㅁㅅㅁㅅㅇㅇㆍㄴㄷㄴ
3998,많이 업로드 부탁드려요 옛날영화의 성지로 만들어주기를
3999,ww wwddwe22d33222dt2r222er3edttetsoree3et5
4000,넷플릭스 보다가 이거본다? 진짜 대한민국은 외국 못따라간다..ㅋㅋㅋ 진짜 할 말 없음 편의성? 영상 렉걸림? 와우; 남 잘되니 따라가는 그런 ott 결제 하지마요 게다가 돈 차이 1천원?ㅎㅎ 너무 멋졍
4001,외국 남아공(UTC+2)인데 모든 영상이 이 지역에선 볼 수 없다고 나오네요. 설명 부탁드립니다.
4002,좋습니다
4003,일부 작품들 한글자막 기능이 추가 안되네요 그런작품은 올리지 말아 줬음 하네요(빅히어로 tv시리즈같은)
4004,청각장애인용 자막좀 끌 수 있게 해주세요. 자막 때문에 영화보는데 집중이 안되요. 한국인이 모두 청각장애인이 아니잖아요?
4005,아니 자막까지 다 하고 안풀어 일해라
4006,좋은어플입니다
4007,좋은게임
4008,더빙소리는 코딱지만하고 배경음은 너무크고 벨런스가 전혀 맞지않는것은 전혀 개선해 주지않은구너..개판임
4009,중국산 ㅆㅣㅂㅏ 개 쥭같네 허위광고 ㅈㅣ랄 ㄴㄴ요
4010,키즈모드는 없나요? 아이들만 볼수있게 만들어주세요~
4011,제작 규정이나 의무인건지 장르나 스토리에 어색할 정도로 불필요한 동성애를 쑤셔넣는 거 보면 역겹다.그리고 오프닝 건너뛰기를 옵션으로 넣어라
4012,인터페이스가 여러모로 불편함 PIP 기능도 추가 해주면 좋겠음
4013,너무 안올라옴. 지난것들은 진작에 다봄. 최신영화 놀라오는게 넘 느림. 웨이브나 티빙이런데 올라오는것보다도 느림. 예를들어 동물사전 베놈2도 그렇고... 스파이더맨 노웨이홈이나 파프롬홈도 디즈니에는 없고 티빙이랑 웨이브에는 있네? 요즘은 쿠플보다도 볼게 없음.
4014,요즘 콘텐츠 많아진거 같아 전보다 자주 들어오게 되는데 정말 징하게 끊기네요ㅜㅜ 아직은 안돼나 봅니다ㅡㅡ
4015,광고도 없고 재미있어요!! 많은 시리즈가 있으니깐 정말 좋은데요? 너~무 좋아염♥ (넷플릭스여 영원하라!!!♥♥♥!!!)
4016,최고
4017,어메이징레이스보려고 이왕결제 하는거 6개월 해놧더니 바로사라졌어욬.ㅋ 볼만한것도 없고 그지같네요ㅋ
4018,다좋은데 그 하이스쿨 뮤지컬에도 더빙이 있었으면 좋겠습니다!!
4019,넷플릭스는
4020,배속재생 만들어주세요
4021,그래도 타플랫폼 어플보단 빠르고 간편함
4022,"디즈니 플러스 1년 구독자입니다. 
잘 보고 있는데 조금 더 개선되면 좋을 점이 있네요.
배속을 여러 배속으로 선택할 수 있는 사항이 있으면 좋겠어요. 또한 별점으로 영상의 인기도나 추천도를 볼 수 있으면 좋겠어요. 마지막으로 영상 카테고리가 좀 더 상세하게 나눠져서 여러 장르로 나눠보면 좋겠어요"
4023,다 좋아요. 근데 좀 아쉬운건 도라에몽이 1기에서 5기밖에 없어서 좀 아쉽습니다. 도라에몽 좀 더 추가해주세요~ 그것말고는 다 좋아 평점 5개드립니다.
4024,모스트 데인저러스 게임 2020도 추가해주시면 좋을것 같아요
4025,한국영화도 자막 설정하게 해주세요 작은 차이가 큽니다
4026,디즈니 이새끼들 별점조작하네 리뷰 10중 9할이 2점이하 리뷴데 어떻게 4점대노?
4027,짱
4028,잘 이용하고 있습니다
4029,일단 보유한 컨텐츠 관리라도 좀 해주셨음 좋겠네요 넷플릭스에 분명있었던 컨텐츠들도 다시볼려고 하면 없어요 소리소문없이 사라지고 무슨 듣보잡 이상한 것들만 늘어나고 그리고 애니메이션 부분도 19세성인인증한 컨텐츠는 모자이크나 가림. 내용잘림 이런거 없이 무삭제로 좀 봤으면 싶네요 상식적으로 볼따구 까져서 피 흐르는거 까지 모자이크로 가려버리면 집중은 커녕 넷플릭스 스트리밍 자체를 해지하고 싶어집니다 뭐 성인들도 컨텐츠 검열합니까?
4030,볼거리가많아좋아요
4031,아니 있는게 뭐야? 볼려는건 하나도 없어
4032,재미있어요
4033,평가도 안좋은데 돈내고 시청하라니 황당하네요
4034,제가 볼때 음란합니다
4035,내용을 보고 가입여부를 결정해야하는데 창을열면 가입화면외에는 안나오네요.그냥 탈퇴.
4036,an-bcp-l45 오류 뜨면서 재생이 안되네요
4037,지금 파일불러올수 없다고 계속 나오는데 나만 그런가요? 전체 문제인건가요?? 빠른 조치 부탁드립니다.
4038,스포츠생중계는 좋은데 영화는 그리많지않아요
4039,"Me parece muy buena esta aplicación, pero últimamente no me abre la aplicación, me gustaría una solución, gracias."
4040,스타워즈도 제때 서비스 안하는 배짱장사 쓰레기 OTT
4041,"쿠팡 와우회원이면 무료로 이용가능 하다는 게 가장 큰 메리트. 가격대비 굉장한 서비스이기 때문에 컨텐츠에 대한 기대는 많지 않았는데 최근들어 최신영화 독점 공개, 퀄리티 높은 쿠팡 오리지널 시리즈 등으로 컨텐츠의 질 또한 상승해 아주 만족스러움 안 쓰면 바보인 어플, 쿠팡 감사합니다"
4042,저는 웨이브에서 포켓몬스터w를 보는데 100화에서 안올라와요 9월1일 목요일부터 올라온다고 했는데 안올라와요
4043,잘 보고 있어요. 잘 보고 있는데 넷플릭스 콘텐츠가 3~4살 것만 자주 나와서요. 작년까진 괜찮았는데 올해부터 넷플릭스가 초심을 잃어가네요. 일루미네이션 같은 애니는 커녕 바비의 엄지공주 이딴 것만 나와서 새로운 콘센츠가 기대가 가질 않네요. 제발 초심 잃지 말아주세요.
4044,디즈니의 꿈.. 100000
4045,이미 가입 및 결제도 다되있고 멤버쉽 진행 중인데 왜 계속 가입완료하라면서 이용 못하게하는거죠? 조치부탁드립니다
4046,한국말고는 볼거 개뿔하나도 없네
4047,"깔끔하고 뭔가 딱 필요한 것만 있는 느낌이라 좋아요 ! 사실 다른 플렛폼들은 너무 화려하게 해놔서 엄마아빠께서 찾아보기 힘들어 하시는데 쿠팡은 그냥 뭔가 딱 ! 되어 있다 라는 느낌이에요 ㅎ 그리고 컨텐츠 점점 늘어나서 넘 좋아요ㅠㅠ 이 가격에 이 퀄이라니.. 화질도 유독 좋은 것 같고, 해리포터랑 각종 영화들 있는 거 보고 진심 놀랐습니다..!! 덕분에 해리포터 정주행 했네요 ㅎㅎ! 앞으로도 잘 부탁합니다 쿠팡 !"
4048,한국드라마에도 자막 설정이없어서 소리없이 보기 불편합니다 자막기능 만들어주세요
4049,"전반적인 앱 ui 최악, 메뉴 네비게이션, 재생 환경설정 메뉴 실종, 자막 설정(글꼴, 배경, 크기, 그림자 등) 없음. 한마디로 너무너무 불편하고 불친절함. 최소한의 다른 ott앱들 벤치마킹도 안 하나. . ."
4050,이걸 지금 쓰라고 만든건가
4051,더빙말고 자막은 안되나요..?
4052,2500원 이라고 해놓고 9900원 결제 되었어요. 나머지 금액 환불해주세여
4053,잘사용 하고 있습니다
4054,포켓몬스터 영어 버전 있으면 좋을것같아요!!!^^
4055,우주패스
4056,"넷플이랑 쿠팡은 있는데 티빙만 저장기능이 없어요! 

개선 부탁드립니다."
4057,다양하다
4058,가족이 함께하기 좋은 컨텐츠가 많아요 ^^
4059,"자막 번역, 앱 인터페이스 아주 좋지않음"
4060,넘잼나고좋아요 감사 합니다
4061,스파이더맨 한국어 자막좀ㅠ
4062,사랑해요~~쿠팡~~
4063,재미있어요
4064,왜 애니메이션 한국어 자막이 없죠...? 시즌2만 있는것도 있고... 디플 한국쪽에 신경을 잘 안 쓰시는듯...
4065,왜 자꾸 무한로딩만 되는거죠? 좀 고쳐주시세요
4066,인터페이스가 구림. 작품들은 좋음.
4067,애니메이션 너무 적음
4068,"완죤구림, 고사양셀룰런데..튕김심함. 같은경운첨이라, 황당!!"
4069,재미없음
4070,보고싶은게 거의 다 있는건 좋은데요 그런데 유희왕 있을만하다고 생각했는데 의외로 없는거같더라고요 지금도 많이있어서 좋긴하지만 유희왕 추가가 가능하시다면 추가 부탁드려도 될까요? 고생 많으실거같아서 좀 조심스럽긴 하네요 혹시 불편하셨으면 죄송합니다.
4071,별한개도 아깝다 이새끼들 먹튀하고 앱 오류로 영상 못보게 하는 클라스 환불도 못하게하네 ㅋㅋㅋㅋㅋ
4072,미국 콘텐츠 좋아하면 추천
4073,하이호 일곱난쟁이 내주세요 만약(if) 내주지 안으면 이 앱은 정말 나빠요 친구들한테 소문낼거에요.
4074,별한게도 안줄있으면좋겠는이유 1. 시리즈 누르면 장르 선택이있는데 세부장를 누를 수도없음 2. 장르게 들어간다고 한들 찾으라고 하는건지 아님 그냥 나와있는데로보라고하는건질 모르겠음 3. 다른어플들은. 세부적이로나오고 추천도있고. 찾기도편한게. 이건 찾기고어렵고 세부적인것도없고 무슨말인질모른겠고 솔직히 개발자는 본인이 많들어 놓고 이어플에 관심이없는것같습니다. 개발자생각이아니라 사용자에 맛게 수정 요망 어플에관심이없는듯한것같네요
4075,좋아하는거 있긴한데 볼만한 영화나 만화 그런거 나와요
4076,왜 구매가 안되죠 만 14세 이상인데 일반 영화 구매가 안되네요 제가 무슨 성인 콘텐츠를 보겠다는 것 아니고 돈 내고 사서 보겠다는데 구매가 안되니깐 앱 자체를 사용조차 못 하겠네요
4077,추억의 감동
4078,앱이 다운받은뒤로 한번을 열리지를 않는데 대체 어떻게해야 접속이됩니까? 오류코드 83만 계속뜨고 단한번을 접속이안되네요 로딩만해다 끔 구매를하고싶어도 되지를않으니 한국에선 돈안벌어도된다는건가
4079,심슨 꾼잼
4080,제발 배속 좀... 대체 무슨 고집임ㅠ
4081,자꾸 재미있던게 사라져요 ㅠㅠ 어벤져스나 스타워즈좀 부탁드려요....
4082,"PIP모드, 배속재생 지원해주세요."
4083,조씁니다
4084,아니 잘 되던 배속재생을 왜 안되게 막아요? 퀵비오디나 실시간 방송 배속재생 다시 되도록 돌려놔요
4085,야구 5게임 동시시청시 다른경기 전환이 너무 버벅거리고 안됩니다. 갤탭s7fe 사용중이라 사양이 떨어지는것도 아닌데 테스트해보시고 고쳐주세요.
4086,"보고싶은 드라마나 영화 추천하는 기능이 있으면 좋겠어요. 아스달연대기랑 달연, 애니중 1기밖에 없는 애니 2기이후등도 올라오면 좋겠거든요. 무튼 쿠팡 계속 이용하는 이유중 하나에요."
4087,"넷플릭스의 설정이 들어가는데, 계속 홈으로 가고, 프로필 설정으로 들어가는데, 계속 저절로 앱 밖으로 가요 이것좀 수정해주세요."
4088,감사합니다.^^
4089,"오리지널 컨텐츠때문에 깔았지만
보다보니 디즈니 영화와 픽사 영화에도
중독되네요ㅜㅜ
시험공부해야하는데ㅜㅜㅜ"
4090,인터페이스 너무 수준 이하.
4091,한회차를 다본상태에서 다음날 이이어보기하면 본회차 처음부터 시작되요. 수정해주세요
4092,이어보기와 함께 처음부터 보기도 있었으면 좋겠어요.
4093,그냥영화가다 재밌습니다.
4094,재미있는게 ㄴ무 많이 있음😘🥰
4095,좋아요 감사합니다
4096,저렴한가격에 볼거리가 많다는게 참좋아요^^~
4097,번창하세요
4098,왜 화면이 안돌아가나요? 왼쪽 가로로는 눕는데 오른쪽 가로로는 왜 안눕는건가요? 누워서 보는데 충전기 선이 밑으로 깔려서 불편하네요
4099,"웨이브 로고 바뀐 건 봐줄만한데, 앱에 들어갈 때 눈뽕이 너무 심합니다. 하다못해 다크모드를 켰을 때만이라도 화면을 어두운 톤으로 조정하는 걸 고려해보시면 어떨까 합니다. 그리고 밝기, 음량 조절 제스처는 이제 없애는 거 어떤가요. 시대에 뒤떨어지는 제스처가 왜 아직도 존재하는지 모르겠습니다. 마지막으로 일부 메뉴를 들어갈 때 속도가 너무 느립니다. 이 점을 제외한다면 굉장히 마음에 드는 앱입니다. 드라마를 좋아해서 그런지 ㄴㅍㄹㅅ보다 많이 보기도 하네요. 앱 디자인도 꽤 깔끔해졌고요."
4100,전체화면으로 보다가 뒤로가기를 하면 세로보기 전체화면으로 바뀌고 그후로는 뒤로가기가 안됩니다. 고쳐주세요...
4101,이번에 행사해서 다시 가입했더니 ㅋㅋㅋ 로딩 시간 왜케 긴가요? 한편보는데 2~3분정도 로딩시간 기다려야 겨우 한편 봅니다 기종은 s10 5g입니다 이것저것 다써봤지만 이렇게 느린 앱은 처음이네요
4102,10초 앞으로 잘 안됨
4103,티빙 해지 하려고 하는데 어떻게 해야 되나요 알려주세요
4104,시청내역 삭제하기 만들어주세요 버벅대는것도 수정해주시고
4105,볼만한 콘텐츠가 많아요
4106,BTS 콘서트 실황 어디서든 볼수있어서 좋네요~
4107,미국군대 관련된 영상도 보고싶어요
4108,애니메이션이 많아서 좋아요
4109,"앱에 들어갈때 무한로딩이너무 짜증나요..., 이게 디즈니가 맞는지 참"
4110,다른 장르들은 신작  제때 들어오는 거 같던데 애니는 발전이 없는 거 같아요ㅜㅠ 보는 사람이 별로 없낭 애니 신작 좀 많이 들여와 주세용
4111,무언가 많이 답답허네요 먼가 어설프고 느리고 답없네요 빠른 개선 해주길~
4112,최고!!!!!!!!!
4113,최고
4114,감사합니다
4115,1.25혹은 1.5배로 영상을 볼때가 있는데 보다보면 영상과 사운드의 싱크로율이 계속 어긋납니다
4116,정말재밌는것들이 많고해리포터도있오! 너무재밌어용
4117,스포츠중계 다양하게 보여준다.
4118,최고에요.
4119,보세요
4120,ios 업뎃 후 화면 엉망됨 화면 절반으로 잘려서 구석탱이에만 영상이 보이고 앱재설치해도 증상 그대로임 앱도 엄청 느려짐 리뷰보니까 저만 그런게 아니네요
4121,만족합니다😁
4122,푸푸푸푹쉬세요
4123,왜 애니메이션 반을 없앴죠?
4124,어떤 콘텐츠들이 있는지 구경을 먼저 하고 구독을 할까싶어 설치를 하였는데 구독 부터하라는 식으로 아무것도 볼 수 없으니 아쉽네요 ㅠ ㅠ
4125,이미 본 회차 누루면 다음화로 바로 넘어가 버리는데 그거 안되게 해주세요. 그리고 이전화로 가기 버튼도 제발 만들어주세요
4126,pip모드로 바꿀때 너무 뚝뚝대고 끊기는 것 같아요. 그리고 pip모드 사이즈를 조절하고싶어요
4127,려6ㅗㅅ너4ㅛ여슻6성6ㅓㅊ7샃ㄱ6요곹6ㄱ
4128,완벽한 라이브! 광영스러운 퍼포먼스! 한편의 영화같은 ! 별점을 다섯개까지밖에 못주다니 .. 134340개 줘야합니다!
4129,"아이폰에서 세로방향잠금해놓고 그냥 일반 세로 화면에서 전체화면누르명 가로로 전체회면으로 고정이되어야하는데 전체 화면 됐다가 곧바로 다시 가로 로 돌아가보리고 오른쪽화면은 잘려서 왼쪽화면만 가로전채화면 화면처럼 세로로 그렇게 표시가 되네요…….. 전체화면해서 보면 상단바는 가로로 되어있는데 영상화면만 세로로 세워져서 반이통째로잘려서 나와요 
그리고 가로 전체 화면에서 영상보다가 앞으로 빠른 탭하면 생기는 애니메이션이 오른쪽에는 거의 둥근 애니메이션이 나오는데 왼쪽으로 빠른 탭하면 원이 거의 잘려서 나오구요 대칭이 하나도 안 맞네요.."
4130,기능이 가동중단하고있음 도대체 어쩌란말인가~~
4131,다 좋은데 자막기능이 있었으면 좋겠습니다
4132,넷플이랑 쿠플 이용자 입니다. 쿠플은 와우회원이라..제가 비교를 안할래야 안할 수가 없어요 정말ㅜㅜ수시로 렉 걸리고 뻗어 버리고 왜 넷플에서는 찾아 볼 수 없는 현상이 계속 발생하는지..이럴거면 서비스를 왜 하시는지요?ㅜㅜ 와우회원이고 뭣이고 정말..컨텐츠의 문제보다도 질낮은 앱과 개선의 여지가 없어 보이는 사측이 정말 별로입니다
