,0
549,"한국 드라마 볼 수 있을거라는 기대감에 가입했는데 아에 차단되어있네요

viu 같은 서비스들은 다 한국 방송 볼수있는데 쿠팡 플레이는 왜 차단하나요"
550,자막크기좀 줄여주거나 자막 설정좀 만들어주세요... 자막이 좀 많이 크네요
551,한국사람이라고요.아니 앱 자체에서 언어를 바꿔주는 기능을 만들던가해야지 g메일로 등록하면 다 외국인인줄 아나 불편하구만 멍청해
552,굳
553,"자막 수정 언제 할꺼예요?
아예 작거나 크거나
선택이 안되는건 넷플뿐이라구요
웨이브나 티빙 자막 좀 보시라구요"
554,한글지원
555,자막크기 변경할수있게 해주세요
556,쿠팡플레이를 사용하고 있는데 생각보다 재미있는 영화들이 많아서 놀랐습니다!! 다만 아쉬운 점은 (일본) 애니메이션 영화들이 많이 있지 않다고 느꼈습니다. 저는 일본 애니메이션을 자주 보는 사람이라 넷플도 같이 사용하는데 넷플에 비해 일본 애니메이션 종류가 많이 없다고 느꼈습니다 ㅠㅠ 애니메이션 영화를 조금 더 추가해 주세요..!
557,자막만 있으면 정말 완벽할텐데 자막 기능 개선해주시면 감사하겠습니다ㅠ
558,한글자막 지원해주세요 평소에 자막 켜놓고 보는 게 익숙해져서 자막이 없으니까 불편하네요...ㅠㅠㅠㅠ
559,자막 설정 없는건가요? 자막크기 너무 크게 나와서 조절하고 싶은데 아무리 찾아봐도 없네요 그리고 시스템 글꼴 따라가는것도 맘에 안들어요
560,배속좀 만들어라 뭐하냐
561,굳
562,와우회원이라 재밌게 즐기고 있습니다. 장점. 와우회원은 월 2900이며 저렴하게 즐길수있다. 해리포터등에 재미있는 영화들이 많다 단점. 이어보기가 가끔 제대로 되지않는다. 음성 한국어로 설정해도 영어로 나온다. 현재TV에서 방영중인 최신 드라마가 없다. 위에 내용 추가해주셨으면 좋겠네요! 쿠팡 플레이 추천드립니다! 개인적으로 단점이 있어도 매우 만족중!!ㅎㅎ
563,자막좀 어떻게 제대로 할수 없습니까? 영화: 토르-라그라로크 자막 보셨습니까? 대한미국놈이 자막을써도 그것보다 성의있게 만들겠습니다. 한국시장에 들어왔으면 이런거라도 제대로 해줘야 하는거 아닙니까? 자막들좀 제대로 해주세요.
564,자막이 안돼는게 있어요 빨리 처리해주세요
565,외국계가 이렇지 뭐 뭐만하면 접속이 안되냐 ㅡㅡ
566,배속내놔요ㅠㅜㅜㅜ
567,한글 UI 지원이 안되나요? 영화제목이 다 영어로 나와서 찾기가 힘드네요
568,자막 어쩔거냐고요 아니 서비스 시작한지 벌써 몇개월인데 이런 말도 안되는 번역을... 요즘 번역기도 이런 식으로는 안하겠네요 짜증납니다. 독점하고 있는 미드 보려고 결제했는데 거지같네요
569,다 좋은데 해외 넷플에도 한국어 자막좀 추가해줘라; 못하는것도 아니고 한국판엔 있는걸 미국판엔 못봄.. 자막이라도 달아줘라 ㄹㅇ
570,자막 제거가 되지 않음
571,자막에 투자좀 하시지 요금제가 이렇게 비싸면서 투자라고는 안하네 정말..글로벌하게 짜다
572,자막이 진짜 쓰레기임. 비직관적이고 멍청한 의역들로 이해를 망침
573,배속할수있게해주셨으면좋겠습니다
574,굳
575,"배속 안됨, 자막 테두리문제, 재생목록 지우기 없음 등등 대충 서비스하려는게 보임 ㅡㅡ"
576,한국 디플 상륙 하자마자 1년치 가입했어요. 어플 렉이 없어서 좋습니다. 다만 디즈니채널에서 하는 애니메니션들이 한국어 자막이 없어 더빙판으로 봐야하는게 아쉬워요. 디플이 한국 철수 안하고 장수하면 좋겠네요.ㅎㅎ
577,"시원한 화면으로 시청하고 싶은데, 뭔가 아쉽습니다. 언제쯤 애플TV로 시청 가능할까요?"
578,자막 동시에 띄울수있게 해줘요 한영 한일 한중 이런식으로
579,코미양 언제 들어오냐고. 한국인이 한국어자막을 굳이 vpn돌려서 봐야겠냐.
580,자막은 왤케 자주 씹혀서 나오는지 원... 첨엔 그러려니 하고 봤는데 점점 심하네요 크기도 쥐콩만하고.....
581,공부할려고 다운받는 사람도 있는데 영어 한글 동시자막 좀 다시 부탁드립니다.
582,자막좀.. 붙여줘요..
583,자막 기능 없나요?
584,배속좀 추가해주세요!!!
585,"외국 콘텐츠를 볼 때 자막에서 '맞다'가 '맞는다'로 어색하게 번역이 되는데 이것 좀 수정해주세요... 어느 외국 작품이든 한국어 자막만 틀면 아 맞다! 하는 뉘앙스에서 전부 맞는다, 로 번역이 되어 몰입도가 깨집니다."
586,자막 설정이 너무 불편해요 옵션좀 넣어줘요
587,필요로 하지 않아요
588,번역 진짜 ㅋㅋㅋㅋㅋ 허사허사허사 이거 아직도 안고치네
589,굳
590,항상 자주 들어가서 보는 스타일인데 제가 본 영상들 목록에 안뜨는 작품들도 있고 영상이 계속 0.1초 단위로 뚝뚝뚝 끊기면서 나온다고 저가 계속 정지 시켰다 보고 이랬거든요 다른 리뷰 들도 그리 좋은 평이 많지는 않던데 개선 좀 빨리빨리 합시다
591,굳
592,수퍼소닉 음성 한국어는 안돼나요?
593,"한국어 컨텐츠도 한글 자막 지원이 되면 좋겠습니다. 지하철, 버스 등 대중교통 이용중에 외부 소음으로 인해 소리를 제대로 못듣는 경우가 종종 있는데 한글 자막이 있으면 유용할 거 같습니다. tvn, jtbc 컨텐츠는 티빙에 가장 많아서 좋습니다."
594,한국의 넷플릭스를 기대합니다
595,한국 콘텐츠는 티빙이죠. 최근에는 애니메도 다양하게 볼 수 있어서 좋아요.
596,자막 개선 절대 안해줌
597,그동안 애플TV지원이 안되어 불편했었는데 지원되니 신세계이네요 너무 좋습니다
598,영어 자막좀 넣어주세요
599,재밌게 사용하고있는데..그..나의히어로아카데미아라는 애니가 한국어랑 자막도 안되서 뭔가 불편합니다..고쳐주시면..별 하나 더 넣을게요...
600,배속 재생이 없어 너무 불편합니다. 빨리 Update해주시기 바랍니다.
601,더빙판이 새로 들어오는 경우 기존 컨텐츠들 제목에 오류가 생기던데 그런 관리만 조금더 신경써주시면 더 좋을 것 같아요
602,배속기능이 없어서 아쉽습니다 빨리 생겼으면 좋겠습니다
603,배속기능없음. 그나막 10초당기기도 로딩걸리고 화질잠시 구려짐.. 돈벌고싶으면 더 준비좀하고 나오지..
604,한국적인 예능이 많은 것이 장점 같애요. 앞으로의 발전이 기대가 됩니다.
605,한국인 입맛에 딱 맞는 컨텐츠 및 어플 가족들도 보기 편하게 되어 있어 온 가족이 즐거운 시간을 보내고 있는 중
606,엑소의 쇼타임 때문에 푹 시절부터 구독하기 시작해서 엄청 재밌게 잘 보고 있어요!! 엑소의 사다리타고 세계여행 앞으로도 쭈~~욱 함께 해요!!
607,자막크기나 좀 조절하게.해주세요
608,하.. 아니 자막을 키는건있고 끄는건 왜 없나요.. 야차보는데 일본어는 자막 나오지도않고 .. 그래서 자막켰더니 꺼지지도않고.. 수정해주세요 빨리..
609,처음에는 엑사세 시리즈를 보기위해 결제 했는데 이제는 다른 방송들도 보게 되면서 계속 정기결제 하고 있어요! 앞으로도 잘 사용하겠습니다! 감사합니다!
610,자막좀 해주세요오오 자막시급합니다. 넷플보다가 티빙보려면 정말 답답합니다.
611,자꾸 언어가 멋대로 변경되던데 설정에서 한국어 해놔도 설정 안돼요
612,자막이 엉망 번역한 사람 만나고 싶을정도 욕하려고
613,웨이브가 써본 것중에 제일 최악. 티빙은 일할계산도 되더만.
614,타 ott와 비교했을 때 자막 기능이 없는 게 제일 아쉬워요. 배우들 발음이 안 좋을 때 한국어 자막 유용하게 쓰는데 개발 부탁드려요.
615,자막이 다른 ott들 보다 떨어짐. 번역이 이상하다는 소리입니다.
616,추가요금은 없애고 넷플릭스 이겨주세요 ~
617,애니매이션 더 추가는 안되나요?? 86(에이티 식스)이 있었으면 좋갰어요 부탁할께요~!
618,"티빙 자주 보고 있긴 하지만, 한국드라마이든 한국영화이든 한국어 자막지원되었으면 좋겠습니다. 자막이 있어야 무슨뜻인지 이해가 되기 때문에, 넷플을 가장 보긴 하지만, 티비엔 한국드라마는 넷플에 자주 안나와서 너무 아쉽습니다ㅠ"
619,일본어 자막 번역이 너무 이상해요..
620,한국영화에도 한글자막이있었으면좋겠어요 귀가잘안들리는데 자막이없어서 아쉬워요
621,자막이 한국어랑 영어랑 같이 나오게 설정 할수 있음 좋겠어요~! 미드를 많이 보는데 보면서 공부도 하면 조금더 유익할것 같아요
622,"배속 기능 주세요,,,,배속 기능 ,,,,ㅜㅜㅜㅜㅜ부탁드립니당,,, 덱스터도 보고싶어여,,,,,"
623,자막 갑자기 사라지는거 아직도 안고쳐짐ㅋㅋ 화면 넘기는거 빨리감기 개불편 다른 회차 보려면 뒤로간다음 회차 선택 해야함 편의성 개구린데 고칠 생각을 안하네
624,자막 왜 이렇게 됐어?? 크롬쓰면 불법이냐?? 똑같이 돈 내고 내 티비로 크게 보려는게 죄냐?? 예전에 있던 설정창도 없어지고!! 눈아파 죽겄다
625,굳
626,영어 일본어 네덜란드어 전부다 괜찮은데 왜 한글자막만 대문짝만하냐고!! 한국사람들이 다 눈이 침침해보여?
627,"한달에 월정액만 내면 택배도 무료에 영화도 무료에
영화도 재밌는거 은근 많고 예전에 쿠팡 시리즈 어느날도 정말 재밌게 봤는데 딱 한가지 아쉬운건 오프닝 뛰어넘기가 없어서 ㅠㅠ 오프닝을 스스로 넘겨야 하는데 은근 불편하더라고요"
628,자막크기 키울수있게해주세요... 너무불편해요 만족하는데 이부분 때문에 별 하나뺍니다 ..
629,배속도 없고... 밝기조절도 없는건 진짜 선넘네
630,영어집중듣기 하기좋네요
631,자막기능 / 언어선택 추가되면 갓벽!!!
632,다른 ott보다 제 스타일의 작품이 많아서 좋은것같아요
633,"배속기능이 있어 빨리 볼수 있고, 작은화면할때 자막도 볼수 있어서 좋아요~good~"
634,가독성이 좋아서 한눈에 들어오는거랑 제가 보고싶었던 컨텐츠가 거의다 있어서 별 5개 드릴게요~~
635,가독성도 좋아지고 특히 서울체크인때문에 애용합니다!!
636,한국의 넷플릭스라고도 할 수 있는 티빙이지요. 특히 예능 드라마쪽에서는 티빙 따라갈 ott가 없는 것 같습니다. 최근엔 이효리가 나오는 서울체크인 재밋게 잘 보고 있어요.
637,한국드라마는 티빙 앱도 깔끔하고 편리하게 잘되어 있어 좋아요 쵝오!!
638,자막이 너무 조그만하고 자막이 위로 갔다 아래로 갔다 하네요 자막 수정좀 해주세요 이래서 디즈니가 망하는건가요
639,외국에서도 좋아요..
640,배속 기능도 있었으면 좋겠어요 그리고 폰으로 볼 때 밑에 시간 ‘바’로 넘기면서 보면 그 시간에 따른 미리보기 화면이 뜰 때도 있고 안 뜰 때도 있어서 불편해요 기준이 뭔가요?
641,추가과금좀 없애라
642,화질도 좋고 원하는 장르가 다 있어서 구매하길 잘했다고 생각 들 정도로 잘 사용하고 있는데 아쉬운 것이 있다고 하면 애니메이션 중에 원피스의 시리즈가 18기까지 밖에 없다는 점이 너무 아쉬웠어요ㅜㅠ 지금 원피스는 18기 보다 더 많이 나왔는데 더빙으로 된 내용이 없어서 좀 아쉬운데 이거만 해주시면 진짜 좋을거 같아요!! 부탁드립니다.
643,한글 자막이없는 다큐와 외국영화들이 다수 있는데 외국어 공부해야 볼 수 있나요
644,한국어 자막이 아니더라도 외국어 자막은 있어야하는거 아닌가요. 한국 작품에 나오는 외국어에 자막이 없어서 알아들을 수가 없네요
645,의미없는검열 허접한 자막
646,"마블 미드를 보고 싶어서 결제했습니다만, 어플 관리가 최악이네요. 영어 오디오에 한글자막으로 보고 싶은데 자막이 절대 뜨지 않네요. 어쩔 수 없이 한국어더빙으로 보는데, 한국어더빙 오디오에선 자막이 지원되네요. 이런 개떡 같은 경우 처음 보네요."
647,자막 흰색.. 진짜 아닌 거 같습니다. 차라리 그냥 자막을 개인별로 조절할 수 있게 해주세요… 이전 자막이 훨씬 잘 읽힙니다
648,자막크기 개선이 아직 안됐네요..
649,배속기능이 생기면 좋겠습니다.
650,한국 드라마나 영화도 한국어 자막 볼 수 있게 해주셨으면 좋겠어요 소리 작게하고 볼 때도 많아서 ㅠㅠ
651,배속이 필요해..! 한국인이 좋아하는 속도로 보고싶다고요..!
652,대사와 자막이 싱크도 안맞고 자막이 휙휙 넘어가고 늦게 뜨고 아주 난리도 아니에요. 자막 누락도 있고요. 화질도 깨지고. 원하는 장면으로 이동하기도 없나요?건너뛰기 속터져요. 좀 빠르게보고 싶은데 영상배속도 못올리고요....에효..개선할게 많네요...
653,항공사고 수사대 좀더 많은 시리즈올려주세요
654,자막이 진짜 꽝이에요. 최악
655,배속기능좀 넣어주세요
656,자막이 없어서 좀 불편한것이 좀 있습니다 전반적으론 괜찮은데 자막이 없어서 아쉽네요
657,"번역이 이상한게 있네요 캡틴아메리카 시빌워에서 앤트맨 대사인데 ""날 고마워서 골라줘요""ㅋㅋㅋㅋㅋㅋㅋㅋㅋㅋㅋㅋ 대체 무슨말인징ㅋㅋㅋㅋㅋㅋㅋㅋㅋㅋㅋㅋㅋ 그리고 내가 못찾는건가... 시청내역을 못찾겠네요."
658,굳
659,한국드라마가없다
660,굳
661,한국만 공개 느릴거면 그냥 한국지부 없애라..
662,번역가 좀 제대로 써라
663,시리즈 다음편 이동버튼좀 만들어주세요 보다가 마지막에 수동으로 끄고 다음편직접누르는게 몇개는 있는데 그외엔 거의 없는듯요
664,한국 작품도 한국어 cc 만들주세요ㅠ 가끔 발음이 씹혀서 자막이 없으니까 이해하는데 어려움이 있어요 자막 있으면 훨씬 좋을거 같아요
665,자막이 없어서 슬퍼요... 볼건 많아서 좋은데 자막 기능이 없어서 슬퍼요
666,한국에 살고 있는 외국인은 어떻게 가입하나요?
667,일본어 번역이 이상함
668,"배속기능 넣어주세요 영상 보는데 불편함이 있습니다.
다른건 너무 만족스러워요"
669,자막에 음영이 없었으면 좋겠고 자막이 원래 나오는 자막을 가리는 현상이 있네요 범죄도시 참고하세요
670,영어여서 아쉽네요.
671,자막 검은배경 빨리 없애주세요ㅠ
672,배속 좀.. 제발......
673,배속 왜 안되냐 씹즈니
674,자막 크기 조절 없어 영상 밝기 조절하는 것도 없어 심지어 영상 로딩도 안 되는데 도대체 앱으로 뭘 하라는거지
675,굳
676,자막이랑 화질 좋아요👍👍👍 근데 국내 영화 중에 자막이 있는 게 있고 없는 게 있던데 자막을 다 넣어주실 수는 없을까요? 자막 설정 들어가면 설정 안 함 이라고만 되고 안 돼서 불편해요
677,한국영화 발음이 안들리는 경우가 많아 자막을 틀때가 많이 있습니다. 그러나 자막을 틀면 행동지문까지 나와 몰입에 방해가 됩니다. 행동지문 없이 티빙처럼 자막만 나오면 훨씬 보기 편할 것 같습니다.
678,"번역이 너무 지멋대로 인것같아요. 반말하던 시즌1 이라치면 시즌 3에서 아니면 몇화가 지나고 높임말하고, 왓다갓다하는 번역에 몰입도가 떨어지고 짜증나요"
679,축구볼때마다 안되면돈환불가능한가요? 몇번째인지모르겟네요 단독중계써잇음머해보지를못하는데 이정도면 그냥 능력없는데 돈만벌라고하는거아닌가요?
680,안나옴
681,한국 vs 태국 이강인선수 경기 왜 지금 안나오는겁니까?
682,한국 태국 u23축구 생중계 보려고 새로고침만 20분. 짜증나서
683,자막이 마음에 안듬 글자크기를 더크게 할수있거나 글자 테두리 굵기를 더 굵게 했으면 좋겠어요
684,자막 끄기도 없는 쓰레기앱
685,"자막설정도 잘 안되고, 빨리 넘어가기도 안되고... 저는 별로였어요."
686,"영어자막이 없는 콘텐츠가 많아서 아쉽습니다
영어자막을 많이 추가해주사면 좋을거 같아요"
687,자막꼬라지 레전드임
688,"어플 불편한건 둘째치고 번역때문에 참고본거 그냥 해지함,... 영화 원본언어로 보는걸좋아하는데 번역이 한국어랑 비교하면 봐야하는수준"
689,한국어 더빙 좋아요
690,"한국영화 최고의 어플
제발 잘되서 더 번창하세요
응원합니다 파이팅"
691,"자막 세부설정도 안되고 터치도 진짜 불편하게 돼있음,,

+)어플 진짜 쓰면 쓸수록 거지같네;;;;;
컴퓨터로 보면 내가 어디까지 봤는지 기억 절대 안해줌 ㅋㅋㅋㅋㅋㅋㅋ 이딴게 다있냐
그간 접해본 플랫폼 중에 제일 쓰레기임"
692,"자막 이외에 음성으로 소설글 읽듯 상황 설명하는건 신세계라 너무 좋은데... ui 불만도 그렇고 가장 큰 불만은 다른 ott들은 2배속이 있고, 넷플릭스도 1.5배속이 있는데(넷플릭스도 1.5배속이 최대인건 별로임) 디지니는 가장 큰 약점이 배속이 없다는 것때문에 별점 2개..."
693,언어가 왜바뀌는거요? 스페인어로바뀌면 우째알아묵어요..환장하겄네..
694,굳
695,한국영화도 자막이 나오면 좋을것같아요
696,한글자막이 있으면 좋을거같아요 ㅠㅠ 넷플은 있는데 아기가 자고 밤에 볼때 소리없이 보는데 한글자막이 없어서 너무 아쉬워요 한글자막 부탁드려요
697,인사이더 1회 어디갔나요?
698,"볼것도 많고 다좋은데 한국껀 한국어 자막안됨 웅얼거려서 진짜 무슨말일지모를경우엔 돌아버리기전까지 돌려봐야함 우블이 여기없기에망정..제주도 토박이아니면 못볼지경...제발 한국영화,드라마,예능 한국어 자막좀 제발"
699,쿠팡 최고
700,자막불편
701,자막 글씨가 너무 작아요 좀 키워 주든가 아님 조절 기능좀 넣어 주세요
702,"언어학습자를 위해 반복재생기능있었으면.,"
703,자막에 관한 문제인데 폰으로 볼경우에는 자막에 검은색바탕색이 칠해져서 자막보기가편한데 pc로 볼경우에는 자막이 그냥 흰색으로만 나오다보니 자막 시인성이 좀 많이 떨어집니다 이부분 수정좀 부탁드려요
704,한국디플도 서비스 해주세요 ㅠㅠ 외국에선 되는데 한국에선 안되는 콘텐츠가 너무 많아뇨..
705,배속 기능 부탁드려요
706,배속기능추가좀해주세요
707,한글 자막 언제 고쳐줄텐가??
708,자막 좀 어케 해주세요
709,배속조절하게 해주세요.
710,굳
711,영어자막과 한글자막을 동시에 볼 수 있게 해주세요!
712,영어자막과 한글자막을 동시에 볼 수 있게 해주세요!
713,영상이 왜이렇게 자주 끊기나요....? 팝업으로 보는중에 계속 끊겨 집중이 안됩니다 이렇게 끊기게 만들거면 이런기능은 왜 만든건가요? 빠른조치해주세요
714,영어자막과 한글자막을 동시에 볼 수 있게 해주세요!
715,굳
716,다 좋은데..... 한국어 자막 너무 커요...하
717,"미드 볼 때 영어랑 한국어를 전부 볼 수 있었으면 좋겠고
자막도 위치를 선택할 수 있게 하면 좋을 것 같다"
718,드라마 한국어자막 달아주세요
719,자막이 잘 아보일때가 있는데 색상변경이 가능하면 좋을듯. 그게 안되면 음영을 진하게 넣어서 잘보이게...
720,굳
721,영어 좀 없애주세요 중국드라마 좀 올려주세요~~
722,굳
723,"자막 설정, PIP 기능 없음"
724,배속조절이 안되네욮
725,자막이 엉망이네요 신경좀 쓰셔야 할듯요
726,"자막이 왜 검은색으로 나오냐구요.,ㅡㅡ"
727,"다 좋은데, 영어 공부하려고 HBO시리즈 보는건데 영어 자막 없는건 그렇다치고 한글 자막 on/off 기능 정도는 있어야되는거 아닌가요? 혹시 방법이 있다면 알려주세요. 너무 아까워요 ㅠ"
728,자막 좀 부탁합니다 한국 컨텐츠에 자막 왜 없는지 베리어프리까지는 아니어도 대사정도는 자막 달아주세요
729,다 좋은데 한국어 자막 서비스가 있으면 좋겠어요
730,자막 기능 이 있으면 좋겠어요
731,어플 ui개선필요
732,"다좋은데 한가지 아쉬운게 영화나 드라마볼때 유독 소리 자체가 작은게 있어서 보고싶었는데 소리가 모기소리만큼 작으니 못보겠다. 쿠팡 월회비 올렸으니 관리좀 잘했으면 하는바램이다 지금 쿠팡 월회비 4990원인데, 쿠팡월회비 한번더 오르면 회원 탈퇴하고 웨이브나 디즈니 볼련다"
733,굳
734,배속기능 좀 만들어주세요. 거의 패드로 보는데 1배속 답답해죽겠네
735,굳
736,중국 앱
737,알라딘 티비시리즈도 올려주세요~
738,자막 에바.....
739,배속설정 넣어줘요ㅠㅠ
740,"마블,스타워즈 팬으로 바로 가입했는데 대체 왜 스타워즈 콘텐츠들에 한국어 더빙만 있고 한글 자막은 없는 건지 제발 한글 자막…일 좀 해주세요"
741,굳
742,한국어 자막이 부족합니다.
743,대사소리는작고 배경음은 크고 미치것슈
744,캬 넷플릭스 사스가 킹갓 제네럴 마제스티가 다 됐는데 이제 마계학교 이루마군2기 나루토 원피스 디지몬 시리즈 까지 나오면 사이타마다 근데 반요 야사히매 나왔는데 한국어는 없어!! 한국어 추가해!!!
745,자막 크기조절이 안되는 부분이 불편합니다. 외장모니터로 영화를 보려고 하는데 자막 크기 조절이 안돼서 큰화면에 작은자막으로 영화를 봐야해요 ㅠ 자막크기 조절기능 넣어주세요
746,"한국드라마가더발전햇으면,,,"
747,중국을...?
748,배속이 없는 게 말이 되냐ㅋㅋ
749,굳
750,배속버튼 화질선택 등 기본적인게 없네요
751,굳
752,애니메이션 오프닝 건너뛰는 기능이 추가되면 정주행할 때 더 편할 것 같아요
753,한국장애인고용촉진공단대전직업능력개발원원장이대훈
754,자막기능은 없나요?
755,자막이 이상한게 많음 해석 잘하는 사람 좀 쓰지;;
756,한국어 자막도 되게 해주세요.
757,한국 영화나 드라마에도 농인들을 위한 한국어 자막이 설정되었으면 좋겠어요 농인이 아니어도 자막이 없으면 불편해서 티빙을 잘 이용하지 않게 됩니다
758,한국드라마나 영화 등등 한국자막 좀 넣어주세요 제발요
759,번역이 어색해요
760,한국진출하기에는 아직 많은것이 부족했다
761,자막 두가지 설정 가능하면 좋겠습니다. 한글+영어 자막
762,자막지원 해주세요 자막 필요합니다
763,"자막언어 선택하게 해주세요. 타사에는 주언어와 보조언어 자막까지 동시에 볼 수 있게 해주던데, 자막 부분에서 아쉬움이 많네요."
764,한국말 통역이 있어서 아주 편해요
765,굳
766,자막 서비스 너무안좋음ㅜㅜ
767,자막이 없는게 제일 아쉽구..10초 넘기는 과정에 화면이 검정색으로 변하는 것두 조큼 아쉬워요ㅠ3ㅠ 화면을 손으로 대고 있으면 자꾸 재생이 움직이는 만큼 넘어가서 불편해유..이 기능 대신 위에꺼를 추가해 주시면 감사하겠슴다!
768,자막에 검은배경 생겼습니다 짜증나네 설정방법도 없고 조치안하면 탈퇴 합니다 토렌트로 다볼수있는거 귀찬아서 돈내고보는데 이러면 안되잔아요
769,자막좀 만들어주세요. 2배속 있어 좋은데 대사가 안들려요
770,자막 배경색 검정 왜 생김
771,자막이 잘 되다가 갑자기 뒤에 검정색 배경이 생겼는데 집중이 하나도 안 돼요.. 고쳐주시길 바랍니다
772,자막에 검은배경이 있어서 보기에 집중이 안돼는데요 다시 원래대로 해주세요
773,자막검은테두리뭐임;;;;;; 집중안되요 다시원래대로돌려주세요
774,자막 검정 테두리 무슨일인가요.. 해결해주세요 겁나 불편해요 뒤에 다가리고
775,굳
776,자막에 왜 검은 테두리가 생긴거죠? 설정에서 변경할 수 있게해주든가 그런것도 없고 마음에 안드네요.
777,"한국어여도 예능은 어럽더라도 드라마라도
 .. 자막.. 기능이 있으면 훨씬 이용하기 좋습니다.

반영 부탁드립니다."
778,잘 보고 있어요 옛날 애니메이션 좀 많이 올려주세요 요즘 것은 많은데 옛날 애니메이션이 많이 없어요
779,자막에 왜 갑자기 검은색이 가치보이나요? 자막도 위로 갔다 아래로 갔다 보기 불편해
780,자막 검은 테두리 왜 생김?? 자막 때문에 집중이 잘 안되는데
