,0
0,"TV에서 시청중입니다

아직은 안정화가 덜 되어 있는듯한 느낌입니다 

딜레이가 좀 길고 리모컨 방향키(좌, 우) 버튼으로 되감기나 빨리감긴 지원이 아직 되지 않는 것 같습니다"
1,기대가 됩니다.
2,"기대반,걱정반으로 구독신청 완.료.
앞으로 디즈니플러스만의 많은,오리지널.콘텐츠
기대합니다.
앱 화면에서 볼륨이나 밝기 컨트롤 가능하게
해주세용!"
3,사랑해요
4,"엄청 좋은 컨텐츠에 감각하면서 보고 있는데, 화면의 반을 가리는 자막때문에 거슬립니다. 자막 크기 조정 해주세요"
5,기대됩니다!!
6,감사감사요
7,확인 해야되는데 글자가 없네요???
8,"디즈니 사랑해요ㅠㅠ
디즈니 픽사 마블 스타 네셔널 지오그래픽 다 있으무ㅠㅠ"
9,한국에도 디즈니 플러스를 보게 되어서 좋은데 컨탠츠가 어떤게 있나 볼려면 9900원 가입을 하고 볼수 있다는게 아쉬움…
10,"깔고 실행했는데 파란버튼에 아무 글자도 안뜸
다음으로 넘어가지지도 않음~~~~~"
11,한국에 떴다!
12,헤헤소울봐야지
13,너무 좋아요 ㅠㅠ 관심에 추가하느라 손가락 아팠음 볼게 너무 많아서 너무 ㅅ행복함
14,사랑해요!!!!!!!!!
15,"pip모드에서 앞뒤로 감을 때 자주 자막꺼짐. pip모드에서 전체화면으로 돌아갈 시 초기화 되어 처음 계정설정으로 감.
한글 자막이 매우 엉터리임. 
너무 직관적으로 표현되어 있어 이해하기 어려움"
16,이건 좀 귀하군요
17,缺点是里面的内容过少.希望后期能大大增加吧～本人是国家地理的铁粉～～～～～
18,진짜 구독하길 잘했네요 제가 좋아하는 시리즈가 있어서 감사함!!!
19,일본어랑 브라질어랑 다있는데 앱 언어설정에 한국어가없네요…? 웃긴건 또 영상 자막이랑 더빙은 한국어 지원이되네요
20,최고의 선택이라 자부합니다
21,10등안에 들어보기
22,"평생 디즈니 보면서 자란 어른이가 또 디즈니를 보네요. 로그인하는 순간부터 두근두근.

컨텐트 목록 첫 화면 보고 와… 했슴니다."
23,"근데 없네요, 다크윙 덕, 칩과 데일은 왜 저렇게 만들어 둔건디, 곰돌이 푸 이런거 하나도 없습니다
거기다가 결제 안하면 뭐가 있는지도 확인 안되게 해뒀습니다 이거 거의 사기 아닙니까?"
24,어릴적 나왔던 것들도 보이고 많이 기대가 됩니다
25,"역시 콘텐츠양이 엄청나네요
구독료도 넷플보다 훨 싸고
기대됩니다!!"
26,한국에도 나왔다
27,"더빙버전말고 자막버전은 없나요?
더빙,자막 버전이 따로 있으면 좋을거같아요."
28,감사합니다 감사합니다
29,스타워즈 시리즈 마블 시리즈 디즈니 프린세스 픽사 작품 내셔널 지오그래픽 등등 너무 많다
30,"화면 슬라이드로 볼륨 조절 밝기조절,
ㅠㅠ빠른재생(1.5배, 3배) 기능이 없는게 너무 불편해요
첫 홈 화면에 카테고리 바가 있으면 편할거같아요.
(드라마 영화 애니메이션 등)"
31,라고 말할 수 있게 좋은 컨텐츠 기대합니다
32,시청기록 지우는 것도 추가하면 좋을 것 같아요
33,다양한거 볼수 있어 좋네요 영상재생만 조금 고쳐졌으면 좋겠어요
34,언어에 한국어 체크하는데도 없고 언어설정 다 바꿨는데 계속 영어로 나오네요 한국어로 바꾸는 방법좀 알려주세요
35,다 좋은데 한국어 자막이 좀 커서 아쉬워요 나머지는 다 정말 👍🏻👍🏻 4k여서 더 좋습니당
36,내셔널지오그래픽을 풀로 볼 수 있다니....
37,완다비전 로키 팔콘앤윈터솔저 등등 마블드라마도 실컷보고있고 디즈니 영화도 제공해줘서 좋네요! 무엇보다 한국어패치 너무 좋네요
38,스타워즈 컨텐츠 미쳤네요ㅠㅜ
39,드림웍스 화이팅
40,아니더라도 필수
41,파란 바만 나오고 눌러보면 동의 하라고 하는데… 또 파란 바만 나오고.. 뭐하라는 거임?
42,기대보다 볼게 별로...
43,다른앱위에 표시되는 기능이 없어 불편합니다. 이점 개선되면 더 편하게 사용할수 있을것 같아요
44,첫 결제하고 아바타 보고 있음요 다만 장기적으로 볼땐 볼께 없다는게 함정... 일단 한달 시청후 아니면 해제각
45,내셔널지오그래픽!!
46,항공사고 수사대가 왜 없는건가요?? where is air crash investigation? so disappointing
47,심슨 볼려고 1년구독 넣었음돠 ㅋㅋ 시즌30개 ㅋㅋㅋ...(스타워즈랑 디즈니애니포함)자막이 좀 투박한데 점차 세련되게 개선되길 기대해요.
48,디즈니 콘텐츠야 말해 뭐해요~ 그.런.데.. 어플 이용해 폰으로 시청할때는 불편하네요 어플에 PIP가 적용되어도 팝업창이 안되요 설정하는 다른 방법이 있는건데 제가 모르는건지 모르겠는데 팝업창이 안되다니...많이 불편하네요
49,GOOD
50,정식 런칭 전에 지들이 받아놓고 별 한개 달아놓은 매크로식 두뇌로 연결된 인간들이 참 많군용
51,빅 히어로 시즌1은 없나요?
52,"넘 기대를 많이 해서 그른가 상당히 실망이네요... 배속 안되는건 뭐 안되는 다른 ott 서비스도 많으니까 이해하는데 밝기 조절, 음량조절 이나 자막 크기 조절 같은 간단한 것도 아직은 제공을 하지 않네요... 아직 자막 지원하지 않는 작품들도 꽤 있는것 같고요.. 또 한달 무료 아니 최소한의 2주 무료 이용조차도 없는게 불친절하고 결제를 해야지 무슨컨텐츠들이 있는지 둘러볼수 있네요.. 이런것들이 개선되지 않는다면 이번 한달이 마지막 이용이 될것같습니다, 괜히 넷플이 시장 1위겠어요.. 다 이유가 있더라고요. ㅠ ㅠ"
53,일부 컨텐츠가 카테고리 목록에 없는 경우가 있습니다 따로 검색을 하거나 비슷한 컨텐츠 목록으로 찾아들어가야 합니다 예를 들어 '일곱개의 대죄'는 검색을 해야지 찾을 수 있고 카테고리 목록 어디에서도 찾을 수가 없어요 새로운 볼만한 거 둘러볼 때 이런식으로 목록에서 누락된 작품은 아예 볼 기회가 없겠죠
54,한국드라마나 한국영화 자막 좀 달아주세요… 안 들리는 대사나 조용히 봐야할 땐 자막이 있어야 하는데 ㅠㅠ 그리고 청각장애인 분들 배려도 좀 해주세요 🥺
55,한국 서비스 시작! (2021.11.12)
56,인크레더블2 보고 있는데 자막 싱크가 엉망이네요
57,한국어 자막같은 기본적인게 추가되어있지않네요. 실망스럽습니다
58,좌우레터박스 안 나오게 화면 비율 지원 부탁드립니다
59,한국드라마컨텐츠 부족
60,심슨가족 시즌1 6화부터 자막 싱크가 안맞음 돈주고보는건데 신경좀 써주세요
61,디즈니 콘텐츠 이용이 가능한건 매력적이지만 가족끼리 계정 공유할 때마다 이런저런 렉이 걸려서 귀찮음.
62,알럽 디즈니 알럽 픽사 알럽 몬스터주식회사
63,인크레더블2 보는데 자막 싱크가 안맞네요 돈 내고 보는데 영화 한 편 제대로 못보네요.. 솔직히 실망입니다 그래서 그냥 한국어 더빙으로 본다능..
64,"시청중인 콘텐츠 삭제 기능이 없는것, 시인성 문제 등 타 앱들과 비교했을때 부족한 기능과 시스템이 많이 보입니다. 빠른 개선이 필요할듯합니다."
65,한글 자막 배경이 검은색으로 나와서 짜증나셨죠? 저도 그랬습니다. 디플 앱에서는 설정이 불가능해요. 해결방법이 있습니다. 설정 들어가셔서 자막으로 검색하시면 구글 자막(cc) 뜹니다. 눌러서 배경색 사용안함 설정하고 글씨 크기도 취향에 맞게 설정해주세요. 그럼 즐감 되세요!
66,"콘텐츠는 좋아요. 그렇지만, 배속 기능이랑 보던 영상을 앱 켜자마자 이어볼 수 있는 기능 추가되면 좋겠어요"
67,"심슨, 뮬란 등 제가 좋아했던 만화를 다시 볼 수 있어서 너무 좋아요 하나 아쉬운 점이 있다면 화면에서 소리조절기능이라든지 화면밝기조절기능을 추가해주셨으면 좋겠습니다"
68,후발주자인데 기본 기능은 오래 전에 나온 넷플릭스보다 한참 떨어지면서 콘텐츠만 내세우고 배짱장사하는 게 스팀과 에픽 게임즈 관계 같네요. 1. 이미 많이 얘기 나온 자막 문제 2. 디즈니 채널로 더빙된 작품이라고 한국 자막 지원 x. 한국 영화도 cc 지원해주는 넷플릭스랑 천지 차이. 캐리비안의 해적처럼 유명한 작품은 온갖 언어 더빙에 자막 다 지원해준다는 점에서 더 짜증남. 3. 보는 중인 콘텐츠 목록 지울 수 없음 4. 찜한 콘텐츠 항목 들어가기가 불편함 5. 디즈니 극장판 애니메이션 시작하기 전에 나왔던 단편 애니메이션 제목을 기억하기도 어려운데 다 분리해놔서 하나하나 찾아야 함. 자기 전에 앰피비아 보려다가 중국어랑 영어 자막만 있는 거 보고 그냥 넷플릭스 보러 갑니다.
69,대만족
70,"디즈니 주니어에서 하던 소피아공주, 꼬마의사 닥 뭐시기, 리나는 뱀파이어 등등.. 이 어플로 볼 수있나요??"
71,이거 참 버그 엄청나게 많네요 그중 성인인증도 못하게 하네요 인증번호가 와도 치지를 못하니
72,오늘 오픈한 앱이 테스트도 안하고 올리나요. 성인인증 안되는 오류정도는 충분히 확인하고 올려야죠. 실망이네요. 빨리 수정해주세요.
73,컨텐츠는 맘에 드는데 번역상태 왜 이럼? 자막상태도 엉망이고 기기따라 자막이 붕 뜨는 현상도 있음. 유튜브로 런칭기념인지 뭔지 할 시간에 기본은 제대로 하고 하자... 일단 계속 구독은 할껀데 개선 안하면 탈주각임
74,"1. 1.25배속, 1.5배속으로 보기 만들어주세요 2. 관심 컨텐츠 항목 홈 화면에서 볼 수 있게 해주세요"
75,드디어 나와서 좋긴한데 일부영화(인크레더블2) 볼 때 음성이랑 자막이랑 싱크가 안 맞음 자막이 0.5초 더 빠름 컴터로 보는데 소리를 최대로 키워도 너무 작음 빨리 개선바람
76,해밀턴 자막없는거 뭡니까? 디즈니플러스가 한국에 들어왔으면 적어도 한국어자막이 있어야하는거 아닙니까? 이런성의없는 경우는 무엇인지요? 일년결제했는데 실망스럽네요
77,아이가 디즈니 애니메이션 좋아해서 1년결제했는데요 왕실탐정 미라는 왜없나요?
78,기사엔 샹치와 텐 링즈 있다던데 없네요 첫판부터 장난질 입니까? 콘테츠도 생각보다 없네요 ㅡㅡ
79,PC 환경에서 자동재생 안되는 문제 언제 고치나요.
80,기본적인 것만 충고합니다. 1) 자막 사이즈 키우세요 2) 키워드 기반 컨텐츠 검색 가능하게 해주세요 3) 자막팀 늘려서 컨텐츠 빨리 늘려주세요
81,"12일 밤 00시 기다려서 바로 가입함. 검색 어려움 볼것 특정 시리즈 말고 별로 없음, 예정작 언제 어디서 나오는지 모름, 자막 검은색 바탕화면 안에 나와서 걸리적 거림..... 왜 넷플이 1위인지 나는 이제 알겠소 반성해라 디즈니 !!!!"
82,디즈니주니어에서 하던게 다 있지 않네요 디즈니주니어에서 하던 하이호! 일곱난쟁이를 아이가 좋아해서 기다리고 기다리다가 결재했는데 없네요;; 기존에 보던 애니메이션정도는 다 있어야 하지 않나요ㅜ 앞으로 추가가 될 예정인지 궁금하네요
83,스타스포츠랑 espn 넣어줘ㅠㅠ 이럴거면 왜 iptv에서 빼간거냐고..
84,국내 런칭됐다고 해서 결제하고 보려는데 넷플릭스하고 비교를 안할수가없네..ㅡㅡ; 아직 초반이라 그런가? 개선해야될거 천지네..잔뜩기대했다가 실망만함..아직은 때가아닌듯..
85,마블 팬들이라면 한국에선 못보던 에오쉴7 팔윈 로키 완비 등등을 볼 수 있으니 한달이라도 구독하는 게 좋음 마블드라마를 볼 수 있단 게 젤 메리트인 듯 +지금 블위랑 샹치까진 볼 수 있음 +크루엘라도 있네 ㅎㅎ 보고는 싶었지만 평이 별로에다 코시국이라 영화관 가기 껄끄럽던 분들 부담없이 보면 됨 미뤄뒀던 마블시리즈있음 다 여기서 ㄱ (아쉽게도 없는 것도 _스파이더맨_몇개 있음 ㅠㅠ)
86,볼게 있고 없고를 떠나서 자막 싱크가 너무 안맞아요ㅜ말은 하는데 자막은 안나오거나 자막이 너무 느리게 뜬다거나 빨리 이런 오류좀 고쳐주세여ㅜㅜㅜㅜ마블영화 보는데 자막이 중간중간 안나오고 하니깐 불편하네염
87,최고다 디즈니!! 보고싶은걸 넘어 갖고싶었던 컨텐츠들~^^
88,재미있어요 드디어 굿
89,너무 별로
90,엄마가 없습니다
91,요한이 벼ㅇ시나 스파이더맨은 소니꺼잖아 왜 디즈니에서 찾아
92,컨텐츠는 신규라 볼께 있지만 앱이 너무 구림 아참 티비앱 자막크기 100프로는 코딱지 만하고 200프로는 플랜카드 글자크기임 150프로 좀 만들어야 할듯
93,"마블팬으로서, 디즈니팬인 아이를 키우는 입장으로서 단연 가성비 갑입니다"
94,겨울왕국2 세르비아 버전을 좋아하는데 음성에 추가되었으면 좋겠어요
95,그동안 못보던 스타워즈 드라마 애니 볼수있어강추
96,자막 크기 설정 안되나요? 한국어로 설정하면 너무 쥐콩만해요... ★☆자막 크기좀 키워주시고 배속기능 넣어주시면 좋겠어요☆★ 한국 출시는 초창기라 아쉬운 부분이 많네요... 콘텐츠도 다양했으면 좋겠어요ㅠ 뱀파이어다이어리도 디즈니에 있는줄 알았는데 없네요ㅠㅠ 보고싶은 콘텐츠 신청은 못할까요??
97,자막 뒤의 검은 배경이 화면을 많이 가려서 거슬리네요. 그리고 ps5버젼 인터페이스는 느리고 오류가 많습니다. 디즈니 픽사 애니메이션을 좋아하는 아이를 위해 1년치 가입했지만 솔직히 넷플릭스 대비 컨텐츠의 양도 절대적으로 부족합니다. 볼게 부족하다는 거죠... 체감상 한 1/5정도..? 많이 노력해야겠네요.
98,진짜 거지같네 볼게없다
99,좋긴 좋은것 같은데 자막이 너무 작아서 하나도 집중이 안되네요..
100,"미국에 체류할때 디즈니플러스 사용했었는데 그때 다양한 컨텐츠를 경험한 기억이 있어 이번 한국 서비스할때까지 2년간 기다렸는데, 팔콘과 윈터솔져도 없고 왓이프도 없고 심슨가족도 없네요... 미국보다 사용료 더 비싸게 내고 구독하는데 한국판에도 컨텐츠 신속하게 탑재 해주시기 바랍니다. 이쯤 되면 한국 차별한다는 이야기가 나올 것 같습니다."
101,"마블 좋아하시는 분들 추천 먼제 로키,완다비전,팔콘과윈터솔져 완다비전은 내년에 나올 닥터2와 연간이 있고 팔콘과윈터솔져는 팔콘이 제2의캡틴아메리카 되는 과정 로키는 모르겠고 다음주에 나올 호크아이 호크아이가 세데교체 되는 과정 이렇게 마블이 페이즈3에서페이즈4로 가는과정에 위에 소개한 드라마가 들에있음 아니면 마블페이즈3정주행"
102,일단 마블 스타워즈 팬으로써 너무 감동적임. 컨텐츠 뿐 아니라 한국어 더빙 까지ㅋㅋ 너무나도 마음에 든다. 다만 왓이프가 아직 없다는게 당황스럽다. 조만간 호크아이도 나올텐데 설마 바로 바로 못 볼수도 있다는건 아니겠지... 왓이프와 차후 신규 마블 드라마들에 대한 디즈니플러스코리아의 계획이 어떠한건지... 조속한 공지가 필요해 보인다.
103,최고임
104,실시간으로도 볼 수 있고 중드보느라 앱 설치하게 되었는데 신작도 많이 올라오고 잘 보고 있어여~^^
105,디즈니 영화만 있는줄 알았는데 다른 영화 예능도 있고 그래서 좀 놀랐어요❤️❤️ 진짜 기다린보람이 있어요👍👍👍👍👍👍
106,"뭔가 관련 콘텐츠 이런게 뜨면 조금더 도움이 될 거고요 그리고 자막이 너무 깔끔하지가 못해요 넷*릭스 처럼 테두리가 검은색이록 적당한 자막 크기이면 좋겠거요 ㅠㅠ 또 시청기록이 따로 안 떠 겁나 고생하면서 
보게 괴네요 가격은 저렴하지만 꼭 그 값어치 하는 거 같아 너무 속상해요"
107,ux가 구립니다.
108,넷플릭스도 볼게 없다고 했지만 여긴 넷플릭스 오리지널도 없네..
109,더빙말고 한국자막 개선됬으면 좋겠어요
110,앱 실행이 안되네요 저만 그런줄 알았는데 다른분들도 많이 계시네요 빠른 조치 부탁드립니다
111,"최대 7명 동시접속 4명, 생각보다 이게 많이 겹칠 수도 있다고 생각이 들더라고요 앱에 들어갈때 누가누가 접속을 하고 있는지가 표시가 되면 끊길일도 없을것 같습니다!!"
112,"더빙판으로 보는게 정말 최악이네요
몰입도 안되고 더빙판으로는 어떤 작품이든
다 노잼입니다"
113,"아니면 디즈니 본사 에서 앱 에 대해 시안 컴펌을 진짜 한건 맞긴함? 사용성이 너무 불편함 컨텐츠 관련 내용은 둘째고 마블추천작, 몰아보기 끝판왕 등등 서브 타이틀 컨텐츠을 한눈에 볼수도 없음 보통 더보기 나 자세히 보시 해서 새로운 페이지 에서 리스트 형태로 보여주는게 맞지 않음? 뭐가 있는지 보려면 계속 가로 스크롤 해야함 전반적으로 너무 ui가 너무 불편함 개선 부탁 드립니다.  검색등등 쓸께 많지만 안쓰면 그만 이라 옛추억 때문에 한번 씀 다음달 결제는 안 할듯 해요"
114,스타워즈 마블 내가좋아하는건다있네요
115,별점 5점 드리고 갑니다
116,"카테고리도 불편하고 직관적이지 못함
넷플릭스를 예로들면 영화도 한국영화 해외영화
그중에서도 세부 탭이 다있고
드라마, 등등 세분화되어 있는데 그른게 없음
걍 컨텐츠 있으니까 보겠지 하고 성의없이 내놓은느낌
한두달은 가겠지만 이대로라면 롱런은 힘들지 않을까??"
117,안맞아요.. 딴거는 다맞고 껐다 키고 난리를 쳐도 안맞아요 ㅜㅜ 이거때문에 가입한거나 다름없는데 꼭좀 확인 부탁드립니다
118,"드디어 출시되서 좋긴한데..ㅎ 앱을 급하게 만든건가ㅠ 광고는 계속하더니ㅠ 너무 불편…아니 시리즈물을 보는데 한편보고 다음편을 또 눌러야하다뇨…자동재생도 없고 화면밝기,음향조절등 이런거 없어서 너무 불편하네요ㅠㅠ개선점이 너무 많이보이는데 개선은 언제 해줄지…"
119,보스 베이비 센과 치히로 포뇨 이런것들이 나오면 좋을거 같아요 너무 만족스럽구 더 만족스러울거 같스아영ㅇ!!
120,이런 아쉬움을 주다뇨
121,좋은데 시청중인 콘텐츠 삭제가 안 됨. 드라마 대충 맛 보고 볼까말까 정하는데 너무 지저분 해져서 불편해요
122,생각보다 손봐야할게 많음 1. 자막 크기설정 및 폰트설정 2. 밝기조절 안됌 3. 몇몇 드라마 시즌 완결 났는데도 다 안나왔거나 중간에 시즌하나가 빠짐 이거 좀 치명적입니다 나머지는 차후 보면서 댓글 남기겠습니다
123,감사해요
124,우측 하단에 팝업 뜨면 보고 있던 화면 스크롤 안됨 ㅡㅡ 진짜 뭐하세요? 매월 돈주고 보는데 팝업까지 달아야겠니? 광고보러 티빙 앱 접속하는줄 아세요? 컨텐츠 보러 들어온겁니다 제발 쫌!!!!!!!!!!!!!!!!!!!!!!!!!!!!!!!!!!!!!
125,"초기에 삼개월은 천원도 안되는 금액이라고 하길래 그냥 한번 가입해봤습니다. 사실 금액 명시가 다 다르게 나와 불편을 겪었지만 워낙 저렴하니 대수롭지 않게 여겼습니다. 두달째엔 아무 알림 없이 6천원대 금액이 출금됐지만 워낙 혼동되게 만든 요금제이기도 하고 다른 플랫폼에 비해 저렴한 편이니 수긍했습니다. 
근데 여러모로 개선되어야 할 방면이 많은 것 같습니다. 콘텐츠는 다른 플랫폼에 비해 적은 편이지만 저야 워낙 마이너한 취향이라 콘텐츠 다양성에선 나쁘지 않았습니다. 프랑스 드라마라던지 다큐멘터리 좋았어요. 
근데 솔직히 터치가 잘 먹지 않는다던가 뒤로가기 누르면 바로 전단계로 가지 않는 점, 쓸데없는 여백이나 답답한 ui/ux 디자인? 한 5년정도 뒤쳐진 느낌입니다..조금만 더 개선됐으면 좋겠어요."
126,예전 드라마나 애니메이션을 보기에는 좋아요 그런데 제가 포켓몬을 좋아하는데 예전에 했던 시리즈 없이 썬문 w이렇게 두개만 있는데 더 추가만 되면 자주 이용하게 될것 같습니다 개인적으로 아쉽네요 ㅠ 영화도 몇개만 있어서 전에 봤던것인데 컨텐츠 추가 부탁드려요
127,진짜 하이큐 전편 올려주시고 해리포터 자막버전으로도 올려주시고 최신거 많이 올려주시면 소원이 없겠어요 진짜 다 좋은데 하이큐는 꼭 전편 넣어주세요ㅠㅠㅠ
128,자료가 매우 빈약함....
129,"ㅋㅋㅋㅋ마블영화는 시청도 안됨 디즈니 영화빼고 실행도 안되서 강제 디즈니 시청행 ㅋㅋㅋㅋ 자막 사이즈도 못골라 코리아 ip면 자막을 한국어로 디폴트 해두지도 않아 ㅋㅋㅋ 소리, 밝기 제어 안 돼 콘텐츠는 겁나 없고 성인 인증 안 되서 15세 영상은 다 막혀있고 UI는 겁나 불편하게 하고 되는게 머임? ㅋㅋㅋㅋ 개킹받는 건 자막도 개후짐 심슨에서 환상적이다를 돈이 많다로 갈긴 어메징함이란...."
130,내가 찾던 그 콘텐츠! 웨이브에 없었어!
131,편하고 좋네요~:)
132,완전 만족
133,굳
134,프로필 여러 개를 성인인증하는데 문제 있고 티비로 시청 시 자막 뒤 검은 박스 처리가 거슬림 그리고 아동용을 제외한 컨텐츠는 굳이 더빙 할 필요가 있을까 싶다 그 비용으로 자막 퀄리티에 더 투자하는게 맞다고 봄 마블 등 디즈니 소유의 콘텐츠는 빨리 볼 수 있는 점은 장점으로 작용할 듯
135,어? 멀티뷰 없는거 맞냐고 썼었는데 왜 없어졌죠..? 암튼 그레이아나토미 보는데 자막이 이상해요 이름을 틀리질 않나 존댓말 할 사이가 아닌데 존댓말을하고 이상해요
136,"개선되어야 할 게 많아보입니다. 1. 자막 뒤 검은 배경 설정으로 조절을 하게 하던 없애던해주세요 2. 잠금기능없음 보다가 잘못누르면 그냥 앞 뒤로 막 이동해요..잠금 기능 추가해주세요 3. 밝기, 음량 조절 영화나 드라마보면서 어플 상에서 조절하는 기능이 있었으면 좋겠습니다 핸드폰 설정으로 하려니 불편해요 4. 통화중에 재생불가 디즈니플러스 구독한 다른 사람괴 동시에 보려고하는데 통화중엔 아예 재생이 안되네요.. 5. 어색한 자막 그냥 말 그대로 어색합니다. 번역기 돌린 듯한 느낌을 받을때도있어요 6. 카테고리 분류창 카테고리 별로 영상을 선택할 수 있었으면 좋겠습니다. 지금 방식안 눈에 잘 안들어오고 찾기힘듭니다. 7. 본 기록 확인 불가 본 영화 목록을 일일이 쳐서 확인해야하네요 확인 할 수있게 기록창을 만들어주셨으면합니다. - 기본적인 7개고 타 어플을 언급하고 싶지않으나 넷플릭스, 왓챠에선 그냥 기본인 기능들입니다. 어플만든지 며칠 안됐다고하나 빠른 시일내에 개선되길바랍니다"
137,자막 퀄리티는 어디다 얘기해야 하죠? 넷플릭스에서 그레이아나토미 시즌 15까지 봤는데 디즈니에 시즌 16 17이 있어서 반가운 마음에 보고 있는데.. 자막은 회차마다 담당자가 달랐다는 게 느껴지니 한숨이 나네요.. 어떤 회차는 기본적으로 누구나 존댓말을 해대는 탓에 아버지가 딸에게 극존칭 존댓말하고.. 교수가 레지던트에게 극존칭 쓰고.. 어떤 회차는 제자가 사수에게 반말질에.. 하아.. 너무 집중하기 힘드네요.. 거지같은 자막 탓에 영어 실력이 늘게 생겼어요..
138,중국 디즈니 인가??? 마블 신작들의 미래가 없어 보인다…
139,시작하자 마자 일베컨텐츠에 투자하나요?
140,돈들어가네 무료애니 쳤더니 한달에 9900원 장냔하냐 모조리싶어먹어버린다
141,배속 재생 시스템좀 만들어주세요
142,롤창이기에 아케인때문에 첫결제간다 넷플릭스 관계자 여러분 라이엇과 앞으로도 친하게 지내서 제가 볼거리를 만들어주세요
143,"10초씩 앞으로가기 개힘듬 디즈니,픽사,마블등 으로 구분되어있지만 세부뷴류가 명확하지 않아 찾기 어려움 틀자마다 설정안하면 더빙판으로나와 빵터짐"
144,"오래 기다렸어요^^ 내 시청기록보기, 배속재생설정, 재생 중 화면잠금기능 이 필요할 것 같아요~ 그외 컨텐츠은 너무 기다렸던 거라 완전 만족합니다^^"
