,0
356,자막도 제대로 없음 절대 쓰지마셈
357,자막이 너무 커서 화면을 가립니다. 자막좀 아래로 조금 작게 해주시길 바랍니다.
358,자막좀
359,자막이 엉성한데가 은근 많네요 안뜨는 경우도 있는거같고 마블덕후라 어쩔수없이 구독합니다.. 시정해주시면 바랄게 없네요
360,배속기능이 있었으면 좋겟어요!
361,자막을 영자막.한글자막 무자막 선택할수있도록해주세요. 넷플도 디즈니도 다되는데 ㅜㅜ휴
362,한국팬 스타워즈 차별좀 제발.. 클론전쟁은 간간이 자막누락에 번역도 그지같고 반란군은 자막도 아예 없이 더빙으로만 봐야되고 이젠 보바팻도 느즈막이 다 끝날때즘에야 볼 수 있다고? 정도 껏좀 해라 제발
363,너무 불편하고 아직 초창기라서 그런가 볼만한것도 없고 오프닝 넘기기 재생속도도 없고 오디오설정에 중국어가 없다라고요.일본어는 있는데
364,자막ㅡㅡ
365,자막이 조금 안맞음
366,자막 개같네
367,자막이 핵구림
368,정말 잘쓰고 있었는데 엔칸토 한국어 더빙이 사라졌네요...
369,한국에서 장사하는거 포기했다고 봐도 되지?
370,한국어자막 설정했는데 와 중국어 자막이 나옴? 자막팀 일좀 제대로 해라 진짜 엔칸토랑 로키릉 특이 2021년도에 나온거 계속 중국어자막나와서 더 빡침
371,앱에서 자막스타일변경 가능하게 만들어봐라
372,굳
373,"너무 좋은데 주술회전 1기 밖에 없어서 너무 아시워요😭
빨리 다른 기(?)도 나오면 좋겠네요!"
374,볼게많아서 영어공부하기 좋아요 영어 한국어 통합자막이 있으면좋겠어요(진짜 제발ㅜㅜ)
375,배속기능좀 만들어줘요 제발ㅠㅠㅠㅠㅠ 배속기능 필요해요.... 답답해 죽을맛
376,"번역이 너무 엉망이네요
덕분에 영어공부가 절로 된다는;;"
377,굳
378,자막 크기 조절할 수 있게 해주세요.
379,한국 시장에서 장사하려면 적어도 ALl등급은 한국어더빙 지원이 되야하는거 아닌가요? 아이보려고 결재한건데 나홀로집에도 그렇고 라푼젤시리즈도 그렇고 한국어더빙이 안되네요. 일본어지원은 되던데 말이죠. 12개월 결재했는데 지금 끊어버릴까 심각하게 고민중입니다.
380,자막도 쓰레기인데 설강화와 중국이 많이 묻었네? 믿고 거름. 마블에 디즈니 묻어서 마블도 탈덕함
381,한국 시간으로 새벽 네시쯤 결제가 되던데 :) 한국 시간에 맞춰서 결제 하세요
382,심슨네 가족들 하나 보고 돈 냈는데요. 한국어 자막을 뭐 조선족한테 맡겼나요? '대'랑 '데'도 구분 못하는거 보고 기가 막혔습니다. 게다가 부부 사이 대화 번역도 그래요. 지금이 어느 시대인데 남편은 반말하고 아내는 존댓말쓰고; 장난합니까? 번역 좀 어떻게 해보세요 제발
383,자막이 너무 부자연스러움 개선바람
384,자막오류도 너무 심하고 배우가 말 하는거랑 자막이랑 안 맞아요. 그리고 다음화로 바로 넘어갈수있게끔 해주세요 자동 재생이 없으니 보다가 다음화 보고싶으면 화면 나와서 다시 눌러야하고 너무 번거로워요 그리고 렉도 너무 심하고 특히 자막오류 진짜;; 초창기는 그렇다쳐도 아직까지 오류가 있음 어떡하죠? 하나하나 다 고쳐주세요.
385,자막 크기 설정좀 할 수 있게 해주세요... 너무 작아요 안보여요....
386,"자막 2개 설정기능 이거 하나면 
외국어 공부하고 싶은사람 전부 다 구독할겁니다

추가 안해주면 취업해서 바꿔버릴거에요"
387,"배속버튼 필수, 2배로 보는거 좋아하는데 정속도로 보니 진도가 안 나감"
388,자막보는법
389,자막으로 보는데 사람 말 소리는 작고 효과음이나 배경음악은 커요.
390,자막 지원이 빨리 됐으면 좋겠네요. 다른 OTT 어플에서 가능한 것들이 지원을 안해서 너무 불편해요ㅠㅠ
391,"넷플리스와 비교하여 외국어 더빙 이나. 자막이. 현저히 부족하던지 전혀 안되어. 답답하고.짜증남. 왜. 이탈리아영화를. 영어로도 들을수있어야. 됨
또한. 미국영화를. 한국어로 들을수. 있게. 만드세요. 이거. 못하면  망해야됨"
392,볼만한거는 많은대 애니가 많이 없는게 아쉽네요 나루토 시리즈 와 건담시드 시리즈도 추가 해주셨으면 좋겠어요~~
393,자막을 끄는 기능이 생겼으면 좋겠습니다. 영상을 볼때 자막 때문에 거슬린 부분도 많았거든요.
394,자막 번역퀄리티만 향상되었음 한다
395,한국 넷플엔 안나오는게 많아요 좀..
396,번역 오류 좀 고쳐주세요 너무 많아요
397,자막이 좀 이상함
398,배속으로 볼 수 있는 기능이 없어서 아쉽지만 나쁘지 않음
399,배경이 하얀색이면 자막 색도 하얀색이라 자막을 볼 수가 없네요
400,배우들 목소리에 비해 효과음과 배경음이 너무 커요.. 몰입을 위해 임의로 조절해놓은 건지 모르겠지만 유독 넷플릭스가 심해서 이부분은 꼭좀 고쳐주셨으면 좋겠어요. 대사안들려서 소리 키워놓으면 갑자기 튀어나오는 너무 큰 효과음때문에 놀랄 때가 많습니다
401,자막이 많이 미흡합니다. 개선되었으면 하네요. 한국영화 예능및 드라마도 장소에 따라 자막도 같이 보기도 하는데 자막따로 더빙따로라 보는데 많이 불편합니다. 넷플릭스의 기능이라든가 자막이 디즈니플러스에 비해 훨씬 안정적으로 보입니다. 많은 개선이 필요합니다.
402,설정 및 조작 등 편리성에 있어서 완성도가 너어어어어어무 떨어져요 개선이 시급합니다
403,"모든 영상에(한국영화,드라마,예능,만화 포함) 한국어 자막이 있었음 좋겠어요. 넷플보다가 소리없이 시청하려거나 배우들의 발음이 어색하거나 어눌하게 들릴때 자막이 없어서 뭐라 하는지 모르겠어서 불편스럽네요. 다 좋은데 자막 관련해서 아쉬워서 별 4점 입니다."
404,자막싱크 안맞아요
405,자막 이상함
406,한국어자막선택하는데 왜자꾸 중국어 자막나오냐고!!!!!! Make Korean subtitles stable!!!
407,네셔널지오그래픽 자막 보는게 불편합니다. 그리고 자막 설정 한국어로 했는데 유지가 안되고 다른편 볼 때마다 다시 설정해야 됩니다.
408,굳
409,"한글자막 있고요. 자막 언어선택이 엄청 많네요. 디즈니답습니다. 아쉬운게 있다면 앱에서 밝기 조절이 불가능하다는 것, 이중자막이 불가능하다는 것 입니다. 재밌는 영어공부에 목마른 저같은 사람들을 구원해주세요. 이 가격에 디즈니로 영어공부할수 있다? 다 할듯"
410,자막을 어플 내에서 따로 설정할 수 있는 기능이 필요합니다
411,자막좀 신경써라 개 거지같아
412,한국어 자막 이외에도 영어자막 요함. 끊기는 것 개선 시급함.
413,"자막 상태는 정말이지 최악입니다. 한국어 설정 했더니 중국어 나오고 이상한 한자랑 물음표가 섞여서 나와요. 그나마 정상적인 글자가 나오면 오역입니다. 너무 치명적인 오역 많고요 그 유명한 '이제 가망없어' 나 '어머니' 도 고치지 않았답니다.
마블빠 디즈니 애니빠 아니면 비추입니다
덕후이다? 한달이면 콘텐츠 다 봐요."
414,"너무 잘 보고 있습니다.
혹시 애플TV로 서비스는 언제쯤  가능한가요?"
415,"지금까지 넷플릭스 유용하게 잘 사용하는 학생입니다 
넷플릭스 볼때 애니/영화/드라마를 자주 보는데요 만화를 볼때 한국어 해석이 나오는 부분에서 우리 다시 손잡고 라는 대사를 말하면 너와 다시 손을 잡을날이 올거야 라고 해석이 되네요 문장을 고쳐서 쓴거라고 하지만 대사가 완전 바뀌는 부분에서 다른 나라 말들도 지금 같은 상황이 있을걸로 예상이 되는데 제가 일본 애니메이션을 보면서 알게된 일본어들도 혹시 제가 해석이 질못된걸 정확한 해석이라고 판단하여 여태까지 쓰고 다녔던건 아닌가 싶네요 이부분 개선해주시면 좋겠습니다 아 그리고 넷플릭스에 새로운 컨텐츠를 업로드 하는것 보다는 여러 시리즈가 있는데 마저 올라오지 못한 시리즈 위주로 업로드 해주시면 감사하겠습니다 4개 시리즈 중에 2개만 올라왔다고 하면 2개 시리즈는 볼 수 있는 방법이 많지 않고 찾기 힘들어서 부탁드리겠습니다"
416,번역둘째치고 자막 싱크도 안맞아?
417,자막 위치가 뭔가 애매 ... 넷플에 비해 쓰기 불편하게 만들었지만 디즈니 몰아보기는 너무 좋아요👍🏻👍🏻
418,한글자막 쓰레기 수준임
419,배속 기능 좀 만들어줘여 ㅠㅠ
420,자막 개선과 저장용량만 덜 차지하면 좋겠습니다
421,자막... 휴
422,자막크기 조절은언제 되나요
423,한국어 자막을 보고 싶은데 자막을 없어서 너무 실망했습니다. 드라마 보다가 가끔씩 대사가 못 들었고 뭐라 말하는지 궁금해요...ㅠ 자막을 꼭 넣어주시면 좋겠네요... 그리고 교육도 자막을 넣었으면 좋겠습니다.
424,자막 ㅎㅌㅊ
425,장사 안된다고 징징대지 말고.. 한글자막 좀 갖춰주세요. 선택 할 수 있는 옵션이 너무 적습니다. 자막없이 오디오로만 퉁치려고 앵간한 애니 시리즈는 더빙판만 들여놓은거 너무 실망스러움
426,자막 수준이 영어 잘하는 고딩한테 맡겨도 이거보단 나을듯. 영화도 그렇고 디즈니 플러스도 이런거보면 뭔가 뒷거래가 있는거 아닌가싶다. 피씨와 탭에서 잘되는 다음 화 자동 재생도 폰 어플에선 안됨.
427,자막이 중간에 안 나올 때가 있어요 그거 빼면 좋아요
428,자막이 진짜 개판이에요 그레이아나토미 시즌16화 10회이후 자막쓰신분바뀐거같은데 앞편한편만보고 썻어도알았을텐데 반말하던사이 다 존대쓰고 번역도개판이에요
429,자막이랑 싱크가 안맞을 때가 있네요! 그것 말곤 괜찮습니다
430,자막이안나옴
431,너무 좋은데 진격의 거인처럼 애니메이션은 오프닝건너뛰기 같은 기능이 있었으면 좋겠어요
432,자막있으면 진짜 좋겠다
433,자막설정 되게 수정부탁드려요
434,"자막 설정이 되는게 있고 안되는게 있네요,, 수정부탁드려요"
435,미드 fbi 자막이 안맞아요
436,배속 기능이 없다는게 말이 되나
437,😅😅
438,미드 FBI 시즌1의 2편과 4편의 자막이 서로 뒤바뀜 다시보니 전반적으로 모두 싱크가 섞여있는 상태네요
439,베트남에서 한국어 설정 어떻게 하나요?
440,자막 조절할수있는 기능이있으면 좋을거같아요!
441,"요새 중소기업 바이럴회사도 맞춤법 검사기
돌려서 일함. 오역도 문제지만 맞춤법 오타도 난무함. 퀄리티가 저질. 디즈니 이름 달고 출시한 게 믿기지 않음. 회차별로 번역자가 다른지 배역이름조차 매번 바뀜. 존대했다 반말했다 와리가리. 최저시급 알바생들 돌려가며 일했나 봄. 메디컬 드라마에서 레지던트를 주민이라고 함. 넷플왓챠웨이브 OTT 가운데 압도적으로 최악의 퀄리티."
442,자막 쓰레기 수준
443,자막오류 및 저질번역이 나아지기는커녕 새로 추가된 이터널스에도 똑같음
444,굳
445,"자막 오역, 영화 소개 부분 성의없음"
446,디즈니 플러스 추억팔이로 팅커벨 날개의 비밀 봤는데 왜 한국어버전이 없죠? 다른거 몇개는 있는데 팅커벨4만 없는것 같아요.있었으면 좋겠네요.
447,더빙은 없나요?
448,자막 왜이래요;;;; 자막 안보일 때도 있고 위치 지 맘대로 바뀌고 존댓말 반말도 이상하고... 화질도 매번 구리게 저화질로 재생되고.. 아주 디즈니랑 마블 컨텐츠가 인질이고 멱살잡고 끌어가는 수준이라 느껴지네요.
449,배속도 없고 자막설정도 구림 보던영상 이어보기 탭같은것도 없고 번역수준도 시청에는 문제없지만 부족한편이 많음
450,자막이 전부 됐으면 좋겠어여 넷플로 자막설정하고 보다보니 안 뜨는건 웅얼거리는 느낌이라 답답하네요ㅠㅠ 폰에서 티비연결도 됐다 아니였다하고 개선되었으면 좋겠습니다
451,심슨 조아^-^
452,배속 기능이 있으면 너무 좋을 것 같아요
453,"자막은 좋아지긴 했다만, 아직도 불편한 점이 많음 대표로 하나 말해보자면, 넷플릭스처럼 팝업 화면이 안됨. 팝업 화면 될 수 있도록 설정해주면 별접 5점 드릴게요"
454,한국 영상에도 자막이 있었으면 더 바랄 게 없겠어요
455,자막크기 조절좀 할수 있게 해주세요.자막이 화면의 반정도 차지해서 자막을 보는건지 드라마를 보는건지 ㅜㅜ 모르겠네요.
456,자막 사이즈 설정 좀 알려주세요... 폰트.사이즈.설정이 안보입니다....
457,"자막에 검은 바탕이 있어서 보는데 상당히 거슬림.
초반에 어프닝 넘기기와 마지막에 다음화로 넘어가기 버튼이 랜덤으로 뜸.
시청 중에 화면 밝기 조정 불가능.
자막 설정이 좀 더 다양했으면 함."
458,와이프와 쿠팡 회원을 각자가입해도 부담이 없고 각자 쿠팡 플레이봅니다. 그런데 오늘 애플TV를 구입했는데 아직 애플TV 용 앱이 없다죠? 어서 개발해주세요. 이제 한국도 애플TV가 대세가 될거에요.
459,영어버전은 어떻게 설정하나요?
460,한국어 자막크기나 번역수준이 너무떨어져서 몰입이 잘안됩니다.
461,"자막이 살짝 이상하지만 전부 이해할 수 있고, 그냥 완벽합니다!"
462,ㄷ느스느느느ㅡ느ㅡ느
463,굳
464,"자막뿐아니라 팝업모드, 화면밝기조절, 음량조절이 없어 너무 불편함.."
465,어릴때 봤던 알라딘 이나 인어공주 티비 시리즈가 그리워요
466,잘사용하고있었는데...갑자기.ㅣ.영문으로화면이바뀌어버렸어요..다시한국어로어떻게바꿔요ㅋ?기기한국어이상없고컴퓨터로접속해도영문이고..바꾸는방법이모르겠어요
467,자막이 거지같아서 더빙으로 듣고 컨텐츠가 한국은 늦게 출시하네요 보바펫 언제나오나 궁금하네요
468,배속 시스템이 잇었으면 좋겠어요.
469,자막수준 낮음 다음 화 재생 시 전체화면이 해제됨
470,번역이 쓰레기예요
471,굳
472,엔칸토보는데 한국어자막이 아니고 중국어 자막이 나오네요 자막을 한국어로 설정해봐도 중국어나오는데 좀 고쳐주세요;;
473,자막주위에 검은색으로 씌워진 오류 계속 나네요ㅠ 씽크 안 맞는 오류도 해결 좀 요ㅎ
474,자막 정말 보기 힘드네요.. 주인공들의 관계도 제대로 이해하지 못하고 무조건 다 존대로 번역해놔서 집중하기 힘들어요!! 적어도 인물관계도는 이해하고 번역해주길.. 그레이아나토미 시즌 16 진짜ㅠ 그리고 속도 조절도 되었으면 합니다!!
475,자막이 나와서 좋아요^^
476,제가 본것중에 진짜 최고인데용???????!
477,추가 하면 좋겠는 애니메이션 시즌이 있어요 약속의 네버랜드 2기를 추가 해주셨으면 좋겠어요 1기도 감동적인데 2기가 너무 보고싶어요.
478,돈내고보는건데 중간에 버퍼링걸리는건 해결해줬으면 좋겠네요. 콘텐츠는 완벽합니다! +)자막안맞는분들은 이렇게보세요. 이게맞습니다. 오디오:영어 - 자막:한국어
479,배속기능내놔라
480,"자막이 엉망이에요…. 막귀가 들어도 틀리게 번역된 부분도 많고, 반말했다가 존댓말했다가 제멋대로 입니다. 제일 거슬리는건 문어체 말투…어플리케이션의 기능적인 부분은 피드백 반영하면 나아질 여지가 있으나 번역 문제로 컨텐츠 질까지 떨어지는 느낌입니다."
481,한국어 프로그램에도 자막이 있었으면 좋겠어요. 이어폰을 사용하기 힘든 상황에서 작게 봐야하거나 주변소음이 있는 경우는 조금 아쉽습니다.
482,굳
483,배속 없습니다. 밀어서 진행 바 이동 기능 없습니다. 소형 화면으로 보는 기능도 없습니다. 일단 영상 보고 싶은게 있으면 각 잡고 처음부터 끝까지 보고 재미없거나 지루한 부분을 넘기려면 더블 터치로 10초씩 이동해야 합니다. 요즘 이렇게 불편한 앱도 오랜만인거 같습니다. 웨이브도 얘보다는 기능이 많을겁니다.
484,자막 오타에 앱 사용성 개불편하고 최악의 스트리밍 앱
485,자막개후짐 ㅋ
486,자막글씨가 너무작아요
487,가면라이더 이그제이드 빌드 제로원 세이버 넷플릭스에서 방송해주세요~음성 한국어로요 제발요
488,어플 업데에트 이후 영상 시청시 '로드 중'이라는 메세지만 뜨며 아무 영상도 볼 수 없음. 돈은 받아가면서 영상은 못 봄 ㅋㅋㅋ
489,배속이 없는게 너무 아쉽게 한번 시청했던 영상은 없앨수가없네요
490,미드가좀더많이졌으면좋겠어요~
491,굳
492,자막이 따로 있으면 좋겠어요
493,"자막이 시원찮아요, 전부 다 경어로 되어있어서 ㅡㅡ; 불편하네요"
494,한글자막이 안나옴
495,자막 구리고 걍 구림 모든게 구림 그냥 제발 하지마세요
496,배속 이랑 창모드 기능이 추가되면 더좋겠네요
497,자막이 너무 작아졌어요 키워주세요 눈아파여
498,배속기능 필요
499,"지금은 축구경기 중계나 SNL 정도 보고 있지만 앞으로는 다양한 컨텐츠들을 볼 수 있을 것 같아 기대가 됩니다.

근데 애플TV 지원이 빨리 되었으면 좋겠네요 ㅠ"
500,자막에 오타가 너무 많고 인물들이 말을 끊어서 하는데 자막에서는 붙어 나와서 불편합니다. 자막 좀 수정해주세요
501,심슨 정주행중//한국어 자막 실망스러움. 귀에 들리는 것만 해도 자막에 쓰인 것 이상으로 재미있는 표현이 많는데 다 생략됨.
502,자막 크기와 위치 조절할 수 있게 해주세요
503,번역 좀 바꿔주세요 제발요…
504,한국드라마를 좋아하는데 넷플릭스만 한국어자막을 지원해주니까 티빙에만 있는 드라마는 보고싶어도 못보는게 너무 불편합니다 제발 꼭 넣어주세요..
505,한글자막 있었음 좋겠어요 ~ 배경음은 줠라큰데 말소리는 개미소리만해서 안들리고 그런일이 많아서 자막필수임니다. 제일 안좋은건 결제할때 무조건 정기결제 아니면 못하게 하는 양아치짓 안했으면 좋겠음. 정기결제해놓고 깜박하게 하려는 악질 개수작 다보여욥
506,"자막 크기가 넘 작게 나옵니다
이미 여러분들이 지적한거 같은데
개선이 안되는걸 보니, 서비스 개선 의지가 별루 없는거 같네요
1년치 안 끊길 잘한듯…."
507,괜찮게 쓰다가 갑자기 아랍어로 바뀌어서 한국어로 계속 변경하는데도 주기적으로 아랍어로 바뀌네요. 무슨 문제인가요? 해킹이라기에는 다른 사람들과 계정 공유중인데 제 것만 이런 상황이라 좀 황당하고 계속 언어 바꾸려니 귀찮네요. 저만 이런가요?
508,"배속기능은 언제쯤 생길까요~~?
배속 기능을 정말 좋아하는 사람으로서 배속기능이 없는것은 좀 불편하네요"
509,번역이랑 자막 나오는 디자인 진짜 어디 토렌토에 영어공부하는 애들이 무료제공한거 가져다가 쓴 느낌ㅋㅋㅋㅋㅋㅋ 미치겠다 정말.
510,자막이 너무작고 빨리지나가서 읽기힘들어요
511,자막 번역기 돌리나?
512,배속 조절 기능 언제 넣어줄껀가요?
513,"자막, 배속 기능"
514,굳
515,잘 사용하고 있습니다. 다만 저는 작품 중 분명 한국어 더빙판을 봤는데 관련 정보는 죄다 일본 성우만 표기되어 있어 불편하고 불쾌했습니다. 성우분들께는 배우와 같이 자신이 어떤 작품에서 무슨 캐릭터를 연기하셨는지 즉 커리어가 굉장히 중요합니다. 하지만 어느 작품에서도 한국 성우 표기를 볼 수 없더군요. 한국 성우 표기 제대로 부탁드려요.
516,굳
517,"한국영화,드라마 주세요"
518,배속 안돼서 안보게 됨 졸라 답답;
519,너무 기기지원이 늦어요 애플TV4k 지원좀 해주세요 너무 쓰기 불편해요
520,자막 설정이 안돼서 불편하네요 크기도 그렇고 위치 조정도 안돼고요
521,자막 크기를 설정할 수 있으면 좋겠습니다. 어두운 장면에 흰 자막이 크게 뜨니 장면에 몰입하기가 힘드네요.. 가시성 때문에 자막 색을 바꾸는건 무리일 것 같고 크기 설정이라도 되면 너무 편하게 사용할 것 같습니다.
522,자막 막 만들었어요.... 덕후도 쉴드가 안되네요....
523,자막 오류 빨리 해결 좀...
524,자막 크기 너무작아 집중이 안됩니다. 빨리 변경해주세요
525,탭s8 ultra에서 전체화면시 여백이 크네요
526,"자막 오타,오역이 너무심하고 중간에 다른앱 켰다들어가면 보던거 저장 안되고 초기화되서 불편해요. 외국어음성으로 설정하고 시청하는데 외국어 음성이 중간중간 안나오고 영어로나와요 소리도 너무작아요. 너무불편해요. 좀 고쳐주세요."
527,자막이 있는걸 보는데 처음에 자막이랑 관람등급안내가 겹쳐서 자막을 읽을수가 없네요. 처음내용은 버리고 보라는 건가요??
528,배속기능 좀 만들어줘오
529,자막 크기는 난 그럭저럭 괜찮은데 드라마가 다른 나라는 대충 6화까지 나왔다 치면 우리 나라에서는 3화 밖에 안 나온다거나 비하인드는 아예 안 나온다거나... 이게 뭐임...
530,"자막,사운드 모두 최상"
531,제가 실수로 잘못 썻을까봐 다시 씁니다 청춘돼지 시리즈들을 삭제 하시지 말아주세요 저에게 정말 소중한 애니입니다 그걸 볼때마다 저의 가슴이 감동을 느껴 눈물을 흐르게 해주었습니다 부탁입니다 청춘돼지 시리즈를 삭제 시키지 말아주세요
532,자막이 검은 줄만 뜨는데 대체 어떻게 보라는거죠 ㅋㅋ 설정하는 기능도 없네요
533,배속없음
534,타 해외 OTT와 같이 자막을 한글외 영어 일본어등 다양하게 서비스 희망
535,키즈채널 만화들 중 몇몇이 번역 안된채로 올라가 있네요 한국어로 번역해서 올려주세요 성우 쓰실 비용이 아까우신가요.
536,"iOS, iPadOS 용으로 앱이 다 있는데 애플TV 앱이 없다는게 말이 안 됩니다. 애플TV에서 wavve, WATCHA, Disney+, Netflix 다 되는데 … 티빙만 안돼야 하는 이유는?"
537,자막이 너무 커요 ㅜ
538,자막 진짜 답없네 넷플릭스 시스템 조금만 참고해도 나아질거 같은데
539,자막수준.. 자막 싱크도 안 맞고 중간중간 날아가 있기도 하네요ㅋㅋ 이딴 완성도로 뭔...
540,넷플릭스 처럼 한국어 자막좀 넣어주세요 외국어를 해도 자막이 안뜨네요 따른건 다 좋은데 개선좀 부탁드립니다
541,배속 없는게 너무 큽니다..
542,"애니메이션 같은 경우 한국어로 더빙되어 있는 것도 있는데 이게 제공이 안되니까 너무 아쉬움. 지브리 영화나 디즈니 영화 같은곤 한국어가 더 익숙하고 좋을깨도 있는데,,,,
그리고 과도한 모자이크…잔인하다고 다 모다이크 초리하면 어떡합니까? 심의 규정을 위한거라면 적정 연령만 보게 규정을 해야지 모자이크로 가 처리하면 몰임이 떨어져요..돈내고 보는데"
543,미드 캐슬 보고싶어서 오늘 가입하고 결제했는데...시즌1~시즌3 뿐이네ㅜㅜ 시즌8까지 있는 미드인데ㅜㅜ 언제 올려주는거에요~?!
544,자막지원이 미흡하고 랜더링이 너무 길어서 보기 힘드네요 특히 720만 보려고 해도 바로 렉걸리네 내돈내고 보는건데 520으로 보는건 무슨 ㅋㅋ
545,"요금이상황데 계정이해킹당한줄알았는데 오류였네요 근데 어제 오류당했을때 닉 프사으로 바뀌고 스페인어로또바꿨습니다 닉을 한국어로 통역하면 순서대로 미친,사자별자리,핫도그,큰으로 바뀌었네요 한번더 해킹당하면 그해킹버뮤신고하겠습니다 (서버관리좀 잘해주세요)"
546,굳
547,"다른건 다 좋아요. 근데, 자막기능만 어떻게 해주시면 안되나요? 마블영화를 볼려하는데 한국어로 듣는건 좀 이상해서 오리지널로 영어음성으로 하고, 한국어자막으로 볼려하는데... 자막이 한국어음성으로 설정해서 비교했을때랑 너무 다르고 안 맞아요.. 뭔가 로봇이 딱딱하게 번역한 느낌? 이여서 한국어자막으로는 도저히 마블같은 외국영화를 못 볼거같아요... 다른건 다 좋으니 자막기능좀 개선해주실 수 없나요? 부탁드려요 ㅠㅠ"
548,"자막? 자막 없는 부분 은근 있음, 컨텐츠? 디즈니라고 해서 기대했더니 없는거 투성이, 화질? 나쁘지 않음, 연결&동영상플레이부분 오류 은근 많음.....왜...결제했을까...."
