,0
0,자막크기 150% 만들어주시길. 100은 너무작고 200은 너무크네요
1,한글 설정 방법 알려주세요..
2,자막이 좀 이상해요...ㅠㅠ
3,한국에도 디즈니 플러스를 보게 되어서 좋은데 컨탠츠가 어떤게 있나 볼려면 9900원 가입을 하고 볼수 있다는게 아쉬움…
4,한국에 떴다!
5,자막이 너무 커요
6,"자막을 한번 정하면, 외국 거 이든 한국거 이든 
그대로 나오는게 흠이네요
외국 영상에서는 자막이 나오게 하고
한국 영상에서는 자동으로 자막이 안나오게 해야하는
시스템이 있어야할 거 같네요"
7,한국어 자막이 너무 커요
8,진짜 구독하길 잘했네요 제가 좋아하는 시리즈가 있어서 감사함!!!
9,자막 골때림
10,일본어랑 브라질어랑 다있는데 앱 언어설정에 한국어가없네요…? 웃긴건 또 영상 자막이랑 더빙은 한국어 지원이되네요
11,한국에도 나왔다
12,자막 크기가 너무 큰데요..조절할 수 있을까요?
13,"더빙버전말고 자막버전은 없나요?
더빙,자막 버전이 따로 있으면 좋을거같아요."
14,언어에 한국어 체크하는데도 없고 언어설정 다 바꿨는데 계속 영어로 나오네요 한국어로 바꾸는 방법좀 알려주세요
15,자막이 화면의 4분의 1정도 가리네요 ㅠㅠ 글씨 크기가 조금 작으면 좋을 것 같아요 !!! 엄청 기대했는데 볼 것도 많고 너무 만족스럽습니다 ㅎㅎ
16,다 좋은데 한국어 자막이 좀 커서 아쉬워요 나머지는 다 정말 👍🏻👍🏻 4k여서 더 좋습니당
17,완다비전 로키 팔콘앤윈터솔저 등등 마블드라마도 실컷보고있고 디즈니 영화도 제공해줘서 좋네요! 무엇보다 한국어패치 너무 좋네요
18,자막 크기 좀 줄이고 시청한 콘텐츠도 볼 수 있게 해주세요 ㅜㅜ
19,배속왜없냐
20,"자막보다가 눈빠지겠어요. 스마트티비는 자막크기와 테두리 투명 가능한데, 모바일기기는 크기나 테두리배경 조절이 안되네요. 자막 크기 변화없으면 재구독 의향 없습니다."
21,자막이 너무 작아요...
22,한국드라마나 한국영화 자막 좀 달아주세요… 안 들리는 대사나 조용히 봐야할 땐 자막이 있어야 하는데 ㅠㅠ 그리고 청각장애인 분들 배려도 좀 해주세요 🥺
23,자막크기조절가능하게해주세요 짜증납니다
24,한국 서비스 시작! (2021.11.12)
25,자막 배경 없애는 기능 넣어주세요
26,자막크기 심각하게 작은데 크기조정 안되요?
27,자막 크기가 핸드폰 시스템 자막과 동기화됨. 모바일 환경에서도 자막 크기 수정 필요.
28,한국어 자막같은 기본적인게 추가되어있지않네요. 실망스럽습니다
29,한국드라마컨텐츠 부족
30,한글자막 번역이 너무 엉망이네요...싱크 안맞을때도 많구요...
31,인크레더블2 보는데 자막 싱크가 안맞네요 돈 내고 보는데 영화 한 편 제대로 못보네요.. 솔직히 실망입니다 그래서 그냥 한국어 더빙으로 본다능..
32,자막판으로 못 바꾸는 사람들들 특 영어못함ㅋ
33,자막이 까맣게 나오는데 어떻게보라는건지 조절할수있게 해주세요
34,자막이 나오는 언어가 없음.. 그냥 모든 언어의 자막이 다 안나옴
35,자막좀 빨리수정해주시길 자막뒤에 검은색 눈에 거슬려요
36,자막이보기안좋아요
37,자막이 변역기 돌린거마냥 수준이 아쉽습니다 개선쫌요...
38,해밀턴 자막없는거 뭡니까? 디즈니플러스가 한국에 들어왔으면 적어도 한국어자막이 있어야하는거 아닙니까? 이런성의없는 경우는 무엇인지요? 일년결제했는데 실망스럽네요
39,배속설정
40,자막 투명도 조절이 시급해 보임 ㅜ
41,자막좀 크게 1.5배속 빠르게 좀 업뎃 해주세요 나홀로집에 잇어서 좋음
42,"12일 밤 00시 기다려서 바로 가입함. 검색 어려움 볼것 특정 시리즈 말고 별로 없음, 예정작 언제 어디서 나오는지 모름, 자막 검은색 바탕화면 안에 나와서 걸리적 거림..... 왜 넷플이 1위인지 나는 이제 알겠소 반성해라 디즈니 !!!!"
43,자막이 영상을 다 가림. 게다가 불투명 자막이라 더 불편함. 다음화로 바로 넘기기 기능도 없음. 재생바를 꼭 손으로 넘겨야함.화면 밝기 소리 제어 기능 없음. 영상에서 회차정보 보는 내용도 없어서 재생 취소를 반복해야함
44,배속 만들어주세요
45,자막크기 조절 시급합니다...
46,배속 기능 추가 해주세요
47,배속 설정 추가해주세요 쿠플에도 있는게 여긴 없네ㅜㅠㅡㅠㅠㅜㅡ
48,자막 미친거 아님? 뭔 발음 받아쓰기에 속도는 겁나빠르고 띄어쓰기도 이상하고 번역 제대로 안되고 걍 번역기 돌린거아님?? 진짜 자막 고쳐지지 않는 이상 절대 안함
49,자막 상태가 왜이러나요..? 차차 개선할건가요?
50,자막 싱크도 하나도 안맞아요 .. 그리고 밝기조절 음량조절 기능도 없네요? 가장기본적인건데요 개선해주세요
51,"자막크기, 재생속도 빠르게 조절할 수 있게 해주세요"
52,자막 크기 설정 안되나요? 한국어로 설정하면 너무 쥐콩만해요... ★☆자막 크기좀 키워주시고 배속기능 넣어주시면 좋겠어요☆★ 한국 출시는 초창기라 아쉬운 부분이 많네요... 콘텐츠도 다양했으면 좋겠어요ㅠ 뱀파이어다이어리도 디즈니에 있는줄 알았는데 없네요ㅠㅠ 보고싶은 콘텐츠 신청은 못할까요??
53,자막 뒤의 검은 배경이 화면을 많이 가려서 거슬리네요. 그리고 ps5버젼 인터페이스는 느리고 오류가 많습니다. 디즈니 픽사 애니메이션을 좋아하는 아이를 위해 1년치 가입했지만 솔직히 넷플릭스 대비 컨텐츠의 양도 절대적으로 부족합니다. 볼게 부족하다는 거죠... 체감상 한 1/5정도..? 많이 노력해야겠네요.
54,자막이 안보이고 넘어가는 경우가 있습니다
55,"자막 전환도 로딩없이 바로 되서 넘 좋네여
관련성 높은 리뷰로 봤을때 보이는 것중에
겨울왕국 소리전환 안된다는 사람있던데
기계 만질줄 모르면서 안된다고 하지 마세요.
모르면 찾아 보기라도 하던가 ㅉㅉㅉ"
56,더빙말고 한국자막 개선됬으면 좋겠어요
57,음성 한국어과 자막 한국어 싱크 일치가 필요해보여요. 음성을 들으면서 자막을 같이보는걸 좋아하는데 둘이 너무 따로놉니당…
58,"더빙판으로 보는게 정말 최악이네요
몰입도 안되고 더빙판으로는 어떤 작품이든
다 노잼입니다"
59,자막싱크안맞고 오타있고 ㅋㅋㅋㅋ 제대로좀하자
60,"ㅋㅋㅋㅋ마블영화는 시청도 안됨 디즈니 영화빼고 실행도 안되서 강제 디즈니 시청행 ㅋㅋㅋㅋ 자막 사이즈도 못골라 코리아 ip면 자막을 한국어로 디폴트 해두지도 않아 ㅋㅋㅋ 소리, 밝기 제어 안 돼 콘텐츠는 겁나 없고 성인 인증 안 되서 15세 영상은 다 막혀있고 UI는 겁나 불편하게 하고 되는게 머임? ㅋㅋㅋㅋ 개킹받는 건 자막도 개후짐 심슨에서 환상적이다를 돈이 많다로 갈긴 어메징함이란...."
61,굳
62,자막 크고 거슬림 국내런칭 굉장히 늦게 했음에도 자막엉망이고 아직도 심의가 안되서 없는 영상도 있음...왓이프 내놔
63,자막은 화면을 많이 가리고 심지어 그런 자막마저도 없는 작품이 많아요. 그리고 오역도 많고요. 문제점 해결되기 전까진 비추합니다.
64,자막이 드럽게 불편하네 폰 설정들어가서 바꿔도 화면 중간쯤에나옴 ㅡㅡ 플스나 pc에서 4k로 사용못함 ㅋㅋㅋ
65,자막실화입니까...넷플릭스도 자막퀄리티구린데 그것보다구리네여
66,자막없는거실화냐
67,자막작업좀...빨리해줬으면
68,돈은 드럽게 비싼데 한국어가 안됨 버그겠지?
69,한국어 더빙이 너무 안되어있네요. 일본시장이 그렇게 큽니까? 왜 일본어 더빙은 있고 한국어 더빙은 없는 작품들이 많은지..
70,한국어 자막이 너무 커요 ..
71,자막 스타일 설정하게해주세요ㅠㅠ 자막이 아얘안보여서 폰으로보면 더빙해서봐야해요
72,새로런칭한 디플보다 한국어 더빙이 없어요 일본어 더 빙은 엄청 많은데 말이죠.한국 컨텐츠로 그렇게 돈을 벌어도 일본 시장이 더커서 그런걸까요?
73,한국어자막.음성 지원 안되는 컨텐츠 대부분임.볼만한거 몇개없고 그마저도 다본거 아직은 결제할가치가없음 실망스러움
74,"자막 크기 조절하기가 있음?
너무 커서 영상에 방해 될 정도인데ㅋㅋ"
75,"그 영상 시청할때 키보드모양(?)같은거 누르면 여러가지 언어가있을텐데요?
거기에 오디오에서 잉글리쉬 누르고 자막 한국어로 설정하면 더빙으로도 말고 자막으로도 시청할수 있습니다 제데로 보고 말하세요-- 고칠점 없는 디즈니 플러스 욕하지 말고요 전 개인적으로 엄청 재미있습니다 티비에서 돈내야 돼는 것도 무료로 볼수있구요^^ 디즈니 플러스 번창하세요~"
76,"자막이 이상해요 
말하는 것과 적히는게 달라요
맞춤법도 계속 틀리고 급하게 적은게 티나요
계속 참고 봤는데 영어를 못하는 분이 적었나요?
에이전트 카터 자막 좀 수정하세요"
77,"자막 크기가 좀 작아요, 크기를 조절할 수 있었으면 좋겠어요. 밝기 조절, 그리고 음성 조절도 필요해요!! 좀 성급하게 만들지 않았나 하는 생각에 별 하나를 뺐습니다. 저는 그 외에 아직 전부 체험해보지 않아서 괜찮아요!!!"
78,번역이랑 자막 ui가 이런식이면 망합니다
79,"저 이거 결제해서 보는데, 뭐가 있는지 확인이 가능해야 되는건 기본이고,, 제가 배속 기능 없으면 불편해서 해지하는데,, 아직 없어서 한달 지나면 해지할거 같네요ㅠㅠ 심지어 왓챠도 이번에 배속 생겼는데,, 여기에 왓챠에 있는 한국 예능 등을 가져와야 비벼볼만 할거 같아요~ 배속 기능 추가좀 부탁드릴게요ㅠㅠ"
80,영어로 된 영상 볼때 자막 끄는 기능이 없어서 불편해요. 자막 끌수 있게 해주세요.
81,"배속기능, 자막위치, 오역, 화면 밝기 아직 고칠거투성이긴한데 볼건 무지많긴하네요"
82,한국에서 보기만을 기다렸습니다. 개선 되야될부분은 많지만 그건 앞으로 업뎃하면서 천천히 바뀌겠고..다른건 뭐 특별히 불편한건 없네요
83,"영화 볼 때 화면에 두가지 언어로 볼 수 있도록 설정할 수 있게 해주세요 예를 들면 한국어를 화면하단, 영어를 화면상단에 띄울 수 있게 말이예요^^"
84,자막 설정을 pc나 아이폰처럼 바꿀수있으면 좋겠어요 자막크기도 크기지만 자막 배경 투명도 도 거슬리고 답답하개 느껴지네요 또 한국어 음성지원을 따로 검색할수 있게 하지는 못하나요? 비교적 최신작만 되어있고 어떤건 되있을법한데도 안되어있네요
85,자막이 너무 작아요..
86,자막 150%도 만들어주세요 100%는 너무 작고 200%는 너무 커요
87,자막이 이상해요
88,자막이 쓰레기 수준 사이즈설정 못하는거야 그렇다치고 싱크도안맞고 부분부분 안나오고 ㅎㅎㅎ 한두달써보고 그래도 개선이 없으면 안씁니다 ㅎㅎ
89,자막 엉망 제공 안되는 컨텐츠도 많음
90,한글이 안나옴 참고 바랍니다.
91,자막크기좀 어떻게해주세요 ㅠㅠ 뒤에 검은배걍도 없애고싶음
92,자막이 조금 늦게 떠요 ㅜㅜ
93,"생각보다 더 다양하고 많은 영상이 있어
그 부분은 만족스럽지만
한국어 자막을 키면 자막이 화면의 반 이상을 가립니다.
영상을 충분히 만끽하며 보기에는 열약한 환경이네요"
94,자막 스타일 특히 폰트와 자막 뒤 쪽 배경 디자인의 개선도 필요할 것 같습니다. 가독성이 너무 떨어지고 특히 영상의 일부를 가리는 것도 큰 문제입니다. 자막 위치도 함께 조정해주세요.
95,자막의 위치가 굉장히 거슬린다. 자막의 위치를 조정할 수 있는 기능이 있으면 좋겠다.  그리고 영어 자막이 가끔 서로 겹쳐서 알아볼수 없는 경우가 있는데 자막 타이밍을 수정하면 좋겠음.
96,자막 ! 화남
97,"자막 오류가 심해요..... 
동영상과 자막과 따로노는게 심하네요 ....
수정부탁드려요 ㅜㅜㅜㅜ"
98,"한국인데 왜 저는 저렇게 뜨나요?

국가설정은 없나요??

사용이야 모를껀 없지만. 저는왜?"
99,딴거 다 좋은데 아이맥으로 보면 한국어 자막이 번역 오류인건지 이상해요 아이폰으로 보면 괜찮은데 ㅠㅠ
100,"자막이 너무 커서 어디서 줄여야할지.. 방법이 있다면 너무 불편한 지원 방법입니다.

배속재생이 있으면 좋겠습니다.

탭하여 건너뛸때 심한 버퍼링에 한국인인 저는 웁니다."
101,"배속기능, 화면밝기 조절 기능, 자막 크기 조절 기능이 시급합니다. 넷플릭스에 비해 여러모로 많이 부족해요."
102,자막싱크수정해주세요.. 인크레더블 2 보는데 자막싱크가 안맞아요.. 안타까워서 그래요ㅜㅜ
103,한국 최고의 OTT
104,더빙도 해주서 보기 좋아요
105,자막 완전 개판이네요
106,마블꺼 다 보는것만으로도 좋은거지 인제 나왔는데 불만 더럽게들 많네 보질 말던가
107,배속만들어주세요
108,번역상태 개판이네. 이럴꺼면 영화관에 나온걸 보고 번역을 쓰던긴 ㅡㅡ 번역이 이랬다 저랬다하면 어떡함. 몰입 안되게
109,자막뒤에 검은 배경은 설정에서 바꿀수 있게 해줘서 괜찮은데 자막 한글번역이 정말 별로인것 같습니다 한글 더빙을 그대로 옮기신건가요? 자막을 보는이유는 원영화 그대로의 느낌을 보려고 보는것일텐데 그런 시청자들에게는 너무 불합리한거 아닌가라는 생각이 듭니다
110,자막 너무 구림 재생목록 편집 못 함 기대보다 다본거가 대부분이고 볼게 별로 없음 키즈모드나 성인이나 컨텐츠 차이가 별로 없어 보임 아이들을 위한 시리즈 물도 거의 없고 예전 것들이라 애들도 볼게 없음
111,자막싱크가 안맞아서 볼 수가 없다...마블 영화는 자막이 제대로인거 같은데 다른 컨텐츠들은 노답..당장 모든 컨텐츠 자막싱크 수정 어려우면 우선 싱크 조절을 직접 할 수 있게라도 해주던지 해야 할듯..
112,외국인이 담당인가?ㅋ
113,한국어 더빙은 있는데 한국어자막은 없는게 많아요. 영어음성과 영어자막은 있으면서 한국어 자막은 없나요? 몇년을 질질 끌며 출시를 왜 미뤄왔는지 이해가 안되네요. 넷플릭스가 이점에서 훨씬 좋네요. 자기들 콘텐츠가 많이 있음 뭐하나요. 요리를 하다가 덜했네요. 구독은 끊고 한국어 자막 지원 시작하면 다시 보겠네요
114,자막이 중간에 끊기기도 하고 검정색 박스로밖에 표현못하는게 아쉽습니다 몰입도가 현저히 낮아지고 신경질나요 공룡기업에서 이런 작은거하나 신경못쓰고 아직까지 방치한다는게 이해가 되질않네요 앱 출시할때 사전테스트같은거 다 해보지않나요?? 해본 결과가 이따구면 디즈니플러스 코리아팀은 다시 재구성해보심이 어떤지...
115,"자막이 오질나게 버벅이고 0.1초만에 지나가고 난리났음 글고 자막 크기도 하나는 너무 작고 하나는 너무큼,, 극단적 그자체"
116,"자막 오류 수정, 배속 재생 업제이트해주세요~"
117,"자막설정 방법 폰의 설정>검색 ""자막"">구글 자막(CC)선택후 설정하시면 됩니다. 아직 오픈 초기인지라 많은 개선점이 보이지만 차차 나아지겠죠^^ 그래도 볼거많고 전연령층이 다양히 즐길수 있어서 대만족 중입니다."
118,한국어 더빙이 적어서 좀 실망스럽네요
119,자막이 씽크안맞는게 많고 중간하면 너무 크고 작게하면 너무 작아요 그래서 별한개 뺍니다.
120,업뎃 전에게 훨 낫다 더 조잡하게 해나네 ㅡㅡ 영화 순위도 안나오고 업뎃 왜 했냐
121,"번역이 너무 개판임. 단순한 오역이나 그런 문제가 아니라 문법 자체가 오류가 많음. 예시로 ""철수 길을 가고 있었어요""같은 뭔가 모자란 번역이 너무 많아서 거슬린다. 검색기능은 제대로 작동하지도 않고 관련 추천사항도 진짜 이상한걸 추천해주는 경우도 많음. 나는 디즈니보다 내셔널 지오그래픽 때문에 사용하는 사람인데 이쪽은 컨텐츠 멸망직전임. 옛날 명작 다큐는 거의 없고 최근에 나오는 노잼 다큐만 잔뜩... pip기능도 없고 재생 중 화면 밝기 조절같은 기능도 없고 내 관심 목록도 두번이나 클릭해서 찾아가야한다니... 한달에 만원이나 받아먹을거면 기능추가랑 저작권 값 좀 치뤄줘라 제발"
122,"자막 개판인거 알죠?

진짜 1년 끊었으면 큰일날뻔..

한국 자막 수정해야할게 한 두개가 아닙니다;

이렇게 늦게 출시를 했으면 자막을 제대로 좀 해야죠

컨텐츠 좋은거 인정합니다

하지만 자막을 이렇게 만들면 집중이 안 됩니다

오타, 자막 싱크, 속도 이 문제를 

하루 빨리 해결해주시기 바랍니다"
123,한국 팀이 있긴 함? 일 ㅈㄴ 못하네
124,자막이 자주 꾾김
125,자막크기 변경은 어디서하나요? 설정도 안보이고 보다가 눈장애 되겠네요~~
126,자막이 너무 쥐똥만해요..ㅡㅡ
127,"한국어버전이 너무 없네요.. 아이들이 디즈니를 얼마나 많이 좋아하는데.. 넷플릭스는 어른꺼,디즈니는 아이들을 위해서 구입했는데 자막버전도 엉성하고 한국어버전도 얼마없고.. 한달만 구독하고 끊을래요."
128,자막이 쓰레기 같아요 안 켜고 보는게 나은 수준. 성인용 컨텐츠 어쩌고 하기 전에 자막이나 고쳐라. 디즈니를 몇개월을 기다렸는데 자막 준비 어쩌구 언플은 그렇게 하더니 수준이 이따위야
129,지금가입하면 개똥망이에요. 자막번역오류는 둘째고 자막 크기나 필체가 어디 삼류쓰레기중소기업 수준에 한국어더빙은 몰입도최하고 대환장파티수준. 그리고 저녁에시청은 복불복임. 서버가폭주래나? 진짜 테스트없이 그냥 런칭한기분. 시청자는 마루타
130,자막 설정 좀 만들어라 검정 레터박스에 검정 글씨로 자막 띄우는 게 말이나 되나? 삼성폰은 자막 설정도 못 바꾸는데 돈 내고 거지같은 자막 보게 만드네 차라리 구글 자막을 쓰게 하던가
131,"자막이 이상해요,, 시리즈물 보는데 번역하시는 분이 줄거리나 등장인물들을 모르는 건지 친구한테 존댓말 쓰고 그리고 존댓말 했다가 갑자기 반말로 하다 다시 존댓말로 바뀌게 번역이 나오고 아무튼 개선해야 할게 너무 많아요..."
132,자막 상태 왜 이럼
133,한국 드라마에 자막 만들어 주실 생각은 없나요?
134,배속 기능 제발 해주세요ㅜㅜㅜ
135,자막도 계속 끊기고 영상 좀 불편
136,자막에 한국어 좀 더 많이 넣어주세요ㅠㅠ
137,배속 좀 만들어주세요ㅠㅠ 진짜 ㅅ 답답해서 못보겟네유
138,자막번역 해도해도 너무한 거 아닙니까
139,자막 눈갱에 성인인증도 계속 안되고 뭔 체험판을 내놨냐
140,한글자막이 별로 없어요!!!! 걍 아쉬운게 좀 많아요..
141,한국에서 장사하기 싫으면 꺼지세요~ 구독 취소!!!!!
142,앱 이용하기 편하게 되어 있어요. 보고 싶은 해외시리즈들이 많아서 좋네요.
143,배속기능 생겼네요 너무 좋아요
144,자막 글씨만 있었으면 좋겠어요..
145,한국드라마 한글자막 부탁드립니다
146,"자막 오류가 정말 많이 발견됩니다
전체적인 검토가 필요해요
그리고 샹치를 크롬으로 볼 때 자막이 씹히는 경우가 2번이나 발생하던데 오류를 줄여주세요"
147,한글 번역은 인기작들은 좀 덜한데 다른작품들은 거의 번역기로 1차 작업하고 급하게 좀 다듬은 수준으로 보임 그리고 자막 크기가 너무 작거나 큼 UI도 첨부터 독자적으로 만들생각하지말고 일단 많이들 사용하고 개선된 넷플릭스꺼 벤치마킹해서 개선하고 그걸 바탕으로 분석해서 독자적인 UI를 만들어 나가는게 좋아보임 지금은 넘 불편함 그리고 기본 볼륨도 넘 작음 디플만 볼때마다 볼륨 높였다 줄였다 하기 불편함
148,자막 안 나왓여 !!
149,미국애니들 제발 한국어 자막 만들어주세요 더빙도 좋지만 영어공부 하려고 보는 건데 다 한국어 자막이 없어요ㅠ 그것도 그렇지만 한국어 더빙이 있어도 당연히 한국어 자막도 있어야 하는 거 아닐까요 .. 디즈니인데
150,굳
151,"한국어 더빙은 공중파에서 더빙 포기한 이래 실로 오랫만에 애니뿐만 아니라 영화, 드라마로 들을 수 있어 좋습니다. 이건 경쟁사보다 우수한 디즈니+의 강점같습니다. 하지만 자막의 질이 개중에 구글번역기 돌린듯한 수준의 오역이 몰입을 해치고, 자막의 뒷부분 검은배경이 영상을 가려 보기도 안좋고 시청 몰입감을 해칩니다. 이런부분이 개선되면 좋겠습니다"
152,자막크기를 조절할수 있었으면 좋겠어요 현재는 너무 커서 보기에 불편함이 있네요 개선을 부탁드리고 싶어요
153,더빙판 많이 부탁드려요
154,자막 뒤에 검은 그림자 좀 없애주셔도 별 4개는 줄듯 컨텐츠는 의심할 여지 없이 고퀄이니까...
155,한국어 자막 모든작품에 추가된게 아니었나요???
156,"자막 싱크가 안맞아요.. 1초정도 딜레이되고, 늦게나오는만큼 긴 대사는 휙 지나가서 읽지도 못해요.. 중간에 아예 안나오는 부분도 있어요ㅠ 자막 싱크 개선이 필요해보입니다"
157,심슨
158,자막 싱크 좀...........
159,배속기능 넣어주세요ㅠㅠㅠㅠㅠㅠㅠ배속 제발!!ㅠㅠㅠㅠ 답답해서 못보겠음요ㅠㅠㅠ
160,자막스타일150으로 해주세요 넘작거나 커요
161,"배속 내놔
마블 일주일만에 정주행 할거니까
2배속 내놔 당장"
162,번역이 진짜 구려요. 싱크안맞는 영상도 진짜많음
163,자막 번역이 너무 이상해요
164,번역 무슨일인가요 급해서 그런건지 난리났던데 이정도면 초딩알바 쓴거라해도 믿겠어요...
165,배속 기능이 없어서 답답해요 리뷰 지우지 말아주세요 리뷰 계속 지워서 별점 내렸어요
166,자막이 영상보다 좀 늦게나오네요 그리고 마블 시리즈중 하나인 인크레저블 헐크는 왜 없나요? 생겼으면 좋겠네요 그래도 잘 보고 있습당!!
167,배속도 가능하게 해주세요
168,자막 신경 좀 써주세요 ㅜㅜ 들리는 영어에 비해 너무 딱딱하고 재미없어요 제발요 .. 다른 건 다 괜찮으니까 제발 자막 좀 🥺🥺 번역가를 바꿔주시던지 해쥬세요
169,다 좋은데 자막이나 더빙 언어 선택 폭이 넓어졌으면 좋겠어요. 외국 생활 중인데 몇개는 한국어를 포함한 여러 나라의 언어가 뜨지만 대부분의 컨텐츠가 영어와 거주 국가의 언어만 뜨는게 너무 아쉬워요. 개선 되었으면 해서 원래 이런 리뷰도 잘 안 남기는 편인데 남깁니다.
170,자막이 너무 커서 가려요.. 자막 설정 따로 할 수 있기는 한가요? 안되는거 같던데 자막.. 좀 어떻게 해주세여
171,필요한 여러기능이 함께라 편리하네요
172,음성이랑 장면이랑 싱크가 안맞네요 그렇다고 조절 할 수 도 없고
173,자막 퀄이랑 설정이 ㄹㅇ 개구림 걍 번역기돌린것 같은데
174,자막 개판임.컨텐츠가 디즈니치곤 상당히 개판이고 앱자체가 정리가 안됨
175,배속 기능 좀 만들어줘요
176,자막도 개판이고 컨탠츠도 없고 내서널 지오그라피하나보고 구독하는데 없어 똥이야
177,배속기능 반드시 빨리 만들어주세요
178,오월의 청춘 원해요 내놓으세요 플리즈
179,"한달만 할껄…
컨텐츠의 다양화는 기대도 안했고
적어도 앱은 넷플만큼 따라 잡을 수 있을텐데
국내 왓챠보다도 못하네요
넷플몇전전 어플보다도 못함
자막을 한국어로 해놔도 중국어로 나오고
특히 한국음성에 한국어로 해놓으면 중국어로(장애인이나 화면만 봐야 하는 상황도 있습니다 )
크롬캐스트로 내보내면 화면은 나오는데화면 아래 로딩하는 표시가 계속 나오고
영상이 풀레이되고 있는데도 포스터와 제목이 위에 고정되어 나오는경우도 많고 
휴대폰인아닌 티비리모컨으로 중간중간 넘길려 해도 힘들고 컨텐츠 찾기도 어렵고  관련 영상도 없고  랙도 잘걸리고, 쓰다 보니 끝이 없네요 쓰레기 앱부터 어서 수정 하시길"
