,0
389,자막크기 조절좀 할수 있게 해주세요.자막이 화면의 반정도 차지해서 자막을 보는건지 드라마를 보는건지 ㅜㅜ 모르겠네요.
390,자막 사이즈 설정 좀 알려주세요... 폰트.사이즈.설정이 안보입니다....
391,"자막에 검은 바탕이 있어서 보는데 상당히 거슬림.
초반에 어프닝 넘기기와 마지막에 다음화로 넘어가기 버튼이 랜덤으로 뜸.
시청 중에 화면 밝기 조정 불가능.
자막 설정이 좀 더 다양했으면 함."
392,와이프와 쿠팡 회원을 각자가입해도 부담이 없고 각자 쿠팡 플레이봅니다. 그런데 오늘 애플TV를 구입했는데 아직 애플TV 용 앱이 없다죠? 어서 개발해주세요. 이제 한국도 애플TV가 대세가 될거에요.
393,영어버전은 어떻게 설정하나요?
394,한국어 자막크기나 번역수준이 너무떨어져서 몰입이 잘안됩니다.
395,"자막이 살짝 이상하지만 전부 이해할 수 있고, 그냥 완벽합니다!"
396,ㄷ느스느느느ㅡ느ㅡ느
397,글씨 크기 설정 할수있게좀...티비로 보는데 안보여요
398,"자막뿐아니라 팝업모드, 화면밝기조절, 음량조절이 없어 너무 불편함.."
399,잘사용하고있었는데...갑자기.ㅣ.영문으로화면이바뀌어버렸어요..다시한국어로어떻게바꿔요ㅋ?기기한국어이상없고컴퓨터로접속해도영문이고..바꾸는방법이모르겠어요
400,배속 없으면 쓸 필요 없지. 마블 영화만 영화인 것도 아니고. 유튜브 무비로 볼렵니다.
401,자막이 거지같아서 더빙으로 듣고 컨텐츠가 한국은 늦게 출시하네요 보바펫 언제나오나 궁금하네요
402,배속 시스템이 잇었으면 좋겠어요.
403,자막수준 낮음 다음 화 재생 시 전체화면이 해제됨
404,엔칸토보는데 한국어자막이 아니고 중국어 자막이 나오네요 자막을 한국어로 설정해봐도 중국어나오는데 좀 고쳐주세요;;
405,자막주위에 검은색으로 씌워진 오류 계속 나네요ㅠ 씽크 안 맞는 오류도 해결 좀 요ㅎ
406,배속설정좀업뎃해주시라요
407,자막 정말 보기 힘드네요.. 주인공들의 관계도 제대로 이해하지 못하고 무조건 다 존대로 번역해놔서 집중하기 힘들어요!! 적어도 인물관계도는 이해하고 번역해주길.. 그레이아나토미 시즌 16 진짜ㅠ 그리고 속도 조절도 되었으면 합니다!!
408,자막이 나와서 좋아요^^
409,제가 본것중에 진짜 최고인데용???????!
410,돈내고보는건데 중간에 버퍼링걸리는건 해결해줬으면 좋겠네요. 콘텐츠는 완벽합니다! +)자막안맞는분들은 이렇게보세요. 이게맞습니다. 오디오:영어 - 자막:한국어
411,배속기능내놔라
412,배속 없습니다. 밀어서 진행 바 이동 기능 없습니다. 소형 화면으로 보는 기능도 없습니다. 일단 영상 보고 싶은게 있으면 각 잡고 처음부터 끝까지 보고 재미없거나 지루한 부분을 넘기려면 더블 터치로 10초씩 이동해야 합니다. 요즘 이렇게 불편한 앱도 오랜만인거 같습니다. 웨이브도 얘보다는 기능이 많을겁니다.
413,자막 오타에 앱 사용성 개불편하고 최악의 스트리밍 앱
414,자막개후짐 ㅋ
415,자막글씨가 너무작아요
416,가면라이더 이그제이드 빌드 제로원 세이버 넷플릭스에서 방송해주세요~음성 한국어로요 제발요
417,어플 업데에트 이후 영상 시청시 '로드 중'이라는 메세지만 뜨며 아무 영상도 볼 수 없음. 돈은 받아가면서 영상은 못 봄 ㅋㅋㅋ
418,배속재생이 필요해요
419,배속이 없는게 너무 아쉽게 한번 시청했던 영상은 없앨수가없네요
420,자막이 따로 있으면 좋겠어요
421,"자막이 시원찮아요, 전부 다 경어로 되어있어서 ㅡㅡ; 불편하네요"
422,한글자막이 안나옴
423,자막 구리고 걍 구림 모든게 구림 그냥 제발 하지마세요
424,배속 이랑 창모드 기능이 추가되면 더좋겠네요
425,자막이 너무 작아졌어요 키워주세요 눈아파여
426,배속기능 필요
427,"지금은 축구경기 중계나 SNL 정도 보고 있지만 앞으로는 다양한 컨텐츠들을 볼 수 있을 것 같아 기대가 됩니다.

근데 애플TV 지원이 빨리 되었으면 좋겠네요 ㅠ"
428,자막에 오타가 너무 많고 인물들이 말을 끊어서 하는데 자막에서는 붙어 나와서 불편합니다. 자막 좀 수정해주세요
429,심슨 정주행중//한국어 자막 실망스러움. 귀에 들리는 것만 해도 자막에 쓰인 것 이상으로 재미있는 표현이 많는데 다 생략됨.
430,자막 크기와 위치 조절할 수 있게 해주세요
431,번역 좀 바꿔주세요 제발요…
432,한글자막 있었음 좋겠어요 ~ 배경음은 줠라큰데 말소리는 개미소리만해서 안들리고 그런일이 많아서 자막필수임니다. 제일 안좋은건 결제할때 무조건 정기결제 아니면 못하게 하는 양아치짓 안했으면 좋겠음. 정기결제해놓고 깜박하게 하려는 악질 개수작 다보여욥
433,"자막 크기가 넘 작게 나옵니다
이미 여러분들이 지적한거 같은데
개선이 안되는걸 보니, 서비스 개선 의지가 별루 없는거 같네요
1년치 안 끊길 잘한듯…."
434,괜찮게 쓰다가 갑자기 아랍어로 바뀌어서 한국어로 계속 변경하는데도 주기적으로 아랍어로 바뀌네요. 무슨 문제인가요? 해킹이라기에는 다른 사람들과 계정 공유중인데 제 것만 이런 상황이라 좀 황당하고 계속 언어 바꾸려니 귀찮네요. 저만 이런가요?
435,"배속기능은 언제쯤 생길까요~~?
배속 기능을 정말 좋아하는 사람으로서 배속기능이 없는것은 좀 불편하네요"
436,번역이랑 자막 나오는 디자인 진짜 어디 토렌토에 영어공부하는 애들이 무료제공한거 가져다가 쓴 느낌ㅋㅋㅋㅋㅋㅋ 미치겠다 정말.
437,자막이 너무작고 빨리지나가서 읽기힘들어요
438,자막 번역기 돌리나?
439,배속 조절 기능 언제 넣어줄껀가요?
440,"자막, 배속 기능"
441,잘 사용하고 있습니다. 다만 저는 작품 중 분명 한국어 더빙판을 봤는데 관련 정보는 죄다 일본 성우만 표기되어 있어 불편하고 불쾌했습니다. 성우분들께는 배우와 같이 자신이 어떤 작품에서 무슨 캐릭터를 연기하셨는지 즉 커리어가 굉장히 중요합니다. 하지만 어느 작품에서도 한국 성우 표기를 볼 수 없더군요. 한국 성우 표기 제대로 부탁드려요.
442,배속 안돼서 안보게 됨 졸라 답답;
443,아니 이거 번역 이상하네요 단어 몇글자만 나오고 수정좀 해주세요 영화는 DC 저스티스인데 불편하네요
444,너무 기기지원이 늦어요 애플TV4k 지원좀 해주세요 너무 쓰기 불편해요
445,자막 설정이 안돼서 불편하네요 크기도 그렇고 위치 조정도 안돼고요
446,자막 크기를 설정할 수 있으면 좋겠습니다. 어두운 장면에 흰 자막이 크게 뜨니 장면에 몰입하기가 힘드네요.. 가시성 때문에 자막 색을 바꾸는건 무리일 것 같고 크기 설정이라도 되면 너무 편하게 사용할 것 같습니다.
447,자막 막 만들었어요.... 덕후도 쉴드가 안되네요....
448,자막 오류 빨리 해결 좀...
449,자막 크기 너무작아 집중이 안됩니다. 빨리 변경해주세요
450,앱 알림이 계속 오는데 수신거부가 안되요 설정>알림에서 수신거부하라는데 알림메뉴가 도대 ㅔ 어디잇나요??
451,탭s8 ultra에서 전체화면시 여백이 크네요
452,"자막 오타,오역이 너무심하고 중간에 다른앱 켰다들어가면 보던거 저장 안되고 초기화되서 불편해요. 외국어음성으로 설정하고 시청하는데 외국어 음성이 중간중간 안나오고 영어로나와요 소리도 너무작아요. 너무불편해요. 좀 고쳐주세요."
453,자막이 있는걸 보는데 처음에 자막이랑 관람등급안내가 겹쳐서 자막을 읽을수가 없네요. 처음내용은 버리고 보라는 건가요??
454,배속기능 좀 만들어줘오
455,자막 크기는 난 그럭저럭 괜찮은데 드라마가 다른 나라는 대충 6화까지 나왔다 치면 우리 나라에서는 3화 밖에 안 나온다거나 비하인드는 아예 안 나온다거나... 이게 뭐임...
456,"자막,사운드 모두 최상"
457,자막이 검은 줄만 뜨는데 대체 어떻게 보라는거죠 ㅋㅋ 설정하는 기능도 없네요
458,배속없음
459,키즈채널 만화들 중 몇몇이 번역 안된채로 올라가 있네요 한국어로 번역해서 올려주세요 성우 쓰실 비용이 아까우신가요.
460,"iOS, iPadOS 용으로 앱이 다 있는데 애플TV 앱이 없다는게 말이 안 됩니다. 애플TV에서 wavve, WATCHA, Disney+, Netflix 다 되는데 … 티빙만 안돼야 하는 이유는?"
461,자막이 너무 커요 ㅜ
462,S22 ultra 사용중인데 로고만 나오고 화면으로 안넘어가지는데 왜 그런거죠?
463,자막 진짜 답없네 넷플릭스 시스템 조금만 참고해도 나아질거 같은데
464,자막수준.. 자막 싱크도 안 맞고 중간중간 날아가 있기도 하네요ㅋㅋ 이딴 완성도로 뭔...
465,넷플릭스 처럼 한국어 자막좀 넣어주세요 외국어를 해도 자막이 안뜨네요 따른건 다 좋은데 개선좀 부탁드립니다
466,배속 없는게 너무 큽니다..
467,자막지원이 미흡하고 랜더링이 너무 길어서 보기 힘드네요 특히 720만 보려고 해도 바로 렉걸리네 내돈내고 보는건데 520으로 보는건 무슨 ㅋㅋ
468,"요금이상황데 계정이해킹당한줄알았는데 오류였네요 근데 어제 오류당했을때 닉 프사으로 바뀌고 스페인어로또바꿨습니다 닉을 한국어로 통역하면 순서대로 미친,사자별자리,핫도그,큰으로 바뀌었네요 한번더 해킹당하면 그해킹버뮤신고하겠습니다 (서버관리좀 잘해주세요)"
469,"다른건 다 좋아요. 근데, 자막기능만 어떻게 해주시면 안되나요? 마블영화를 볼려하는데 한국어로 듣는건 좀 이상해서 오리지널로 영어음성으로 하고, 한국어자막으로 볼려하는데... 자막이 한국어음성으로 설정해서 비교했을때랑 너무 다르고 안 맞아요.. 뭔가 로봇이 딱딱하게 번역한 느낌? 이여서 한국어자막으로는 도저히 마블같은 외국영화를 못 볼거같아요... 다른건 다 좋으니 자막기능좀 개선해주실 수 없나요? 부탁드려요 ㅠㅠ"
470,"자막? 자막 없는 부분 은근 있음, 컨텐츠? 디즈니라고 해서 기대했더니 없는거 투성이, 화질? 나쁘지 않음, 연결&동영상플레이부분 오류 은근 많음.....왜...결제했을까...."
471,자막크기좀 줄여주거나 자막 설정좀 만들어주세요... 자막이 좀 많이 크네요
472,한국사람이라고요.아니 앱 자체에서 언어를 바꿔주는 기능을 만들던가해야지 g메일로 등록하면 다 외국인인줄 아나 불편하구만 멍청해
473,"자막 수정 언제 할꺼예요?
아예 작거나 크거나
선택이 안되는건 넷플뿐이라구요
웨이브나 티빙 자막 좀 보시라구요"
474,한글지원
475,자막 장난하냐 구글 크롬캐스트 연결하니 자막이 개미똥만한데 현재로선 조치가 어렵다고? 월트 디즈니가 지하에서 울겠다 그거 프로그래밍 설정하는데 돈 얼마 든다고 다른 OTT는 호구라서 편하게 볼 수 있는 크기로 자막 맞춰주는거니?
476,자막크기 변경할수있게 해주세요
477,자막만 있으면 정말 완벽할텐데 자막 기능 개선해주시면 감사하겠습니다ㅠ
478,한글자막 지원해주세요 평소에 자막 켜놓고 보는 게 익숙해져서 자막이 없으니까 불편하네요...ㅠㅠㅠㅠ
479,자막 설정 없는건가요? 자막크기 너무 크게 나와서 조절하고 싶은데 아무리 찾아봐도 없네요 그리고 시스템 글꼴 따라가는것도 맘에 안들어요
480,배속좀 만들어라 뭐하냐
481,자막좀 어떻게 제대로 할수 없습니까? 영화: 토르-라그라로크 자막 보셨습니까? 대한미국놈이 자막을써도 그것보다 성의있게 만들겠습니다. 한국시장에 들어왔으면 이런거라도 제대로 해줘야 하는거 아닙니까? 자막들좀 제대로 해주세요.
482,자막이 안돼는게 있어요 빨리 처리해주세요
483,배속내놔요ㅠㅜㅜㅜ
484,한글 UI 지원이 안되나요? 영화제목이 다 영어로 나와서 찾기가 힘드네요
485,자막 어쩔거냐고요 아니 서비스 시작한지 벌써 몇개월인데 이런 말도 안되는 번역을... 요즘 번역기도 이런 식으로는 안하겠네요 짜증납니다. 독점하고 있는 미드 보려고 결제했는데 거지같네요
486,다 좋은데 해외 넷플에도 한국어 자막좀 추가해줘라; 못하는것도 아니고 한국판엔 있는걸 미국판엔 못봄.. 자막이라도 달아줘라 ㄹㅇ
487,자막 제거가 되지 않음
488,자막에 투자좀 하시지 요금제가 이렇게 비싸면서 투자라고는 안하네 정말..글로벌하게 짜다
489,자막이 진짜 쓰레기임. 비직관적이고 멍청한 의역들로 이해를 망침
490,"자막크기 설정 할 수 있게 좀 해주세요ㅜㅜ
휴대폰으로 볼땐 살짝 큰데
크롬캐스트 연결하고 티비로 보면 엄청 작아요"
491,배속할수있게해주셨으면좋겠습니다
492,"배속 안됨, 자막 테두리문제, 재생목록 지우기 없음 등등 대충 서비스하려는게 보임 ㅡㅡ"
493,한국 디플 상륙 하자마자 1년치 가입했어요. 어플 렉이 없어서 좋습니다. 다만 디즈니채널에서 하는 애니메니션들이 한국어 자막이 없어 더빙판으로 봐야하는게 아쉬워요. 디플이 한국 철수 안하고 장수하면 좋겠네요.ㅎㅎ
494,"시원한 화면으로 시청하고 싶은데, 뭔가 아쉽습니다. 언제쯤 애플TV로 시청 가능할까요?"
495,자막 동시에 띄울수있게 해줘요 한영 한일 한중 이런식으로
496,코미양 언제 들어오냐고. 한국인이 한국어자막을 굳이 vpn돌려서 봐야겠냐.
497,자막은 왤케 자주 씹혀서 나오는지 원... 첨엔 그러려니 하고 봤는데 점점 심하네요 크기도 쥐콩만하고.....
498,공부할려고 다운받는 사람도 있는데 영어 한글 동시자막 좀 다시 부탁드립니다.
499,자막좀.. 붙여줘요..
500,설정어디로들어가나요.잘못눌러 키즈 들어갔는데 키즈에서 빠져나올수없네요
501,자막 기능 없나요?
502,배속좀 추가해주세요!!!
503,자막 설정이 너무 불편해요 옵션좀 넣어줘요
504,번역 진짜 ㅋㅋㅋㅋㅋ 허사허사허사 이거 아직도 안고치네
505,수퍼소닉 음성 한국어는 안돼나요?
506,"한국어 컨텐츠도 한글 자막 지원이 되면 좋겠습니다. 지하철, 버스 등 대중교통 이용중에 외부 소음으로 인해 소리를 제대로 못듣는 경우가 종종 있는데 한글 자막이 있으면 유용할 거 같습니다. tvn, jtbc 컨텐츠는 티빙에 가장 많아서 좋습니다."
507,한국의 넷플릭스를 기대합니다
508,자막 개선 절대 안해줌
509,그동안 애플TV지원이 안되어 불편했었는데 지원되니 신세계이네요 너무 좋습니다
510,영어 자막좀 넣어주세요
511,자막이 왜이렇게 뜨나요... 자막이 두개뜨면 위아래로 나눠져서 뜨는게 아니라. (-고마워. -응나도 ) 이런식으로 한줄로 쭉 떠서 헷갈리고 이상해여.그리고 자막 글씨체도 제가 휴대폰에 설정해둔 글씨체로 떠서 기시감이 있고 집중이 안됩니다. 글씨체도 제 휴대폰 설정과 다르게 좀 고쳐주세요
512,배속 재생이 없어 너무 불편합니다. 빨리 Update해주시기 바랍니다.
513,배속기능이 없어서 아쉽습니다 빨리 생겼으면 좋겠습니다
514,배속기능없음. 그나막 10초당기기도 로딩걸리고 화질잠시 구려짐.. 돈벌고싶으면 더 준비좀하고 나오지..
515,한국적인 예능이 많은 것이 장점 같애요. 앞으로의 발전이 기대가 됩니다.
516,자막크기나 좀 조절하게.해주세요
517,자막좀 해주세요오오 자막시급합니다. 넷플보다가 티빙보려면 정말 답답합니다.
518,자꾸 언어가 멋대로 변경되던데 설정에서 한국어 해놔도 설정 안돼요
519,자막이 엉망 번역한 사람 만나고 싶을정도 욕하려고
520,타 ott와 비교했을 때 자막 기능이 없는 게 제일 아쉬워요. 배우들 발음이 안 좋을 때 한국어 자막 유용하게 쓰는데 개발 부탁드려요.
521,자막이 다른 ott들 보다 떨어짐. 번역이 이상하다는 소리입니다.
522,"배속 기능 넣어주세요. 
화면 밝기, 음량 제스쳐 넣어주세요"
523,한국영화에도 한글자막이있었으면좋겠어요 귀가잘안들리는데 자막이없어서 아쉬워요
524,자막이 한국어랑 영어랑 같이 나오게 설정 할수 있음 좋겠어요~! 미드를 많이 보는데 보면서 공부도 하면 조금더 유익할것 같아요
525,"배속 기능 주세요,,,,배속 기능 ,,,,ㅜㅜㅜㅜㅜ부탁드립니당,,, 덱스터도 보고싶어여,,,,,"
526,자막 갑자기 사라지는거 아직도 안고쳐짐ㅋㅋ 화면 넘기는거 빨리감기 개불편 다른 회차 보려면 뒤로간다음 회차 선택 해야함 편의성 개구린데 고칠 생각을 안하네
527,자막 왜 이렇게 됐어?? 크롬쓰면 불법이냐?? 똑같이 돈 내고 내 티비로 크게 보려는게 죄냐?? 예전에 있던 설정창도 없어지고!! 눈아파 죽겄다
528,영어 일본어 네덜란드어 전부다 괜찮은데 왜 한글자막만 대문짝만하냐고!! 한국사람들이 다 눈이 침침해보여?
529,자막크기 키울수있게해주세요... 너무불편해요 만족하는데 이부분 때문에 별 하나뺍니다 ..
530,배속도 없고... 밝기조절도 없는건 진짜 선넘네
531,영어집중듣기 하기좋네요
532,자막기능 / 언어선택 추가되면 갓벽!!!
533,다른 ott보다 제 스타일의 작품이 많아서 좋은것같아요
534,"배속기능이 있어 빨리 볼수 있고, 작은화면할때 자막도 볼수 있어서 좋아요~good~"
535,폰화면으로 크게 보다가 다른 앱 위에 보는 작은 사이즈로 줄이면 화면이 검정색으로 변해요ㅡㅡ
536,자막이 너무 조그만하고 자막이 위로 갔다 아래로 갔다 하네요 자막 수정좀 해주세요 이래서 디즈니가 망하는건가요
537,배속 기능도 있었으면 좋겠어요 그리고 폰으로 볼 때 밑에 시간 ‘바’로 넘기면서 보면 그 시간에 따른 미리보기 화면이 뜰 때도 있고 안 뜰 때도 있어서 불편해요 기준이 뭔가요?
538,한글 자막이없는 다큐와 외국영화들이 다수 있는데 외국어 공부해야 볼 수 있나요
539,한국어 자막이 아니더라도 외국어 자막은 있어야하는거 아닌가요. 한국 작품에 나오는 외국어에 자막이 없어서 알아들을 수가 없네요
540,의미없는검열 허접한 자막
541,"마블 미드를 보고 싶어서 결제했습니다만, 어플 관리가 최악이네요. 영어 오디오에 한글자막으로 보고 싶은데 자막이 절대 뜨지 않네요. 어쩔 수 없이 한국어더빙으로 보는데, 한국어더빙 오디오에선 자막이 지원되네요. 이런 개떡 같은 경우 처음 보네요."
542,자막 흰색.. 진짜 아닌 거 같습니다. 차라리 그냥 자막을 개인별로 조절할 수 있게 해주세요… 이전 자막이 훨씬 잘 읽힙니다
543,자막크기 개선이 아직 안됐네요..
544,배속기능이 생기면 좋겠습니다.
545,한국 드라마나 영화도 한국어 자막 볼 수 있게 해주셨으면 좋겠어요 소리 작게하고 볼 때도 많아서 ㅠㅠ
546,배속이 필요해..! 한국인이 좋아하는 속도로 보고싶다고요..!
547,대사와 자막이 싱크도 안맞고 자막이 휙휙 넘어가고 늦게 뜨고 아주 난리도 아니에요. 자막 누락도 있고요. 화질도 깨지고. 원하는 장면으로 이동하기도 없나요?건너뛰기 속터져요. 좀 빠르게보고 싶은데 영상배속도 못올리고요....에효..개선할게 많네요...
548,자막이 진짜 꽝이에요. 최악
549,배속기능좀 넣어주세요
550,자막이 없어서 좀 불편한것이 좀 있습니다 전반적으론 괜찮은데 자막이 없어서 아쉽네요
551,"번역이 이상한게 있네요 캡틴아메리카 시빌워에서 앤트맨 대사인데 ""날 고마워서 골라줘요""ㅋㅋㅋㅋㅋㅋㅋㅋㅋㅋㅋㅋ 대체 무슨말인징ㅋㅋㅋㅋㅋㅋㅋㅋㅋㅋㅋㅋㅋ 그리고 내가 못찾는건가... 시청내역을 못찾겠네요."
552,다른건 2배속도 있는데...여긴 무조건 1배속
553,한국만 공개 느릴거면 그냥 한국지부 없애라..
554,번역가 좀 제대로 써라
555,한국 작품도 한국어 cc 만들주세요ㅠ 가끔 발음이 씹혀서 자막이 없으니까 이해하는데 어려움이 있어요 자막 있으면 훨씬 좋을거 같아요
556,자막이 없어서 슬퍼요... 볼건 많아서 좋은데 자막 기능이 없어서 슬퍼요
557,한국에 살고 있는 외국인은 어떻게 가입하나요?
558,"배속기능 넣어주세요 영상 보는데 불편함이 있습니다.
다른건 너무 만족스러워요"
559,자막에 음영이 없었으면 좋겠고 자막이 원래 나오는 자막을 가리는 현상이 있네요 범죄도시 참고하세요
560,영어여서 아쉽네요.
561,자막 검은배경 빨리 없애주세요ㅠ
562,배속기능 좀 제발 만들어주라!!!!!!!!!!!!
563,배속 좀.. 제발......
564,배속 왜 안되냐 씹즈니
565,자막 크기 조절 없어 영상 밝기 조절하는 것도 없어 심지어 영상 로딩도 안 되는데 도대체 앱으로 뭘 하라는거지
566,자막이랑 화질 좋아요👍👍👍 근데 국내 영화 중에 자막이 있는 게 있고 없는 게 있던데 자막을 다 넣어주실 수는 없을까요? 자막 설정 들어가면 설정 안 함 이라고만 되고 안 돼서 불편해요
567,한국영화 발음이 안들리는 경우가 많아 자막을 틀때가 많이 있습니다. 그러나 자막을 틀면 행동지문까지 나와 몰입에 방해가 됩니다. 행동지문 없이 티빙처럼 자막만 나오면 훨씬 보기 편할 것 같습니다.
568,"번역이 너무 지멋대로 인것같아요. 반말하던 시즌1 이라치면 시즌 3에서 아니면 몇화가 지나고 높임말하고, 왓다갓다하는 번역에 몰입도가 떨어지고 짜증나요"
569,축구볼때마다 안되면돈환불가능한가요? 몇번째인지모르겟네요 단독중계써잇음머해보지를못하는데 이정도면 그냥 능력없는데 돈만벌라고하는거아닌가요?
570,한국 vs 태국 이강인선수 경기 왜 지금 안나오는겁니까?
571,한국 태국 u23축구 생중계 보려고 새로고침만 20분. 짜증나서
572,배속재생좀 ㅠㅠ
573,자막이 마음에 안듬 글자크기를 더크게 할수있거나 글자 테두리 굵기를 더 굵게 했으면 좋겠어요
574,자막 끄기도 없는 쓰레기앱
575,"자막설정도 잘 안되고, 빨리 넘어가기도 안되고... 저는 별로였어요."
576,"영어자막이 없는 콘텐츠가 많아서 아쉽습니다
영어자막을 많이 추가해주사면 좋을거 같아요"
577,자막꼬라지 레전드임
578,"어플 불편한건 둘째치고 번역때문에 참고본거 그냥 해지함,... 영화 원본언어로 보는걸좋아하는데 번역이 한국어랑 비교하면 봐야하는수준"
579,한국어 더빙 좋아요
580,"한국영화 최고의 어플
제발 잘되서 더 번창하세요
응원합니다 파이팅"
581,"자막 세부설정도 안되고 터치도 진짜 불편하게 돼있음,,

+)어플 진짜 쓰면 쓸수록 거지같네;;;;;
컴퓨터로 보면 내가 어디까지 봤는지 기억 절대 안해줌 ㅋㅋㅋㅋㅋㅋㅋ 이딴게 다있냐
그간 접해본 플랫폼 중에 제일 쓰레기임"
582,"자막 이외에 음성으로 소설글 읽듯 상황 설명하는건 신세계라 너무 좋은데... ui 불만도 그렇고 가장 큰 불만은 다른 ott들은 2배속이 있고, 넷플릭스도 1.5배속이 있는데(넷플릭스도 1.5배속이 최대인건 별로임) 디지니는 가장 큰 약점이 배속이 없다는 것때문에 별점 2개..."
583,언어가 왜바뀌는거요? 스페인어로바뀌면 우째알아묵어요..환장하겄네..
584,한국영화도 자막이 나오면 좋을것같아요
585,한글자막이 있으면 좋을거같아요 ㅠㅠ 넷플은 있는데 아기가 자고 밤에 볼때 소리없이 보는데 한글자막이 없어서 너무 아쉬워요 한글자막 부탁드려요
586,"볼것도 많고 다좋은데 한국껀 한국어 자막안됨 웅얼거려서 진짜 무슨말일지모를경우엔 돌아버리기전까지 돌려봐야함 우블이 여기없기에망정..제주도 토박이아니면 못볼지경...제발 한국영화,드라마,예능 한국어 자막좀 제발"
587,자막불편
588,자막 글씨가 너무 작아요 좀 키워 주든가 아님 조절 기능좀 넣어 주세요
589,"언어학습자를 위해 반복재생기능있었으면.,"
