,0
202,자막 싱크가 10초정도 차이나네요. 도저히 볼 수가 없어요
203,"자막설정되있으면 영상 재생할때마다 자동으로 자막 뜨게 해주세요! 매회 자막설정들어가서 설정해야되서 불편합니다~
그리고 오프닝이나 줄거리 건너뛰기기능도 만들어주세요!
쿠팡회원으로 단품무료배송 반품비없는거나 다 편하게 쓰면서 혜택도 많고 저렴하다고 생각했는데 ott섭스도 이용할수있다니 혜자스럽네요ㅠㅠㅠㅠㅠ몇가지 기능만 개선해주세용"
204,"배속, 팝업 설정이 있음 참 좋겠습니다"
205,익숙해져서 사용이 편해요 다만 멀티유저 개인별 패스부여필요
206,자막싱크가 안맞아요..
207,자막 번역이 급하게 진행되나보네요. 영어 대사 스크립트를 보고 번역하지 않고 들리는 대로 번역한 티가 나는 지점이 많네요. 오역리포트 같은게 있나요? 없으면 만들어서 품질관리를 해야할 듯.
208,자막 기능을 발로 만들었나 싶다
209,이게 좋지만 몇몇 편들은 자막이랑 음성이 한국어로 없어요.빨라 고쳐주세요(특히아발로 왕국의 엘레나 시즌2 18화요)
210,영어음성에 한국어자막나오도록 설정하고 싶은데 어떻게어디서바꾸는거죠ㅜㅜ
211,배속없으면없다구래야지 한참찾았잖.. 자막도 넘 별루
212,자막번역이 개같네요
213,자막패치진짜...중간중간 끊겨서 영화를 볼때 몰입도가 떨어짐 중간에 보다가 자막때문에 때려침 디즈니라 믿고봤는데 이게뭐냐 ㅋㅋㅋㅋㅋㅋㅋㅋ;;;;;;;
214,오역이 많고 아이들보기에 번역표현이 부적절함
215,"쿠팡을 갓팡이라 하는 이유 중 하나가 바로 쿠팡플레이일 정도로 감동받으며 서비스를 이용하고 있습니다.
아이폰, 아이패드, 웹OS등등 잘 사용하고 있는데요, 애플TV용 앱이 아직 없어서 많이 아쉽습니다. 
애플TV용 앱을 어서 빨리 서둘러 출시해 주시면 감동은 배가 될 것 같습니다.^^
감사합니다. 쿠팡!!"
216,자막오류는 지금 많이 괜찮아 졌고 넷플은 약 만 이천 원 내야지 고화질인데 디즈니는 그런 차별없이 설정에서 바꿀수 있음 그리고 댓글에 있는 불편한점 거의 고쳐짐
217,"TV에서도 보고싶은데, 애플TV용 앱도 출시해주시면 안될까요?"
218,외국에서 한국어 영상을 볼때 한국어 자막을 사용할수 없습니다.
219,자막과 더빙이 많이 아쉬워요ㅠㅠ
220,근데 좀 불편해요 한국어여도 자막 설정 가능하게해주세요 그리고 재생로딩 없애주세요 뛰어넘기 빠르게되게해주세요 넷플릭스랑 똑가기만하면 대박날거같네요
221,자막 보기로 설정했으면 계속 뜨게 해주세요 이어보기하는데 제가 자막 일부러 끈 것처럼 안 나와요. 다시 설정을 눌러줘야지(심지어 자막 이미 한국어 선택돼있음) 자막이 나옵니다
222,번역 누구니? 진짜 나와
223,"배속과 자막좀 최대한 빨리 많들어주시면 감사하겠습니다 ^^,,"
224,동영상을 볼 때 시간 10초 앞으로가기를 누르거나 영상시간 앞당기면 한국어으로 듣고 있는데 자꾸 한국어 자막이 나옴 제발 고쳐주삼
225,음 가격대비 좋아요 영어 자막으로 보고싶어거 영어 자맏선택하면 한국어나와요 전에는 영어자막나왔었는데 왜 한국어로 나오는지 ㅠㅠ
226,번역도 엉망 단어 번역대신 ?로 나오는 자막 수시로 ?자막에 오타도 빈번 회차가 섞여있음 앞내용을 중간에 끼워놓다니 최악이네요
227,자막 폰트가 폰은 넘 크고 중간에 있고 컴은 넘 작아서 눈 아파요. 자막이 뜨지 않는 오류도 있어요. 아무리 처음이라지만 갈길이 아주 멀어 보이네요.
228,한국어작품 외국어더빙 기능 및 한국어자막설정 가능한가요 있으면 좋을거같은데
229,전체관람가 영화에 한국어 오디오가 없는게 많아요 아직 자막 읽기 힘든 어린아이들 위해 한국어 오디오를 많이 도입해 주세요 타 ott서비스에는 전체관람가 영화에 한국어 오디오가 많습니다
230,자막이 말보다 빨라요 글자에있는바탕색과 글자크기도 개선이 필요합니다
231,크기 좀 줄여요
232,"자막이 티비로 봐도 작아요 
너무 불편 합니다 
좀만 더 크게 해주세요 

자막 크게 해달라 🙏🏻🙏🏻🙏🏻🙏🏻🙏🏻🙏🏻🙏🏻🙏🏻🙏🏻
눈아프다구요 🙏🏻🙏🏻🙏🏻🙏🏻🙏🏻🙏🏻🙏🏻

자막 자막 자막 크게 크게 크게 
자막 자막 자막 크게 크게 크게 
자막 자막 자막 크게 크게 크게 
자막 자막 자막 크게 크게 크게 
자막 자막 자막 크게 크게 크게"
233,자막조 크게 해주든가 사이즈 설정 가능하게 해주세요!!!!!!’ㅜㅜㅜㅜ 제발요
234,자막이야 영어듣고 알아서 하면 되는데 pip 안되는건 시대에 뒤떨어지는 개 에바임....ㅠ ott의 기본은 pip아닌가요? 왓챠 반만해주세요 ㄹㅇ
235,자막크기좀키워줘요 너무작아서 못보겠음
236,자막에 영어랑 한국어 둘다 있는데 왜 영어자막은 안뜨고 한국어 자막만 뜨나요? 어제까지 영어자막으로 잘봤는데 갑자기 이러네요?
237,자막 지 맘대로 바뀌는 거 언제 고쳐 주시는 거예요? ㅠㅠㅠㅠ 업뎃이 세 번 네 번 될 동안
238,"자막 테두리 문제, 팝업화면 불가, 검열로 인한 업데이트 지연, 기타 등등..."
239,자막 누가작업함?
240,자막이 병맛! 자막하는 사람 교체하숑 자막이 안좋아 결제 미루는중..
241,자막 좀 바꿔줘요ㅜㅜ
242,"자막 하나만 나오게 하지말고
두개이상나오게지원좀 해주세요"
243,"배속 기능, 락 기능 추가해주세요"
244,한글자막이갑자기안나와요 전중드시청중입니다.
245,자막이 너무 별로입니다.. 이래서 전문 번역가가 필요한거구나 싶은 자막 퀄리티..자막 크기도 다른 ott 에 비해 너무 커서 영상 시청에 방해가 됩니다 그리고 한글+영어 이중 자막이 있었으면 좋겠어요
246,자막은 어떻게 없애나요? 자막땜에 신경쓰이네요ㅠ
247,"이긴 한데, 제 기기만 그런지 모르겠으나 노트북이나 데스크탑에선 안그러는데 모바일에서 볼 때 항상 자막 설정을 다시 해줘야 합니다. 어플 켰을 때 자막 설정 누르면 한국어에 체크되어 있는데 자막이 안떠서 자막없음 눌렀다가 다시 한국어 눌러야 자막이 뜹니다. 심지어 다음 화로 넘어갈 때마다 자막이 꺼져서 다시 켜줘야 합니다. 같은 시리즈인데 어떤 화는 다음 화로 안넘어가고 멈추기도 하고.. 확인하고 수정 부탁드립니다"
248,자막좀 제대로 달아주세요 다큐멘터리는 자막이 있는 부분도있고 없는 부분도 있네요 그리고 오역도 너무 많아요 제발 자막좀 다시 제대로 달아주세요
249,자막설정이안되네요.외국영화에자막이 안뜨는데
250,영어자막이 안되는데 왜그런가요
251,"자막좀 넷플릭스 반만 따라해봐 자막 스타일변경이 왜 앱자체에서 없냐? 자막높낮이도 개판이고 사용성 최악!! 아이패드로에서도 사용중인데 밝기 최대로해도 어두워서 명암, 색감 다 뭉개짐"
252,삼성TV에서 자막이 반 잘려서 나옴
253,자막 좀 제대로 설정해라 한국말 번역도 이상하곸ㅋㅋㅋ... 번역하기 귀찮았나;;; 대충 번역한 것 처럼 나오고 이상하고... 자막 갑자기 스킵 되는 경우도 있고 위치 설정도 한 곳에만 두고 하지 왔다리 갔다리 진짜 보기 힘들다 소리도 최대로 키워도 키운 느낌도 안들고.. 이게 맞아...?
254,영어자막되는건 뭐에요?
255,진쨔 다 너무 좋은데 한국드라마나 한국영화에도 한국어 자막 넣을 수 있게 해주세요ㅜㅜ
256,한글 자막 없는 경우도 많이 있고 다음회차로 넘기기가 불편합니다. 앞으로 개선되리라 기대합니다
257,더빙으로볼때 자막끄는데 외국어글씨 나올시 자막이 안나오때가있음
258,자막이 안뜨네요. 한글자막 어떻게 나오게하나요?
259,한글자막 아예없어서 영어로 들어야되네요;; 한글판 아니면 영어니;;;; 자막 제대로 넣고 설정할 수 있게 해주세용 그리고 좋은데 영화 만화 많이 좀 놔주세용 9900원... 돈 아깝지않게... 그리고 (이건 팁인데 켤때 디즈니 특유소리 넣으면 게임처럼 중독된거처럼 좋을듯 인텔처럼..) 맞다 메뉴 번역도 이상함;;; 글씨 짤린것처럼.... 한국인 직원이없나... 그리고 영화평점 추천 좋아요 그런것은 왜 없을까요 ㅠ 아그리고 이제 자막 되네오 근데 진짜 파파고 구글 번역 돌린거같아서 직역번역은 영화의 감흥이 떨어지네요;;;;;; 자막 안 보는게 나은듯.....
260,자막도 불편하고 불편한게 한두개가 아닙니다. 넷플릭스 보고 좀 배우길...
261,자막 번역이 개판입니다... 그리고 한 영화에서 영어 대사 나오다가 다른 언어로 하는 대사가 나오면 자막이 한국어번역을 안해줍니다ㅋㅋㅋㄱㅋ 그냥 자막을 안 띄워주는 식이에요. 걍 어이가 없어요... 번역도 이상할뿐더러 심지어 제대로 해주지도 않고 자막 폰트 가독성도 떨어져서 잘 보이지도 않구요. 디즈니 돈이 좀 없나요? 제대로 된 번역가 고용도 못할 정도는 절대 아닐텐데요;; 세계 최고의 캐릭터산업 회사 아닌가요 번역 신경좀부탁드려요
262,자막꼬라지가 참 가관이네요ㅋㅋ....
263,한국 더빙이 거의 없어 아쉽네요.
264,"한국 영상- 한글 자막에서 번역체(속된 말로 언어 시험 때나 볼 수 있는ㅋ)라고 할까요 예를 들자면 '아, 맞다'라고 하는걸 '아, 맞는다'라고 하는? 충분히 청각장애인분들도 속어, 은어 다 아시는데 좀 아쉬움이 크네요"
265,한국 민주화 운동을 왜곡한 설강화를 플레이리스트에서 삭제하지 않으면 구독취소합니다.
266,번역 구린 건 참아줄 수 있지만 설강화는 못 참겠네요 손절합니다
267,자막이 틀리는 영화나 만화가있어서 아쉬움
268,자막 번역수준이 타사대비 떨어집니다. 그리고 빠른배속으로 볼 수 없는게 불편해요.
269,한국 역사를 왜곡하는 내용인데 저걸 올리다니
270,자막이 자동으로 안나오고 꼭 자막을 눌러줘야 적용이 되네요.. 아이폰 xs max ios15.1입니다
271,자막설정에 자막이 없는걸로나와요 업뎃해주세요!
272,자막이 안떠요 까만 블록만 나오고..
273,번역을 볼때마다 눈을 의심할 수준입니다
274,"자막 퀄이 좀 떨어지고 UX도 넥플 대비 별로인 점, 반응속도가 느린 점이야 뭐 개선의 여지가 있으니 차치하더라도, 설강화로 대대적으로 홍보하는 걸 보면 무슨 생각을 하는지 대충 알겠습니다."
275,배속 기능 원해요 제발 1.5배라도. . . ..
276,"인도네시아에 사는 한국사람인데, 설정에서 선호 자막을 한국어로 했는데도 특정 영상에서는 한국 자막이 없습니다. 그래서 그냥 아직 한글 업데이트가 안됐나보다 했는데, 한국에 사는 지인한테 물어보니깐 한국어 자막이 있다는군요? 참 어이가 없는게, 한국어 자막은 안돼는데 인도네시아 자막과 함께 중국어 자막도 있습니다. 저는 설정에서 중국어 자막을 고른적이 없는데요? 이게 시스템상의 문제인건지 제 계정에 오류가 난건지는 모르겠지만, 다른 사람들 반응을 보니 저처럼 외국을 자주 가시는 분들은 이미 몇년 전부터 호소하고 있는 문제더군요. 도대체 왜 특정 나라에서는 특정 자막을 막아놨습니까? 그냥 애초부터 다 풀어놓고 우리가 고를 수 있게 하면 좋은거 아닙니까? 제발 고쳐주십시오."
277,어벤져스보고있는데 한국어자막으로 설정을 해도 부분부분 중국어로 뜨는 것 좀 고쳐주세요 정말 짜증나서 못보겠어요 제발요~~~~
278,한국에서 밍사용료도 안 내고 무임승차한 주제에 요금까지 인상했네
279,한국에 대해 전혀 파악안하고 들어온듯
280,자막 디자인 설정 좀 통일해주세요. 앱마다 일일이 설정을 해줘야 하고 검은색 백그라운드는 왜 되어있는 거죠? 그거 없애도 자막 윤곽선이 안되어있어서 밝은 화면에서는 자막이 보이지도 않아요. 자막 문제 개선될 때까지 이 별점 유지하겠습니다.
281,자막이 코딱지만하게나옴. 돋보기쓰고 보라고 만든거임?그리고 자막위치가 왤케 위에있나요. 그리고 댓글 쓰자마자 메크로 복붙답변 진짜 개같네.
282,매회마다 계속 한국어 자막 눌러야되요 수정좀부탁드려요ㅠㅠ 미드볼때 한국어로 체크가 되어잇는데도 자막안떠서 한국어 한번더 뉴르고 완료로 매화마다 눌러야 자막이뜨네요 삭제하고 다시깔아봤는데도 똑같아요
283,한국시장을 전혀 고려안함
284,자막은 구리고 개같은 드라마나 만들고
285,자막 .. 제발 자막 왤케 왓다갓다 거리는지 .. 영어 눌러도 안나올 때 잇고 애초에 한글로 자막 설정 되어잇는데도 자막 안나올 때도 잇고 .. 개발자? 관계자? 분들도 다 아시는 내용이겟죠? 기다릴게요 .. 꼭 좀 수정해주세요ㅠㅠ
286,한국어 음성지원이 안되는게 이상함.일본어는 지원하더만요~ 자막이 보기 불편해요~ 영상과의 크기가 안맞는거같음 N사와 비교하자면 화면을 보면서도 자막이 눈에 들어온다면 디즈니는 자막을 찾아서 봐야함 에휴~~ 그리고 왜 다음화로 넘기는 버튼이 없음~??
287,설정-알림설정 자체가 없는데 어디서 끄라는거임?
288,자막문제... 자막이 너무작아요... 너무 커도 안됩니다.... 자막 제발 중간크기좀 맞춰주세요ㅠㅠ
289,한국컨텐츠가 많아서 너무 제취향😘
290,자막 크기가 너무 커요... 화면을 너무 가려서 이 부분이 좀 아쉽네요 다른건 좋습니다 ~
291,자막에 오역이 많고 자막의 가독성이 좋지 않은 것 같아요 ㅜㅡㅜ 빨리 개선됐으면 좋겠네요
292,자막 너무 가독성이 없어서 피가 거꾸로 쏟아져 버렸어요 이런 식으로 해서 돈을 버실려고 하신건가요?
293,영상들에 많은 것들이 일본어 더빙이 있는데 한국어 더빙은 굉장히 조금 한국 사용자 차별 선택 할수있는거랑 없는거는 큰차이에요. 한국유저도 고객입니다. 공평하게 서비스 바랍니다.
294,자막에 실행문제에 설강화까지... 관두자...
295,쑤1ㅅ. 2.
296,배속 좀 넣어라 답답하다 진짜
297,"어제까지만 해도 자막 잘되었는데 
엔칸토 한국어 자막 선택해도 중국어 자막으로 나와요 문제 해결해 주세요"
298,자막 좀 어떻게 해야될듯 합니다 오역도 많고 번역 안되는 언어도 있네요
299,자막이 별로고 화면 밝기와 소리 높이는걸 화면에서 바로 할 수 없고 다음화 바로보기가 없어서 불편해요
300,자막이 번역이 아예 틀리지는 않은데 어색한 부분이 꽤 있어서 아쉬워요 ㅜㅜㅠ
301,번역 문제와 아직 한국에 방영못한 컨텐츠만 더 추가하면 괜찮을 것 같아요
302,영어로 설정한 언어설정이 다음화로 넘어갈때마다 한국어로 바뀌네요 계속바꿔줘야하는 번거로움이있어요 한전설정한 언어가 바뀌지않게 수정해주세요
303,자막 좀 이상한거 말고는 괜찮아요
304,더빙 자막 개판 싱크도 안맞고
305,배속만 됐다면 참 좋을텐데..
306,자막도 제대로 없음 절대 쓰지마셈
307,자막이 너무 커서 화면을 가립니다. 자막좀 아래로 조금 작게 해주시길 바랍니다.
308,자막좀
309,자막이 엉성한데가 은근 많네요 안뜨는 경우도 있는거같고 마블덕후라 어쩔수없이 구독합니다.. 시정해주시면 바랄게 없네요
310,배속기능이 있었으면 좋겟어요!
311,자막을 영자막.한글자막 무자막 선택할수있도록해주세요. 넷플도 디즈니도 다되는데 ㅜㅜ휴
312,자막ㅡㅡ
313,자막이 조금 안맞음
314,자막 개같네
315,자막이 핵구림
316,정말 잘쓰고 있었는데 엔칸토 한국어 더빙이 사라졌네요...
317,한국에서 장사하는거 포기했다고 봐도 되지?
318,한국어자막 설정했는데 와 중국어 자막이 나옴? 자막팀 일좀 제대로 해라 진짜 엔칸토랑 로키릉 특이 2021년도에 나온거 계속 중국어자막나와서 더 빡침
319,앱에서 자막스타일변경 가능하게 만들어봐라
320,볼게많아서 영어공부하기 좋아요 영어 한국어 통합자막이 있으면좋겠어요(진짜 제발ㅜㅜ)
321,배속기능좀 만들어줘요 제발ㅠㅠㅠㅠㅠ 배속기능 필요해요.... 답답해 죽을맛
322,"번역이 너무 엉망이네요
덕분에 영어공부가 절로 된다는;;"
323,자막 크기 조절할 수 있게 해주세요.
324,한국 시장에서 장사하려면 적어도 ALl등급은 한국어더빙 지원이 되야하는거 아닌가요? 아이보려고 결재한건데 나홀로집에도 그렇고 라푼젤시리즈도 그렇고 한국어더빙이 안되네요. 일본어지원은 되던데 말이죠. 12개월 결재했는데 지금 끊어버릴까 심각하게 고민중입니다.
325,자막도 쓰레기인데 설강화와 중국이 많이 묻었네? 믿고 거름. 마블에 디즈니 묻어서 마블도 탈덕함
326,한국 시간으로 새벽 네시쯤 결제가 되던데 :) 한국 시간에 맞춰서 결제 하세요
327,심슨네 가족들 하나 보고 돈 냈는데요. 한국어 자막을 뭐 조선족한테 맡겼나요? '대'랑 '데'도 구분 못하는거 보고 기가 막혔습니다. 게다가 부부 사이 대화 번역도 그래요. 지금이 어느 시대인데 남편은 반말하고 아내는 존댓말쓰고; 장난합니까? 번역 좀 어떻게 해보세요 제발
328,자막이 너무 부자연스러움 개선바람
329,자막오류도 너무 심하고 배우가 말 하는거랑 자막이랑 안 맞아요. 그리고 다음화로 바로 넘어갈수있게끔 해주세요 자동 재생이 없으니 보다가 다음화 보고싶으면 화면 나와서 다시 눌러야하고 너무 번거로워요 그리고 렉도 너무 심하고 특히 자막오류 진짜;; 초창기는 그렇다쳐도 아직까지 오류가 있음 어떡하죠? 하나하나 다 고쳐주세요.
330,자막 크기 설정좀 할 수 있게 해주세요... 너무 작아요 안보여요....
331,"자막 2개 설정기능 이거 하나면 
외국어 공부하고 싶은사람 전부 다 구독할겁니다

추가 안해주면 취업해서 바꿔버릴거에요"
332,"배속버튼 필수, 2배로 보는거 좋아하는데 정속도로 보니 진도가 안 나감"
333,자막보는법
334,자막으로 보는데 사람 말 소리는 작고 효과음이나 배경음악은 커요.
335,자막 지원이 빨리 됐으면 좋겠네요. 다른 OTT 어플에서 가능한 것들이 지원을 안해서 너무 불편해요ㅠㅠ
336,자막을 끄는 기능이 생겼으면 좋겠습니다. 영상을 볼때 자막 때문에 거슬린 부분도 많았거든요.
337,자막 번역퀄리티만 향상되었음 한다
338,한국 넷플엔 안나오는게 많아요 좀..
339,번역 오류 좀 고쳐주세요 너무 많아요
340,자막이 좀 이상함
341,배속으로 볼 수 있는 기능이 없어서 아쉽지만 나쁘지 않음
342,배경이 하얀색이면 자막 색도 하얀색이라 자막을 볼 수가 없네요
343,자막이 많이 미흡합니다. 개선되었으면 하네요. 한국영화 예능및 드라마도 장소에 따라 자막도 같이 보기도 하는데 자막따로 더빙따로라 보는데 많이 불편합니다. 넷플릭스의 기능이라든가 자막이 디즈니플러스에 비해 훨씬 안정적으로 보입니다. 많은 개선이 필요합니다.
344,설정 및 조작 등 편리성에 있어서 완성도가 너어어어어어무 떨어져요 개선이 시급합니다
345,자막싱크 안맞아요
346,자막 이상함
347,한국어자막선택하는데 왜자꾸 중국어 자막나오냐고!!!!!! Make Korean subtitles stable!!!
348,네셔널지오그래픽 자막 보는게 불편합니다. 그리고 자막 설정 한국어로 했는데 유지가 안되고 다른편 볼 때마다 다시 설정해야 됩니다.
349,"한글자막 있고요. 자막 언어선택이 엄청 많네요. 디즈니답습니다. 아쉬운게 있다면 앱에서 밝기 조절이 불가능하다는 것, 이중자막이 불가능하다는 것 입니다. 재밌는 영어공부에 목마른 저같은 사람들을 구원해주세요. 이 가격에 디즈니로 영어공부할수 있다? 다 할듯"
350,자막을 어플 내에서 따로 설정할 수 있는 기능이 필요합니다
351,자막좀 신경써라 개 거지같아
352,한국어 자막 이외에도 영어자막 요함. 끊기는 것 개선 시급함.
353,"자막 상태는 정말이지 최악입니다. 한국어 설정 했더니 중국어 나오고 이상한 한자랑 물음표가 섞여서 나와요. 그나마 정상적인 글자가 나오면 오역입니다. 너무 치명적인 오역 많고요 그 유명한 '이제 가망없어' 나 '어머니' 도 고치지 않았답니다.
마블빠 디즈니 애니빠 아니면 비추입니다
덕후이다? 한달이면 콘텐츠 다 봐요."
354,"너무 잘 보고 있습니다.
혹시 애플TV로 서비스는 언제쯤  가능한가요?"
355,번역둘째치고 자막 싱크도 안맞아?
356,자막 위치가 뭔가 애매 ... 넷플에 비해 쓰기 불편하게 만들었지만 디즈니 몰아보기는 너무 좋아요👍🏻👍🏻
357,한글자막 쓰레기 수준임
358,배속 기능 좀 만들어줘여 ㅠㅠ
359,자막 개선과 저장용량만 덜 차지하면 좋겠습니다
360,자막... 휴
361,자막크기 조절은언제 되나요
362,한국어 자막을 보고 싶은데 자막을 없어서 너무 실망했습니다. 드라마 보다가 가끔씩 대사가 못 들었고 뭐라 말하는지 궁금해요...ㅠ 자막을 꼭 넣어주시면 좋겠네요... 그리고 교육도 자막을 넣었으면 좋겠습니다.
363,자막 ㅎㅌㅊ
364,자막 수준이 영어 잘하는 고딩한테 맡겨도 이거보단 나을듯. 영화도 그렇고 디즈니 플러스도 이런거보면 뭔가 뒷거래가 있는거 아닌가싶다. 피씨와 탭에서 잘되는 다음 화 자동 재생도 폰 어플에선 안됨.
365,자동결제 해지하려고 들어갔는데 코인 받고싶지고 않았는데 맘대로 줘놓구 해지는 못하게 해버리네요? 회수해가세요. 살다살다 이렇게 갈취하는 ott서비스는 처음봅니다.
366,자막이 중간에 안 나올 때가 있어요 그거 빼면 좋아요
367,자막이 진짜 개판이에요 그레이아나토미 시즌16화 10회이후 자막쓰신분바뀐거같은데 앞편한편만보고 썻어도알았을텐데 반말하던사이 다 존대쓰고 번역도개판이에요
368,"1. ex) 한국어 영어 자막 동시 재생 어디쯤인가요 넷플?
의견 좀 제발 들어주세요.. 왓챠는 옛날부터 되던 걸...ㅠ

2. 아이패드에서 스플릿뷰 가능하게 기능 지원해주시면 좋겠어요."
369,자막이랑 싱크가 안맞을 때가 있네요! 그것 말곤 괜찮습니다
370,자막이안나옴
371,자막있으면 진짜 좋겠다
372,자막설정 되게 수정부탁드려요
373,"자막 설정이 되는게 있고 안되는게 있네요,, 수정부탁드려요"
374,배속 기능이 없다는게 말이 되나
375,베트남에서 한국어 설정 어떻게 하나요?
376,자막설정 좀 만들으세요ㅡㅡ 홈페이지에서 해도 설정이안되네
377,자막 조절할수있는 기능이있으면 좋을거같아요!
378,자막 쓰레기 수준
379,자막오류 및 저질번역이 나아지기는커녕 새로 추가된 이터널스에도 똑같음
380,"자막 오역, 영화 소개 부분 성의없음"
381,디즈니 플러스 추억팔이로 팅커벨 날개의 비밀 봤는데 왜 한국어버전이 없죠? 다른거 몇개는 있는데 팅커벨4만 없는것 같아요.있었으면 좋겠네요.
382,더빙은 없나요?
383,자막 왜이래요;;;; 자막 안보일 때도 있고 위치 지 맘대로 바뀌고 존댓말 반말도 이상하고... 화질도 매번 구리게 저화질로 재생되고.. 아주 디즈니랑 마블 컨텐츠가 인질이고 멱살잡고 끌어가는 수준이라 느껴지네요.
384,배속도 없고 자막설정도 구림 보던영상 이어보기 탭같은것도 없고 번역수준도 시청에는 문제없지만 부족한편이 많음
385,자막이 전부 됐으면 좋겠어여 넷플로 자막설정하고 보다보니 안 뜨는건 웅얼거리는 느낌이라 답답하네요ㅠㅠ 폰에서 티비연결도 됐다 아니였다하고 개선되었으면 좋겠습니다
386,배속 기능이 있으면 너무 좋을 것 같아요
387,"자막은 좋아지긴 했다만, 아직도 불편한 점이 많음 대표로 하나 말해보자면, 넷플릭스처럼 팝업 화면이 안됨. 팝업 화면 될 수 있도록 설정해주면 별접 5점 드릴게요"
388,한국 영상에도 자막이 있었으면 더 바랄 게 없겠어요
