,0
0,버튼이 에피소드 끝나고 바로뜨면 젛겠어요 왓이프는 언제공개되나요?
1,뒤로가기나 다른 상단바 터치들이 잘 먹히지 않습니다
2,저렴한 가격으로 마블과 디즈니 영화를 볼 수 있다니 최고에요 ㅠㅠㅠㅠ
3,시청기록 지우는 것도 추가하면 좋을 것 같아요
4,영상 배속조절이 없는게 많이 아쉽네요... 요즘 적용 안되는 프로그램이 거의 없는데~ 진짜 그것만 있으면 완전 좋을거 같아요!!
5,"시청중인 콘텐츠 삭제 기능이 없는것, 시인성 문제 등 타 앱들과 비교했을때 부족한 기능과 시스템이 많이 보입니다. 빠른 개선이 필요할듯합니다."
6,"콘텐츠는 좋아요. 그렇지만, 배속 기능이랑 보던 영상을 앱 켜자마자 이어볼 수 있는 기능 추가되면 좋겠어요"
7,왜 이제왔나요 이렇게 꿈잼일걸 난 이제 보네ㅋㅋ 근데 오프닝 건너띄기 다음편 이어보기가 없어서 불편하긴 하지만 딱히 그렇게 큰 지장은 없어요ㅎㅎ
8,좋은 콘텐츠가 많아서 재밌게 보고있어요~!!
9,재생이안됨
10,영상을 보려고하면 검은화면과 소리만 들리네요 다시삭제했다가 깔아도
11,넷플에 없어서 못보던 예능이나 드라마가 있어서 좋습니다. 특히 무한도전.. !! 들어온 거 보고 놀랐었는데 회차도 계속 업데이트 되니까 너무 좋네요 ㅠㅠ
12,"영상을 재생한 후에 화면내에서  컨트롤 할 수 있는 기능을 만들어 주세요 밝기를 조절하거나 볼륨조절, 다음화로 중간에 바로 넘어가거나 하는 기능들이 필요합니다!!"
13,영상마다 화면비 다른건 알고 있어요 근데 좌우에 레터박스가 모든 영상에 일정하게 생깁니다 상하는 원래 생긴다지만 좌우는 없어야죠 다른 ott 앱들은 안 이렇습니다…. 똑같은 프로그램도 티빙만 생겨서 다른 앱을 이용하게 되네요
14,내가 찾던 그 콘텐츠! 웨이브에 없었어!
15,우선 다양한 콘텐츠가 있어 좋지만 자막문제와 공개예정 챕터가 없어 아쉽네요
16,영상 재생이 전반적으로 너무 어두워 시청에 방해될 정도입니다. 개선 요청합니다.
17,지금 많은 분들이 끊기는 현상에 대해 불만을 토로하는데 기계적으로 반복적인 답변만 계속 늘어놓으시고 정작 이루어져야할 업데이트는 없네요. 넷플보다가 갈아탄건데 진짜 돈아까워요. 보라는건지 말란건지. 이 부분에 대해 무슨기기 어떤프로그램에서 그런지 알려달라는것보다 전체적으로 왜 그런 문제가 생기는지 점검을 하세요;
18,영상속도 배속좀 넣어주세요
19,"백그라운 재생, 다음 에피소드 자동 재생 기능이 추가되면 좋겠습니다!! 그래비티 폴즈랑 아울하우스 한글자막 추가도 해주세요!! 오디오는 영어, 자막은 한글로 설정하고 보는데 없어서 너무 아쉽네요ㅠㅠ 또 한글 자막 검수 제대로 해주세요!!"
20,프로그램은 좋습니다! 하나 아쉬운점이 아이들 만화보여주는데 시리즈가있는건 1화에서 2화넘어갈때 버튼을 꼭 눌러줘야되네요. 타 플랫폼은 시간지나면 자동 재생되는데 그부분 업데이트해주시면 좋을것같아요. 애들한테 보여주고서 집안일하는데 계속 다음화 틀어달라고 오고 그러거든요ㅎ 부탁 좀 드립니다~^^!!
21,"영상, 자막설정,재생속도변경기능 모두없음"
22,"와우회원들에게 이런 서비스까지..
쿠팡을 사랑하는 1인인데...넘 좋은 서비스 감사해요~~~~ 원하는것도 많고 다양한 프로그램들 최신이 있어서 좋아여 넷*** 없는게 은근히 많아서 돈아깝다 생각했는데 ㅋㅋㅋ  이거 있어서 여즘 여가시간 잘 즐기고잇네요 ㅎㅎ"
23,오프닝 넘기기랑 배속좀 만들어주세요 ㅜㅠㅠ 특히 배속좀 제발~~
24,검색해도.안나오는.애니가.여러개.있음
25,프로그램도 많고 좋은데 작은 화면에서 다음화로 못 넘기니까 다시 프로그램 들어가서 또 바꾸고 너무 번거로워요
26,다 좋지만 광고 시스템이 별로입니다. 마치 초창기 모습을 보는거 같습니다(광고가 2회 나오는 경우 등). 예전처럼 1개만 나오고 방영중인 프로그램을 한번 더 눌렀을 때 광고가 나오지 않게 해줬으면 좋겠습니다.
27,재생이 안되잖아...
28,재생중 넘기는 화살표가 너무 가운데 몰려있어요.터치드래그로 넘기고싶어요.재생중 다른어플사용할수있게 화면작게해서 빠져나오게해주세요.설정에 아무것도없으니 바꿀수도없네요.
29,너무 좋아요 방송프로그램도 바로바로 볼수 있고 시간 맞추어서 영상 볼필요 없어서 편하네요
30,콘텐츠가 너무 없는데... t플랜 요금제 변경해서 무료로 볼수 있다지만 볼게 없다는게 영.. 아니 왜 웹페이지에서 보는거랑 앱에서 보는 메뉴가 다르냐 =_=.. 웹에서 먼저보고 카테고리 빈약한거 보고 컨텐츠 전혀 없는줄
31,애기가있어서 타요나 뽀로로나 이런 프로그램들 시청하고있었는데 갑자기 없애놓고 없어졌다고 리뷰다니 리뷰도 삭제하나봅니다? jtbc나 이런프로그램도 기존에 다보고있었는데 없어졌는데 돈받고 이런식으로 하는거면 왜 돈을받나요? 푹때부터잘보고있었는데 요금은 더올려받으면서 이런식으로 하나씩 없애나요??
32,"내가 찜한 콘텐츠에서 선택삭제를 할 수 있었으면 좋겠어요ㅠㅠ 하나하나 눌러서 삭제하는 것도 힘들고, 아래로 내려서 삭제하다 보면 스크롤이 맨 위로 올라가 있어서 짜증납니다.. 그리고 TV에서 자막 싱크 좀 맞춰주세요.."
33,제가 잘몰라서 구독 취소도 해보고 연간에서 월간으로 바꿔보고했는데 이미 나간 99000원은 증발하고 추가로 9900원나가서 월간 구독으로 바뀌었어요…어떻게 해요…환불방법도 모르겠고 진짜…
34,"티비로 시청할 때 미드 2~3개 연속 시청하면 다음 에피소드 넘어갈때 갑자기 화면 끊김??화면이상?? 나오는데 언제 개선되는 걸까요??
이런 현상 저만 있는건가요??"
35,영상재생에 문제가 있다는데 도대체 뭐 어쩌자는 건가요
36,보고 싶었던 콘텐츠가 많아서 자주 이용하고 있습니다. 요즘에는 이렇게 된 이상 청와대로 간다 보는 재미로 계속 이용하게 되요.
37,"영상의 많고 적음을 떠나서
기본적인 ott 재생 기능들 구현이 전혀 안되어 있는..."
38,콘텐츠가 다양해서 웨이브앱 너무 좋습니다.
39,콘텐츠 저장기능 사용하지말것. 저장기능 사용하면 바로 앱이 고장나버림. 저장된 콘텐츠 기능 사용할경우에 단순히 재생불가뿐만아니라 앱 자체가 일반적인 기능들도 전부 무한로딩에 앱자체가 뻗음. 노답앱임
40,"집에 TV가 따로 없어 항상 유튜브로 클립 영상만 봐왔었는데, 저렴하고 합리적인 가격에 많은 콘텐츠를 시청할 수 있어 너무 좋은 것 같습니다^^ 이렇게 좋은 서비스를 제공해주셔서 감사드립니다 많이 번창하세요!!"
41,나참~ 영화가 안된다닌까 기다려 달라고만 하고 ~ 본사나 개발은 하는데는 이게 문제 안되남 안 나오는거 왜 프로그램에 올렸지 처음부터TV 만 나온다고 하지
42,일단 사용은 잘하고 있는데 사용할때마다 렉이 너무 많이 걸린다는 점이 아쉽고요 또 방영이 끝난지 오래된 프로그램은 무료화 시켜주시면 안될까요?? 제가 끝난지 오래된 프로그램을 다시 정주행하면서 보고싶은데 다른곳은 안나와서 이곳으로 왔는데 저는 지금 돈이 없는 학생이여서 구매도 못하는데 끝난지 좀 된 프로그램들은 무료화 시켜주시면 안될까요??
43,굿 좋아요 콘텐츠많음
44,"영상을 10분 뒤로가기 하면 영상이 끊겨요 
그리고 영상이 가끔 버벅거려요"
45,서비스 자체는 좋은데… 없는 프로그램이 너무 많네요 ㅡㅡ;; 거침없이 하이킥 꼭 추가되면 좋을 것 같아요.. 그리고 영화 중에 후속작만 올라와있고 1부는 없는 경우가 종종 있는 것 같은데 시리즈물은 전체를 추가해주시면 완벽할 것 같네요!
46,어느 정도 콘텐츠를 소비해왔던 사람들은 뭐 볼 게 있어야지? 국대축구 말곤 볼 게 없네요. 화질은 좋네요
47,콘텐츠 다양하고 사용하기 편해요
48,생각보다 다양하고 많은 볼거리가 있네요. 예전에 인기있던 프로그램들부터 요즘에 인기있는 프로그램들까지 선택 폭이 넓은게 장점입니다. 앞으로도 더 많은 영상이 올라오길 기대합니다!
49,다양한 프로그램 있습니다
50,"보기에 편하고, 콘텐츠도 매우 풍부합니다."
51,콘텐츠가 진짜 처음에비해선 엄청나게 늘었고 가격대비 정말짱
52,"웨이브 콘텐츠도 다양하고
어플도 보기 편해서 시청할 때 제일 만족스러운 것 같아요! 
앞으로도 재밌는 콘텐츠 많이 가져와주세요
약속 없는 날엔 무조건 집에서 웨이브 24시간 틀어놓습니다 ㅎㅎ"
53,주중에 놓치는 프로그램들을 바로바로 볼 수 있어서 너무 좋습니다 ! 해외드라마도 많아서 좋아요! 앞으로도 많은 콘텐츠 부탁드립니당 👍💙
54,심플한게 좋긴하지만 너무 대풍만든  심플함이다. 자막또한 검은색 배경이 남아 영상에 걸리적거림이 많다. 영상 속도변경 시간이동에 따른 딜레이가 너무 심하거나 버퍼링이 걸려 영상 재실행이 필요함. 재실행하면 이동된 위치가 아닌 버퍼링이 걸린부분부터 시작됨 다시 이동을 반복하게 되고 앞서 설명한걸 반복해야됨.  영상의 질이나 양은 당연히 디즈니의 명성에 걸맞게 다양하고 대중들이 좋아할만한게 많지만 하나의 프로그램으로써 간편하고 즐겁게 즐길수있는 UI의 프로토콜은 넷플릭스의 아래다. 이 편의성에 못따라가 사람들은 줄어들것이다
55,"갑자기 분야별로 볼 수가 없네요 미드나 일드, 중드, 예능, 각 채널별로도 정리가 잘 되어있었는데 카테고리를 찾을 수가 없어요. 업데이트된건지 제목 검색만 가능한데 너무 불편해요"
56,베타프로그램의 정원이 찼습니다 라고 뜹니다. 어떻게 해야 할까요?
57,저렴해서 좋다 하지만 콘텐츠가 아직은 미흡하다 그리고 검색하지 않더라도 재미난 콘텐츠 좀 더 많이 추천해주면 좋겠다
58,Pc로 볼때 자동으로 전체화면 됐으면 좋겠어요. 넷플처럼요. 매번 다음에피소드 시작될때마다 마으스로 저체화면 클릭하려니 너무 불편삽니다.
59,영상 재생이 안됨
60,다시보기 편리함 프로그램도 한눈에 보여 찾기쉬움
61,"일단 의역은 재앙 수준이고 (제발 번역 하는 사람들 억지로 의역 좀 하지마 직역이 기본이고 거기에 문제가 있을 것 같을때만 바꿔야지) 앱의 오류는 , 성인인증을 계속 해도 인증 안됨 이건 PC에서 해야만 된다는 리뷰가 있음 심슨의 경우 자막이 검은색 배경이 없어서 보기 힘듬 반응 속도도 느리고 다음 에피소드로 바로 가는 버튼이 없음 이건 진짜 끔찍하다. 다시 말해서 ui도 문제 설정도 문제 번역도 문제 한국의 런칭 문제가 아니라 애초에 시스템의 문제인데 플러스 런칭 한지가 언제인데 아직도 이러냐 이런 수준의 앱은 처음임."
62,재생속도 바꾸는 거 있으면 좋겠어요 다른 건 그래도 만족하고 있어요!!
63,"콘텐츠를 SD카드에 다운 받은 뒤, 디즈니+앱을 실행시킬 때 영상 목록이 한참 뒤에야 다 뜨고 저장한 콘텐츠를 재생 시키면 20분 뒤에야 재생 시작합니다. 콘텐츠를 SD카드가 아니라 태블릿 PC 본체에 저장할 때는 괜찮습니다."
64,프로그램 하단이나 가운데 자꾸 광고처럼 프로그램 홍보 띄우는거 거슬리고 불편해요 없애주세요
65,"바로 혹은 자동 다음편 진행 불가 오프닝, 엔딩 자동 스킵 불가 시청 리스트 지우기 불가 그냥 영상 보는 용도 외에는 기능이 없음"
66,시청완료된거 한꺼번에 지울수있게 해주세요 그리고 10초 건너뛰기를 하면 랙이 너무 많이 걸려요
67,영상을 보다가 끄면 그 위치가 저장도어야하는데 저장이안되네 ㅋㅋ ㄹㅇㅋㅋㄹㅇㅋㅋ
68,컨텐츠는 좋은데..재생하려 하면 소리만 나오고 화면은 자꾸 검게나와서 한 에피소드 재생하려면 거의 5분이 걸리네요;;
69,영상이 아예 안틀어지네요... 요금도 올리면서 제대로 좀 합시다 이럴거면 요금을 올리지를 말던가... 시간 아깝게
70,"오프닝 건너뛰기, 엔딩 시작할때 다음화 바로 재생할 수 있는 버튼이나 아님 건너뛰기 같은게 추가됬으면 좋겠습니다"
71,최고의 프로그램 입니다
72,다양한 프로그램이 많아 좋아요
73,몇몇 프로그램 시리즈나 회차가 자막이 빠져있거나 안올라가 있네요~ 빨리 다올라가면 좋을것 같네요~
74,장점 디즈니 단점 PIP 없음 자막 불편
75,콘텐츠는 좋은데 영상이 왜이리 끊기지 계속 버벅거리고 왓챠랑 넷플은 그런적 한번도 없었는데 너무 불편함
76,재생 왜 안되냐 진짜
77,"앱 자체는 나쁘지 않으나, 콘텐츠에 기복이 있음."
78,OTT 어플 중 컨텐츠도 다양하고 제가 찾던 프로그램들이 거의 다 있어서 아주 만족스럽네요👍
79,여러가지 예능프로그램이 많아서 좋습니다👍👍
80,"콘텐츠가 다양해서 좋아요 ! 보고싶고, 볼 수 있는 영상도 많고 매주마다 업로드되는 영상은 빨리 올라와서 항상 만족하면서 보고 있습니다!!"
81,"- 일시정지 후 다시 재생하면 바로 다시 시작하는 것이 아니라 로딩을 하는 것처럼 썸네일이 나왔다가 다시 시작하는 점.
- 화질 및 배속 재생을 위해 점 세개(...) 버튼을 클릭하면 영상이 멈추는 점. (재생 중 에피소드 버튼을 누르면 영상이 멈추지 않고 재생되는데 이와 같은 방식으로 작동했으면 합니다)
- 1.25 배속 등 배속 재생을 하면 초반에는 싱크가 맞다가 뒤로 갈 수록 싱크가 틀어지는 점.
- 배속 재생을 디폴트로 고정할 수 있었으면 좋겠어요. 티빙은 1.25 배속으로 영상을 보면 그대로 고정되어 있어서 편합니다.

+) HBO 석세션 시즌2 이후도 업데이트 되나요? HBO 다른 시리즈들도 완전 기다리는 중.."
82,시리즈 에피소드 재생중에 다른 회차로 선택해서 넘어갈수있었으면 좋겠어요.
83,너무 만족스럽고 좋은데! 넷플릭스처럼 다 본 프로그램은 시청 중인 프로그램 목록에서 사라지는 기능이 있으면 더 좋을 것 같아용!
84,콘텐츠도 별로없고 볼게없음 돈아깝
85,"웨이브 정말 옛날 프로그램부터 현재 방영되는 프로그램까지 있어 ott 플랫폼 중 가장 최애하는데요:) 과거 프로그램 중 점프챔프라는 방송도 있으면 좋을 것 같은데, 혹시 나중에 이 부분도 고려해주실 수 있을까요? 웨이브 사랑합니다💜"
86,콘텐츠 나이제한 19세까지 올리고 워킹데드 시청하려는데 재생버튼 누르면 계속 회차목록으로 돌아오네요
87,"콘텐츠와 가격(현재 기준)은 참 만족스럽지만, UI 및 맞춤 추천 등의 사용 환경은 글로벌 서비스를 시작한 지 1년이 넘었다는 것이 의심이 들 정도로 아쉬움."
88,아직은 많이 부족한 컨텐츠. 다만 아이가 있다면 좋은 선택
89,왜 오프닝 건너뛰기 하면 처음으로 돌아가버리는거죠....? 티비 외 기기는 제대로 지원 안하는건가요 10초 건너뛰기해도 처음으로 돌아가버림
90,시청중인 영상 삭제도 안되고 자막도 테두리없이 흰글자라 밝은배경나오면 자막안보이고 영상화질도 고정못하고 영상속도도 못정하고 이것저것 불편함이 많네요. 심슨땜에 참아요.•`ﻌ'•)ฅ
91,재생속도 조절할 수 있게 해주세요
92,"웨이브만의 장점은 아무래도
방송3사의 공중파 프로그램을 실시간으로, 핸드폰으로 볼수 있다는 점같아요.!!! 이제 tv가 필요없죠!! 누워서 뒹굴하며 웨이브로 보는 날은 최고의 힐링~☺️
늦은귀가에 내가 보고싶은 프로그램을 놓쳐서 바로 볼수있다는 건 진짜 최고인거같아요!!!
이제 웨이브 없으면 안될거같아요ㅠ..!!!"
93,각종 영화제 개최될 때마다 웨이브에서 후보작과 수상작을 볼 수 있어서 좋아요!
94,일단 회사 소개로 앱을 깔게 되었습니다. 연예인이 대문짝을 열면 안될 것 같아요 비리가 너무 많아요 : < 하여튼 앱을 깔고 느낀점 *_* !!!♡ 무궁무진한 장르가 많다. 깔아도 섭섭하지 않을 정도의 재미난 에피소드의 주제를 가진 내용이 많다. #저는 이만 >×< ㅃㅃ2
95,알찬프로그램 좋아요
96,다양한 프로그램 있어 좋아요
97,"콘텐츠는 부족한건 감안한 부분인데, 자막은 조선족을 쓴거마냥 개판오분전인게 빡침"
98,콘텐츠가 다양하지 않음 봤던게 많음 절대 년 결제 하지마시길
99,재생이 안된다고요
100,시청제한 성인인증창이 자꾸 튕겨요 돈내고도 못보고 있음
101,주로 시청하는 프로그램이 항상 홈에서 접근가능한 UX라 보다 편리하게 이용하고 있습니다!
102,프로그램시청시 꽉찬화면으로 볼수있게 해주세요...화면이 너무 작아요...
103,프로그램을 보여주고 여러 작품을 가져오기 이전에 기본적인 재생도 어려운데  유료 맞나 의문이드네요… ott플랫폼중에서 싼편도 아니라고 생각드는데 재생 환경부터 개선부탁드려요 진짜 보기 힘들 정도로 심해요 ㅠㅠㅠ
104,세로보기도 되게 해주세요. 영화보면서 다른 것도 동시에 할 수 있으려면 필요합니다. 폴더폰쓰면 불편해서요~ 좀더 콘텐츠가 늘어나길 바래봅니다. 김수현 때문에 들어왔어요. 잼나네요^^
105,"디즈니플러스에서 제공하는 컨텐츠는 독보적이고 만족스러움

그러나 개선이 필요하다고 느껴짐

1. 자막
단순 직역이 상당히 많음. 오역도 가끔 발견됨. 
스토리라인, 인물의 관계(직위,나이) 등을 고려하지 않고 단순히 번역만 된 자막. 
배경 음악의 가사가 번역되는 것은 좋으나 글자 색상에 차별을 두어 구분이 필요함. 
자막 글씨 크기 설정이 되면 좋을 듯. 

2. 배속 재생
1.1배속, 1.2배속, 1.5배속 등 배속 재생 옵션이 추가되면 좋을 듯

3. 재생 중 각종 설정
화면 밝기 조절, 음향 조절, 에피소드 리스트 확인 등 각종 설정이 재생 중인 화면 내에서 설정 및 확인이 가능하면 좋을 듯"
106,"뭐 좀 볼까? 하고 들어갈때마다 연결 불가 라고 떠서 몇번을 깔았다 지웠다 깔았다 지웠다 했는지 모르겠습니다. 디즈니 콘텐츠 좋아해서 가입은 했습니다만, 그거 빼곤 죄다 구리네요."
107,볼 거리 많아요 요즘은 집에서 tv 안보고 폰으로 웨이브 봅니다~~!
108,"영상 시간조절이 안되네요 터치잼금상태도아니고, 더블탭. 하단 시간바 터치등 아무것도안되고 티비처럼 그냥 계속 봐야됨"
109,컨텐츠 다음 에피소드 업로드 일정 좀 표시 해주시면 안되나요? xx월 xx일 이런식으로
110,콘텐츠가 넘 다양한게 많은듯 해요
111,"왜 다른 OTT앱들은 자체적인 회원가입이 되는데,쿠팡 플레이에서는 모기업인 쿠팡사의 기존회원들만 사용하게하여 반강제적으로 쿠팡에 가입하게 하는지 모르겠네요. 게다가 콘텐츠의 다양성도 아직까지는 부족하고,독점 콘텐츠도 2~3개 밖에 안되고요. 차라리 웨이브나,방송사별 다시보기에 가입할려구요..."
112,영상보다 멈추는것도 문제인데 자막도 같이사라지네요 보기 불편해요ㅠ
113,돈줘서 월마다 결제하는데도 게임광고 있는건 무슨 심보임?? 너무 괘씸하네 그리고 업데이트 이후에 카테고리 선택하면 3줄씩 밑으로 쭉있는건 뭐야 ㅋㅋㅋㅋㅋㅋ 더 촌스럽고 컨텐츠 보기가 싫어지는 구조로 돼있음 업뎃 이후 나락행 시작임 됐고 디즈니로 넘어감
114,"돈 내고 보는 서비스인데, '역사 저널 그날' 같은 무료프로그램이라고 유료결제해서 보는 사람들에게 까 지 광고가 보이게 하는것은 아니라고 봅니다. 오히려 원래 유료프로에는 광고가 나오지 않는데;;;;;"
115,내용이 다양해서 좋아요 ᆢ 보고싶은 드라마나 프로그램을 바빠서 놓친게 많았는데ᆢ자주이용하고 있어요
116,이런 미친앱을 봤나 이런 *~*#*×>@>#>×>#*×*#*#*×!×!앱을 봤나
117,불편해요 지금 계속 올라오는 리뷰에 요구 개선사항들 좀 개선해주세요~ 공통적 기능이 다른 앱에는 다 있는데 디즈니는 없는게 많아요...
118,평소 방송때 놓친 프로그램들 웨이브로 들어가면 다 있네요~ 편하게 볼 수 있어서 요새 가장 많이 찾는 어플이 되었어요 앞으로도 좋은 컨텐츠 부탁드립니다 ㅎㅎ
119,재생오류가 왜 이렇게 자주 떠요???!!
120,콘텐츠도 많고 앱 사용하기도 좋아요 VOD도 빠르게 올라와서 만족합니당~~
121,넷플릭스 만큼이나 콘텐츠도 다양하고 시간떼우기 좋은거 같아요 강추 :)
122,시청중인 컨텐츠 삭제X 밝기 조절X 자막설정 폰 자체설정으로 해야 됨 배속X 잠금X 오프닝 건너뛰기X 팝업모드X
123,"영상 종류도 많고, 오래된 방송들도 보고싶을 때 언제든 볼 수 있어서 좋아요.
라이브도 좋고
음량 밝기 조절 바로바로 되는 것도 좋아요~"
124,"바빠서 놓친 티비 프로그램 다시 찾아볼 때 너무 편하고, 신작 콘텐츠도 많아서 거의 매일 이용하게 되네요🙏"
125,시청기록 전체삭제가 있었으면 좋겠어요. 하나씩 하는거 너무 불편해요
126,"볼게 별로 없고 오프닝, 엔딩 스킵 기능은 없느니만 못함 기능을 넣을 거면 제대로 좀 만들어주세요."
127,다른 OTT에서 찾지 못했던 콘텐츠와 영화들이 있어서 좋습니다!! 여가시간에 앞으로 웨이브와 함께 시간을 보낼것 같네요! 좋은 콘텐츠와 서비스에 감사드립니다!
128,웨이브에서 무한도전 정주행중입니다~
129,"넷플릭스, 왓챠에 없어서 보고싶었던 영드 여기 다 있네요 ㅠ 프로그램도 다양하고 너무 대만족이에요!"
130,"내가 찾던 그 콘텐츠, 웨이브에 있었어!"
131,다른 앱이랑달리 엄청 오래된 콘텐츠도 삭제되지않고 언제든 볼수 있어서 좋은 것 같아요~~
132,다른 서비스도 사용중인데 제 취향에 맞는 콘텐츠양은 웨이브가 갑인것 같네요.. 잘 보고있습니다!
133,"요즘하는 드라마, 예능뿐 아니라 예전에 했던 프로그램도 볼 수있어서 좋은거 같아요 웨이브 시청하면서 아직은 불편함을 느낀적 없습니다."
134,재생중간에 보다 꺼지고 난리..ㅡㅡ 못보겠음
135,"스마트티비로 보는데 화질도 좋고 모든 영화,티비프로그램 다 있는거같아서 W**이나 N***보다 만족스럽습니다"
136,불편
137,담당자님께 건의드립니다. 회차가많은 시리즈물 (무한도전 걑은건 300회차 넘은데 검색을 세부적으로 해도 해당회차가 안나옵니다 무한도전 200화이런식으로 치면 그냥무도하나 나옵니다. 그리고 무도 무인도특집을 보고싶으면 그냥 스크롤 내려서 일일이 찾아야합니다. 또 회차를 내림 오름차순으로 정렬하게 해주세요. 너무불편합니다 20회차 보고싶은데 300회차 부터있어서 내리는데 한참걸리고 어플은 렉도 걸려서 불편해요
138,"이 가격에 다양한 콘텐츠를 즐길수 있다는 게 큰 장점이지만! 개인적으로 아쉬운 점은, 스킵을 하면서 보는 편이다보니 장면 넘어갈 때 다른 곳들처럼 미리보기가 있었으면 좋겠습니다!"
139,"영상 재생 중에 원하는 지점으로 이동하는 게 안됩니다.
앞이나 뒤로 가고 싶을 때는 리모콘을 무한으로 눌러 1분씩 조정하는 방법 밖에는 없는 것 같은데요ㅠㅠ 답답하네요
그리고 최근에 본 지점부터 재생할 수 없나요? 매번 처음부터 보는 것도 지겨워요..
보고싶었던 예능 실컷 볼 수 있어서 너무 좋은데 기능적으로 좀 더 보완해주시면 감사하겠습니다."
140,콘텐츠 가 적다보니 아쉽다
141,다양한 프로그램과 빠른 업데이트 만족합니다♥
142,"UI,다음에피소드재생 등등 문제 너무 많지만 
자막문제가 너무 심각하네요.. 
유료서비스라고 믿을 수가 없는 수준이예요. 
맞춤법, 단순오타, 오역 난리났네요 진짜"
143,시청기록 남게 해주세요. 저번에 본 콘텐츠 찾으려면 다시 또 검색해서 봐야 하네요.. 불편합니다
