,0
524,완전쓰레기예요.. 돈내고가입했는데.. 티비연결하려면 존재하지않는아이디로떠요 고객센터 문의를 하면 성의없이 메뉴얼만 답으로오고..상담이안되요 무료사이트도아닌데..
525,별 하나도 아깝다 놈들아... 아이디 비밀번호로 로그인 되게 만들어라.. 이메일 인증 개수작 부리지말고...하.. . .
526,가입도무료
527,"네이버 메일 휴면 이었다가 돌아왔을 경우에 인증 이메일이 수신 되지 않는 상황이 있네요.

네이버 측과 조속한 해결을 부탁드립니다... 너무 불편하잖아요 이건."
528,왜 기존 아이디로 로그인이 안되나요..폰 바꾼거로 들어가려는데 회원정보도 없다고 하고 당황스럽네요..
529,무료로 볼수 있나요??
530,"계정이멊어서 로그인이 안된다니,,,ㅡㅡ 이용권 결제일 마다 따박따박 돈빼가면서 오늘 왜 이런건지 빨리좀 해결해주세요"
531,유료.개별구매가 느무 많아요
532,갑자기 로그아웃 되있더니 로그인해도 없는아이디로 뜨고 아이디찾기했더니 가입되지 않는 아이디로 나오네요
533,무료영화 무한 즐김 굿입니다
534,유료 서비스가 이렇게 잘 죽는건 이 놈이 처음...
535,엠스틱2로 시청할때 한번 로그인하면 계속 로그인되어있는게 아니라 매번 접속할때마다 로그인해야 되는데 왜 이러는지....티빙 넷플은 안그러는데 유독 웨이브만...왜 그런건가요?
536,와 너무하네.. 왜 쿠팡 아이디로만 가입하게 만들었으까나??? 난 쿠팡에서 물건 절대 안 사서 아이디 만들기도 시른데... 궁금해서 함 들어가볼라 했는데 걍 넷플 디플 웨이브로 만족해야겠다...
537,막 결제되고 로그인도힘들고 어렵게만들어놔서 손해봤어요 해지도 멤버쉽도 안뜨고 짜증납니다 ㅡㅡ
538,가입을 편하게하고 로그인을 어렵게 하는건 무슨 심보인지 모르겠네요
539,손흥민이랑 이강인 등 코리안리거 경기좀 넣어주세요... 아니면 쓸 일이 없을것같네요
540,가입이 너무 어렵네요
541,무료영화도 많고 잘보고있습니다
542,무료회원도 팝업창으로 볼수있게 좀 해주세요 다른 티비어플들은 무료회원이라도 팝업창해주는데 왜 웨이브는 안해주나요? 유료회원만 회원인가요?
543,축구 볼려고 깔았는데 볼 수가 없네 ㅋ
544,회원가입 할때 무조건 해당된다고 적어주세요 시도해는데 안되더라고요
545,아니 웹사이트에 로그인 버튼이 없어요 진짜 정신나갔네요 무슨 회원가입 플로우로 밖에 진행이 안되나요
546,로그인하면 돈이나간다구 차라리 꽁짜라도 해주면 어디가 덜납니까 디즈니채널 이 예전처럼 부활했으면 좋겠는데 채널171번과172번이 아예 사라졌잖아요
547,어플 설치후 안 열려서 로그인을 할수가 없네요. 어떻게 해야하나요?
548,축구는 너무 끊기네요
549,가입후 결제 할인은 정확히 표기해야지 쳐가려놓으면 어떻게 알라고ㅋㅋㅋ앱디자인한 저능아짤라라
550,축구화질 뭐냐...ㅡㅡ
551,와우 멤버십 사자마자 다음달 해지 될때까지 쓰려고 해지했는데 또 결제하라고 하네요 이거 해지하면 한달정도는 쓰는게 보통아닌가요? 즂같이 장사하시네요 엿드세요
552,회원가입하면 첫달 100원에 본인인증하면 2개월 반값이라고 해서 둘다 다 했는데 결재는 왜 돈 다 내는거죠? 사기인가요? 제가 잘못봤나요? 뭔가요 이거?
553,가입을 했는데도 자꾸 에러로 뜨네요 . 고쳐 주시면 감사하겠습니다
554,저녁6시이후에는 로그인도 안되서 볼수가 없네요 소비자보호원 고소감이네요
555,무료면 좋겠는데 구매를 해야 볼 수 있네요😑 시청하는거 포기 할래요.😕
556,중간에 화질이 깨졌다가 돌아오기를 반복해서 몰입이 깨지는게 아쉽네요
557,잘쓰고 있어요 아쉬운건 로그인이 자꾸 풀려요 로그인좀 안풀리게 해주세욤
558,아니 쓰 ㅂ ㅓ ㄹ 10월26일 새벽4시 결제시도 우체국계좌 정비중? 결제거부 넷플아이디 정지상태 이게무슨 짓이여 보통 은행들 새벽이 점검 업뎃하는데 결제시간을 꼭 새벽4시에 해야겠냐?
559,아니 왜 로그인을 못하게하는데 4명이서 나눠보는데 자꾸 아이디메일로 6자리를 보내질않나 친구 스케줄 봐가면서 겨우 6자리 입력하면 새 비번을 치라고 하질않나 화나네 안봐안봐
560,로그인부터 안되네요 네이버 로그인 몇번을 시도해서 계속 똑같이 안되고 멍청한 앱
561,폰으로 로그인이 안돼요 ㅠㅠ 아예 버튼이 눌리지 않네여.. 지웠다 깔아야할까요?
562,"계정을 해킹당한것같습니다. 어제 새벽 비밀번호 변경 및 전화번호가 변경되었다는 메일이 와있었고 오늘 아침 결제가 되어있습니다. 해킹으로 인해 로그인도 안되는데 어떻게 해지하며, 환불은 어떻게 받을 수있나요. 앱을 이렇게 쉽게 해킹당하게 만들어도 되는건가요. 정말 아침부터 화가나네요. 빠른조치 부탁드립니다."
563,지금 네이버 비번을 까먹어서 네이버 로그인이 필요한 건 전부 일회용번호 받아서 로그인한 지 오래고요. 데스크탑으로 티빙 웹사이트에서 네이버 로그인 하면 일회용 번호로 로그인 떠서 제 폰 네이버 앱에서 번호 받아서 로그인 할 수 있는데요. 아이패드로 웹사이트에서 티빙 네이버로 로그인하면 일회용번호로 로그인하기 잘 뜨는데 무조건 앱으로 보라고 하고. 네이버 로그인 한 상태에서 앱으로 열었으면 자동으로 로그인이 되던가 그냥 앱만 열어지고 다시 로그인 하라고 하고. 앱으로 네이버로그인 누르면 일회용 번호 안 뜨고 무조건 아이디 비밀번호를 쳐야 로그인되게 해놓고. 일회용 번호로 로그인 이거 하나 안 뜨는 거 때문에 또 네이버 비밀번호 새로 바꿔야되고. 나중에 까먹으면 또 티빙때문에 새로 바꾸고 또 바꿔야됩니까 웺사이트에서 로그인한 상태로 앱에서 볼래요밖에 못 누르는데 그거 누르면 자동로그인 돼야 되는 거 아닌가요 또 로그인 하라고 하게?
564,유료 결재해야만 뭘 하는지 알수있나? 우선 뭐가 있는지를 보고 결정하게하던가.. 걍 넷플이나 계속 봐야겠다
565,"어플 켤때마다 오류가 계속되네요. 로딩화면만 나오고, 넘어가도 로그인 오류라며 어플이 종료되고요."
566,멤버쉽 구독 취소 이런거 머한다고 구글에서 따로관리하고 앱 사용 불편하게 해놨노 에휴
567,"애플 아이디로 프리미엄 결제해서 다같이 보려고 했는데 기존 애플기기에서 다른 아이디로 로그인 되어있는 사람들은 로그인조차 안되네요?
이것저것 다 해봐도 안되길래 어플말고 그냥 웹으로 보려고 로그인했는데 계속 어플로보기만 터치되고 어느것도 터치가 안되는데 도대체 뭘 어떻게 쓰라는건지 뭐 인터넷에 검색해보니 그런사람들 한두명이 아니던데 다른방법으로 해결좀 해주시던지 아님 애플결제를 없애야되는거 아닌가요?
웹에서는 다른 애플아이디로 로그인이 가능하도록 되어있고 어플에서는 안됩니다. 빠른 수정 부탁드려요."
568,휴 좀더 분발하길 바래 스타워즈 밖에 볼게 없슈
569,축구중계를 하실거면 서버관리좀 하세요 중계가 안보이네요^^
570,"무료 생중계라더니,,"
571,디즈니 로그인 하고 돈내면 그시간 동안만 무료로 볼수있어서 최고네요
572,가입하신 정보가 업다니 오류 왜 이래요?
573,쿠팡(와우회원)으로  로그인하면 무료로 시청 가능한 건가요?
574,Lenovo YT-X705기기에서 네이버 로그인이 안됩니다
575,"4회선 할때 계정 아이디 비번공유 위험하지 않나요?; 구매자가 초대하고 비번4자리입력 방식이었으면 좋겠어요 왜 아이디비번공유해서 로그인하게 만든건지,,"
576,무료영화있나요?
577,아니 뭐있나 검색좀 하고 결재하려는데 기존계정 로그인했더니 막 뭔 쓰잘대기없는 사이트 들어가서 가입을완료하라는 문구뜨면서 검색도안대고 뭔 이따구로바뀌었나요
578,진짜 별로입니다. 로그인도 자주 실패하고 결제도 잘안될때가 허다한 허술한 플랫폼.
579,티빙....진짜 거지같은거 알죠? 렉걸리고 느리고...목록은 숨바꼭질하나요. 제발 시상식이나 필요한방송 티빙에서 안해주길 두손모아 빕니다. 울며겨자먹기로 결제하고 눈씻고 볼거 찾아도 안보여요.
580,아니 네이버 로그인 누르면 창이 안 뜨는데 좀 고쳐주세요;
581,탈퇴어떻게 하나요? 아무때나 가능하다더니 실제로는 안되네요
582,비추합니다 무료제공 불편하게 로그인으로 봐야한다는거 네이버 보세요
583,회원가입 하다가 열받아 디지겠네요 회원가입하면서 카카오페이로 결제까지 했는데 로그인할라면 회원가입하라고 나오고 자꾸만 얼마남지.않았다는데 뭘 어쩌라는건지.. 1시간 헤매다가 열받아서 다른 계정 만들어서 다시 가입했더니 전화번호가 이미 가입되어 있어서 인증도 안된다하고!! 기존가입한거 해지할라면 다시 회원가입하라하고 새계정은 인증도 안되고 진짜 개판이네 통장에 돈은 빠졌더만 진짜 욕나와서 못 쓰겠네 좀 쓰기쉽게 만들어요!!
584,어제 결제 하고 잘 시청 하고 있었는데 오늘 갑자기 로그아웃 되면서 다시 로그인 하라는 게 뜨는데 그때 아이디 비번 까먹어서 못하고 있는 상황 이였고 아이디 찾는 방식 해봤는데 결제 된 아이디로 돌아가지 못합니다 환불해주세요
585,하...저는 넷플릭스의 로그인에 실패한사람입니다 혹시 될까? 하는 마음에 깔아보았는데요 로그인은 잘되서 좋았는데 돈을 내야해서 싫어요 그냥다 싫어요
586,네이버웨일에서는 비번 입력하면 그 뒤로 먹통이고 스마트 폰에서는 첫 화면에서 먹통이고 어쩌라는건지
587,가입을 했는데 얼마남지 않았대서 하루를 기달렸는데 변한게없어 좀 불편하네요...
588,"다음메일로 유료 구독 가입한 아이디와 애플 아이디 2개가 있는데 애플로그인으로 했다가 다음으로 로그인
하고 싶은데 시작하기밖에 없고 로그인을 도대체 어디서 하는지 모르겠네요 
카카오로 시작하기/페이스북으로 시작하기 뭐 이런 것만있고 들어가면 다 신규가입만 나오거
로그인을 못해서 어플 삭제했어요 어디가야지만 다음으로 로그인이 가능한거죠?ㅠ"
589,계정 잠금 기능이 있었으면 좋겠어요....!!!
590,이틀에 한번씩은 아이디 비번 입력화면으로 돌아가 있네요 ㅜ 왜 그런가요?
591,가입한지 10년넘게 보구있는데 업뎃 할때마다 불편해도 그려려니 괜찮았는데 이번업뎃이 제일 불편하네요 . 강제 전체화면 진심 최악입니다.원래대로 바꿔주세요.
592,회원가입을 어떻게 하는거죠? 아무리 찾아봐도 로그인 할 수 있는 것만 떠서..
593,핀번호 틀렸다고 로그인 안되고 겨우 들어가도 발열 심해지면서 먹통이돼요 제발 관리 좀 해주세요
594,무료도 아니고 유료인데 세로보기는 왜 없애나요 너무 불편합니다 2년 가까이 유료로 보고 있는데 해지할까 생각중이네요
595,회원탈퇴는 어케하는지요?
596,왜 세로모드 없앴나요? 세상에 이딴식으로 운영하는 ott 회사가 어딨습니까? 처음 시작을 가로로 고정하는 것도 아니고 아예 세로모드를 없앤다? 고객이 우습나요?
597,가입시 네이버로 로그인 으로 가입후 결제 후 앱으로 로그인 하려하는데 아이디 비번 틀리다고 나오네요 ㅠㅠ
598,왜 재생하려는데 재생은 안되고 로그인 정보가 없다고 뜨나요? 그리고 확인 버튼을 눌러도 갱신이 안되고 재생하면 다시 또 팝업이 뜨는데 왜 그런건가요?
599,가입절차 부터 짜증나서 딴데가서 거입합나다.
600,웨이브 sns연동 로그인이 안돼요 갑자기 안되져요4일내내 로그인이안되져요
601,무료 ott도 아니고 장난합니까? 당장 이전처럼 돌려 놓으세요 1년치 결제해서 해지도 못하고 짜증나네
602,가입도 ㅜㅡㅜ 안돼 😢
603,멀쩡한 세로모드를 재생시 바로 가로모드로 넘어가는거는 누구의 아이디어인지 기가차네요.다른ott서비스들은 이런거는없는데 시대를 역행하는건지 내머리로는 울화통이 치미네요.돈내고 이용하는거 이러지는맙시다.상당히 불쾌하네요
604,시청중 잠시 나갔다 들어오면 처음으로 돌아가서 보던부분을 다시 찾아야되고 왜이렇게 불편해졌나요? 몇년 동안 불편없이 잘 사용했는데 지금은 엉망이네요
605,지금까지 잘 사용하고 있었는데요. 로그아웃 한 뒤로 로그인이 안되고 있습니다.
606,페북아이디로 로그인 안 된지가 벌써 1주일도 넘어가는데 아무 공지도 없네요. 하다못해 택배사도 출발했다 몇 시에 도착한다 하는 문자 잘만 보내주는데 정말 무성의 그 자체고 신뢰가 안 가는 모습이네요.
607,"탈퇴 후 오랜만에 재가입 했는데 가입한지 2시간도 안 지나서 ""현재 기술적인 문제로~~~"" 로그인 오류뜨네 설연휴에 즐겁게 보내려고 했는데 바로 탈퇴 한 것임"
608,타지역에서 로그인되는건 왜그런거죠? 고객정보 유출된건가요? 한두번도 아니고 한달동안 지켜보니 계속 그럽니다 다른분들도 확인해보세요
609,하지도안는펫북아이디로가입이왜되있는건지모로겟네요 도용관리같은건신경도안쓰는거아님니까싸이트신용할수가없는싸이트네요
610,무료는 아니지만 good
611,"애초에 어플 깔았을때 아이디 만들어서 로그인 되어있었는데 구독해서 사용하려고 결제완료하고 같이 쓸 기기에 로그인을 해야하는데 로그인 정보 알아둘려고 로그아웃 했다가 다시 로그인 하려고 하니까 가입정보가 없다는데 휴대폰 번호는 등록을 안해놔서 그렇다 치고 이메일이랑 아이디가 없다고 하는데 말이 됩니까? 그럼 어떻게 로그인을 한 상태에서 결제를 했을까요
비회원이 볼수있는 것도 아니고 고객센터 전화하려고 하니까 주말이라고 하지도 않고 다시 아이디
돌려받는다고 해도 결제일로부터 3일이나 아무것도 이용못하고 날리는건데 진짜 어이가 없네요ㅋㅋㅋ 보자마자 환불처리 해주세요"
612,다른건 모르겠는데 카지노 보다가 화면터치하니까 안눌림 뒤로가기가 안돼서 어플나갔다 들어와야함 10초전 10초뒤는 터치두번하면 되긴하는데 정지 나가기 터치가 사라짐ㅋㅋㅋㅋㅋㅋㅋ 이게뭐여
613,탈퇴하기가 겁나어려움..
614,아니 멤버십중에도 변경할수있게 해놔라 이^^ㅐ끼들아 PC에서 안되노 ㅋ
615,좋긴 좋은데 매달 돈 내고 보는건데 불법 사이트보다 로딩이 느리면 어떻게 하나요...ㅠ
616,네이버플러스 회원은 무료라 설치하고 로그인하면 또 다시 앱스토어 화면이 뜨고 10번째 반복하니... 짜증이 많~~이 나네요.. 오류인가요 뭔가요
617,탈퇴하기힘들다
618,재밌게 잘보있는데 어느날부턴가 네이버페이결제가 사용불가인데 왜그런건가요?
619,잘보고있는데 네이버페이 결제 사용불가로 뜨는데 왜그런가요?
620,계정을 탈퇴했는데 계속 결제가 됩니다 환불 후 빠른 조치 부탁드립니다.
621,로그인이 안 돼요.. 티빙 아이디로 로그인 하려는데 자꾸 오류 떠요.. 제발 좀 고쳐주세요 티빙을 못 보고 있어요..
622,축구 중계는 왜 일부 tv에서 안되나요
623,무료로 볼수있다는게 정말 좋은데 보고싶은게 없더라구요 지브리 라거나.. 그리고 스파이패밀리 2 왜 안나오나요 다른덴 다 나왔던데 빨리 2 주시면 좋겠습니다 ㅠ
624,탈퇴 못하게합니다 10만원식빼가면서 취소도 안되고 돈만빼갑니다 쓰지도 못해요
625,무료어플도아닌데.. 중간광고도 그대로 나오네ㅋㅋ중간중간 광고는 왜붙여서 ..
626,"그전에 잘 보다가 해지하고 다시 보려고 멤버십 재시작했는데 결제되고 돈은 나가고 계속 멤버십 가입하라고 뜹니다 앱 지우고 깔아도, 데이터, 캐시 지우고 들어가도, 폰으로 들어가도, pc로 들어가도 똑같이 멤버십 가입하라고 떠서 이메일 문의라도 하려고 보니까 이메일 문의도 없고 실시간 채팅은 시간이 끝나서 안 된다고 하고 전화라도 하려니까 전화도 시간이 끝났네요? 이메일 문의라도 되게 하든가 당장 보려고 결제해 놓고 보지도 못하게 하고 다음날 고객센터 열 때까지 기다리라는 거잖아요 계정 들어가서 결제내역 봐도 결제내역도 안 뜨고 카드에서 돈은 결제됐고 멤버십은 해지돼 있다고 뜨고 영상만 볼 땐 몰랐는데 고객센터 개편 좀 하셔야 할 것 같아요 검색하니까 저 같은 사람도 종종 보이는데 자주 묻는 질문에도 해결법도 없어요 그냥 꼼짝없이 아무것도 하지 말고 기다리라는 건 너무한 거 아닌가요?"
627,가입했고 결제도 했는데 왜 계속 가입마무리 하라고 뜨죠~~~
628,해지 시켜는게 계속현금이빠져 모르고있다가 다시해지 하려하니 아이디를 잊어버려 가려쳐달라니 앞에와 땡땡만 붙여서 들어가게도 못하게 하고 전화문의 하려니 녹음목소리만 계속나오고 이거 본사로 가야 하나 고민중
629,무료영화가 많이 없어 아쉬워요
630,디지니 잘 보다가 그만보려고 취소했는데 금액은 나가고 로그인을 하면 돈을 내라는데 답답해서 안쓸려구요
631,디즈니 로그인 할 때 한 번 비밀 번호 바꿈
632,아... 결제오류인지 아이디는 하나밖에없는데 구글에는 결제되었다고 통장에 돈도 빠져나갔는데 앱들어가니 영상은 안나오고 이용권 구매하라고하고 이용권구매하기 누르면 이미 구매했다 그러고 어쩌라는거죠?
633,회원가입이 안됨 몇번을 시도해봤는데...안됨!!...더글로리 보려고했는데 아쉽게됐음..ㅠㅠ
634,왜로그인안되지? 분명네이버로 로그인하고 결제까지했는데 들어가지못하는데 무슨경우인가요
635,관리자님 제발 도와주세요 몇개월전 디즈니플러스 결제를 하고 앱을 지웠는데 아직까지 결제가 이어지고 있고 로그인해서 한번 막아보려는데 계정을 못찾겠고 비밀번호 재설정도 하려는데 문자가 안와요 스팸함이 뭔지도 모르겠고요..
636,Kt시즌에서 넘어왔는데 파라마운트보려고 네이버 이용권 구매했는데 kt 어쩌구하면서 새로구매한 네이버 이용권은 등록이 안됩니다. 기존 이용권 해지하기 등록하기등 편하게 적용시키는 방법좀 알려주세요
637,축구중계 오잇오잇 다시 컴백
638,탈퇴가 안되네 ㅡㅡ
639,핸드폰으로 들어가려고 하면 며칠전부터 일시적인 오류로 자동로그인실패로 나오네요. 직접 입력으로 하면 없는 아이디라고 나오고 틀린건가해서 간편인증으로 다시 확인하면 아이디가 맞게 나오는데 어떻게 로그인하라는 건가요?
640,회원탈퇴합니다
641,네이버 카카오톡 로그인 흰화면만 뜨고 안넘어감
642,티빙 페북 로그인 할 때 자꾸 이전에 로그인한 기록 있다면서 떠서 어플을 삭제하고 다시 깔아도 또 뜨고 그 후에는 회원가입하라고 뜨는데 저보고 어떡하라는건지 모르겠네요 로그인이 안돼요.
643,멤버쉽해지는 당췌 어딨나요? 시키는대로 계정들어가면 멤버쉽취소는 안뜨고 연간멤버쉽 전환만 보입니다. 고객센터 질문남기는경로도 안보이고. 다 자동답글 링크뿐. 답답해미치겠네요.
644,자주 로그인오류가 발생 합니다.. 잘 안열림
645,개인계정만 사용가능하다네요 사업자계정도 와우멤버십 가격 똑같은데 와 차별하죠?
646,회원탈퇴시 이용권결제한거 사라진다고 경고만 하고 이용권 구매해도 사용 못하고 분명 결제되었는데 오류로 안되나 싶어 다시 결제하려해도 이미 구독중이라며 결제는 안되고 뭐어쩌라는건지 원...
647,음.... 폰 바꿔서 다시 깔았는데.... 로그인이 안됩니다. 아이디도 비번도 같은데 로그인이 안되는 이유는 뭘까요?
648,"혹시 로그인이 안 되신다면 앱을 제거하신 후 다시 설치하시고 수동으로(아이디, 비밀번호 직접 입력해서) 로그인 해 보세요 저는 그렇게 해서 다시 로그인 할 수 있었어요ㅎㅎ"
649,네이버멤버십이라 걍 별 기대없이 쓰고있는데 컨텐츠가 실속있네 진짜 만족
650,아니 왜 구글 로그인이 안 뜨죠?
651,회원이라 사용 가능한 것은 좋은데 업로드된 영상들 보면 원본에서 많은 부분이 편집되서 올라옵니다 재밌거나 중요한 부분도 편집되던데 왜 그런건가요?
652,가입하면 해제가 힘듬 가입 하지 마세요
653,계정탈퇴는 어떻게 하는거죠?
654,"회원가입도 안하고 구독초차도 안했는데
갑자기 돈이 빠져나감;; 이게 뭔지 정말 궁금하네요 다른분들은 조심하세요"
655,티멤버십으로 할인받아서 좋은 가격으로 좋은 서비스를 누릴 수 있어서 좋아요. 웨이브 항상 애용하고 있습니다🥰❤️
656,네이버에서 보다가 우연히 웨이브에서 프로야구를 보게 되었는데 정말 만족하고 있습니다 화질도 더 좋고 특히  다른 팀 경기까지 한번에 볼 수 있는 기능도 있어 순위 싸움 중일때 정말 유용하게 사용하고 있어요 앞으로고 계속 웨이브로 프로야구 관람 할 것 같습니다!!
657,"대체 환불 관련해선 어디,누구와 얘기를 해야하는거죠? 고객센터연결도 안되고 메일 문의를 해도 답도 없고 진짜 못쓰겠네요"
658,회원가입하고 본인인증하면 첫달 100원이라더니 16000원결제 뭐냐 사기꾼들이네 환불해주시죠 짜증나니까 안보고말지
659,광고를거짓말하지마라 무료가아니데 월돈을주어야무료가되데 무료사이트에들려가지말고 유료사이트에들려가라 3개월무료해주면 시청률이올리수있다
660,네이버실시간이랑 최근에 티빙에 스포츠채널 생겨서 이용했는데 웨이브까지 가능하네요 다른 ott보다 더 편리핝 기대 중입니다
661,웨이브에서도 편하게 프로야구를 볼수있어서 기쁩니다. 네이버tv보다 사용성이 훨씬 좋네요!
662,사실 야구 생중계는 네이버나 다른 곳들도 많지만 웨이브가 화질도 제일 좋고 끊김없이 나올 뿐더러 중계 내용이나 선수 정보도 자세히 알 수 있어서 매주 이용중입니다!!👍👍
663,맨닐 네이버에서 야구 보다가 웨이브로 야구 보니 넘 편하네요. ㅎㅎ 다른 구장 경기도 동시 시청되니 너무 좋아여. 이제야 웨이브를 알았다는게 너무 좋네여 ㅎㅎ
664,네이버 쓰다가 웨이브로 야구 시청하는데 끊김없고 PIP지원 되는 기능이 꿀이라 너무 잘쓰고있습니다~~
665,무료사이트에 이질말고 유료사이트에 있어야한다 시청자안고쉬게
666,주변은 밝은데 밝기조절을 마음대로하면 보지말라는건가요
667,네이버 프로야구로 아이와 함께보다가 웨이브로 바꿔 보기 시작했습니다. 화질도 좋구 무엇보다 보기 편하게 구성되어 있어 대만족입니다^^
668,네이버 스포츠는 광고 나 동시 시청이나 스포츠 시청하면서 동시에 다른 것들을 못하는데 wavve는 네이버 스포츠에서 불편한 점들을 다 보완했습니다! 몇년동안 잘 사용중이고 티비로도 볼수있게되면 더 좋겠습니다!!
669,외출로 밖에 있을 때 야구를 주로 네이버로 봤었는데 웨이브를 설치한 후에는 웨이브로 봐요 :) 야구 중계 시작할 때 알림이 뜨고 또 득점 날 때마다 알림이 떠서 보기 편해요 ! 그리고 다른 팀 경기 상황도 볼 수 있고 밑에 선수 정보랑 베이스 상황도 보기 쉽게 올려줘서 요즘은 웨이브로만 야구 봅니다 ! :)
670,삼팬입니다 웨이브로 크보를 자주 봅니다 네이버는 광고 기다리다가 목빠지겠네요ㅎㅎ
671,그동안은 네이버에서 사청했는데 자주 끊겨서 짜증났는데 웨이브는 화면도 선명하고 끊기지 않아 너무 좋습니다. 최곱니다~~!!!
672,네이버로도 보고있었지만 매일 이용하는 웨이브로 이용할 수 있으니 더 좋네요! 운전하면서 야구 틀어놓고 오디오모드로 들어야겠어요!
