,0
783,"디즈니 작품을 좋아해서 모아 보니 좋긴함.. 근데 배속이랑 자동으로 줄거리, 오프닝 건너뛰기 있었으면 더 좋았을 듯..."
784,"다 좋은데, 무한도전 업데이트 좀 부탁드립니다!!!! ㅠㅠ"
785,좋은 프로그램 볼 수 있어서 좋아요^^
786,볼만한 콘텐츠가 많아요
787,영상조작법이 불편함. 넷플릭스 반에 반도 못따라 오는 듯. 영화 한 편 가볍게 보기 위한 접속이 꺼려짐.
788,오프닝?건너뛰기 없음 볼려고 누르면 3초 기다려야함 자다가 넘어가버린거 다시보기 누르면 3초뒤에 다음화로 넘어가버림ㅋㅋㅋㅋㅋ전편으로 눌려서 봐야함 컨텐츠가 너무 없음 자막없는게 대부분임 추억의 프로그램이 많음
789,"tv앱에서 시청중인 컨텐츠를 누르면 바로재생되는기능 굉장히불편하네요. 컨텐츠를 한,두개만 보는것도 아니고 재생하기전에 회차 정보라도 띄워주던가 게다가 재생중에 회차목록 들어가서보면 옆에 잘보이지도않는 썸네일에 딸랑 회차랑 날짜만 올라와있고 그거를 편의기능이라고 넣은건지. 무슨생각으로 저런기능을 업데이트한건지 모르겠네요."
790,the challenge usa 프로그램 추가해주시면안되용..? 너무 보고싶어요
791,프로그램 시청중 오프닝 건너뛰기되는 프로그램있구 안된것도 있는데 왜그런건가요. 그래고 TV시청중 Wavve 접속이 잘안됩니다. Wavve 잘보고 있는데 이런 문제점 해결부탁드립니다.
792,영상시청중 제스처 기능이 있으면 좋겠음. 그리고 컨텐츠의 언어지원 내역을 영상들어가기 전에 쉽게 확인할수 있으면 좋을것 같음
793,"매주 올라온다고 하는 프로그램들 업데이트좀 해주세요 
처리 좀 원활하게 부탁드립니다 
메리트가 없어요"
794,가로모드인 상태에서 프로그램 한 편 다보고 다음화로 넘어갈 때 자꾸 가로모드 상태에서 세로모드 화면이 나와서 불편하네요 개선 됬으면 좋겠습니다 한 두번더 아니고 휴대폰을 껐다가 켜도 저러고 앱을 지웠다가 새로 다운 받았는데도 이러네요 그냥 일시적인 오류인 줄 알았는데 앱 문제인거 같아요
795,"볼꺼 많고 다좋은데 조금만 오래봐도 발열 완전심하고, 10초 건너뛰기 넘기기 하면 랙걸려서 버벅거리고 오류나서 꺼지고 로딩걸려서 한참을 재생도안되고 제자리 걸음에 앱삭제하고 다시깔아도보고 다른 백그라운드 프로그램 다끄고 티빙만 켜놔도 버벅거림은 여전하고. 앱만드시는분들은 사용안해보시고 업데이트하시나요????? 제발 써보세요. 진짜 미치겠으니까요👀 그리고 시청목록 정리하는것도 전체 선택하는것도 없고 몇십개씩되는거 하나씩 일일이 선택하는것도 귀찬게 되있구요. 재생목록에 많이 차있어도 버벅거려서 지우면서 보는데 시리즈물 보면 하...진짜 한회차씩 삭제해야하니 이게뭔 개고생인지 제발 빠른시일에 다시 업뎃쫌 해주세요."
796,(LGTV로 사용시) 전에는 시청중 콘텐츠 누르면 보던거 이어보기 혹은 회차 선택할수 있게 선택폭이 있었는데 지금은 일단 재생되고 회차보기를 또 가야하는 불편함이 있네요 업데이트 후 불편해졌어요!!
797,연속재생이여도 넘어가는데 1분이소요됨 짜증이 절로 남니다 프로그램도 업데이트가 왜 늦어요 현재 17회 하는데 여기선 13회로 너무 늦어요 다음날이면 올라와야하는데 너무 늦어요 장미의 전쟁경우도 너무 늦게 올라와요
798,"제목 그대로 영상 크게 화면으로 보려고 재생시키고 넓은 화면 보려고 해당 기능 키면 반정도는 그냥 검정화면? 으로 깨져서 소리만 들리고 화면은 하나도 잘 안보여요
16으로 os업뎃하고 나서 그러는 건지 기존 이슈인건지는 모르겠으나
이거 버그 수정 해야 하실 것 같아요
화면 잠금모드 풀고나서 이리저리 화면 바꾸면 그때는 다시 원래대로 되나 이게 매번 처음 화면 크게 할때마다 저래서 엄청 불편하네요"
799,태블릿으로 이용할 때 프로그램 선택해서 들어가면 하단의 내비게이션 바가 없어져요. 뒤로사기 하려면 아래에서 위로 한번 쓸어줘야 하는데 엄청불편해요. 시청중 콘텐츠 자동재생되는건 물론이구요
800,청춘 블라썸 재생이... 왜 안되나요 다른 프로그램들은 다 되는데 청썸만 안 되네요...?
801,재생이 안된다 임마
802,화면 비율폭이 좁아서 그런지는 몰라도 계속 뚝.뚝 끊기는 현상이 벌어짐 드라마나 애니는 최소 270 영화는 480이던데 이걸 140까지 내려서 구형 폰 라도 볼수있게끔 해줘야 한다고 봄
803,왜그래요 왜 프로그램이실행이안되죠
804,재생옵션이 0이라고 봐도 무방한 수준. 콘텐츠 때문에 보고 있긴하지만 진짜 편의성 최악임
805,시청중 컨텐츠도 삭제 안되고 너무 불편 기본적인것 테스트도 안하는 앱인듯
806,폰을 폴드로 변경하고 나서 계속 프로그래스바가 뱅글뱅글 돌고 있어요 이걸보려고 결재한건 아닌데
807,여러 콘텐츠앱을 사용중인데 디즈니는 좀 불편한 점이 많네요ㅠ
808,모바일 진짜 답답합니다. 자막에 가끔씩 자음이 하나씩 빠져있거나 띄어쓰기가 잘못되있는 등의 사소한 버그가 많습니다. 자막 배경은 또 왜 생겼고 영상 화면 방향은 왜 가로가 고정인지 알고 싶습니다. 콘텐츠를 보려고 해당 콘텐츠를 누르면 에피소드 목록이 뜨지 않고 설명만 뜨는 팝업창이 나와서 불편합니다. 탑10 콘텐츠가 뭔지도 일일이 찾아보지 않게 앱 내에서 따로 탑10 콘텐츠를 한번에 볼 수 있는 버튼이 있었으면 좋겠습니다.밑에 바에 설정이나 찜목록 같은 찾기 어려운 버튼들도 다 넣어주십쇼. 만약 홈에 있는 내가 찜한 콘텐츠를 일일이 정리하려고 하면 하나를 삭제했을 때 갑자기 처음으로 돌아가져서 다시 스크롤해야 하는 불편함이 생깁니다. pc와는 차이가 확실히 날 정도로 너무 다릅니다.
809,다 좋은데 프리파라 시즌1 왜 없음..?ㅠ 우리 동심을 지켜주던 원본 라라 어디감ㅁ..
810,ㅇㅏ.. 티빙에 있는 모든 프로그램에 자막이 있는줄 알았는데 ㅇㅏㄴㅣㄴㅔ..ㅠ
811,"불편함.. 티비에서 연결하는데 한세월걸리고 앱을 한번 폰에도 깔아야하고 내가 폰으로 볼 일이 뭐가이있다고 시청도중에(음성: 영어, 자막: 사용안함) 자막을 사용으로 바꾸고싶은데 안됨..."
812,검색기능 좀 보완해줬으면....
813,뒤로가기 했을 때 바로 누르기 직전의 화면이 나왔으면 좋겠어요 추천작 카테고리 이어서 보고싶은데 뒤로가면 자꾸 초반의 화면이 나오니까 너무 불편해요
814,이렇게 갑자기 콘텐츠가 내려가는 경우가 어딨어요 안내도 없이....아메리칸 하우스와이프 잘보다가 몇시간 후에 들어가니 갑자기 회원님 지역에서 사용할 수 없는 콘텐츠라 뜨네요?
815,무한도전 자주보는데 회차 찾기가 너무 힘들어요 스크롤 내려가는것도 엄청 버벅거리고 최신회차 보려면 다 내려야되는데...
816,그동안 잘 사용하다가 오늘부터 무한도전 지난회차 찾으려고 스크롤 내리면 멈춤니다 폰 껐다 켜도 계속 같은 증상이고 업뎃도 해봤는데 안됩니다
817,개발자님들 Z폴드 4까지 나온건 아시는거죠?? 개발자분들 중에 폴드쓰는사람 분명 있을건데??? 안봐도 딱 보이는데???
818,TV로 보기 제일 불편한 OTT. 오프닝 건너뛰기가 무의미할 정도로 느리고 버퍼링 심함. 특히 장면 건너뛰기 제일 불편함.
819,시즌 정주행시 엔딩 크레딧 나올때 다음 에피소드 바로 보기 버튼 출력 필요함.
820,불편ㅡㅡ 오프닝 앤딩 자동스킵좀 만들자제발ㅡㅡ
821,콘텐츠는 역시 디즈니인데 추천 알고리즘이랑 자막 품질이 아직은 좀 구리다. 특히 넷플이랑 비교하면
822,전체적으로 콘텐츠가 빈약해서 볼게 별로없음
823,흥미 진진한 여러 프로그램 올라와서 좋은데 중간에 끊기는게 자주 발생하는게 좀 아쉽네요..
824,"불편해 죽겠네요
언제출시하나요
계획없는지 개발중인지 알고싶네요"
825,"시청하기 누르면 계속 설치앱창으로 다시연결되요 정말오랜만에 티비보려햇는데...,,또 르 르 ....."
826,"재생 버튼이나 10초 되돌리기, 빨리감기를 누르지 않아도 저절로 눌리는데 뭐 해킹입니까??"
827,"보완해야 되는 것들이 많긴하다... 1.일반 오프닝 건너뛰기, 다음 에피소드로 넘어가기 등이 없다. 2.검색엔진이 이상하다. (예)를 들어 매트릭스라고 검색을 안하고 ""매트"" 또는 ""매트릭""이라고 글자를 쳐서 검색하면 매트릭스 영화를 찾을 수 없다.(다른 영화들도 똑같다.) 그래서"" 혹시라도 이 콘텐츠가 있을까?""하는 마음에 일일이 다 적어야 한다. 그 컨텐츠 제목이 길면 길수록 불편함이 크게 느껴진다. 3. 1080p까지만 지원을 한다. 4. 볼게 없다.(거짓말이 아니고 진짜 없다. SNL 볼려고 다운받는 사람이 아닌 이상 진짜 없다. 나는 미성년자여서 보고 싶어도 못 본다 ㅠ-ㅠ)"
828,수요없는 공급인 프로그램만 잔뜩 만들어냄 이래서 넷플이랑 왓챠를 못따라감ㅋㅋ 아마 평생 못따라갈듯
829,불편합니다.화면이 느린느낌입니다 드라마 예능 보다가 보던 애니 다시보기할려면 기록에서 쌓여있는 횟차를 모두 지나야합니다 몇번시도한 외국 드라마도 지나고 중간에 그만둔 영화도 지나고 뒤지듯이 찾아야합니다 찜 목록에 들어가면 되나했는데 찜한 프로그램만 나오지 어디까지 봤는지 표시가 전혀 없어요 기록 삭제도 전체삭제 조차없어요 개선 좀 해주세요 꼭 보고싶은 프로그램이 있으면 이어플은 불편해서 기피하게 되요 이어플에서 하고 저 어플에서도 하는거면 저 어플로만 가게됨
830,보는 프로그램마다 자막보기를 설정해야하는건가? 아니면 설정에서 일괄 선택하면 안되나요? 또한1회당보고 그다음회자를 보더라도 또 설정을눌러야함니다 이건쫌.. 100개가 넘는건그만큼 계속 설정하라는건가요?
831,스크롤 말고 1~50 정도로 끊어주던가 회차별 검색 가능하게 해주세요. 놀토 하나때문에 쓰는데 옛날거 생각나서 보려면 nn화로 검색도 안되고 노가다로 올라가야함. 휴대폰은 그나마 빠른데 tv로 볼 때 미쳐요.....
832,재생시점 초기화 되는거 왜 수정 안해 줍니까? 돈은 매달 결제해 가면서 왜 이런 버그는 빨리 수정 안해 주나요? 영화를 보다 홈으로 나오면 일일이 재생시점을 찾아서 봐야 하나요?
833,화면크기변경불편
834,목록에서 회차 검색이나 스크롤로 이동할수 있게 좀 해주세요 무한도전같이 회차많은거는 목록 내리기가 너무 번거롭네요
835,앱 자체가 실행이 안됩니다 못해도 5번은 지웠다가 접속한거 같은데 그래도 안되네요
836,시청중 목록 제거 못함 빠른 넘기기 못함 한글 더빙만 잘했음
837,웨이브 접속해서 보고자하는 프로그램 누르면 그전에 봤던거에서 자동재생 되는거 너무 불편해요 그 이전처럼 회차목록에서 내가 보고자하는걸 찾을수있으면 좋겠어요
838,프로그램 검색시 방송국별로 나눠져있으면 검색이 수월할것 같습니다 반영부탁드립니다
839,무한도전 다시보기를 주로 보고있습니다~ 예를들어 13년꺼 보고있다가 회차선택하면 08년부터 상단으로 다시 올라가있어서 회차선택을 일일이 내려서 선택해야 하는게 너무 불편합니다.. 보고있는 영상에 고정되어서 근처 영상을 선택할수 있도록 업데이트 해주세요 많은분들이 공감할듯ㅠㅠㅠ
840,"다 좋아요~ 너무 좋은데
싱크 안맞는게 너무 심하네요
특히 화면 작게해서 다른거할때.. 다른 플랫폼들은 안그런데 쿠플만 유독 심하네요 ㅠㅠ 몇번을 껐다켰다..
특정 프로그램을 볼때 그런게 아니라 다 그래요.
그것만 개선되면 참 좋을것같습니다.^^"
841,"아 진짜 업데이트 왜했나요, 시청중콘텐츠 너무불편한데, 자동재생되는거 끄는기능을 만들던가요. 예전처럼 목차나오는게 좋아요 다시 돌려주세요 ㅠ"
842,매주 업데이트인 프로그램들 보면 아닌것들이 많이 보이더라구요 제발 빠르게 해결해주시길 바랍니당
843,처음에는 콘텐츠 없어서 마블말고는 볼거없었는데 계속 새로운거 추가되서 좋아요!
844,회차 이용중 서비스지연으로 계속 오류 뜨는데 문제가 뭘까요? 이용료까지 내면서 정기사용하고 있는데 짜증납니다
845,"많은 컨텐츠가 있고, 사람들이 많이 보는 프로그램은 왠만하면 다 볼 수 있어서 좋았습니다.
하지만 영상을 다 시청했는데도 시청중인 목록에 계속 떠 있어서 개인적으로 지워야 하는 번거로움이 있었습니다.
영상을 시청하다가 화면을 옆으로 돌렸을 때 렉(?)과 비슷한 현상이 있으면서 화면이 멈춰버려서 어플을 껐다가 다시켜야할때가 자주 있었는데 이 부분은 사용하면서 정말 불편하다고 느껴진 부분입니다. 제발 개선해주세요 ㅜㅜ"
846,치얼업 3화 4화 재생안됨 콘텐츠가없다고 팝업뜸
847,버튼의 터치가 너무 공간이 작아서 불편하다. 조금만 빗나가도 원하는대로 작동이 안된다. 넷플릭스와 비교 됨.
848,업데이트후 에피소드 원하는 회차 찾아 가기가 힘들어졌어요
849,다음회차 넘기기 이전 없는거 다 글써서 알고 있겠지만 또 필요함 오프닝 넘기기 사라지면 오프닝 넘기지도 못하는거 이것도 문제임 예전이 나았는데 점점 이상해지네
850,이번에 업데이트 돼서 내가 찜한 콘텐츠가 일자로 나열되게 바뀌었는데… 전처럼 한눈에 볼 수가 없어서 너무 불편한 거 같아요.. 내가 찜한 콘텐츠만이라도 업데이트 전으로 한눈에 볼 수 있게 다시 바꼈으면 좋겠어요ㅠ
851,불편해요
852,체험버전으로 사용시작해봤는데요. 폴드4에서 크롬캐스트로 쏴서 보는데 연속재생이안되네요? 앱에서 연속재생설정해두었는데도 한편보면 계속 종료됩니다. 한편끝날때마다 해당에피소드찾아서 다음편을 꼭 클릭해줘야합니다. 원래 그런건가요?
853,콘텐츠 전시 밴드가 뭔가요 개발자인 저는 대충 감이 오지만 일반 사용자는 뭔말인가 싶을거 같네요 너무 대충 아닌가?
854,콘텐츠는 좋은데 최적화 좀; 발로 만들었나 맨날 무한 로딩이네
855,영상이 너무 예쁨
856,재생속도 바꿀수있게 해줘라
857,PIP모드에서 다음화 재생시 오프닝 자동 건너뛰기 기능은 왜 없어졌나요... 흐름 끊겨서 불편해요
858,"업데이트하면서 오래된 기종은 지원이 끊겨서 앱 사용 이 불가능해져서 불만이지만 그건 그럴 수도 있는거고, 한 광고 반복해서 틀어주는거는 진짜 듣기 싫습니다. 다음 프로그램 기다리면서 미리 틀어놓으려고해도 15초에 한번씩 반복해서 듣고 있으면 너무 짜증나서 그냥 꺼버립니다. 자사 프로그램 광고여도 제발 다양하게 해주세요. 치얼업이고 금수저고 꼴도 보기 싫습니다. 첫번째 중간광고에 치얼업 반복하고 두번째에 금수저 반복하지 말고 다 섞어서 한타임에는 한번씩만 해주세요..."
859,아이 퍼피구조대 영어로 보여주는데 활용하고 있어요. 그런데 영어로 음성을 설정해 놔도 다음 에피소드로 넘어가면 또 한글로 바뀌어 버리네요 ^^; 에피소드 때마다 영어로 다시 선택해 줘야하는 게 불편합니다 ㅜ
860,점점 콘텐츠가 늘어나네요
861,너무 좋은데요 왜 자꾸 콘텐츠들을 없애는 건지 모르겠어요. 제가 보던 것들이 갑자기 볼 수 없는 콘텐츠라고 뜨면 너무 화가나네요.
862,다음화 넘어갈때 전체화면 해제되는거랑 영상시작되면 에피소드목록 못보는거 너무 불편하고 짜증납니다. 이런거 감수하면서 계속 구독할만큼 컨텐츠가 많은것도 아니고 걍 구독끊으려고요.
863,콘텐츠 재밌는게 많아요:)
864,좋아하는프로그램 많아서 연간으로 보는데 환승연애 저팀들좀 어떻게해보세요ㅋㅋㅋ 지네멋대로 왓다갓다 왜저러는거지? 내돈내고 내가보는데 기분잡치게
865,"시청 완료 후 다음화 클릭 후 '오프닝 건너뛰기'를 클릭하면 건너뛰기가 안되고 되려 맨 앞으로 돌아갑니다. 아무리 ‘오프닝 건너뛰기’를 눌러도 되려 그 화의 맨 앞으로 가네요. 또 10초 뒤를 눌러도 맨 앞으로 가요.
뒤로 가서 다시 클릭해야 그제서야 오프닝 건너뛰기가 가능해져요. 모든 화가 그런건 아니고 3,4편 연달아 보고나면 꼭 중간에 한번씩 랜덤으로 이러네요.. 에러면 보완 부탁드립니다! 원래 안그랬는데 2-3주 전 부터 갑자기 이래요!"
866,고화질 다운필요해요.. 그리고 무한도전 같은 프로그램 볼때 스크롤 계속내려야하는문제는 계속 불만사항 나오고있는데 엄청 큰문제도아닌데 왜 업데이트를안해주십니까...
867,영상 속도 조절 기능이 없어서 매우 답답합니다. 곧 1년 결제 만료기간인데 이부분이 개선되지 않는 한 재결제는 하지 않을것같습니다. 개발 요청합니다.
868,검색기능이 아직 모자른 느낃
869,"시청내역, 현재 시청중인 영상 삭제해도 그대로 남아 있음, 시청내역 너무 지저분하고 불편함"
870,업뎃후에 첫화면에서 영화 리스트 썸네일이 다 안보이고 검은색으로 뜨네요
871,×1.75 ×2배속 우측 스크린 스크롤 볼륨좀~~ 업데이트좀 8282...
872,실시간TV와 키즈 동영상은 재생이 되는데 영화와 프로그램 Vod는 재생이 전혀 되지 않고 있습니다. 업데이트는 언제 나오나요?
873,에피소드 다음화 업데이트가 안됩니다 버그인가요?
874,영상 업데이트 안하시나요? 아직도 방영중인 예능프로가 왜 7월 31일부터 멈춰 있는거죠? 11월인데 몇달을 업데이트 안한건 너무 하지 않나요? 그러면서 메인화면에는 매주업데이트 라고 되어있고 혹시나 해서 다른 프로그램도 보니 똑같이 같은 날에 아니 7월달에 멈춰있네요? 그리고 프로그램 리뷰를 보니 최신회차 업데이트 되면 오래된 회차가 없어진다던데.. 이래서 누가 이용하겠나요? 비용이 저렴하다고 질과 양도 저렴하면 안되는거 아닌가요? 돈을 조금더 받더라도 최고의 품질을 보여줘야 하지 않나 싶네요 소비자는 절대 바보가 아닙니다
875,검색하면 콘텐츠가 안 눌러져요 돈받고 어쩌자는 보지말라는건지?
876,저 애니보는용도로보고있는데 너무 최고에요ㅠㅜ 엔딩스킵이랑 오프닝 스킵만있으면 짱일꺼같구 자꾸 애니가 사라져요....
877,전체화면으로 보다가 뒤로가면 원래의 세로 화면이 아니라 자꾸 가로화면에서 에피소드 목록이 뜨네요 수정해 주세요
878,있던 프로그램들은 왜 없애는거에요? 응답하라나 이런 시리즈들 월정액 아깝네요
879,현존 최강 콘텐츠 앱
880,쉬지 않고 업데이트되는 재밌는 콘텐츠들 너무 행복합니다.. 디플 들어갈 때마다 어릴 적 그 시절로 돌아간 듯.. 다만 장면 선택이 좀 더 편하면 좋을 거 같아요~
881,런칭한지 3년도 안된 ott 치고 볼거리는 꽤 많아서 돈값은 하네요. 다만 보고싶은 에피소드 찾으려고 화면 스크롤할때마다 자꾸 터치가 잘못 먹혀서 다른 에피소드에 들가져요ㅋㅋㅋ 큰 문제는 아니지만 에피소드 로딩 속도 생각하면 꽤 시간낭비가 심해서 빨리 해결되었으면 좋겠습니다.
882,영샹 시펑 리스트에서 안 볼 것들은 메뉴 버튼 만들어서 시청기록에서 지우기 만들어주세요.
883,"프로그램. 영화를 볼 수 있어 유용하긴 하지만 넷플릭스,웨이브 같은 서비스보다 볼거리가 매우 적습니다. 프로그램,영화,만화 등 새로운 볼거리 좀 추가부탁드려요"
884,그것1 은 있는데 그것2가 없네여 ㅠㅜ 다른 앱에서는 돈내고 해야해서 넷플만 의지하는데 그것2도 계약해주심 안댈가요ㅠㅜ 이거 ㄹㅇ 그것 2가 레전드 인데 ㅠㅡ 제가 진짜 넷플 라버하잖아여 라ㅂㅓr
885,"타 OTT처럼 자막좀 어떻게 안되나요? 렉도 너무 걸리고, 몇편보고 나면 다음회차에서 렉이 심하게 걸려서 넘기기도 힘들고... 한국프로그램에선 자막이 자동으로 안나와야하고, 외국어권에선 자막이 자동으로 나와야 하는데... 자막설정 빼놓는거 일일이 해야되고... 개선이 시급하네요!!"
886,어휴 진짜.세로 스크롤 모드로 바뀐후부터 넷플 보기 개불편하고 짜증난다.해지하고싶다.내가 이미 본것과 찜한 목록만 나오자나!!!왜 쓸데없이 변경한거!!!! 1년전으로 돌려놔라!!!!!
887,재미있는 프로그램이 많네요
888,너무 재밌게 잘 이용하고 있어요. 더 좋은 콘텐츠 많이 올 려 주세요.
889,영상 속도 조절이 있으면 좋겠습니다 꼭 만들어서 넣어주세요
890,11월 업데이트 너무 불편해요.. 저번처럼 분류해서 묶어주세요..세로로 그냥 나열되어있어서 골라서 보기 너무 불편합니다 이게 무슨짓인지... 넷플에서 정해놓은 순서대로 그냥 스크롤 내려서 일일히 찾아야하는거 진짜 개킹받습니다 유튜브 처럼 뭐 새로고침되는 것도 아니고 들어갈때마다 똑같은 순서대로 나열해서 진짜 관심도 없는 프로그램들 까지도 다 노출되는거 진짜 최악입니다 스크롤 탑으로 한번에 올리는것도 없도 도대체 누구머리에서 나온 아이디언지.. 최악이에요
891,컵헤드 쇼 시즌 3의 몇몇 에피소드의 소리 싱크가 맞지 않습니다 (한국 더빙 한정)
892,시청중프로그램 목록 삭제하면 안 나타나게 좀 해줘요 다 본건데 삭제 해도 또 목록에 뜨고 삭제해도 또 뜨고 정리가 안돼요
893,콘텐츠를 저장하고 삭제하려는데 삭제를 누르면 앱이 멈추고 아무것도 안눌려요 매번 시도하는데 매번 똑같아서 몇달째 못 지우고 있어요 개선좀 해주세요 ㅠ
894,시청중인 콘텐츠 삭제 없고 자막설정 구리고 로딩 느리고 킹받네
895,콘텐츠 나열 이거 왜이렇게 바뀜 ? 세로로 쭉 내려보게 바꼈던데 보기에 개불편 원래데로 돌려주시길 ㅡㅡ
896,프로그램상으로는 자막이 켜져있는데 보다가 일부분은 자막이 안나올때가 종종있어요 모바일이나 노트북이나 전부 그래요 다시돌려보면 자막이 또 뜨는데 매번 돌려보기 불편하네요
897,"영상을 10초씩 넘기거나 드래그하여 구간을 옮길 때 검은색 화면이 뜨거나, 재생되기 전까지 시간이 소요되어 답답..한 경우가 다소 있습니다. 
스킵을 주로 하며 시청하는데 스킵 후 답답함 때문에 이 습관이 고쳐지고 있습닏댜... 하하 그래도 이 알수없는 느림?이 개선되었으면 좋겠어요!"
898,TV용 앱에서는 성인콘텐츠 잠금 해제가 불가능해서 매 에피소드마다 인증비번 입력해야합니다...
899,싱포골드라는 프로그램 보려고 결제했는데 영상이 반이 없음 원본 2화는 79분인대 웨이브는 37분 실화임? 바로 다음달 결제 취소함 그리고 첫달무료 링크타고 들어갔는데 걍 월 결제로 슝 가져감 예전에 웨이브 사용한적도 없음 걍 일 안하고 덜벌려는 작정인듯
900,연속으로 보는데도 자막 설정 왜자꾸 꺼지나요ㅡㅡ 시리즈물인데도 다음화 넘어가면 자막 자꾸 꺼져요. 짜증. 오프닝 건너뛰기도 안 되고 엔딩 건너뛰기도 안 되고. 구려요 언제 나아지나.
901,오프닝넘기기 쿠키보기 TV앱에서는 되는데 모바일에서는 왜 안 되냐... PiP도 한동안 되더니 또 안 되네 ㅡㅡ
902,아니한동안잘쓰고있어는데가면갈수록왜이런거죠?왜검색이안되요검색하면검색한프로그램이나와야되는데아예나오질않아요;;밑에서일일이찾아야되고왜이렇게바뀐건지도대체쓰라고하는건지쓰지말라고하는건지요새는진짜지우고싶어요..ㅠ이만한앱이없으니쓰고있지만공짜로쓰는것도아니고정기적으로결제를하고쓰는건데쓰기편하게바뀌여야지가면갈수록불편하게바뀌고뭐하자는건지...제발쓰기편하게좀합시다!!제발!!돈쓰는거아깝지않게해주세요제발~
