,0
354,"로그인이 안되서 라이브 경기를 못보는 중..
이럴때쓰려고 쓰는건데 로그인이 안된다니 
이게 무슨 일이에욥 ㅠㅠ 쿠팡 와우 회원이 아니시냐고 물어보는데 뭔 뜬금없는 소리랍니까 ..?"
355,왜 접속이 안되나요 중요한 손흥민 경기때
356,하... 이 중요한 축구경기를 로그인 오류로 놓치는게 말이 안됌 ㅡㅡ
357,오늘 중요한경기 볼려고 하는데 일부러 로그인 안되게해놨니?? 로그인이 갑자기 인되니???ㅋㅋ다신 이거 안쓰고 내주변 모든사람들한테 쓰지 말라고 한다!
358,손흥민 경기 보려고 12시에 접속하려고 하니 로그인 자체가 안됩니다. 짜증 제대로네요.
359,별한개도아까움 로그인도안돼서 지금 토트넘경기도못보고있음 20분째 로그인할수없습니다 팝업만뜨는건 오버아니냐진짜
360,서버 자신없으면 중계권을 따오질 말든가 아님 미리 예측을 하고 조치를 취하던가 내내 기대하고 마지막 경기보러 왔다가 내내 로그인만 하다 경기 끝나겠네 다운받지마세요 능력도 뭣도 없는 애들이 운영하는 어플 1점도 아깝네
361,오늘 pl 마지막 경긴데 로그인 안되고 이게 뭔가요 돈 받고 서비스해주는 거면서 이런 오류가 있으면 어떡하나요 확인해보니 와우회원도 맞는데 자꾸 로그인이 안된다고 뜹니다
362,로그인안되서왔더니 다른 사람들도 다 안되나보네.. 축구말곤 솔직히 잘 안찾게되는데 축구볼때마다 이러면 좀 짜증나지..
363,공짜도 아니고 유료인데 로그인도 안되는게 말이 됨?
364,갑자기 로그인이 안되는데 뭔가요? EPL 손흥민경기 보는데 로그인 안되서 열받네 ㄷㄷ
365,로그인을 쿠팡앱으로 하게 바꿔놔서 로그인이 안된다. 도대체 왜 바꿔서 로그인이 안되냐고!!! 토트넘 마지막 경기인데... 아 진짜 짜증나네
366,로그인이안되요 토트넘경기봐야되는데ㅡㅡ
367,아니..전에 잘 쓰다가 오랜만에 들어갔는데 쿠핑앱으로 로그인하기 떠서 누르는데 계속 로그인 실패가 뜹니다; 지금 축구 봐야되는데 이게 뭔일이야
368,손흥민경기 무료해줘서 와우회원 안끊고있는건데 장난하냐?공지를 띄우던지.ㅁㅊ
369,쿠팡앱 로그인 상탠데 왜 로그인 조차 되질 않나요?? 쿠팡멤버십 계속 돈내고 쓰고 있는데 접속을 못하게 하면 어쩌자는거죠
370,축구보려고 했는데 접속이 안되네 쓰레기앱ㅡㅡ
371,손흥민 보려는데 쿠팡 서버터짐 제일 중요한 순간에 로그인 안 되는 클라스
372,와우회원인데 로그인할수 없습니다 나중에 다시 시도해주세요 이럼 돈내고 서비스 이용도 못하고~ 이러면 따로 분리해서 하든가 화나게 하지말고
373,손흥민이가 기다리고있는데 이게 머냐구.....
374,축구보려니까 딱 안되는 기적의 타이밍. 쿠팡 훌륭합니다.
375,와 접속이 되야지 결제가 아까울정도로 최악이네요 토트넘 경기볼려고접속했는데...접속이 미접속이라.... 최악중에 최악.. 별하나도 아까움.. 역시 쿠팡 이름값하네요...
376,장난하나 월정액 받아먹으면서 여러사람 로그인 안되서 서버터졌네 동시접속자 서버확장 안합니까? 매달 돈은 받아가면서 정작 필요할때 로그인 에러 계속 나서 구경도 못하네 라이브방송
377,손흥민경기 중계권 왜삼? 관리도 못할거면서
378,아니 무슨 로그인이 안됩니까.. 쿠팡 앱으로 로그인하기 누르면 로그인 할 수 없습니다 다시 시도해 주세요 팝업이 나옵니다 답답하네요
379,몇달전 스포츠이벤트때도 그러더니 로그인 안되네 아 짜증나 앱이라고 서버좀 제대로 하던가 짜증나 미치겠네 로그인안되니 내 결제금액 돌려주세요
380,새벽시간이나 저녁시간때 애기들 때문에 티비로 축구보기가 힘들어 축구 때문에 결재를 했는데 시즌 마지막경기 그리고 제일 중요한 경기인 토트넘 경기를 로그인이 안되네요ㅡㅡ 에휴 이 경기 볼려고 결재를 했는데 30분 동안 무한 로그인만 합니다ㅡㅡ
381,"4,990원만 결제되고..로그인도 안되는데..이게 뭐지?"
382,로그인 왜 안 되냐... 손흥민 경기 봐야 하는데... 화딱지 나네...
383,왜 로그인이 안되는거죠?? 하필 토트넘 노리치 마지막 경기할때에??
384,와 손흥민 경기 봐야하는데 오류걸려서 못보네 최악이다
385,로그인이 안됩니다..쿠팡 아이디로 로그인하기 누르는데 로그인할 수 없다고 뜨네요
386,쓰레기같은 앱. 한번 팅기더니 30분째 로그인 안됨. 로그인 반복 시도해도 로그인할 수 없습니다. 라는 문구만 반복. 고딩들이 만든 앱도 이보다는 안정성 높겠네요
387,아무 설명 없이 로그인이 안 됨
388,축구때매 남겨놓은 ott인데 이렇게 로그인도 안되면 누가쓰냐
389,개빡치네 토트넘 노리치한다고 볼라니 로그인안댐 ㅡㅡ 피자 맥주 사왓더니 짜증나네
390,축구보려고 결재했는데 서버 터져서 로그인도 안되네 이럴거면 돈은 왜받냐
391,중요한거 볼때만 로그인 안되고 오류뿜고 뭐하자는건지
392,30분간 로그인 문제 해결 못하고있음.....
393,"진짜 짜증나네요. 토트넘 경기 볼라하면 로그인이 안된다하거나, 시청중 버벅거리고, 왜 이러나요?"
394,손흥민 경기 보려했는데 서버가 터져서 보지도 못했습니다. 쿠팡플레이 때문에 로켓도 돈 냈는데 이건 아니죠.
395,손흥민 경기보려고 앱누르니 로그아웃되어 있고 20분째 로그인이 안됩니다. 로그인 할 수 없다는 메세지와 어렵게 로그인 가능 메세지에 허용 버튼 눌러도 결국 다시 시도하란 문구만 떠요. 이러다 경기 끝나겠어요!
396,아 진짜 손흥민 시즌 최종전에 설마 서버 터져서 접촉안되는겁니까? 진짜 속터지네요
397,이새벽에 손흥민 경기 얼마나 본다고 서버터지냐?싼마이 한계인듯 에잇 퉷
398,로그인안대노 토트넘경기 못보니
399,와 미쳤다 손흥민 시즌 마지막 경긴데 이걸 못보게하네
400,내돈 돌려줘라 내가 이럴려고 와우회원했는줄아냐? 광고는 오지게하고 손흥민 왜 안보여주냐 답답해 속터져
401,손흥민 경기보려고 하는데 왜 자꾸 로그인 할수 없습니다 라고 나오고 로그인이 안되죠? 환장하네요
402,로그인이 오류로 계속 안돼길래 다시 재설치하고 쿠팡으로 로그인을 했는데도 로그인 이후에 계속 알 수 없는 오류가 발생했다고 뜨면서 사용을 못하고 있습니다. 기종은 13 pro이고요 서버에 문제 인걸까요 ? 정말 화가 나네요 ㅡㅡ
403,돈 받아 먹으면서 관리 너무 이상하게 하네요. 토트넘 노리치 보지도 못 하고
404,"쿠팡 와우회원 맞고 쿠팡앱도 깔아져있는데
쿠팡앱으로 로그인조차도 진행이 안되요
올바른 포맷이 아니라고 나오는데 뭐가 올바르지 않은거죠? 자꾸 올바르지 않게 개발하실래요?
 야밤에 어디 문의도 못하고 속수무책이니 그냥 참고 넘어가야만 한다는 사실이 너무 짜증나 죽겠네요."
405,"와우 가입되어있는데도 계속 로그인 자체가 안되고 

앱 연결해서 로그인 하려해도 올바른 포맷이 아니여서 읽을 수 없다고 뜨네요;; 이게 뭔지"
406,"토트넘 경기 보려고 로그인하는데 계속 안되네요
돈 내고 이용못하는게 말이 됩니까"
407,"와우멤버십을 몇년째 이용중인데 쿠팡플레이 앱에 단 한번도 로그인 못함
쿠팡아이디 비번을 잊어버린것도 아니고 쿠팡앱으로 로그인도 안되고.. 로그인 기본인 아이디찾기 비번찾기 기능도 없고.. 대체 이걸 이용하는 사람이 있기는 한가요? 로그인이 돼야 뭘 이용을 해보지..  별 한개도 아까움.. 오늘 안에 로그임 안되면 쿠팡 고객 한명 잃은줄 아세요"
408,뭐 볼려고만 하면 올바른 포맷이 아니라고 쿠팡 앱 로그인도 안돼고 아이디로 로그인해도 쿠팡와우 회원인데 인식도 못하고 왜 맨날 오류가 뜨나요?
409,쿠팡플레이 터졌어요? 프리미어리그 마지막 경기보려는데 로그인도 안되고 앱 자체가 실행이안되네요 장난하시나 토트넘 경기봐야한다고 제발 좀
410,손흥민 경기는 홍보 다 해놓고서는 사람 많이 몰려서 서버 터짐???
411,"로그인이 안됩니다 .......
쿠팡 앱으로 로그인도 안되고 아이디쳐서 로그인해도 안돼요 ..."
412,축구중계보려는데 로그인 할수없다고만 계속 뜸
413,축구봐야하는데 로그인을 할수 없다고 무한반복 축구하나 볼라고 돈내고 쓰는데 일주일어 한번있는경기 못보고있음 어떻게 보상할꺼임?
414,네이버 카카오 못가고 쿠팡에서 일하는 이유가있네ㅋㅋ
415,토트넘 경기봐야하는데 오늘 갑자기 로그아웃돼서 쿠팡으로 로그인이안되네요 이 중요한날에 갑자기 안되는건 무슨 상황인가요?
416,손흥민 경기보려고 가입한건데 마지막 경기 계속 로그인이 안되네요 어쩌라는 건지
417,야이놈들아 손흥민때문에 서버폭주할거 몰랐냐? 니놈들때문에 사용못하는거니까 모든회원 한달 무료혜택이나 내놔라...
418,쿠팡와우 회원 유지하는 이유가 토트넘 경기볼려고 하는건데 전반 45분동안 경기볼려고 수차례 반복해서 로그인시도 했는데 쿠팡앱으로 시도시에는 알수없는이유로 로그인 불가 아이디로 로그인 시도시에는 쿠팡와우 회원만 가능하다구.. 저 쿠팡와우 회원이 맞거든요. 결국 전반 끝나고 하프타임 되어서야 쿠팡어플로 로그인 성공했는데 너무한거 아닙니까? 로그인 할려고 낭비된 시간동안 경기 못보고 이게 뭐하는건지 유료서비스 ott가 맞나 싶네요 이건 아닌듯요.
419,손흥민 축구보려고 쿠팡플레이 가입했는데 에러만 뜨면서 접속조차 안되면 이때까지 냈던 돈 다 환불 해줘라ㅡㅡ 진짜 개 빡치네
420,축구보려고 겸사겸사 결제까지 해서 이용하는데 서버가 터졌는지 로그인도 안되네. 이따위로 할거면 가격 왜 올리려고 하지? 이해할수가 없네
421,"앱으로 연결해서 로그인하려하면 오류가 계속 뜨고
아이디랑 비밀번호 쳐서 로그인하려고 하면 로켓와우회원이 아니라 뜨네요,,, 로켓와우회원인데,,.,,,,"
422,"와우 회원인데 회원아니라고 ^^
쿠팡 앱으로 로그인하기 연결하면 네크워크 유실?
오늘 손흥민 선수경기만 기다리고 있엇는데 아주 개빡치네요.
뭐 씨의부러얼 어떻게 하라는건지"
423,"아니 쿠팡플레이 진짜.. 로그인이 왜 안되나요??
쿠팡 앱으로 연결해서 로그인도 안되고, 일반 아이디랑 비밀번호 입력해도 안되고…
혹시 제가 잘못 기입한줄 알고, 웹 그리고 쿠팡 앱에 해봤는데, 잘만 되네요…
아니… 손흥민 경기만 보려 하면 안되네 화나게"
424,"그 동안 잘 되다가 로그인이 안돼요
토트넘 경기 봐야하는데 왜 안되는건지
소스배포 문제인지....?? 돈주고 손흥민 경기만 보고 있는데 이것도 못보면ㅋㅋㅋ"
425,"직접 로그인을 해도 멤버십 회원이 아니라고 하구요
1년 넘게 멤버십을 유지하고 있고 축구를 보기 위해 로그인이 안되서 돈 내고 이용하는 플랫폼을 이용하지 못하네요. 쓰레기 앱 덕분에 다른 곳 찾아가서 봅니다"
426,축구볼려고 결제했는데 ㅋㅋ 정작 로그인 오류뜨는중 ㅋㅋㅋ 개화남
427,아니 중요한 경기봐야되는데 로그인이 안되면 어쩌라는거지
428,손흥민 경기보려고하면 서버터지는데 서비스를 왜하는지...
429,계정이 2개밖에 안되요.수정부탁드려요ㅠ
430,진심 서비스 가입 손흥민 경기때문에 했는데 왜 로그인이 안될까요...?ㅋㅋㅋㅋㅋㅋ
431,와우회원인데 갑자기 왜 로그인이안됌? 개짜증나네
432,아 토트넘 볼라고 결제했더니무슨로그인이 안돼서 하
433,계속 로그인할수없다고 다시시도하라는대 제돈주고 제가못보면 어쩌나요
434,멤버십 가입했는데 자꾸 가입하라고 뜨면서 로그인 안되는건 왜그럴까요^^...
435,무료이용권등록을 어떻게 하는지 나오지않아서 쿠폰번호누르려고 프리미엄이용권 눌렀다가 결제되버림 구글에서 환불도 안해주네요..주말껴서 문의하느라 시간도 다 가버리고 정말 화나네요 환불하려고 재생도 한번 안함
436,손흥민경기보기위해결제했는데 접속못하게하면 무엇을 위한 쿠팡플레이냐?
437,꼭멤버십가입을해야돼나요
438,무료 영화가 너무 허접한 것만 있음....
439,아예 로그인이 안되서 리뷰 남겼었는데 답변이 친절하네요. 앞으로는 이런 문제가 없길 바랍니다.
440,로그인이 안돼요. 아이디비번 치고 로그인하기 백날천날 눌러도 아무반응이 없습니다. 에러가 발생했다는 메세지같은건 전혀안뜨고 그냥 아무반응이 없어요
441,네이버플러스로 가입해서 잘보고 있어요
442,회원가입부터별로임
443,어플 터치하면 계속 검은 화면만 떠요. 로그인창도 안뜨고.. 삭제했다 다시 깔아도 이런데 왜 이러는 거죠..?
444,토트넘 경기 표사려면 일단 유료회원 가입해야 되는건가요?? 쿠팡한테 경기 중계나 티켓으로 얻는 이익도 있을텐데 양아치 아닙니까??
445,네이버 플러스로 실시간 보러 왔는데 되는게 한개도 없음. 뭐하러 제휴하는지.
446,매번열때마다 첫화면이 추천이랑 계속바뀌어서짜증나요 그냥 내가보던거를 맨위에 해주면안되나요? 그리고 가끔 광고한다고 전체화면으로 깜짝깜짝 놀라게 무서운화면떠서 화나요
447,축구중계보려고 결재했는데 화면정지ㅡㅡ
448,진짜왜그러세요?손흥민마지막경기.이번 태국하고하는경기 생중계권을따오지말던가요!보지도못하고ㅡㅡ
449,축구때마다 진짜 너무하네 돈받고 매번 못보게하는거는 아니지않나요? ㅡㅡ
450,축구볼려고 결제했는데 서버다운 너무 많네요!!!!!
451,축구 볼려구 하는데 한국 경기만 아나와ㅋㅋ 서버 문제면 빨리 고치든가
452,축구보려고 깔고 가입한건데 왜 에러만 나는겁니까?
453,"간편 로그인이 더 편하니까 간편로그인할 수 있는 거 아닌가요? 이름부터 ""간편""로그인인데;; 간편로그인도 첫 달 혜택되는 것처럼 대놓고 간편로그인할꺼냐고 나와있는데, 결제 방법은 콩알만하게 찾아보게 해놓고선 환불불가라... 웨이브 이용하지 않겠다고 한 것도 아닌데 말이죠? 뭐 돈 벌었으니 땡이겠지만 학생입장에선 부담이 돼요. 다른 분들께는 그러지마시길 바라요."
454,축구잘봤습니다
455,전 넷플릭스를 아빠랑 같이 사용하는데 드라마 보는걸 진짜 너무 좋아해서 맨날 보는데 핸드폰 바꾸고 다시 로그인을 하려고보니 이메일과 비밀번호를 제대로 입력해도 회원가입 완료가 얼마 안남았다는 창이 뜨고 로그인이 안돼요 왜이러는건가요?ㅠ
456,열기를 누르면 구글 로그인이 나오는데 다른 아이디로 로그인하려면 어떻게 해야하나요...?
457,방송 무제한 네이버플러스 멤버십 이용중인데 볼 수 있는 게 없네요. 볼 수 있는 영상을 확인 할 수 있나요?? 아니면 하나하나 다 눌러보고 이용권 구매나 무료 문구를 확인 해야 하나요?? 네이버플러스 멤버십 존은 따로 없는 건지ㅡ
458,무료인데 이정도면 훌륭합니다
459,토트넘 세비야 경기 자리잡혀서 결제하는데 백신설치하라고해서 설치하고들어가니까 튕겨져있네 말이돼나
460,어이없네. 쿠팡 플레이 어플 자체를 로그인해야만 들어갈 수 있게 만들어놓고 접속해서 토트넘 티켓 1시간 가까이 대기하고 겨우 들어가서 예매하려는데 '로그인해야 예매할수 있습니다' 이런 문구띄우고 다시 처음으로 돌아가버리네 장난하나 진짜. 내가 무슨 유령 아이디로 들어가서 대기했단 말임? 뭔 경우야 대체
461,"호리미야 올려주세요!!!프리랑 흑집사,기븐 잔부다다아아아ㅏ앙!!!!"
462,로그인 때문에 신비아파트 빛에 뱀파이어와 어둠의아이 못봤어요ㅠㅠ 로그인 구글 계정으로 하면 안된나요?제 아이디하고 비번를 몰랐어 구글 계정으로 하고 싶어요!!!그리고 로그인 너무 어려워요
463,진짜 리뷰쓴 어플 살면서 한개도 없는데요 결제를 하려해도 할 수 없네요? 구글지메일 아이디 비밀번호 몇번이나 맞게해도 왜 틀리다고 계속나오죠? 문제가 발생했다고만 나오는데 그 문제가 뭔지 알려주던가요 아니면 다른 결제방법도 추가해주던가 더러워서 안봐요 번창하세요^^
464,아니 멤버십 해지 했는데 왜 결제가 된거죠? 왜?
465,"멤버쉽 변경 은 어떻게 하나요? 결제 수단 변경,멤버스 변경 이런게 없던데 멤버스 해지 만 있고 어떻게 하라는건가요?"
466,봣던거 다시 보려고하면 제일 뒷부분 뜨면서 바로 다음회차 넘어감ㅋㅋ 다시 해도 넘어가고ㅋㅋ 누구아이디어지?
467,아니 다시 로그인 비밀번호 까먹었는데 그리고 시즌2 더빙 해놓고 안 올리는거는 또 뭐야 진짜 돈만 날림 돈 너무 아까움 ㄹㅇ 이걸 앱으로 만들네
468,"삼성에 받은 무료 3개월 이용권 등록해서 9월까지 이용인데, 로그인하니 다시 유로 가입하라는 안내가 나오네요. 당황스럽네요. 결재복구도 안되구요. 문제 해결 바랍니다. 연락 가능한 메일주소라도 알려주시죠."
469,앱을 깔고 들어갔는데 계속 로딩만 돼요. 안 들어 가지네요;;로그인 조차 안 됩니다;;
470,토트넘 경기 볼려고 12시까지 기다렸는뎈ㅋㅋㅋㅋㅋㅋㅋㅋㅋㅋ 하 개빡치네여 피드백 좋네요
471,"다음화로 자동으로 넘어가는것도 안되고
끝나기전 다시 화면을 크게 키워야 하는데
크게 키울때마다
재로그인하라고 해서 비번처야하고
어플 진짜 이상하게 만들엇네요"
472,무료라서 쓰는거지 돈주고는 절대 안쓸듯
473,"아무리 돈에 미쳐도 온에어를 보기위해 앱을 설치하라는 것까지는 참고 하고 또 회원가입에 로그인까지 하라해서 또 참고 했더니 이런 미친 실시간 온에어 방송을 돈주고 보랍니다,정말 미친거 아닙니까?다른 모든 방송사 채널들은 실시간 온에어 방송은 앱도 안깔아도 되고 회원가입 로그인도 안해도 다 시청됩니다,이제까지 모든 방송들 온에어 다 앱없이 로그인도 안하고 봤는데 이런 티비엔 방송은 첨 봅니다 너무 기분 더러워서 바로 앱 삭제 했고 여기 방송 관계자든 누가 개발 계획했는지 모르겠지만 유료로 볼 수 있는 것과 무료로 볼 수 있는 건 따로 있답니다,타 방송사들이 어떻게 시청자를 위해 서비스하는 지 좀배우고 공부하시죠ㅉㅉㅉㅉ"
474,평이 쓰레기라 네이버 검색하다 중국 진수기 우리나라빼고 공개했단말에 앱삭제하러감 ㅂㅂ 이런거 우리나라사람들 예민한데.. ㅉㅉ
475,네이버로 로그인 된상태인데 티빙 앱이 계속 로그인 시킴 로그아웃떠있는데 계속 처음 모바일앱 로그인시작하기로 도돌이됨
476,아니 와우멤버십을 여기서 가입하게 해줘야지 진짜 개불편하고 귀찮게 하네
477,뭐 이런 개같은 경우가 있냐..토트넘이 니꺼냐?더 가입안해
478,축구보게좀해줘라
479,가입했음에도 작동이 안됩니다. 축구 보려고 했는데.. 아아..
480,회원가입
481,와우멤버십 가입하라고만하고 링크도없고 내가 가입방법을 따로 검색해서 해야하고 진짜 개판이네 ㅋㅋㅋㅋ
482,아니 내.가 내이메일쓰고 내이름쓰고 내번호쓰고 했는데 왜안됨? 기분좋게 토트넘볼라 했더니 기분개잡차네
483,이거 설치하고나서 와우회원로그인을 누르면 쿠팡플레이가 쿠팡앱으로 로그인합니다 허용하시겟습니까? 라는 문구가나와서 예를 누르면 쿠팡플레이 이용을 위해 와우멤버쉽가입이 필요합니다 라는 문구가 나와서 확인을 누르면 다시 처음으로 돌아가는데요.... 어떻게해야하는건가요??????????????????? 쿠팡아이디 와우멤버쉽아이디 다잇는데 아이디 비번 입력하는 화면이 도대체 뜨질않네..
484,토트넘때문에 보는사람.......
485,축구만하면 멈춤 서버 증설좀 해라
486,회원가입을 하려고 했는데 회원가입란이 없네요..
487,축구보려면 안가입할수없게했네 이건 대국민 컨테츠폭행임
488,회원가입도 없고 g미럴 왕짜증 납니다.무조건 로그인만 아디.비번.뜨네요. 즤미럴 왕짜증납니다.
489,장난해요?? 로그인 자체가 안됨 회원가입 버튼도 없음.. 개열박네
490,축구보는데 좋아요.
491,가입하고 로그인하는데 계속 와우멤버쉽가입하라고만 나오고 와우멤버쉽가입하는거는 안나오고 진짜 짱남
492,토트넘 친선경기를 오직 쿠팡? 안보고 말지.
493,축구 독점 불편하네
494,왜 갑자기 로그인도 안되죠;; 유료서비스인데 이렇게 서비스 관리가 안되면 어쩝니까!!!
495,축구 좀 보자 왜 연결이 안 되는 건데… 만반의 준비 해놨는데 개망했잖아요… 관리 좀 제발
496,지웠다 깔고 다시 켜고 다 해봐도 네이버로그인이 안돼요 다시 원점이거나 꺼집니다
497,창 열면 자주 닫힘
498,웨이브 로그인 안되는데 된다고 문제없다 우기면 소비자는 당해야 되는건가요 환불도 안해주고 어쩌라는거죠 전화도 안되고
499,탈퇴도없고 요금도비싸고 누가보겠어 이딴걸요즘시국어려운뎅 흠 돈아까움
500,로그인창이 안뜨네요 아레까지는 자동로그인되다가 어제부터 재 로그인하라하면서 아이디와 비번을 몰라서 몇번실패하고 이후 재접속해서 로그인할려니 로그인창이 안떠요
501,"아니 다 좋은데 프리! 이거 어디갔나요 보는데 갑자기 없어졌어요;; 진짜 보고 싶은데 주술회전이랑 호리미야 들어오고 없어진건가요?,,"
502,캐리미에서 설치 후 실행하면 루팅된 기기에서 사용할 수 없다고 나옵니다. 캐리미에서 실행시 해당 검증 로직 좀 제거해주세요. 이거 한번 보려고 네이버 맴버십 결제 했는데 안되니 좀 당황스럽네요.
503,친절하지가 않아요. 로그인만 있지 회원가입 하려면 쿠팡공식사이트 가서 해야하고 와우멤버십도 어디서 하는지도 안알려주고 쿠팡 아무리 찾아도 와우멤버십 가입이 없길래 삭제했습니다.
504,회원가입해야 볼수 있네요ㅠㅠ
505,어플 로그인이 불가능함. 아이디를 입력하려고 하는데 키보드가 눌려지지 않음. 전원이 꺼졌다가 다시 켜짐.
506,8월 6일 개막하는 이피엘 22/23시즌 토트넘 경기 중계 이제 안해주시나요? 토트넘 손흥민 선수 보려고 와우 멤버십 가입했는데 중계 없으면 해지해야 겠네요ㅠㅠ
507,토트넘 경기 보려고 작년에 가입해서 잘 사용 중이였는데... 이젠 생중계 일정에 토트넘이 없네요? 이젠 중계안하는지요?
508,가입하지 마세요 해지을 못합니다..
509,토트넘 경기때문에 결제하고 봤는데.이젠 이것 마저도 없음????볼거 하나도 없는 플렛폼인데....ㅃ2
510,"ㅣ로그인이 왜 안되나요. 켜면 화면이 안나오내요 돈도 다내고 있는데요. 빨리좀 수정해주세요,"
511,네이버로 로그인하고 결제도 했는데 앱 설치가안됩니다~~ 환불해주세요
512,토트넘 중계.... 제발
513,유료라서 좀....
514,왜 손흥민 축구경기 중계 안하면서 가격은 올리냐?!!! 가격 다시 낮춰라!!
515,"앱을 재설치해도 무한 로딩만 하고 다시깔고 해도 오류코드 14라고 아이디,비번도 개무시됨ㅠㅠ 이런 쓰레기를..뉴스에 제보할까?ㅡ.ㅡ"
516,무료배송도 받고 영화도 보고 일서이조-- 가격대비 짱~^^
517,토트넘경기도안보여주면서 토트넘그만울거먹어라한새도아깝네
518,사업자는 회원도 아닙니까???
519,제발 자동로그인 좀 해제시켜주세요 이것때문에 다른 아이디로 로그인이 안돼요 홧병나서 뒤질 것 같다고요
520,이제 토트넘 경기는 생중계 못보나요?
521,회원가입 버튼?이 안보이는데........
522,보기편하고 좋은데 무료사이트랑 다른게 없는게 아쉽네요 많이 비싼편입니다 웨이브가
523,임영웅님 보려고 가입
