,0
986,예전 시즌사용자입니다 예전에 보던거 볼려고 다시깐건데 그 프로그램이 안나옵니다 너무 슬프네요
987,회차 목록이 안보이고 바로 전체화면으로 넘어가네오. 버그인듯
988,이번 업데이트 너무 별론데요... 회차정보 확인도 힘들고... 이건 건의사항인데 장수 프로그램은 회차가 많아서 보고싶은 거 선택하기가 힘들어요. 100~200 / 200~300 이런 식으로 나눠서 구간별로 볼 수 있었으면 좋겠습니다
989,영상시청시 전체화면모드만 되는거 진짜 너무 구려요;;;
990,이번 업데이트.... ㅠ진짜 뭔가요. 무조건 전체화면 황당하고 당황스럽네요. 이건 누구 아이디어인지...... 그리고 다른프로그램 확인하려고 뒤로버튼 누르면 팝업떠서 계속 볼수있었는데 그냥 꺼져버리는거 진짜 너무 별로예요
991,"회차가 많은 프로그램의 경우 예) 무한도전 시즌 1부터 스크롤을 내려서 최신화를 보는게 너무 힘듭니다 시즌 별로 되어있는게 아니다보니 이해합니다만, 최소한 못해도 100-200 / 201-300 / 301-400 이런식으로 카테고리가 나눠져있어야 한다고 봅니다 수정이 되면 리뷰 또한 긍정적으로 수정하도록 하겠습니다"
992,"영상 재생하자마자 바로 전체화면으로 되는데, 불편합니다. 원래대로 해주세요"
993,회차정보를 작은화면에서 아예 볼 수 없게해서 정말 많이 불편합니다 ㅡㅡ 업데이트 후회되네요
994,이번 업데이트 실망입니다 넷플 따라한거같네요 넷플은 시즌제라 한 시즌에 몇회차 안돼서 찾기 쉬우나 웨이브는 공중파 위주라 예) 무한도전 . 런닝맨 . 라스 등등 500회 ~ 700회 . . 800회 ... 회차가 많은데 바로 가로모드로 전환되니 보고싶은 회차 찾기가 너무 오래걸리네요 이런 의견 반영이나 하려나 모르겟네요
995,회차선택도 센스없게 만들었으면서 세로모드를 없애? 그리고 이전회차 이동 버튼은 어디갔냐;;
996,재생 속도 조절이 되었으면 합니다
997,"재생중인 프로그램 선택하면 회차 리스트로 넘어가면서 줄거리나 화면 크기를 결정해서 볼 수 있고, 보다가 잠이 들어서 다른 회차로 넘어가도 줄거리를 보고 어디까지 보고 못봤는지 파악할 수 있었는데 할 수 없게 되었네요. 이번 업데이트 후 너무 불편합니다. 아니면 최소 넷플릭스처럼 바로 재생할지 회차정보를 볼건지 선택할 수 있게 해놓으시던지 해야지...줄거리를 보려면 그 프로그램을 다시 검색해서 들어가야 하는데 이게 뭔가요... 업데이트는 사용자들 편리를 위한 게 아닌가요? 업데이트 의미를 다시 생각해 보시거나 업데이트 관련 담당자분이 실제로는 웨이브로 시청을 안하는 분이 아닌가 하는 생각도 드네요. 예전 방식으로 업데이트 하거나 넷플릭스처럼 회차정보로도 바로 갈 수 있는 방법을 추가하시거나 해주세요"
998,회차 누르면 바로 가로 모드 적용되는거 불편해요....
999,"업데이트를 통해 어플을 사용함에 있어서 구체화되고 편리해지는건 좋지만 이번 업데이트는 여러모로 불편함만 생겼네요. 1. 우선 기본적으로 세로모드를 지원하지 않아 시청중 다른 에피소드를 찾는것에 불편함이 있고, (화면을 터치해 에피소드를 눌러 찾으라 하지만 처음 또는 끝에서부터 찾아야하니 상당히 불편합니다.) 2. 티비와 연결해서 볼때 에피소드를 바꾸려면 연결을 끊고 찾아야 합니다. 2가지가 가장 불편하네요. 이번 업데이트는 개선보다는 소비자 입장에서 불편과 실망감을 안겨주네요. 다수의 사용자가 불편해하고 있는 점에 대해서는 하루 빨리 개선부탁드립니다."
1000,업데이트 되고 넘 구려졌어요. 세로모드로 프로그램 전체목록을 보는 게 더 좋은데 재생중이던 콘텐츠 에피소드만 켜지도록 만들어놔서 진짜 불편해요. 다시 바꿔주세요. 아 진짜 구려요 누가 이런 아이디어를 낸거야
1001,프로그램들이 다양하고 빠르게 업데이트 되는건 좋은데..관심프로그램 설정에서 무조건 최근 관심표시한게 맨위에 설정되어 불편하네요..매번 내가 관심도 높은걸 수정을 해야하더라구요..맨아래로나 현재꺼에 다음으로 라던지 선택권이 잇음 좋겟어요..
1002,혹시나하고 설치 삭제하고 다시 설치를 몇번이나 해봤는데 이건 업데이트때문이라니... 정말 너무 불편하네요 보던 프로그램 찾아서 볼수없게햐고 시청 누르면 바로 큰 화면 넘어가고 이제는 고객보고 시청 중에 밑에 에피소드 눌러서 확인해라니 이건 좀 아닌것 같네요
1003,영상누르고 바로재생 뒤로가기 누르면 원래대로 돌아오는데 원래는 목록보기 있지 않았나요? 저는 목록을 보고싶은데 영상보기 또는 처음화면만 나오니 너무너무 너무 불편하네요
1004,이전회차보기 버튼 다시 살려주세요!! 회차가 많은건 찾기도 힘든데 이전 회차 보기 왜 사라졌나요???? 세로모드도 사라져서 시청하면서 다른회차 검색하기도 힘들어짐...시청 전 프로그램 상세 정보 페이지? 에서 전체 회차 다 나오지도 않음.. 오류인가?? 회차 목록 내리면 .. 47회를 보고 싶은데 20회 다음에 60회 이런식으로? 다 검색도 안되고 다른 회차 시청하면서 에피소드 검색해야 나옴.... 아니 업그레이드가 왜 더 불편해졌죠??? 심지어 에피소드 보다가 왼쪽 상단 <xxx누르면 웨이브홈으로 이동됨... 아니 편한거는 죄다 없애는 게 개편이라는 게 말이 돼요??? 지금 리뷰보니 죄다 불편사항인데 업뎃 단계이니 지켜봐달라구요? 이러다 버티면 알아서 보겠지 하는 생각이신가요...... 웨이브의 ui 장점들을 버리지 마세요
1005,"다른 분도 써놨듯이 무한도전, 런닝맨, 1박2일같이 오래한 프로그램들은 가뜩이나 회차 찾기가 어려운데 그걸 세로 방향 한줄로 해놓으니까 계속 내려야히잖아요….. 게다가 난 회차 찾기하고 싶은데 해당 프로그램 누르면 최신화가 나와요 예전에는 보던 거 그대로 볼 수 있었고 자동 재생되기 전에 한번 물었었거든요 그게 얼마나 편했는데 그 기능을 없앴네요??? 핸드폰이면 몰라 티비로 보면 정말 이건 아니다 싶거든요??? 티비로 예능 좀 보자구요 500화 한 프로그램 계속 리스트 내려보면 제가 한 말이 뭔 줄 알걸요 그리고 회차 내용이 간단하게라도 나와야 뭔 내용인 줄 알지 출연진이랑 그 회차 간단요약 그런 것도 보고 싶은 회차가 뭔지 알 수가 없어서 힘들어요 핸드폰은 세로보기도 없앴네요… 좋은 기능은 없애고 프로필 잠금 기능은 아직도 추가 안 했다는 게 놀랍네요"
1006,"스마트TV로 웨이브 이용 중임. 아니 왜 점점 불편하게 업뎃을 하는 거지? 홈의 ""시청 중 콘텐츠""를 누르면 회차 목록이 안 뜨고 바로 영상 나오는 거 더럽게 불편함. 이렇게 바꿀 거였으면 홈 화면에 구독중인 프로그램 목록이라도 띄우던가.. 넷플릭스처럼. 무한도전 1회 봤다가 내일은 100회 보고 또 모레는 150회 보려면 매번 리모컨으로 my-구독 프로그램-에피소드 선택해야 함. 이게 어딜 봐서 유저 편의를 위한 거임? 참다참다 하도 빡쳐서 의견 남기는 중임. ----- 홈에서 시청 중 콘텐츠를 누르면 이전처럼 에피소드 목록이 뜨게 롤백하던지, 죽어도 롤백은 못 하겠다면 최소한 홈에다가 구독 중인 프로그램 목록 정도는 띄우길 바람. 진짜 얼마나 멍청하면 이 정도 ui 편의성도 생각을 못하는지 답답해 죽겠음.------------ 1:1 문의 후 추가 리뷰. 문의 결과 복붙 답변만 돌아옴. 개선의 의지가 전혀 없어 보여 조만간 해지 예정임."
1007,영상 이어보기가 어느 순간부터 되지 않아요 영상 보다가 나가면 이어볼 수 있었는데 봤던 기록이 저장이 안되어서 첨부터 봐야됩니다 불편하네요
1008,"영상 선택 시 강제 가로모드로 변환되고, 태블릿으로 시청 시 에피소드 화면이 팝업창처럼 플로팅되는 것도 불편합니다. 이전 업데이트까지 잘 시청하고 있었는데, 이번에 오히려 업데이트가 아니라 더 불편해져서 리뷰 남깁니다. 다음 업데이트 시 참고하여 개선해주시면 좋겠습니다."
1009,열기가 안됩니다 베타프로그램 정원이 다 차서 열기가 안되는건가요? 열기가 갑자기 안됩니다
1010,이번에 업데이트 되면서 시청중이던거 누르면 자동재생되던데 중간에 다른 회차로 바꿀수잇는 기능좀 넣어주세요 한편 다 보고 나서도 다음화로 넘어가기 라던가 회차를 골라서 볼 수가 없어 웨이브를 껏다가 다시 켜서 다시 그 프로그램을 검색해서 들어가서 산택해야해서 너무 불편해요 밑에 분이 말씀하신 거 또한 작게보기가 안되서 불편한게 아니라  세로로 재생이 되야 밑에 회차를 고를 수 있기 때문에 말씀드린거 같은데요
1011,"업뎃되고난후 강제 가로전환,회차 선택해서 보는게 나았는데 누르면 그냥 재생돼 불편합니다. 최신순.오래된순도 각각 선택되는것도 아니고 예전방식이 저는 볼때 너무 좋았던 사람입니다. 웨이브내에서 세로로 전환하면 회차나 에피소드 찾아볼려면 안되고,바탕화면 에서나 세로모드가 지원돼 불편합니다. 줄거리내용 좀 볼려니,강제 가로 로딩. 보는 방식이 너무 불편해서 매일매일 보던게 짜증이 나서 덜 보게 됩니다. 구글 들어와 앱 평가해 보기는 처음인듯이요. 다른 리뷰.불편글 보고 며칠 지났으니 예전처럼 보기 편해졌나 싶었더니 지금 이시간에도 웨이브 볼려니 달라진게 없네요. 고객 하나둘씩 빠져나갈 소리가 들리는듯 합니다."
1012,왜업데이트를 이딴식으로 하신걸까요 프로그램을 선택하면 회차정보가 나오고 그중에 선택해서 플레이를 할수있어야지 다짜고짜 영상이나오고 엉망입니다 회차정보도 아주깨알같이봐야되고 눈나쁘면 못볼지경이네요 어처구니가없는 최악의 업데이트네요
1013,시청중인 컨텐츠 누르면 회차 목록 나오는데 이제는 저절로 봤던게 재생되니까 겁나 불편해요.. 고쳐주세요
1014,주로 티비로 보는데 최악의 업데이트네요 시청중 콘텐츠에서 나가기를 하면 보고있는 프로그램 초기화면으로 나와 프로그램정보나 회차보기를 할수 있는게 아니라 그냥 처음화면으로 빠져나와버리니 진짜 불편하네요 이번 업데이트 하신분들은 티비로 웨이브 이용을 하지않는 분들이 하신것 같네요 원래대로 돌려주세요 프로그램 정보와 회차보기를 이렇게 불편하게 만든 이유가 무엇인가요? 생각할수록 이해가 안가는 최악의 업데이트입니다
1015,"이번 업데이트는 정말 아니네요 밑에 다른 분들 말씀대로 드라마,영화,예능 등등 프로그램 회차를 재생시키면 전체화면만 되게 하는 건 누구의 발상인지 참 이해가 안됩니다 전처럼 먼저 작은 화면으로 재생이 되고 그 밑으로 다른 회차도 선택 할 수 있게 다시 얼른 바뀌면 좋겠네요 돈 내가면서 이용하는건데 이런 식으로 되면 이용할 생각이 점점 사라질 듯 합니다"
1016,재생속도 조절 기능 추가푸탁
1017,재밌는 프로그램들이 많아서 계속 이용을 하고 싶었는데 렉이 좀 자주 걸렸고 가끔 이어보기가 오류가 걸려서 처음부터 다시 시작되는 경우가 많아요 그리고 영상을 시청하다가 중간에 정지하고 잠시 연락을 보거나 다른 앱을 이용하고 다시 웨이브로 들어갔을때 처음부터 다시 시작하는 경우도 많습니다 매번 그러진 않지만 가끔 그럴때마다 답답합니다.. 이런 점들만 빼면 정말 자주 이용할 거 같습니다!
1018,에피소드 리스트 정렬 최신화부터 볼 수 있게좀 해주세요
1019,"어디서 제대로된 회차 정보를 볼 수 있나요? 시청중 콘텐츠에서 최신 회차를 볼 수 있었는데 이젠 보기 어렵네요. 하단 에피소드 버튼은 회차 제목도 잘리고 세부 내용도 없고 대안이 안됩니다. 맨날 보는것도 회차를 보려면 검색해서 찾아들어가야 하다니.. 이런 미개한 UI는 누가 설계했나요? 대학교 프로젝트도 이렇겐 안하겠어요. 이젠 최신화가 나왔는지도 알기가 어렵군요. 회차 목록을 ""많이 사용하지 않는 동작""이라고 하다니 통계가 그렇던가요? 그냥 ""넷플릭스 따라하기""한 수준낮은 결과물이겠죠. 제대로 따라하던가.."
1020,이게 뭔가요!! 더 사용하기 편하고 보기 좋게 바뀌어도 될까말까한 간단한 어플을.. 재생시 무조건 꽉찬화면으로 나오게하는 바보같은 짓과 회차많은 프로그램은 다시보기를 언제 스크롤하라고 첨부터 나오게 많들었나요. 합병해서 일할사람이 더 줄어든건가요?? 얼른 빨리 진짜 업데이트를 해주던지 아니면 예전 그대로 돌려놓기를 바랍니다!!
1021,"개선점은 하나도 안보이는 것 같군요
자막스타일 설정이나
영상 에피소드넘어가는 버튼
배속설정 등
개선해주시면 감사하겠습니다"
1022,영상을 보다가 다른 앱을 열고 다시 돌아오면 다시 첫화면으로 가버리는게 자주 일어납니다. 게다가 지금보고 있는 목록이 안떠서 다시 새로고침을 해줘야하는 번거로움이 있네요. 앱이 이래서 영상볼때마다 짜증이 나서 큰일입니다.
1023,업뎃 불편
1024,동영상 클릭하면 바로 큰화면으로 넘어가는게 너무 불편합니다!! 회차보고 선택하고 영상을 시청하고 싶은데 프로그램을 검색해서 들어가야 하는게 정말 너무 불편합니다! 회차 간략한 정보를 보고 선택도 하는데 큰화면 켜지고 에피소드 눌러서 봐야해서 불편해지기만 한 것 같습니다. 그리고 구글캐스트 연결시에 다른회차 선택은 아예 안됩니다. 끄고 그 프로그램 선택하고 다시 연결해야돼요!! 이전으로 돌려주세요!
1025,이전 버전으로 다시 설치할 수 있는 방법 좀 알려주세요. 괜히 자동업데이트해놔서ㅠ 세로버전 안되니 너무 불편해요. 원하는 회차 찾을 때까지 확인하면서 보는 저는 세로버전이 꼭 필요한데요 ! (에피소드보기는 설명이 안뜨고 너무 작아 불편합니다)
1026,크롬캐스트로 연결하고 시청중 콘텐츠 선택하면 무조건 이어보기만 되고 에피소드 선택이 안되서 재생 취소하고 메인화면으로 돌아와서 검색 눌러서 제목 검색하기로 다시 컨텐츠를 선택해야 에피소드가 보여요 구리다구요 예전처럼 돌려놔줘요
1027,와..이번 업데이트 분석설계 누가했나요 역대급 불편하네요. 많이안쓰는기능은 없앳다니..컴펌 내준사람은 웨이브 안쓰나봐요 에피소드 리스트 바로 전체화면 변경 진짜 불편하네요 전체화면 시청중 뒤로가기하면 영상 나가져 버리고 이전엔 리스트보여서 잘 써멋엇는데 세로로 볼수도없고 불편해 미쳐 버리겟네요 개발실적 채웠어야 했나요? 잘쓰던걸 굳이 업데이트를...노이해
1028,업데이트 하고나서 너무 불편해졌어요 전에는 회차를 누르면 그 상태로 멈췄는데 지금은 회차를 누르면 초기화가 되서 다시 찾으러 내려가야돼요 그리고 프로그램을 클릭하고 전체화면이 안뜨고 중간에 조그만 화면이 뜨는것도 불편해요 전체화면으로 볼수있고 회차를 눌러도 초기화가 되지않고 멈출수있게 원래 버전으로 돌려주시길 부탁드립니다
1029,진짜 업데이트 이후 ui 좀처럼 익숙해지지 않는다... 불편해 미침.... 제발 원래대로 좀 돌려놔라 최소한 시청 중인 컨텐츠 눌렀을 때 바로 재생되게 말고 프로그램 정보 뜨게 좀 ㅠ 개인적으로 ott중 웨이브가 이용성 측면에서 가장 편했었는데 제일 불편해져 버림.....
1030,아 절라 불편하네 에피소드 보기 졸라 힘드네 잘보고 있는데 탈퇴하라고 이러는건가 누구 생각이냐 웨이브볼때마다 진짜 짜증난다
1031,티비랑 연결해서 보다가 다음 회차로 넘어가려고 하면 핸드폰 처럼 하단에.에피소드가 있지않아 불편하네요... 심야괴담회 - 에피소드에서 원하는 회차를 눌러야 하는 불편함이 있네요
1032,이번 업데이트 너무 불편합니다. 그래 이유가 있겠지.. 이용자를 더 편하게 하려고 업데이트를 진행한 걸거야.. 라며 제 자신을 세뇌하며 이용하려해도 순간순간 불편하네요.. 불편한 사항을 리뷰에 적어야겠다 했더니 다른 이용자분들 또한 저와 같은 마음이시네요. 기존에는 보고싶은 드라마나 예능 누르면 세로화면으로 먼저나와 회차를 고를 수 있게끔 되어 있었는데 이번 업데이트에서 바로 이어보기 영상이 나와서 여간 불편한게 아닙니다. 드라마 같은 경우는 바로 이어지는 내용이니 이해하며 볼 수 있지만 예능이나 기타등등 프로그램을 보려면 무조건 가로화면으로 강제전환 뒤 에피소드 눌러서 옆에 분할되어 뜬 작은 회차보기를 통해 열심히 찾아 눌러야 합니다. 전체를 1편부터 몰아 볼 수도 없고 이런 서비스의 장점 중 하나가 내가 보고싶은 부분을 어렵지 않게 시청하는 것인데 그런 장점이 사라진 것 같습니다. 젊은사람들도 에피소드 누른 후 원하는 회자 찾아보기 쉽지않은데 어르신들은 더 어려울 것 같습니다.
1033,시청 중 컨텐츠 누르면 전체화면 바로 재생되는거 진짜 너무너무너무너무너무 불편해요. 회차선택 하고 싶다고요! 이전으로 되돌려주세요 ㅠㅠ
1034,업데이트 너무 별로예요. 바로 전체화면 뜨는 것도 불편하고요. 다른 에피소드 확인하는 것도 재생중 화면 클릭>하단의 에피소드 클릭하라는데 뭔소리인지 모르겠어요. 제꺼에서는 그런 거 안떠요
1035,"매력적인 티빙만의 프로그램이 있지만 발끝도 못따라가는 인터페이스와 구성, 상품은 괜찮지만 엉망진창인 동선과 매장구성의 가게를 보는것 같아요. 시청한 항목을 보면 그냥 답답. 그걸 왜 전부 편편이 다 모아 기록하는지 이유 아는사람? 다본건 지워지는 넷플릭스의 배려는 안보심? 그리고 내가 찜한 목록은 안보이고 맞지도 않는 내가좋아할 만한 함목들은 호객하는지?"
1036,시청중인 컨텐츠 삭제가 안댐
1037,영상 시청할때 세로모드 전체화면으로만 볼 수 있게 바꼈네요???자동차에 가로로 거치해서 틀어놓고 뉴스도 듣고 그랬는데 자동차에서 세로로 돌려서 틀어놓기는 공간 자치가......누군가한테는 가로모드 작은화면이라도 필요합니다 세워서 봐야하는 경우도 있으니 개선 없을 시 웨이브는 굿바이......
1038,업데이트 후에 정말 불편하네요 회차정보를 보고 볼 영상을 선택하고 싶은데 바로 풀 화면으로 넘어가니까 너무 불편해요 에피소드 보기 힘드니 진짜 최악의 업데이트에요 사용자들이 설정탭 같은데서 화면설정 방법이라도 선택할 수 있게라도 만들어주세요
1039,"시청 기록 지울 수 있게 해주세요.
앱 론칭한지 1년이나 지났는데 아무런 개선이 없다니요.. 진짜 일 안하는 듯."
1040,재생이 안되네요
1041,"돈주고 보는 사람한테 광고좀 그만해라. 광고보기 싫어서 티빙으로 돈주고 보는거야. 티빙 프로그램 홍보하는건 알겠는데 ㅋㅋㅋㅋ 적당히해. 영상 중간중간 몇번이 쳐 나오는거냐? 넷플, 웨이브, 왓챠, 디플, 쿠팡플레이, 시즌 다 쓰는데 니들이 처음이에요;; 영상보는데 거슬려요;; 그냥 어플 처음 들어갈때 나오는 광고로 하세요;;"
1042,불편
1043,답글 다시는 거 보니까 그냥 밀고 나갈 생각인 거 같은데 어플 개발하시는 분들 고생하셨겠지만 이렇게 많은 사람들이 불편해하는데 업데이트 전으로 돌리는 게 맞지 않을까요? 이건 적응 문제가 아니고 진짜 그냥 불편해진 건데... 예전 타 어플도 그렇고 왜 업데이트를 전보다 실용성이 떨어지게 하시는지...실사용은 해보시고 업데이트 하셨는지 궁금하네요 에피소드 보기 너무 불편해서 웨이브 해지하고 싶어요 (태블릿 가로모드 기준) 예전처럼 영상 따로 설명 따로 에피소드 목록 따로 나눠주세요 제발... 그리고 에피소드 목록 현재 시청중인 회차 기준으로 나오게 해주셨으면 좋겠습니다
1044,어제 업데이트라고 자주 보던 프로그램(뭉찬)의 목록이 변경되었습니다. 최근 보이던 목록도 사라져버리고 작년말 회차가 제일 최신 회차가 되어버렸음..
1045,미러링 기능은 또 오ㅐ 안되요?? 전체화면 바뀌는거..에피소드 클릭해서 전체회차봐야하는 불편함도 그냥 아쉬운데로 쓰자 싶었는데..미러링 기능은 진짜..있는거 없애지 말고 새로운 기능을 추가해야 될거 아닙니까..
1046,왜케 유료가 많은지...그러러면 한달 정액제를 확낮추던가요... 비추입니다. 프로그램도 적고...볼만한건 유료 또 결제해야함
1047,영상다운 듀ㅣ게 해줘요...
1048,무한도전 200회 이후 회차 볼려고 하면 렉 걸려서 압 강재 닫기 해야됩니다
1049,"업데이트 구리다고 최신리뷰에 다 말하고있는데 왜 개선을 안하세요.. 전처럼 시청중컨텐츠 누르면 회차보이게 해주세요 진짜 너무 불편해요. 전체화면으로 보면서 이전회차로 갈수있게 하는 버튼도 다시 돌려주세요. 또, 300회 이상 된 회차들은 에피소드 골라서 보는게 불편해요 에피소드 목록 누르면 지금 보고있는 회차부터 스크롤할 수 있게 해주세요 매번 최신회부터/첫회부터여서 너무 불편합니다. 그래도 지금 업데이트전에는 쓸만했는데 요즘 너무 불편해서 웨이브 들어오는 거 꺼려집니다 개선 좀 해주세요!!!"
1050,시청했던콘텐츠 클릭시 자동재생되는것도 짜증났는데 이번업데이트로 더 짜증이납니다. 왜 영상클릭시 강제 가로화면으로 돌려놓아서 에피소드목록을 힘들게 찾아야되나요? 무한도전이나 나혼자산다 라디오스타같은 에피소드 몇백개 넘어가는 콘텐츠는 이번업데이트 덕분에 원하는 에피소드찾기 참 드럽게 힘듭니다. 업그레이드가 아닌 다운그레이드 삽질덕분에 시청중콘텐츠로 재생못하고 보던 콘텐츠임에도 굳이 검색창에 검색해서 에피소드 골라서 시청해야하는 수고로움을 실행중이네요. 정말 웨이브 어플 개발자들 정신 좀 차리세요
1051,영상재생하면 끈기는현상이 너무심해요
1052,"짱구나 스폰지밥 같은 키즈프로그램도 시청목록에 나오면 좋겠어요; 어른들도 그게 보고싶을 수 있는건데 그거 보다가 나중에 다시 보려면 시청기록에 가서 매번 뒤져봐야하는게 너무 불편해요 짱구 스폰지밥 핑구 이런거 없었으면 티빙은 진작에 안 썼을 것 같은데 여기말곤 볼 수 있는 곳이 없어서 어쩔 수 없이 쓰는데 개선 좀 해주세요.. 그리고 라바, 아따맘마는 시청목록에 뜨는데 무슨 기준으로 그렇게 나눈건지 모르겠네요 그냥 다른것들도 나오게 해주면 좋겠습니다ㅔ"
1053,시청 제게가 안되고 계속 로딩만하던데.... 다른 콘텐츠도 못보고 로딩에서 안넘어가네... 이전 업뎃 문제 많네...디즈니로 갈아타야하나...
1054,업데이트 괜히 했네요. 세로모드는 도대체 왜 없앤건가요? 회차정보도 볼 수 없고 바로 전체화면으로 넘어가버려서 너무 불편합니다. 프로그램을 따로 검색해야만 회차정보가 나오니 이거야말로 불필요한 모션 아닌가요? 저 말고도 불편해하는 이용자가 많네요. 전체화면에서 에피소드 누르면 된다고 안내하면 끝인가요?
1055,불편해요
1056,불편
1057,불편한게 한두가지가 아닌데..다른 ott참고해도 금방알수있는게 없네
